mbti,comments
ENTP,네 맞아요 근데 먼저 헤어지자고 한 마당에 먼저 연락은 안 할 것 같네요 제가 하지 말라고 했거든요 근데 정말 잡아주길 바랐을까요 풀리고 나서는 저보고 자고 가라고 자기가 소파에서 자겠다 하길래 뭘 주인이 있는데 내가 침대에서 자 이러니까 그럼 같이 자든지 이러길래 뭐지 했거든요 마지막에 주차장에서 떠나기 전에 후회 안하냐고 하니까 후회하겠지 이러고 
ENTP,흑흑 아직 고민이네요 재회하는 방법은 뭘까요 바쁘신가봐요 흑흑 시간나시면 꼭 답변 부탁드려요 힝 
ENFP,지금 확인했어요 맨 위에 제가 사귄 기간이 얼마 안됐지만 2번의 헤어짐이라고 했던 것을 보고 다시 한번 생각했는데 상대방이 정말 좋아한다면 아무리 화가 나거나 의견 안맞는 거로 헤어짐을 말하지는 않아요 기싸움으로도 보이고 글쓴이님 가지고 노는 느낌도 드네요 제가 위에서 말씀 드린 것처럼 남자친구분이 진짜 글쓴이님을 좋아한다면 자신의 행동에 대해서 생각하고 미안함을 가지고 연락을 먼저 할 거라고 생각하는데 기다렸음에도 연락이 오지 않는다면 금방 마음 정리를 하지 않을까 싶네요 재회를 하시고 싶으시다면 먼저 연락을 해보시는게 제일 좋은 방법으로 보입니다 연락하실 때는 상대방의 평소 어떤 스타일인지에 대해서 글쓴이님이 제일 잘 아실테니까 그 방법으로 한번 연락해보세요 이렇게 하나 저렇게 하나 결과는 하나에요 기다려보시고 연락이 안오면 그냥 지나가는 인연이였다 라고 생각하는 것과 먼저 연락을 해서 재회를 시도 해보는 방법이라고 봅니다
ENTP,뭔가 개복치같다고 할까요 조금만 갈등 상황이 생겨도 그걸 못 참는 것 같았어요 첫번째 이별통보 이후 헤어지잔 말 다신 안 하기로 약속하고 하면 자기가 1억을 준다는 둥 널 너무 좋아한다 이렇게 확신을 주는 말을 하루종일 해놓고 그날 저녁에 홧김에 그러는 걸 보고 진짜 신기했던 것 같아요 불건강한 느낌 근데 마지막에 울먹거리고 후회할거라고 하면서 스킨십하고 했지만 전 당연히 이제 끝이라고 생각했으니까 엥 뭐지 왜지 하고 웃으면서 뭐야 이러고 말았는데 집에 오고 가만히 생각해보니 그거 붙잡아 달라는 뜻이었나 하면서 제가 잡았어야 하는 건가 생각도 들었고요 전 극 T라서 그런지 감정에 휘둘리지도 않았고 헤어지잔 말에 특별히 상처받거나 하지 않았었어요 얘 또 그러는구나 이정도 생각 워낙 갈등 상황이나 제가 조금만이라도 차갑게 말하면 무섭다고 헤어지자고 하는 사람이어서 걘 먼저 연락은 못할 것 같아요 무서워서 그래서 제가 먼저 연락해야 하는게 맞는걸로 보이긴 하는데 저게 일요일이었는데 좀 더 기다려보고 이번주 일요일에 하면 일주일 뒤라 너무 늦을려나요 하 전 먼저 연락하는 스타일은 아닌데 이 사람이 절대 먼저 못 할거란 확신이 드니까 제가 해야겠단 생각도 들어요 이미 한번 잡아본 적이 있는터라 어떻게 풀면 되는지는 아주 잘 알아요 아마 다시 만날 순 있을 것 같아요 근데 그래도 먼저 미안하다고 연락해주면 진짜 좋겠네요 휴 근데 안 올거 같은 답변 계속 해주셔서 너무 감사하네요
ENFP,잘해준다고 없던 호감이 생기는 경우는 없었고 오히려 역효과 날때가 많았어요 부담스럽고 아니다 싶으면 걍 어느순간 단둘이 만나거나 그러것도 아예 안해요 근데 20번이나 만났는데 진전이 없다면 저같으면 이제 걍 남사친 정도로 생각할거같은데요 보통 제가 꽂힌 사람도 나한테 꽂혀서 엄청 열정적으로 사랑을 하는 그런걸 너무너무 좋아해요
ENFP,서로의 관계도 끝이 났는데 8월까지 안기다리고 금전적계산 빨리 끝내고 싶다고 말해보세요 깔끔하게 정리 하고싶다고요
ENFP,저도 윗 댓글에 동의합니다
ENFP,새로운 사람이 일단 생겼고 붙잡아도 안잡혔기 때문에 가능성이 적어보입니다
ENTJ,저게 그 사람에 본성이에요 똥차랑 500일만에 헤어지게라도 됐으니 정말 다행입니다
INFJ,맞아여 깃털같이 가벼운 엉덩이를 만듭시당
ENTJ,건강한 유형 기준일거고 남녀에 따라 좀 차이도 있는 거 같더라고용
INFJ,인프제는용
ENTP,저도 마음속으로 다섯번셉니다 왠만함 안그러려구하는데 상처 진짜 잘받아요대신 그걸 이겨내는것도 빠른것같아요
ISFP,제가 만나온 ENP들 생각 깊고 다정해요
ENFP,헉 enfp랑 상극인 mbti이지만 잘 맞으셨나 보군요
ENFJ,앗진짜요갠히 울쩍울쩍하네용톡이 뭐라고저도 늦게 답하는거 극혐하는뎅 기다리려고 하니 힘드네용
ENFJ,이제 그만울고싶어용그렇죵 기다리는거 포기해야하낭
ENFJ,맞아여마음이 참우째야되는건지 친구분 마음 고생하셨겠어용 넹 감사합니당힘낼게용
ENFJ,맞아용 이해해요 저는아예 잠수라슬프네용
ENTJ,으아 읽씹 안읽씹 바로 차단
ENFJ,그정도인가용차단 못하겠어여
ENTJ,전 텀 느리거나 읽씹하면 그냥 차단해영
INTJ,리트리버 
INFJ,헉 댕댕이넘모 귀여워요 라랄님 헤어밴드 잘 어울리세요
INFP,감성 못느끼면 시들해져요
ISFP,어 진짜 그런면 있어요 소소한건 내가 그랬어 할정도로 기억못함
ISFP,맞아요 입냄새로 놀린적 있는데 과한 리액션으로 대응하길래 웃고넘겼는데 사실 상처받았다고 하더라고요 상처 안받는 수준에서 잘 놀리고 있습니다
ISFP,근데 의외로 감정을 잘 숨기더라구요 그래서 사회생활 잘하는 유형이라 하는건가 아무렇지 않은건지 상처받는건지 전혀 구분이 안가요 그래서 그런일 있으면 꼭 얘기를 하라고 했죠
ISFP,입벌리고 자고있을때 머리카락 한개 집어넣으세요 샤워하고나서 난닝구 줄때 미리 쫙쫙 늘려놔서 젖꼭지다튀어나어게 만드시고
ISFP,안그래도 아재개그 100개즘 던집니다 그중에 두어개 건지면 흐뭇하고요 이러나 저러나 내 옆에있는 사람이 최고 아니겠어요 좋은 저녁 되십시여
ESFP, 잡으셨나요 저도 기다리고 있는데 enfp특성상 시간 지나면 잊혀진다해서 무섭네요 
ENFP,제 구남친이 엔프피였는데 전자를 좋아했어요
ENFP,3개월 뒤 재회해봤어요 이별은 양 쪽 부모님의 반대 나이차이도 그렇고 저렇고
INTJ,상황때문에 이별하셨던거군요 서로에 대한 감정은 좋게 마무리 하셔서 다시 재회가 된거군요 
ENFP,서로가 싫어져서 헤어진게 아녀서요 한사람이 싫어한다면 재회도 안 됐겠죠
INTJ,그렇네요 부럽습니다
ENTP,진짜 못됐어요 그 친구 그래서 더 잘 지내고 싶지 않은 것 같아요 나중에 크게 한번 당했으면 좋겠어요
ENFP,와나였으면 헤어지기로 한 사이라면 그 모임에서 아는 척도 안할텐데 그 분은 무슨 이별로 해방구 찾은 것 마냥 신났네요 이건 같은 엔프피로써 이해가 안되는 행동이네요
INTP,올 거 같아요 언제 올지는 모르겠지만요
ISFP,사람의 감정과 생각이 항상 똑같을 순 없잖아요 특히 타유형에 비해 감정기복이 많은 유형 중의 하나이기도 하고요 분명 그분은 그 순간만큼은 진심이었을 겁니다 근데 같은 유형이라도 사람에 따라 그 기분이 확확 변하는 분들이 있어요 말 한마디에 감동받고 말 한마디에 삐지는 뭔가 이런 아이스러움이 있어요 그리고 항상 새로운 걸 좋아하고 여기저기 일을 벌리기도 하는 유형이잖아요 대신 뭔가 마무리라던지 끈기는 좀 부족한 분도 있고요 어쨋든 이런 타고난 특징들이 있지만 책임감이라는 건 유형으로 따질 순 없는 거 같아요 아마 이 분은 책임감이 떨어지다보니 문제가 되는 거 같아요 그리고 그냥 가볍게 보면그땐 하고 싶었는데 지금은 하고 싶지 않아이런 기분 탓이 아닐까 싶어요 그래서 그때 그때 하고 싶은 게 생기면 즉흥적으로 하는 편이기도 하거든요
ESFP,저 전부에 해당되는게 저여서 배신감이에요
ESFP,답변 감사합니다 하지만 그렇게 하기에는 이미 무책임에 무한잠수회피에 들어가서 그렇게 할수가 없어요
ESFP,똑같아요
ISFP,NFP는 개성주의자라 나쁜말은 아니라 생각해요 제 기준에선
ISFP,그냥 그 사람 사상이 조선인미이라 뇌가 구닥따리인가봐요
ISFP,
ENTP,저도 이거 칭찬개성잇단뜻
INTJ,그게 예전에는 사차원이다 자기 세계가 있다 하는 식으로 다소 부정적인 인식이 강했어요 저희 부모님 세대는 여전히 그런 부정적 의도로 쓰시기도 하고요 그래도 최근에는 자기 세계가 분명하다 하는 식의 말은 개성 있다 독특하다 자신만의 색이 있다 라는 뜻으로 많이 쓰이고 있는 것 같아요 물론 상대방이 말할 때 어떤 의도로 얘기했는지가 중요하겠지만 저도 그런 말은 많이 들었고 되게 의아했었던 적 있어요 내가 비정상이라는 건가 싶고 남들과 너무 다르다는 뜻인가 싶고 저 스스로를 고민하고 바꿔보려 노력도 했었는데 결국 지금은 그게 가장 나 다운 거라고 인식하고 있어요 오히려 전 좀 자신 있게 드러내기도 하고요 그러다보면 이런 저를 좋아해주는 사람도 있더라고요 타인의 말과 평가 시선을 너무 의식하거나 타인의 말로 자신의 존재를 고민하지 마세요 남들에겐 조금 달라 보이는 누군가가 비정상일 수도 있고 나에겐 다른 사람이 또 비정상일 수도 있다고 봐요 근데 이제 그걸 면전에 대고 너 비정상 같아 식으로 말을 한다면 맺지 말아야 할 인간관계 그 정도일 뿐입니다
INFJ,
ENTJ,자기만의 세계는 누구에게나 있는것 아닌가요 전 셀수도 없이 듣고살지만 칭찬으로 여겨요 4차원이니 외계인이니 하는 말도 많이 들었으나 그것 또한 축복이라 생각합니다 무슨 범죄를 저지르거나 비윤리적이거나 하지 않는 이상 자신만의 세계가 있다는건 좋다고 봐요 그리고 사람에 따라서는 이 말을 괜히 가스라이팅 식으로 쓰기도 하거든요 자기가 이해를 못하겠거나 자기랑 좀 다르면 니가 이상하다는걸로 몰아가는거죠 얼마나 웃기는 사람이에요 그러니 신경쓰지 마시고 나만의 멋진 세계를 구축해가면 됩니다 남에게 피해주지 않고 예의 지키고 그러면 돼요 이거 신경쓰는 모습을 보여주면 상대는 신이 나서 더 가스라이팅을 할수도 있어요 개의치않으면 그쪽에서도 못그래요
ENTJ,만남 유도 아닐까요
ESTJ,한번 더 만날수 있잖아요
ENTP,2
ISFJ,사준다 하면 부담스러울까봐 사달라고 하는 거 아닐까요 호감 있어서 막상 만나서 먹으면 자기가 오자 했으니 사겠다며 내려고 그렇게 만남 이어가려 흠 근데 싫다 차라리 같이 먹으러 가자 하던가 사죠사죠 싫어요 쓰니님 부담스럽고 싫으시면 제가 왜요 한번 시전하시죠 
INFJ,역질문이요 만약 욕을 안 먹는다는 보장이 있다면 새로운 것을 시도하고 싶으신가요
ENFP,오호 당연하죠 원래 새로운 일 자주 했었는데 많이 혼나서 그 후로 익숙한 일만 찾게 되더라구요 
INFJ,오그렇다면 혹시 에니어그램 유형이 어떻게 되시나요
ENFP,어 혹시 에니어그램이라면 이거 맞나요 예전에 테스트 한 거 즐겨 찾기 저장했었는데 이거 맞는지 모르겠네요
INFJ,그거 맞아요 보통은 날개까지 나오는 어반리스트 꺼를 많이 하지만요 하지만 작성자님께서 8번이라기에는 음이 글에서 써 놓으신 특징은 다른 유형에 더 가까운 것 같아요 8번은 ENFP라도 하던 일에서 쉽게 의욕을 잃는 경향이 덜해요
ENFP,그쵸 밑에 유명인들 보고 뭐지 내가 항목 잘 못 선택했나 완전 나랑 다른 사람인데 느꼈습니다 8번은 절대로 아닌 것 같아요 승부욕 좀 있지만 아니다 싶으면 금방 실증을 느끼는 스타일인지라 
INFJ,httpsurbanlistkrcontentsenneagram 시간 나면 이거 한번 해 보세요 다만 팝업이 뜨며 다른 사이트로 이사 간 버전을 권유할 텐데 어느 쪽이 더 정확할지는 모르겠네요 
ENFP,httpsurbanlistkrcontentsenneagramresultdataqqqVhsltstlpKskUSqNRstJVVUktSlhthJlKtKltststNJsphlttslskhUNppqttVNsMMstMRqtVhsphVJsNtlKittA 결과 이렇게 나왔더라구요 
ENFP,해석 공감이 되더라구요 소름 낯가림 은근히 심한 거 공감 
INFJ,오옹이런 결과는 보통 INFP들에게서 많이 나타나요 4번이 이렇게 높게 나올 거라고는 예상하지 못 했는데 의외네요 먼저 힘의 중심머리 가슴 장을 찾으신 다음 높게 나온 2번 4번 7번 9번 위주로 찾아가시는 게 좋을 것 같아요 여담으로 여기서는 8번이 낮게 나왔네요
ENFP,아 INFP 분들이 많이 나타나는 결과군요 가끔 혼자 있고 싶고 우울감 느껴지고 INFP 변한 기분이랄까요 확실히 밖에 있는 것도 좋아하긴 한데 집에 있는 시간이 많을수록 안정감을 느꼈습니다 타인의 시선 예민한 편이고 상처 잘 받는 편인지라 INFP 특징 보다가 공감이 너무 되더라구요 
INFJ,외향형들이 내향형보다 도파민을 더 갈구하기 때문에 그만큼 더 쉽게 지쳐요 그래서 나 I 된 것 같아라고 생각하는 지친 외향형들을 적지 않게 볼 수 있는 거죠 반면 내향형들은 외향형보다 아세틸콜린을 더 원해요 그래서 조용히 생각하는 걸 선호하게 되죠
ENFP,와 대박이다 어쩐지 뭔가 쉽게 지치더라구요 그럴 때 마다 I로 착각을 MBTI도 신기했는데 에니어그램도 너무 신기하네요 
ENFP,크윽 역시나 글 쓰신 거 보고 끄덕이면서 공감하면서 읽었습니다 저 같은 분 계셔서 기분이 좋네요 자전거 탈 때도 새로운 곳 가는 것을 매우 좋아합니다 같은 곳 3번 정도 가면 질리더라구요
ENFP,저도 냥님 엄청 공감이가요 진짜 좋으면 몇 번 더 가기도 하지요 근데 애매하게 좋으면 별로 안 내키더라구요 
ENFP, 맞아요 ISTJ 어머니께서 통제 못 하신 정도면 말 다한 것 같아요 근데 냥님 저 보다 훨씬 텐션이 높으신 ENFP 같아요 크큭 
ENFP, 저도 솔직히 어머니랑 성격 가치관 성향 너무 달라서 독립하니깐 속이 너무 시원합니다 전화오면 그냥 내킬 때 받으면 되고 좋네요 죄송하긴 하지만 확실히 nf 분들 기본적으로 잘 맞더라구요 enfp장점은 비록 세월 흘러 체력이 예전 같지 않지만 밝은 에너지를 통해 남 맞춰주고 밝게 해주는 게 가장 큰 장점이 아닐까 합니다 
ENFP,코로나 거리두기 이어서 istj 거리두기 확실히 저는 nf 계열 분들이라 같은 enfp 분들 잘 맞더라구요 
ENFP, 그저 전형적인 어머니 성향이거나 이해가 안 갔는데 mbti 알고 난 후 원래 그런 성향이시구나 받아 드리 게 되었네요 
ENFP,음 일단 글을 적어 보자면 장점 나의 부족함 부분을 채워주신다 옳고 그름을 잘 잡아주신다 이게 맞는지 틀린지 의논 할 때 잘 판단해주신다 저거 하면 좋다 저거 하면 손해본다 후회할거다 단점 서로 가치관 성향이 너무 달라서 서로 이해가 안 가고 피곤하다 살짝 팩폭을 말씀하신다 너는 이렇고 저렇더라 성향이 다르면 부족한 부분 채워져 좋긴 한데 가끔 어머니 만의 일정한 틀에 사로 잡힌 삶이라고 해야할까요 어우 저는 그렇게 못 살겠더라구요 가끔은 새로운 변화를 추구하는 저로선 확실히 성향이 달라 부딪히게 됨 
ENTP,저랑똑같네요게임할때 엔딩봐야지 어쩌구 하는거랑 완전 다똑같아요 저도 tf성향 차이가 별로 안나서 enfp에용
ENFP,오 반가워요 동지를 찾았다 지금도 전에 하던 게임 다시 깔고 있는데 막상 시작하면 삭제 하고 싶다는 생각에 갈등 할지도 
ENTP,저도 그저께부터 하던게임 다시 깔고 하고있어요 저희어머니도 옛날엔 istj였고 지금은 j성향 강한 istp이신데 하나라도 제대로해봐라 하는거까지 인정이여
ENFP, 다시 하시던 게임 잘하셨나요 저는 왜 깔았는지 후회 중 
ENTP,저 지금 1일째 안들어가고있습니다 
ENFP,저 씨씨티비로 관찰후 제 얘기 쓰신줄 저도 그래여 헤헤
ENFP, 반가워요 다른 mbti 분들은 저를 신기하게 보더라구요
ISFJ,저도요 아이디도 3아웃 
ENFJ,가끔 답답할 때 있지만 정말 좋은 궁합같긴해요
ENFJ,훈훈 짧고 여운있는 댓글이네욬
ENFJ,어떻게 금방 풀수가있을까용5일째회피하는뎅
ENFJ,헉 5일은 너무 심한데 저라면 장문으로 우리가 이러이러한 문제로 인해서 내기분은 이랬고 너 기분은 이랬을 것 같다 당장 얘기안해도되니까 대화하고 싶을 때 말해주면 좋겠다 기다릴게 라거 할 것 같아요
ENFJ,회피하는분 처음만나봐서 상처도 받고 충격이예용기다리다 지치는그렇게 한번 보내볼게용
ENFJ,네 회피형 쉽지 않죠 무작정 끄집어내는것보다 툭 던지고 기다리는게 젤 졸은 것 같아요
INTJ,평화주의자 인프피는 지혜로워서 대화로 잘 풀어가게끔 이끌어주는거같아요귀염둥이답게 애교로 사과하면 더 큰 애교로 돌아오는 
ENFJ,남자친구가 가끔 회피하기도 하고 감정적인 말 하려고 할때도 있지만 귀여운건 정말 인정입니다
ENFP,완전 찐친바이브신가요 아니면 살짝 썸같은 기류가 있으세요
ENFP,제가 봤을 때 인간적인 호감은 확실하고 이성적 호감도 가능성 있는거 같은데요 찐친 바이브가 아니시면 이성적 호감에 가까울 거 같아요
ENFP,저는 전화는 이성적 호감 없으면 안 하는 편이라서요 한번 지켜보시죠
ESFP,썸 그런거 아닌 enfp 여사친이고 알게 된 후로 친해져서 불나게 연락 주고 받았는데 어느 순간 대놓고 읽씹하고 무시합니다 보고 있었다는 듯이 1초만에 읽씹하더라고요 평소에 자주 연락할 때도 다음 날까지 안읽씹도 하고 그러던 애가 읽씹은 빛의 속도로요 읽씹 을 하기 전에 본인 뇌피셜로 제가 본인을 이성으로 생각한다고 할 만한 일이 있기는 있었습니다 여러번 연락을 해도 답도 없이 읽씹만 하고 전화도 안되고해서 연락을 안하려나보다 하고 잊고 지냈는데 그러길 한 달쯤 지났을때 제가 매일 가는 장소가 있는데 그곳에 그 애가 왔습니다 그 애가 일부러 보려고 오지 않는한 그곳은 전혀 올 일도 이유도 없는 곳인데 와서 enfp 특유의 반짝이는 눈으로 한참을 염탐하듯이 몰래 보고 있는데 저랑 눈이 마주칠 듯 하니까 숨더니 잠깐 더 보다가 갔어요 그 때는 모른척하고 며칠 지나서 평상시처럼 연락했더니 역시 읽씹을 했는데 몰래 오고 연락은 무시하고 하는 건 왜 그럴까요 지금 두 달이 되가는데 다시 연락오는 일이 있을까요
ESFP,아 그랬으면 달랐겠지만 그런 사이 아니라고 했었어요 친하지만 이성적 사이는 아니라고요
ESFP,아 이성적 사이 아니라고한건 엔프피가 한 말이었어요 본인 뇌피셜로 본인을 이성으로 생각한다고 할 만한 일이 있었을때에요
ESFP,공개적으로 보여주기 힘든 것도 아니고 어떤 사건이 아니라 아무 것도 아닌거였어요 누군가한테는 아무 것도 아닌걸수도 있고 누군가한테는 남친이나 할만한거다 할 수 있겠지만 어떤 걸 해줄까 이 장난말 한마디였어요
ESFP,아래 답글에 환경이 안좋기를 빌어야한다고 하셨는데 엔프피가 어려운 환경에 있다가 저렇게 할때쯤에 전보다 환경이 좋아졌는데 그래서 좋아진쪽으로 갈아탄걸까요
ESFP,아니에요 많은 도움이 됐어요 듣기에는 지금 환경이 써주신 것과 비슷한 환경이었던것 같아요 본인뇌피셜이란건 써주신대로 쉽게 보았나 그렇게 오해한 것 같고 그건 다음에 풀었는데 좋은 환경에서 있으니 그런가보다 미련은 남았는데 뭔가 이유가 있어 거리를 둔다고 생각은 했어요 그렇다해도 일방적인 회피는 서운하네요 답변주신게 다 맞아보여요 감사해요
INTJ,enfp 와 재회하기 위한 치트키가 있다면 무엇이라고 생각하시나요
INTJ,연애후에 이별 그리고 오늘 만나기로 했습니다 그녀를 향한 제 진심과 간절함으로 붙잡아 보려고 합니다 혹시 제가 더 준비해야 하거나 빠트린게 있을까요
INTJ,50일 사귀었고 되게 자주 만났습니다 이틀에 한번꼴 마지막 만남은 지난주 토요일 그리고 헤어진건 이번 월요일 전화로 헤어졌습니다 그리고 50일 연애하며 이별과 재회를 꽤 여러번 반복했습니다 둘다 불건강이라서요 둘이 돌아가며 차고 잡고를 반복했었고 지금은 여자친구가 찬 상태입니다
INTJ,네 감사합니다
INTJ,실패 했습니다 만나서 울고불고 제발 돌아와달라고 추한모습 다 보였는데 달래주고 화도내고 짜증도 내고 그러다 다시 달래주고 미안해 하지 않아도 되고 예전만큼 좋아하지도 않고 내인생도 중요하다고 하더라구요 제발 자길 놔달라고 그리고 이젠 무섭다고 잡는데 까지 잡아봤지만 실패했어요 
ENTP,저번달에 헤어졌고 일방적으로 헤어짐을 통보받으면서도 저는 끝까지 잘 지내고 힘내라고 격려했어요 동아리에서 만났기 때문에 헤어진 후에도 피치 못하게 마주칠 일이 생기면 제가 그냥 피했습니다 마주쳐봤자 제 기분만 상할 것 같아서 주변 지인들은 저희가 좋지 않게 헤어진 걸 몰라요 헤어졌다는 걸 모르는 사람도 있어요 굳이 말해봤자 좋을 게 없을 것 같아 주변 사람들에게 알리지 않았습니다 이후 현재 한달 정도가 지났고 동아리 모임이 생기면 그 친구가 나오는지 슬쩍 돌려서 떠보고 안 나온다고 하면 안심하고 나갔어요 근데 최근 1주 정도 전부터 그 친구가 유독 제가 나오는 모임에 나와요 분명 안나온대서 나갔는데그런 일이 잦았어요 다른 모임에는 안나오는데 제가 나가는 자리마다 나오는 느낌 그리고 저한테 아무렇지 않게 장난을 치거나 제가 있는 테이블 쪽으로 앉거나 하는 행동을 하더라고요 전 솔직히 이 친구와 헤어지는 과정 중에 좀 감정 상할 말을 들은 탓에 아무렇지 않게 지내는게 불가능해요 함께 있는게 너무 불편하고 아무리 생각해봐도 이 친구가 이러는게 좋게 느껴지지는 않더라고요 날 우습게 보나 얘는 나한테 그런 말을 해놓고도 아무렇지 않구나 하는 생각 때문에 엔프피 전남자친구가 왜 이러는 걸까요
ENTP,한켠으로는 다가오면 아무렇지 않게 대해보자 싶다가도 전남친이 했던 말이나 행동 생각하면 또 말 섞기도 싫고 아는 척도 안해줬으면 하는 마음이에요 제가 힘든 상황일 때 불도저 처럼 다가와서 사귀게 됐는데 한두달 정도 지났을 때부터 이미 식은 듯한 느낌을 받았고 그 상태로 두달 정도 질질 끌었네요 저라는 존재때문에 스트레스 받는다 짐같이 느껴진다 마음이 식었다고 하면서 헤어지자고 했던 사람이고 근 한달 전부터 헤어질 당시까지 남자친구가 창업 문제로 힘들 때라서 그냥나쁘게 헤어지면 피차 서로 좋지않은 기억으로 남을 것만 같아서 내가 그렇게나 너에게 스트레스였다면 헤어지면서 짐을 하나 더는 거니까 그만큼은 좋은 일만 생겼으면 좋겠다고 밥 잘 챙겨먹고 건강챙기라고 하고는 헤어졌어요 좋아했던 사람에게 저런 말을 들으니 곱씹을 수록 마음이 안좋아서 사실 맘 같아서는 저는 이대로 연을 완전히 끊고싶어요 그래서 동아리 모임도 최대한 줄이고 아예 친분 있는 사람들과는 개인적인 연락만하고 단톡도 나와버렸거든요 그런데 또 생각해보면 그 사람 때문에 모임을 아예 나가지 않자니 또 왜 제가 그렇게까지 피해야하나 싶기도 하고참 복잡하네요 
ENFP,안맞는다 이미 돌이킬수없는 마음의 벽 세움 재회해도 안맞는 부분 노력해서 다 맞게끔 고치지 않는 이상은 다시 깨질 확률 높아요
INFP,괴로울 때 안좋은 생각 많이 했었는데 먹고싶은게 많아서 못죽어요 단순하게 생각하기로 했습니다 
INFP,호감이 없으면 매일 꾸준히 답장도 하지않고 산책도 하지 않을거에요 그분도 호감이 있어보입니다
ENFJ,인프피 남자친구한테 물어봤어요 호감 없으면 굳이 따로 안 만난대요
