mbti,comments
ENFP,완전 격공이요 저 하도 나대지말라는 말 듣고 사회에서 억압하도 받다가 힘들어서 인프피로 강제 전환 시도 하고험난한 인생살다 엔프피라는걸 깨닫고 살아가고 있는데 진짜 나를 찾은거 같고 너무 좋아요 저는 제 엠비티아이가 최고라고 생각을 엔프피님 화이팅 우리 무너지지말아요
INTJ,남편은 아니지만 결혼을 준비 중이기도 하고 현재 1년 정도 쭉 같이 살고 있는 예비 남편으로 인프피는 있어요 장점 1 껌딱지 아침에 일어날 때도 퇴근하고 나서도 같이 밥 먹어도 티비를 봐도 항상 곁에 찰싹 달라 붙어있습니다 오히려 제가 떼어낼 정도인데 졸졸 쫒아다니면서 도와줄까 같이 할까 하는 다정함도 물론 아주 칭찬하고 싶은 부분이고요 2 고무적인 성격 제가 뭔가 고민하고 있거나 함께 여행을 계획하거나 기타 등등 모든 일에 있어서 고무적인 태도로 옆에서 저에게 응원과 지지를 해줍니다 3 책임감 본인이 잘한다고할 수 있다고 생각하는 부분에 있어서는 가사일에서 적극적이고 책임감 있는 태도를 보입니다 예를 들어 밥 지을 때 물을 잘 맞춘다면 밥은 꼭 본인이 하겠다고 하고 본인이 먹은 음식은 바로 설거지 하려고 노력하는 편하고 제가 가사일을 도맡아 하다보니 본인이 먼저 저 출근한 사이 해놓기도 하고 함께 산다는 것에 대해 책임감을 보이기도 합니다 4 애교많음 정말 애교 많습니다 물론 집에서만 신기할 정도로 인간의 언어가 아닌 것을 사용한 애교에 특출난 재능이 있더라고요 고양이 소리 내기 개 소리 내기 알 수 없는 소리내기 웃긴 표정 짓기 춤추기 엉덩이 내밀기 등등 단점 1 귀차니즘 하루가 일정한 루틴과 리듬으로 착착 진행되어야 하는 J형인 저의 기준으로 인프피는 귀찮음에 굴복한 게으름인 것 같아요 스스로 뭘 해야 하는지는 아는데 몸과 마음이 움직이지 않는다고 하더라고요 저도 귀찮음 심하지만 이해할 수 없는 부분이긴 해요 가장 기본적인 집안 정리 허물 치우기 등등에서 귀찮음이 강력하게 발현하는 듯 해요 2 민감함 인프피는 대체로 언어적 민감성이 높은 것 같습니다 저는 솔직하게 말하고 잊어버리거나 넘어가는 편인데 이런 저의 다소 경직된 태도나 말투 직설적인 화법에 상처를 받거나 급발진 버튼이 눌려서 욱하고 감정을 뱉어낼 때가 있어요 3 와식생활 어떻게 그럴 수 있나 싶을 정도로 하루에 상당한 부분을 누워서 지냅니다 잠도 많습니다 본인이 잠을 이기지 못하는 편이라 부르면 대답은 하는데 일어날 수가 없다고 힘들어 합니다 답장이 없을 때는 10 중의 9가 잠들었음 입니다 4 보여지는 것에 많은 신경을 씀 외출할 때 1시간 동안 샤워하고 단장하는 시간을 갖는 남편입니다 딱히 뭘 하진 않는데 보여지는 것에 굉장히 민감한 것 같더라고요 물론 저에게도 잘보이고 싶고 좋은 것만 보여주고 싶고 좋은 모습만 보여주고 싶다고 했습니다 같이 살면서 그게 될리가 없는데 많은 애를 쓰는 것 같습니다
ISFP,제 얘길 하시는거 같네요방금 검사해보니 ISFP에서 INFP로 바꼈더라구요
INTJ,음 아무래도 이건 해결할 수 있는 문제는 아닌 것 같습니다 대신 여러 방법을 시도하면서 최근에는 인프피가 언어적인 민감성이 높다보니 대면하고 그 자리에서 말하는 것보다는 편지를 쓰거나 카톡으로 전달하는 방법을 주로 쓰고 있습니다 제 인프피가 대체로 강압적이거나 간섭하거나 지적하는 것에 대해 굉장히 반감이 심하더라는 것을 알게 됐고 오히려 더 자기 고집대로 행동하려는 경향도 있기도 해서 말이 아닌 문자로 전달할 때 해야한다 라는 어투보단 하는 게 더 좋을 것 같다 라는 식의 화법을 주로 쓰는 편입니다 결론적으로는 이 부분에선 제가 양보하고 있다고 봐야겠죠 그리고 경험상 제 인프피는 인풋에 곧장 아웃풋이 나오지 않았습니다 스스로 깨닫지 못하면 마음을 바꾸지 않았고 그래서 저는 마음을 바꿀 수 있게 많은 정보와 환경을 주위에 갖다주곤 해요 조금 시간이 걸리더라도 결국 본인이 깨닫고 마음을 바꾸거나 새롭게 다짐하는 게 가장 탈 없는 방법이었네요
INTJ,저와 엔팁님은 상대방인 인프피와의 관계성이 달라 뭐라 말씀드리긴 어려울 것 같아요 대신 저는 오히려 적극적으로 지지해주고 같이 요즘 이런 스타일이 유행이더라 하며 알아봐주고 하는데 본인 만족도가 채워지면 자존감도 높아지는지 더이상 꾸미는 것에 크게 신경쓰지 않는 것 같더라고요 그리고 사족을 붙이자면 저는 동생들 세 명을 어머니 대신 키워왔어서 일부 공감하는 부분이기도 합니다 이런 문제는 mbti와 성별을 떠나서 그 시기의 나이에 가장 크고 중요한 부분인 것 같아요 그 시기가 이성과 외모에 대해 매우 관심도 높고 주위 친구들이나 또래 연예인 sns를 보고 자신도 꾸미는 것에 대해 굉장히 민감했던 것 같아요 저도 물론 그랬고 엔팁님도 그 시기에는 어느정도 그러시지 않았을까 싶어요 딱히 해결책이 있는 건 아니고 저도 그 시기 동생들 때문에 머리를 좀 싸매쥐었어서 공감되는 부분이라 사족 붙였습니다
INTJ,건강하고 성숙한 사람 만나셨다니 넘 부럽네요 행복하세요
ENFP,엔팁이 봤을때 엔프피 어떤게 매력인가요 궁금
ENFP,후 이미 손바닥 안이군요
ISTP,건강한 엔프피는 최고죠
INTJ,저도 잔소리를 통제로 느껴요 그래서 sj분들 너무 힘든데 우리나라엔 sj가 많아서 인간관계 자체를 잘안해요
INFP,딱히 빡쳤다는 감정없이 후회담아 썼던 글이었는데 웃기다는 말에 속상하네요
ESFJ,상호적인 찐사랑은 그런 부정적 생각도 하지 않을거라 생각해요
ESFJ,짝사랑이 찐사랑이 되시길 기원합니다
ESFJ,아 친구관계엿군요 이해했어요 좋은 친구분들을 사귀셨군요 한결같은 느낌을 받으셨나봐요 저는 연락 못해도 평소보는거 같이 편하고 안정적으로 대해주는 건강한 친구들을 곁에 두니까 저도 건강해지더라구요
ESFJ,곁에 두고 좋은 점 따라하시면 점점 그런 사람들이 느실거에요
ESFJ,지금은 천천히 배우시고 나중엔 마음을 베푸는 사람이 되시는거죠 좋은 영향입니다
ESFJ,걱정보다 자신감 얻으세요 내가 좋은 사람이라서 주변도 좋아진거라 생각하셔요 저는 잠깐 대화했지만 글쓴이 분이 충분히 좋은 사람이라고 느껴진답니다
ISTP,호르몬 과다 정신병 이라고 정신과 의사가 사랑하면 어째야한다는 온갖정보들로 내사랑 평가하는 시대라 씁쓸 걍 맘가는데로
ENFP,엔프피의 플러팅이라고 하기에는 누구에게나 배려를 잘 하는편이라 좀 애매하네용 뚝딱거리거나 어슬렁 거리는거 공감되네용
INTP,후엥 감삼당
INTP, 티 날만큼 꼬셔야겟다
INTP,흐엉 엔프피 은근 알기 어렵네여
ISFP,IFP유형은 Te외향사고가 열등기능이여서 동기부여 받고 페르소나로 사용하지 않은 이상은 외부로 부터 인정받기 성과나 성취에 대한 욕망이 크지 않죠 IFP는 주기능 Fi내향감각에 더 의미있게 사는거 같습니다 욕망이 남들보다 크지 않은 만큼 능력이 남들 보다는 후달려도 그 사람의 부족함을 지적하시는것 보다는 좋아해주시는게 사랑받는 기분들꺼에요 물론 취미취직을 위한 자격증 같은거는 호기심에 따놓는편이에요
ISFP,바꿀려고 하지마세요 자식분은 평소 그렇게 사는게 행복한데 누군가 내 삶을 억지로 바꿀려고 집착하고 간섭하면 오히려 반항아될 수 있어요 Fi내향감정 기능 때문에 외부에서 나를 있는 그대로 보지 않고 누군가의 틀에 맞게 바꿀려고 하면 방어기제 나와요 IFP는 자기 존재 자체를 사랑해하거든요 일단 IFP유형은 예쁜 말 듣기를 좋아하기에 거친말은 안하는게 좋아요 직업적으로 잘 맞는거는 머리 사용하는 일 보다는 손재주가 좀 필요한 일이 더 잘 맞을꺼에요 바리스타바텐터제빵제과공방자기 취향대로미용음악사진작가 등등 IFP 유형 장점이라면 성급하지 않고 오히려 차분하고 인내심이 강하다는 점이 있어서 장인되기 좋죠
INTJ,남동생이 인프피고 되게 친한데요 좋은 말로는 감성적이고 말랑말랑한데 나쁘게 말하면 이성적인 사고 해결력은 개인적인 만족을 우선시하는 것 같구요 사람마다 다르겠지만 제 동생은 멘탈이 잘 깨져서 일단 피하고 모르는 척 다시 다가옵니다 가족이라 20년 넘게 지냈으니 그러려니 하는데 남이면 답답할듯요 남보다 잘하고 싶어하는 마음은 있습니다 사람이면 누구나 조금은 그렇지 않을까요
INFP,저도 혼자있는 시간도 좋지만 안정감주는 남자친구랑 연락하고 만나는 시간이 영향이 큰듯요
INTJ,인프피인 제 남자친구도 제가 특별히 해준건 없지만 자기 이야기 잘 들어주고 지지해주는 말 해줘서 힘이난다고 고맙다고 마음이 건강해졌다고 하더라고요
ENTJ,그냥 저는 이또한 지나가리라 하고 참았었네요 그리고 바쁘게 지냈어요 못했던 운동도하고 공부도 하고 자기계발 하니 시간 후딱 가면서 잊어지더라구뇨
INFJ,엄청 좋아하셨나보네요 그치만 사랑받는 연애는 아니다 판단 하에 놓으신거구요 저는 생각나지 않도록 계속 바깥에서 산책이나 등산을 했었네요
ENFP,T는 T끼리 F는 F끼리 만나는게 정신건강에 좋은거 같아요 저도 인팁 만나면서 사랑받는느낌 행복하다는느낌 못받았었어요
ENFP,오잉 남자는 아니지만 우리썸맞지 이정도면 썸이지 나는 썸이라고 생각했는데 이 정도면 썸아닌가 뭐가 더 필요한가 썸맞는데 라고 생각해서 한 말 같아용
INFP,아 저랑 반대시네요 보호본능은 저 하나로 충분해서 행동이 믿음직스럽고 멋있는 저를 잘챙겨주고 기댈 수 있는 사람이 좋아요
ISFP,FP나 TP요
INFP,저는 무조건 F요 
ISFP,FJ는 좀 계산적이고 오지랖 있어서 꺼려져요
INFP,근데 장점들이 너무 치명적이에요 리더쉽 있고 자상하고 세심하고 센스있고 든든한 아빠너낌 제가 기댈 수 있달까요
INFP,엔티제의 매력은 뭔가요
INFP,어떤 매력이 있나요
ESTJ,소심하고 생각많고 너무배려하느라 말못하고 이런거 이해해주고싶지만 답답하고 화나서 화가나요
ISFP,잇프피가 본 ETJ 마상 받았어
ISFJ,역시 예상했던 대로군요 소개팅남이 저보다 연상인데도 연락하면서 종종 그런 면들이 보이더라구요 어떻게 보면 귀여워 보이긴 하는데 외적인 부분은 제 스타일이라 더 고민되네요 사귀기 전부터 그런 부분이 보이는데 시작을 하는게 맞나 싶구
ISFJ,그래도 되게 오래 만나셨네요 사귀면서 혹시 많이 싸우셨나요
ISFJ,앗 그렇군요 큐 외적으로도 제 스타일이고 장점이 참 많은데 성격이 저랑 맞을지가 고민되네요 여태까지는 귀여운 스타일인 남자를 만나본 적이 없어서 혹시 실례가 되지 않는다면 징징거린다는게 어떤 식이었는지 알 수 있을까요
ISFJ,헉 생각했던 것보다 정말 감정기복이 심하신 분이었군요 직장 다니시면 20대 중반은 되셨을텐데 그걸 받아주시면서 2년반 만나신거면 정말 대단하신 거 같네요 저는 외모를 그렇게 따지는 편은 아니지만 외적인 이상형을 찾기가 어려워서 그래서 더 고민되는 거 같아요 댓글 달아주셔서 감사해요 도움도 되고 재밌었어요 
ISFJ,아 염탐 너무 웃겨요 댓글 달아주셔서 감사해요 
ISFJ,역시 그런가요 댓쓴이 분께서도 ISFJ이신가요
ISFJ,허허 그렇군요 잇프제가 보기에 인프피는 한마디로 귀여운 스타일인가요 금사빠 금사식 기질은 없는지도 궁금해요
ISFJ,구름 속에 있는 느낌 비유가 너무 적절해서 뭔지 알 거 같아요 말하다보면 현실적이라기보다는 이상적으로 꿈꾸는게 있어보이더라구요 댓쓴이분은 아직 인프피 분을 만나고 계신건가요
ISFJ,아하하 그런 느낌이군요 소개팅 하신 분 외적인 부분은 정말 제 이상형과 비슷한데 사귀기 전부터 성격이 다른 점들이 보여서 참 고민되네요
ISFJ,아 그런가요 하긴 mbti가 같더라도 뭐든 사바사긴 하죠 댓글 달아주셔서 감사해요 도움도 많이 되고 재미있었어요
ISFJ,아 속으로 쌓아두는 스타일도 있을 수 있겠네요
ISFJ,대화로 풀어야 해결이 될텐데 연애 참 어렵네요 도대체 잘 맞는 사람은 어떻게 찾는건지
ISFJ,그러니까요 안맞는거 알아도 마음이 맘대로 안되네요 감사합니다
ISFJ,아 경험담이신가요
ISFJ,아하 그렇군요 INFP분들 중에서 그래도 감정표현을 자제하시는 분들도 계시겠죠
ISFJ,저는 3년 만났고 냠냠념 님과 똑같은 이유로 헤어졌어요 모든 상황에서 눈치를 본답니다 만났던 사람 중에 제일 사랑꾼이어서 오래 만났지만 남친 보살피고 키우는거 좋아하는 분이 아니라면 비추입니다
ISFJ,INFP분이 모든 상황에서 눈치를 본다는 이야기인가요 사랑꾼이고 다정한 스타일이라는건 너무 좋은데 어른스러운 사람 좋아하는 저에게는 정말 치명적인 단점이네요 남친 보살피고 키운다고 표현해주시니까 너무 와닿아요 고민 좀 신중히 해봐야겠어요
ISFJ,그냥 한 번 만나보시고 겪어보시는게 제일 좋을 듯 해요 mbti가 전부는 아니니까요 
ISFJ,아무래도 그렇죠 
ISFJ,글쿤용 감사합니다
ISFJ,제가 훈련시킬 수 있을지를 모르겠네요 한번도 그걸 훈련시켜본 적이 없어서 방법도 잘 모르겠어요 사바사니까 좀 더 만나면서 알아보려구요
ISFJ,연상연하 커플이 여자가 연상이라는건가요 피터팬 비유 찰떡이네요 같은 엠비티아이끼리는 역시 성격이 다 비슷할 수 밖에 없나봐요
ISFJ,저도 그분과 만나면 이렇게 될 수 밖에 없을 거 같은 느낌이
ISFJ,그런 사람도 간혹 있긴 하군요 저도 그런 분 만나고 싶어여
INFP,타격감 오지죠 투뿔 소고기입니다
INTJ,잉뿌삐 너무 귀엽습니다헤헤 제 남친 잉뿌삐는 오히려 저를 잘 놀리고 귀엽다고 해주는데 자기가 더 귀여운 걸 모르는 바보잉뿌삐
INFP,저는 오히려 좋은거라고봐요 거의 반반정도라는거니까 극f 극t는 힘들어요
ISTJ,오 보통 반대로 엔에서 에스되던데 신기해용
ENFP,제 주위 친구들 다 엔프피 인데 항상 나오는 말이 난 다 좋아 입니다 그래서 열받아서 제가 선택하긴 하는데 엔프피는 누가 주도적으로 해서 자기가 이끌려다니는걸 좋아해요 너무 걱정 안하셔도 될듯해용
ENFP,진짜 괜찮아요 내가 먹을거 너가 골라줘는 일종의 놀이라고 생각하시면 됩니다 약간 게임같이 재밌잖아요
ENFP,내가 좋아 하는 사람이 하는거면 나는 다 좋아 예요 걱정마세요 
INTJ,아뇨아뇨 상대가 수고했다 해서 엔프피도 수고많았어 뭐 이런식으러요
INTJ,넵 안읽씹 상태라 예전에는 무시하고 보내기도 했는데
INTJ,뭐 이런적이 꽤나 있었는데 하루를 넘기진 않았는데
ENFP,속상 인간적 호감은 있지만 이성적 감정은 없는상태에서 좋아하는 건 아니지만 챙겨주니 관심이 생겨서 한 번 봐볼까하구 같이 놀고 대화해보다가 모종의 이유로 에이 역시 아닌가보다하고 흥미떨어져서 답장하기 귀찮음상태인거같아요
INTJ,저도 그만 당겨야죠 뭐
ENFP,이거 맞는것 같아요 흥미 떨어져서 답장하기 귀찮음
INTJ,월요일 약속인데 뭐 오긴오겠죠 연락이
INTJ,한달뒤도 잡혀있어요 야구보러 안읽씹 상태여서 그냥 제가 쿠키 둘만아는 공간에 넣어놓고 먹으라고 했는데 오늘 퇴근하면서 먹을거 챙겨주고 가네요
INTJ,감사합니다 연락에 큰의미 두진 않는거 같아요 약속 잡는게 좀 항상 트러블이 있었어서 그게 걱정이네요 월요일보고 6월 잡아놔서 그사이에 아마 제가 안잡으면 못볼지도 모르는데 그냥 안잡고 기다려보는 것도 괜찮죠
ENFP,아 저는 읽다보니 왜 그런지 알거 같아요 앞으로 잘될 확률이 희박할거 같아요
INTJ,알려주시면 안되나요
ENFP,엔프피는 생각이 많거든요귀찮아서 안적을라다가 한번 적어봐용 제가 저의 입장에서 생각해본 결과는 이렇습니다 일단 첫번째 자기가 꽂힌 사람이 아닌데 그 사람이 호감표현함불편했음그래도 같은 회사에서 얼굴보고 지낼 사람인데 이렇게 두면 불편할거 같아서 잘 지내자고 함 다시 고백 받기 전처럼 편하게 지냄 일단은 친구로써 타지로 놀러갔는데 스킨십을 당하니 뭔가 감정이 아리송 해졌지만 일단 덮어두고 오늘 잼썼다로 마무리 지음 그때 잘 놀았던 기분대로 친해진 마음에 챙겨도 주고 인사도 하고 그랬음 근데 뭔가 상대방은 친구로서의 느낌이 아닌거 같음 좀 부담스러워 짐 집가서 덮어뒀던 아리송 했던 감정을 다시 꺼내봄 아 근데 생각해보니 뭔가 좀 아닌거 같음 내 타입이 아니거나 좋아하는 마음이 안들거나 부담스러움 등등 결과도출 안읽씹 인사안함
INTJ,감사합니다 거리 둬 주는게 서로에게 좋겠네여
ENFP,네네 더이상 들이대지 마시구 편하게 일반 직원들 대하듯이 하거나 같이 모른체 하면 오히려 그쪽에서 호기심 가질수도 있으니까 그렇게 행동하심이
INTJ,늦은시간 답변 감사합니다 가장 큰 문제가 오늘 저녁에 둘이 약속이라는거 하 오늘도 사건이 좀 있어서 보기 싫은데
ENFP,근데 어제 인사 안한거면 그 약속도 무효 아닌가요 사이좋은거 가정하에 약속 아닌가용
INTJ,그건아닙니다 약속은 또 잘지켜요
ENFP,그건 특이하네요 저라면 약속도 같이 회피할거 생각해서 인사 안했을거 같은데
INTJ,뭐 그래서 굳이 제가 안나서 볼 생각입니다 제가 시간 장소 말하면 무조건 보는데 그냥 이번엔 있어보고 이야기없음 포기하렵니다
ENFP,enfp 관심있는 사람한텐 답장이 빨라요 반대로 재미없거나 흥미없으면 답장 느리고 딴짓하다가 밀려있는 카톡 한 번씩 답장해주고
ESTP,얼굴이라도보자 한표긴하지만 술자리 자제가필요해보이긴하네요
ESTP,동감합니다 그래도커피라도하자는건 보자는거니까 너무 생각많이안하셔도좋을듯해요
ESTP,네 화이팅하시고 좋은하루되세요
ENFP,예기치 않은 술자리가 갑자기 많았으면 그럴 수 있다고 생각해요 근데 마음이 크면 아무리 힘들어도 같이 오래하고 싶어할 것 같은데 그건 좀 이해 안 가긴 하네요
ENFP,그러게요 약속 갑자기 바꾸는건 너무 배려심이 없는건 아닌가 싶네요 그래도 연락은 바빠서 못 했을 수도 있는거니까 너무 걱정하지 마세욤
ENFP,음 저의 경우로 빗대보면 아 요즘 술 많이 마셔서 힘들다 저녁 먹으면 왠지 술 한잔 할 것 같은데 내가 조절이 될까 그냥 커피만 마시자고 할까 이렇게 얘기하면 서운해하려나 하고 무수한 내적갈등을 하지 않았을까 싶어요 연락만으로는 파악이 힘드니까 한번 직접 만나서 판단해보세요 
INTJ,왠지 서운해 보이시는 것 같은데 아무래도 같은 유형이라 뼛속님 생각을 어림짐작 하자면 나와의 약속 전에 저렇게 컨디션 관리가 안 되는 모습을 보면서 나와의 시간이 중요하지 않나라는 의문이 드셨을 것 같아요 저도 바쁘다바쁘다 하면서 술 마시고 데이트 할 때 컨디션 관리 안 되는 전애인을 쥐잡듯 잡았었거든요 그래도 아직 썸단계시니 두분 시간 잘 보내보세요 
ENFP,그냥 모든사람들이 다 기분좋규 좋았으면하고 날 좋아해줫으면하니 눈치를보면서 기분을살피는겁니당
ENFP,동성이성 이런거 관계없이 친하거나 가까운 사람에 대해서는 상대방 기분이나 눈치를 잘 살피는 편인듯하고 그 외에는 전혀 눈치안봐요 그러거나 말거나
ENFP,배려 내 사람들과 나 자신을 위한 배려임 상대도 내게 해주길 바람 그게 진정한 관계라 생각함
ENFP,유년시절에 그런 환경에서 자랐던 사람들이 엔프피가 되는 경우가 있더라구요 저 같은 경우는 그런 케이스예요 눈치 많이 보는 집안에서 자라서 엔프피가 된거 같아요
ENFP,걱정되고 도움주고 싶어서요 세상이 망하는 순간에도 사과나무심을 엔프피니까요
ENFP,노놉 진짜 바빠서 그런거에요 엔프피가 집중하면 주변에 노래방이던 지진나도 모르는 타입 좋은데 놓치고 싶지않아서 그런거 같은데 타이밍은 진짜 절묘해서 그런거 같아요 저도 많이 그래서 묘하게 그렇게 되더라구요 엔프피 상처 진짜 잘받아요 그래도 좋아서 잡은거니까 놓치지마시고 잘 잡고 있다 만날때 즐겁게 만나시길 바래요
ENFP,엔프피 싫으면 못만나요 제가 여자분이라면 좋아하는 거 맞고 바빠서 그런거 같고 헤어지자 하면 상처 받을거 같아요 바쁘면 감정이 복잡해지고 그냥 정신이없는게 아니라 그냥 고개들었더니 저녁이네 밤이네 이러는 생각할 시간 3일정도면 적당하다고 생각해서전 기본 1일 현실 돌아가는시간 2일 생각정리 3일 감정정리 이런식이라서 닥치는 데로 일해결하는 유형이라서 에너지를 일에 쏟느라 구런것 같아요 일단 식게 하려는 작전은 절대 아닐걸요 그냥 거절하면 했지그런 행동 하면 엔프피가 아닐 거에요
ENFP,22222 막줄이 핵심입니다 딱 저렇게 느꼈어요
INFP,대답 하나하나에 신중한편이예요 이 말 했다가 상처받으면 어쩌지 하는 경우도 있어요 그래서 바로바로 대답이 안나오기도 하고 선택사항을 주면 안돼요
INFP,긍정적이신것 같아요 저는 늘 최악의 경우를 상상해서 부정적이거든요
INFP,마음을 담은 손편지는 꼬옥이요 잘어울리겠다며 향수 주면 저는 너무 좋을 것 같아요
INTJ,네 사귀어도 카톡은 잘안하더라구여
ENFP,전 사무실에서 일하는 시간 집에서 자기 전 시간에는 붙잡고 실시간대화만 12시간씩도 하구요 밖에 있거나 사람만나거나 놀러다닐땐 폰 쳐다도 안보는데 상대가 서운하면 안되니까 신경써서 한번씩해요 근데 엔프피는 남녀 차이도 꽤 큰 것 같긴해요 저는 여자
ENFP,카톡은 심심하거나 말하고 싶을때만 하는 것 같아요 연애도 안정기에 접어들면 카톡 현저히 줄어들어요 
INTJ,헷갈리면 아직이에요
ENFP,아직참으세요 엔프피는 그냥 재밌으면 만나서 놉니다 호감을 떠나서 재밌으니까요 잘들어주고 웃어주세요
ISTP,그 긴 글들을요 이렇게 답변 주셔서 감사해요 감동 네 맞아요 아파도 봐야 사랑이죠 그 짧은 문장이 용기를 주네요 좋아하는 사람 만남까지 가는 게 정말 쉬운 일이 아니죠 그래서 미련이 넘치다 못해 흐르나봐요 중간님의 말씀을 들으니 뭔가를 받는다고는 느끼고 있었는데 이게 사랑인가 확신이 없었던 거 같기도 합니다
ISTP,네 오늘 종일 생각했는데 이대로 끝내기엔 확실히 아쉬울 거 같긴 해요 근데 제가 받은 상처들이 자꾸 고개를 들어서 하루에도 수백 번 마음이 왔다 갔다 합니다 보여준 용기에 믿음으로 다시 시작해보려고 하는데 잘하는 짓인지 확신은 없네요 레이나님 매번 감사드려요 댓글 주셔서 아마 저는 INFP 방을 또 찾아오겠죠 다음엔 너무 행복해서 찾아왔으면 좋겠어요
