comments,comments_writer
"항상 일에 미쳐있는 엣티제 친언니를 모셔본 결과! 그런말 하면 저는 엣티제에게 최적화된 말을 해줘요ㅋㅋㅋㅋ""힘을 내거라! 일해라!! 쓰러지지 말거라!! 용사여!"" 이러면 눈에 다시 불이 켜지고 힘낸다는 뜻으로 울부짖어요ㅋㅋㅋ그리고 기분 전환할겸 시간 날때 저랑 맛있는걸 먹으러 가거나 힐링하러 경치 좋은곳 가는거 같아요",삐뚤어진 잇프제
때려쳐 내가 먹여살림 하고싶은거해 라고 해주면 기분좋아져서 그래도 일은 가야지 할듯,I or ESTJ 여자
그쵸 마무리는 고기가 좋겠네요 벌써 마음이 충만ㅋㅋㅋ,I or ESTJ 여자
어떤게 힘든지 물어봐주고 들어주면 좋던뎅 아무 영혼없이 넌 잘할거야 힘내 같은 의미 없는 위로는 노노 갑자기 그냥 깊티보내면서 힘내도 싫음,아토찡 ESTJ
저건 저라도 사랑받는단 느낌 못 받을 거 같네요,S가 좋은 잇티제쟈나
제가 회전님과 같은 상황이라면 나에대한 마음이 변한것 같은데 금사빠 금사식이구나 싶어서 실망할것 같아요,갓블레스유INTJ
저여!!ㅠㅠㅠ펑한거 뭔지 궁금하네요ㅜㅜ,esfj 감자
"아 진짜요? ㅜ 그냥 애정표현 전혀 없고... 말이 이어진다는 느낌이 없고 뚝뚝 끊길때가 많아요.
'그래요. 네. 알았어요. 아아,,,'이런 말이 참 많아요.... 그냥 절 별로 안좋아하는 걸로 생각해야하는지,
어떻게 해야할지 답답하네요.",회전
"팀장이라 아마 더 그렇지 않을까 싶네요 .. ㅠㅠ (직급만 달라졌을뿐인데 사원들이 그렇게 따돌린다는 팀장님들..) 아무래도 직급이 있다보니 먼저 다가가서 말을 걸고 하심이 사람들이 더 쉽게 다가올 수 있지 않을까 싶습니다 ,, 근데 또 너무 친해지면 정도를 모르고 선을 넘는 사람들도 있으니 주의하시고 화이팅입니다 .. ! 💪🏻",잇티제 dori
감사합니다!,밤 산책ISTJ
잇티제... 어렵죠... 진짜 우당탕탕 뿌시고 들어가야하는... 근데 또 너무 훅 들어오면 부담스러워함... 어쩌라는건지... 오늘도 자기반성합니다 고생하셨어요!! 님의 가치를 알아주는 남자 만나시길~~!,지각쟁이 ISTJ
ㅋㅋㅋㅋ별 관심도 없는 상대가 날마다 말거니 싫증낫나봐요ㅠㅠ 그래도 칼답에 아침부터 쭉 연락해서 뭔가 가망이 있을 거 같기도 햇는데 결국은 ㅠㅡㅠ,EnTP입니당
님 쓰신글 쭉 봤는데 진짜 멋져요... ㄹㅇ 상여자!!! 이런 매력둥이 희귀탬인데 저 잇티제가 바보네요~ 매력 알아주는 남자 만나서 사랑받으시며 행복하시길!!!!,지각쟁이 ISTJ
"헤헤 감사합니다,,,🥹💖",EnTP입니당
잘했어요,S가 좋은 잇티제쟈나
감사합니당 ㅎㅎ.. 잘한거겟죠? ㅠ,EnTP입니당
"네 무조건 잘한거요
님만 비참해짐요",S가 좋은 잇티제쟈나
"좋아해주는 사람한테 맨날 연락 하는거 안지겹냐고 얘기하는게;;;
상황이 어땠는지는 모르겠지만 인간적인 호감도 없는 상대라 해도,
저런 식의 말은 감정 존중도 할 줄 모르는 것 같은..
차라리 잘됐다 싶은데요 시작 전에 걸러져서
달달한거 먹고 털어내시죠~",잇토끼isstj
ㅋㅋㅋㅋ평소에도 원래 그런식으로 말하는 친구인건 알았는데 그 대상이 제가 되니깐 어질어질하더라구요 ㅡㅋㅋㅋㅋ ㅠㅠ 엠비티아이를 떠나서 사람대 사람으로서 예의가 없는 거 같은 ㅠ.. 감사합니다!!,EnTP입니당
잇티제에게 간택 당하는건 노력으로 되는게 아닌지라….빨리 포기하신게 잘하신거에요,스톡 istj
ㅠㅠ감사합니다,EnTP입니당
ㅋㅋㅋㅋㅋㅋ아 저도 계속 하다보면 되겠지~ 하고 진짜 끊임없이 다가갔는데 결과는ㅋㅋㅋㅋㅋㅋ 잇티제의 지겹다…와 포기엔딩ㅋㅋㅋ ㅠ 슬퍼요,EnTP입니당
"ㅋㅋㅋㅋㅋㅋ저 한 한달은.. 됐어요ㅋㅋㅋㅋ 그리 긴기간은 아닌 거 같은데,,",EnTP입니당
연락하기 시작한게 한 열흘.. 좀 될거에요 ㅠ,EnTP입니당
"ㅋㅋㅋㅋ 제 짝남은 사회화가 덜된게,, 다행인걸까요 오히려 근데 진짜 정이 너무 떨어져서 미련도 안남아요 그냥 한대 쥐어박고 싶군요",EnTP입니당
전남친이 잇티제엿는데 잇티제 넘 어려워요 ㅠㅠ 근데 전남친 말로는 자기도 마음에 들어야 마음의 문을 여는 것 같다고 한 것 같아요 .. 저런식으로 말했으면 마음 접으시는게😿,와아아압
사바사 영역 아닐까뇨..,집에가고싶은 INTJ
역시 그렇겠죠?! 감사합니다:),ENFJ양양
"경험상 엣티제남은 신중한 고백, 엣티제녀는 상대 꼬셔서 고백받아내기",아토찡 ESTJ
20대 중반까진 고백 받는게 좋아서 은근하게 유도하다 20대 후반부턴 대놓고 꼬시는것도 상대 반응이 꽤 흥미로워서 직진모드였던것같아요,I or ESTJ 여자
"상대방이 어떤 스타일인지에 따라 다른거같아요. 내가 직진해야 쉬운스타일이면 직진, 유도하는게 득인 스타일이면 유도!",Bee ESTJ
"저한테 질문 따위 없었지만 제 분야에 도움 주신다면서 따로 연락하자고 그랬는데, 워낙 외향적인데다 사업하시는 분이라서 동호회에서 사람들한테 잘 베풀고 잘 챙기기 때문에... ㅋㅋ 이것이 자신의 사업 연장의 영업인 것인지 이성적인 호감인지 잘 모르겠지만 답변 감사합니다 ㅎㅎ",상어지느러미INFP
인프피 좋아합니다,무정 ESTJ
서로 반대라서 멋있어 보이는 걸까요? 좋아해주셔서 감사합니다~~,상어지느러미INFP
"착한 여자 좋아합니다 ㅎ
제 엣티제는 쎈캐라서 잇프피인 저랑 잘 맞아요",iiiiiiiijliliiiiiiii
그러시군요~ 저는 물컹물컹 인프피입니다. 감사합니다.,상어지느러미INFP
음.. 일단 그분의 스타일에 맘에 들면 뭐든 직진 할겁니다!,엘버
직진하는 스타일이군요... 여자 쪽에서 먼저 연락하고 그럼 별로인가요? ㅋㅋ,상어지느러미INFP
맘에 들어하시면 뭐든..?,엘버
ㅠㅠㅠㅠ 맘에 들어해서 하는 행동인지 영업인지 알 수가 없지만 ㅠㅠ 감사합니다,상어지느러미INFP
"아닙니다! 전 엣티제가 아니지만
사겼던 사람이 엣티제였어서",엘버
접던데요,INTP 5W6인팁
접을듯 내 도덕심과 인격유지가 더 중요함,E or ISTJ 여자
화나고 따지고 싶지만 그것조차 시간 아깝기 때문에 그냥 바로 포기 차단,아토찡 ESTJ
접습니당!,Bee ESTJ
아쉽지만 접어요,엣Tf제리
포기요,estj입니둥
"맞아요
티를 내기도 하고 안내기도 해요",S가 좋은 잇티제쟈나
다른사람들은 어색해하는지 모를텐데... ㅋㅋㅋㅋ 그냥 말안섞어도 될땐 굳이 말안하고 말을 해야한다 싶으면 스몰토크정도....,istj 사탕
거리를 두고 벽을 친다.,가을햇살
그냥 말안하고 있는다 상대가 눈치채면 티난거고 못채면 티안낸거 ㅋㅋㅋ,E or ISTJ 여자
티안나요 어차피 말을 잘 안함,잉잉 ISTJ
ㅋㅋㅋㅋㅋㅋㅋㅋ 마자요,다정 ISTJ 1w9
ㅋㅋㅋㅋㅋㅋㅋ말을 잘안함ㅋㅋㅋ,잇틔제
말안하고 얘기듣거나 리액션정도만 해요,시뇨이야
"아뇨
그런 행동을 못하게 하지 제가 거울치료로 하진 않아요
거울치료 대상도 없고 굳이 싶고요
그렇게 해야만 고쳐지는 것도 별로네요",S가 좋은 잇티제쟈나
"저는 직장인이고 상대방은 학생인데 몇주전에 부서회식으로 이성섞여서 갔다왔는데(회식전날 미리말함) 기분 안좋은 티를 내더라구요. 그러려니했는데

이번주에 월요일날 같은과오빠랑 술마셨다고 오늘 통보를 하는데 어떻게 받아드려야할까요",엔도림스크 INTJ
222 소름이요,다정 ISTJ 1w9
"이건 엠바엠이 아니고 사바사, 그리고 나이 바이 나이라 생각합니다ㅋㅋㅋ 어리면 그럴수도요",지각쟁이 ISTJ
아.. 여자친구가 21살이에요.. 감사합니다^^,엔도림스크 INTJ
충분히 그럴 수 있어요. 연기가 단순하고 어설프겠지만.,가을햇살
감사합니다 그러려니하고 넘어가야겠네요,엔도림스크 INTJ
"회식인데..... 어려서 이해를 못해주고 질투한 부분은 그만큼 날 좋아한다 생각이 들어서
귀엽고 좋게 보이는데 그걸 의도적으로 남사친과 술먹는 행위로 갚아준 거라면
귀여운 모습이 그냥 생각 없고 철 없는 느낌으로 바뀔 것 같아요. 별로네요
그걸 동일시 한다는게 ;;",잇토끼isstj
쌓인다면 이별사유가 될 것 같긴 하네요,엔도림스크 INTJ
"아직 경험하지 못한 부분이라 어린 친구에게 이해를 강요할 수는 없겠죠
질투 하는 모습을 보인다면 그만큼 나에 대한 마음도 크다고 생각이 들어요ㅎ
나쁜 방법으로 해소하려 하기 전에 조금 더 표현하고 신뢰되는 모습을 보여 주시는게 좋을 것 같아요ㅎ",잇토끼isstj
미련있으신가요?,E72 S96 T75 J98
"저는 좋게, 안좋게 헤어지는거 상관없이 헤어지면 바로 차단해요. 다시는 안 볼 사람이라 생각해서요.
어느정도 만나셨는지 모르겠지만, 볼거 못볼거 다 보고 다시 쿨하게 친구사이로 지낸다는건,, 미래의 이성친구/배우자에게
엄청난 실례라고 생각해서요.

근데 제가 차였거나 다시 만날 여지가 있는, 애매한 이별, 미련 남으면 연락처 차단 망설일 때 있는 것 같아요.",E72 S96 T75 J98
넹 저는 미련있죠 ㅎ.. 쿨한 척 하며 헤어지고 지내긴 했지만 전 좋아하는 마음이 클 때 헤어졌으니까요 솔직히 자존심 상해서 놓지 못하는 것 같기도 하고요,련 intp a 5w4
"ㅠㅠ성향 떠나서 이성적으로 쉽게 생각해보면 다시 만나고 싶은 사람이면 차단까지 안 가지않을까요..
너무 마음 아프지만...",E72 S96 T75 J98
"사실 지금 이성적인 판단이 흐려진 것 같아요. 많이 벗어났다고 생각했는데 아직도 이별에 허우적거리는 것 같네요.

어떤 대답이 듣고 싶어 제가 이 글을 쓴 건지도 모르겠고 뭘 묻고 싶은지도 잘 정리가 되지 않는데

권태기로 헤어졌다는 게 제게 자존감을 많이 떨춘 것 같아요. 저만 감정 동요하는 줄 알았거든요
상대 상황 특성상 사람들과 어울려 지내는 시간도 많고 저와 이별도 엄청 오랜 시간 고민하고 결정해줘서 노력해줘서 후련한 마음만 클텐데 저만 이별 후에 못 벗어나고 그리워하는 게 자존심 상했던 것 같아요

겹지인이 엄청 많아 애인이나 썸 타는 상대가 없다는 건 소식이 들려오고 상대는 그럴 시간도 없긴 해요. 저도 애인이 생기면 그냥 두거나 불편해 할 것 같다 하면 숨김 삭제 할 것 같거든요 (숨김, 차단 목록에 안 남는데 내 카톡에서는 사라짐)
근데 두 달 동안 아무 연락 없었는데도 차단 한 걸 보먄 그래도 내가 신경 쓰이나보다
하면서 희망회로 돌렸던 거 같아요.

그 희망회로를 충족되길 바라면서도
미련 버리고 싶어서 반대의 말도 듣고 싶긴 하고
오.. 글 쓰면서 조금씩은 정리 되는 거 같네요 ㅋㅋㅋㅋㅋㅎㅎ


그래도 어쨌든 다시 만나고 싶지 않다는 의지로 차단도 한거겠네요! 답변 감사합니다!",련 intp a 5w4
와... 저랑 비슷한감정이에요ㅠ 저도 좋아할때 이별통보당해서 미련있고 자존심상한것도 있어요ㅋㅋㅋㅋ 딱이마음ㅜㅜ,냠냐냐냐냠
"사랑한다고 느꼈던 마음들은 헤어지자는 말을 들음으로써 식은 것 같은데 자존심이 상해서 미련이 남은 것 같아요..!
나는 좋아하는데 어떻게 나를 안 좋아해! 정말 안 좋아해? 하면서 그 희망에 맞는 근거를 끼워맞추려고 생각 투자를 많이 하게 되니까요!",련 intp a 5w4
저도요 제가 걔를 사랑해서 걔없으면 죽겠고 보고싶고 이러는 건 아닌 거 같아요 아무리봐도 부족했던 연애에 대한 미련이거든요ㅎㅎ 헤어짐당하니까 자존심 진짜 많이상하고 나는 힘든데 넌 안힘든거 알아서 또 억울하고ㅎㅎㅎ 근데 이거 다 성숙하지못하고 부질없는 거 알아서ㅜ 조금만 더 하다가 놔주려구요ㅎㅎㅎ 내마음이 풀릴때까지만!,냠냐냐냐냠
"전 차단한 적도, 당한 적도 없어요",S가 좋은 잇티제쟈나
우와 실례지만.. 그 이별 중에 다시 엮이고 싶지 않게 싫거나 상처가 컸던 상황도 있었나요??,련 intp a 5w4
없었어요,S가 좋은 잇티제쟈나
답변 너무 감사드립니다 😍,련 intp a 5w4
저는 좋게해어지든 안좋게헤어지든 차단 안해요 미련있으면 있는대로 없우면 없는대로 그냥 봐요ㅋㅋ,Lkjhjk
오호..! 답변 감사드립니다 😁,련 intp a 5w4
차단은 그냥 안하고 삭제정도는 합니당..ㅎㅎ,estp istp 반반
답변 감사드립니다 😆,련 intp a 5w4
"굳이 먼저 차단까지는 안하는 편이지만 관계에 가망이 없는 상황에 더하여 저는 미련이 없는데 상대한테 미련이 있는 게 보이면 상대를 위해서 비공개 차단해줍니당.... 🥹🥹
이후에 새 사람이 생겨서 그 분이 원한다면 차단하구요!",치이 infj 2w1 spso
"저는 미련 엄청 많은 사람이라 차단은 안하지만...혹시나 상대방이 새로운 인연을 만나고 있다는 소식이 들리면
안그래도 이별 극복하는 데 엄청 힘들었고 상처가 깊게 남아있는데 또한번 제가 먼저 무너질 것 같아서
카톡은 숨김이나 아예 없애버리고 인스타는 스토리하고 게시글 안보이게 해놨어요.",에반셀린 ENFJ
"좋게헤어졌는데 차단하는 경우는 
다른 사람이 생겨서 프로필 못보게 하려구 차단하네요",나는누구이고여긴어디
저도 차단 원래 안하는 편인데 뒤늦게 재회하고싶다며 질척거리면 차단해요,잇틔제
친구목록에서 아예 삭제합니다 찾을 수 없게 번호도 지웁니다 술을 먹지않아 실수로 번호 누를일도 없습니당,그룸 inftj 6w5
"불가피한 상황(집안문제, 이사 등)으로 인해 헤어진게 아니라면 좋게 헤어지는 것은 없다고 생각합니다.
연락받기 싫거나 프로필을 보여주고 싶지 않아서 차단한 것으로 생각돼요.",ISTJ가든
어이쿠야 남친이 저런거까지 지적하면 전 피곤해서 못사귈것 같아요,갓블레스유INTJ
저도요ㅜㅠ너무답답해요 😭,엣팁ㅋ
저도 엥? 초면애 안녕 했어? 싶을거 같긴 해요 혹시 미성년자신가요? 성인 기준 저는 다같은 성인인데 초면에 나이 알아도 반말하는건 조금 띠용... 근데 어쨋든 얼굴도 모르는 사람인데 내 여친이 중요하지 개념없다 어쩌구 이렇게 무례하게 말할 일은 아닌거 같아요,지각쟁이 ISTJ
아뇨 성인이에요ㅠㅠ흠..😭그렇게 생각할슈도 있나봐요 😔,엣팁ㅋ
네... 조금 이해불가... + 제가 그 동생이었으몀 기분 상한 티 냈을거고 만약 제 남친한테 다른 사람이 그렇게 초면에 반말했으면 좀 더 오바해서 개념없다 못배워먹은놈 아니냐 이렇게 욕했을거 같아요.. 근데 반말을 한 사람이 제 남친이라면 남친한테 개념없다고 하면서 크게 뭐라하진 않을거 같네요..!! 그냥 어.. 초면애 반말은 좀 글치 않아..? 정도로 끝냈을듯,지각쟁이 ISTJ
제남친이랑 똑같은말하시네요.. 못배운거로보인다면서 그랬는데😭ㅠㅠ의견감사합니다~,엣팁ㅋ
앗.... 어쩔수 없는 동족이군요... 넵 토닥토닥입니다!!!!,지각쟁이 ISTJ
"저도 비슷한 사이가 있는데 서로 궁금하기도하고 소개시켜준대서 셋이 만난적이 있는데 어차피 내 지인도 아니고 초면이기도 하고 사실 몇번 봤는데 지금도 존댓말써요 그친구랑은 ㅋㅋ
아마 다 큰 성인이고 처음보는데 예의없다 생각한 것 같네요.",ISSUE
엥 초면에 반말을..?,잉잉 ISTJ
"저는 상관없어요.. 제가 그 동생분이어도 언니, 형 얘기 많이들었어요 했을거같은데.. 갑자기 만난 사이도 아니고 오랫동안 얘길 들어온거라면 충분히 그럴 수 있다고 생각해여.. 님 잘못 없어보여요.",두부아버지
오 제 잇티제 남친은 그런걸로는 아무소리 안하는 스타일인데 기준이 다 다른가봐요,삐뚤어진 잇프제
엣티제가 안되는게 많은게 아니고 남친분이 안되는게 많네요,무정 ESTJ
ㅋㅋㅋㅋㅋㅋㅋ,ESTJ 여자사람입니다
대박 ㅋㅋㅋㅋㅋㅋ,iiiiiiiijliliiiiiiii
보수적이고 자기만의기준이 명확해서 더 그런거같아요ㅋㅋㅋ잇팁이시면 잔소리 진짜 싫어하실텐데 걱정이네요ㅋㅋㅋ,병살타ESTJ
"잔소리를 싫어하는것을 아는 엣티제면 좋으련만,,, 아직도 모르는 것 같아요,,,",잇튑
진짜 전형적인 엣티제를 보는것같은 기분이드네요 ㅋㅋㅋㅋ,그래내가infj
엣티제 다 저러신가요ㅠㅠ,INTP 3w4 린네
불건강한 성격같은데요.... 통제욕이 많은 것을 망치고 상처주는 상황같은데 여자친구분 괜찮으세요?,ENFJ 랄라스윗
저건 엣티제의 특징이 아닙니다...,엣Tf제리
저도 엣티제 만나고있는데 저러지않아요.. 가스라이팅이 있으신 분 같은데..,Isfjpl
조금 심하신 편인 것 같긴 한데 제 엣티제도 조금 남사친이나 이런 거에 있어서 엄청 보수적이고 다른 전남친들보단 안 되는 거 많은 것 같아영 ㅎ 그대신 자기도 안 해서 할말은 없어용…,쓰동쓰 enfp
"모든 엣티제남들이 다 저러지 않지만ㅋㅋㅋ 저런 엣티제남 만난 적 있는데 저런 사람들 보수적, 내로남불 엄청 심하고 싸울 때 이성적이고 논리적(지금 생각해보면 살짝 무논리=가스라이팅)으로 달려듬. 과거 전적이나 헤어지고 보니까 여자친구는 자주 바뀌면서 오래 만나지는 못하더라요 ㅋㅋㅋㅋ지쳐서 떠나는듯,, 순종적인 유교걸 아니면 저런 엣티제 절대 못 만납니다..",아토찡 ESTJ
저랑 완전 비슷하네여,S가 좋은 잇티제쟈나
와... 하나부터 열까지 다 공감되요! 특히 엣티제 일상 루틴에 내가 들어가 있는 느낌을 받을 때 엣티제가 나를 찐으로 사랑하는구나 라는 느낌을 많이 받죠....ㅋㅋ,해이랑 enfp
지인짜 공감하고 갑니다👍,리트리버 엔프제
누가 내얘길..,잇티제당
4번 ㄹㅇㅋㅋㅋㅋㅋㅋㅋㅋㅋㅋㅋ 6개월동안 점심 똑같운 식당에서 먹음... 남친이 이해못함....,지각쟁이 ISTJ
ㅋㅋㅋㅋ제남친은 삼각김밥에 꽂혀서 삼각김밥 1달 먹다가 김밥 꽂혀서 김밥 1달 먹다가 요즘엔 빵에 꽂혔어요 ㅎㅎ,화아앙
찐공감이요 ㅋㅋㅋ,민아냥
"좋아하는 잇티제가 7,8을 저한테 하는데 이거 가능성 있는 거라고 믿겠습니다 ㅋㅋㅋㅋ
안정적이고 예쁜 연애 부럽네용 ~.~!",ENFP 화초모
완젼 제얘기네요~ 결혼 10년차 아저씨인데.. 제가 하는 생활 훔쳐본듯 정확하네요 ㅋㅋㅋ,수훈 ESTJ
"와 소름돋아염 애인이 엣티제반 엣프제반인데 4,6번빼고 다맞아여..",INTP 냐옹
"잇티제 3번 4번 진짜ㅋㅋㅋㅋ
루틴 목요일은 무조건 손톱 깎는날!
집가서 밥먹고 씻고 운동하고 저한테 정확히 9시 30분에 연락와요ㅋㅋㅋㅋ 11시 30분 취침

본인기준 맛있다고 생각한거 그후로 쭉 그 먹어본것만 먹는 사람ㅋㅋㅋ새로운 음식 도전 안하기
새로운 음식 먹어보고 맛없으면 다신 안먹는다 시전ㅋㅋㅋㅋㅋ",삐뚤어진 잇프제
월급이 최고의 영양제..,ISTP 8w7
"이거 맛다,,,맞긴 한데ㅋㅋㅋㅜ영양제를 줄려고 생각했어서,,!!답변 감사해요",엣프제잇티제
"따흐흑 아직 직장을 안다녀서,,,금전적으로 쉽지 않겠네오,,,,답변 감사합니다",엣프제잇티제
아이스아메리카노 생존템,파스타좋아 ENTJ사자
오 맞죠!이것도 참고할게요 답변 감사합니다,엣프제잇티제
"마그네슘!!!!!!!! 진짜 담날 눈뜨는게 다른데. 다들 왜 안먹어요!!!
킬레이트 마그네슘으로 드세요.
저는 닥터스베스트꺼 먹는디 블루보넷이 유명한거같아요, 브랜드는 상관없을듯요!

아무튼 마그네슘 진짜 다들 챙겨드세요!!!",인팁걸
"혹!!!!!!!드디어 원하던 정보가,,!!감사합니다 매모하겠습니다 답변 감사합니다",엣프제잇티제
제가 영업 당하고 갑니다ㅋㅋㅋㅋㅋㅋ,잇티제당
"자기전에 먹고자면 숙면에 엄청난 도움이,,,!
자는동안 근회복 팍팍 시켜주거든요
다른 효과도 많지만 저는 숙면/근회복 부분 체감을 확 했습니다 ㅜ~ㅜ

진짜 직장인들 다 먹었으면 좋겠어요~~",인팁걸
근회복이란 말에 당장 샀습니다 감사해요＞︿＜,잇티제당
종합비타민....철분제...유산균...콜라겐 먹고있어요 ㅋㅋㅋ,istj 사탕
"오호 직장인 남자들한테도 필요한건가요,,,!",엣프제잇티제
헐 와 정보 감사합니다!!찾아볼게요 감사합니다!!,엣프제잇티제
호곡 감사합니다!!!참고할게요 답변 감사합니다,엣프제잇티제
"남자영양제는 우루사, 아르기닌, 밀크씨슬. 구빰..!",잉잉 ISTJ
"저는 비타민만 챙겨먹어요!
다른건 먹어도 그다지 ... 라는 느낌이라..
제가 먹고 있는 종합비타민은 드리내 종합 멀티비타민입니다!",조뚱이맘
"엣티제든 잇티제든 성향 자체는 비슷할 것 같아 보여요ㅎㅎㅎ;;
제가 이전에 만났던 분이 잇티제여서요.
이분들의 사랑 표현법은 일상 공유/보고입니다.
내 입장에선 잔소리로 느껴질 수도 있고, 이 사람은 내가 하는 게 다 관심이 많구나라고 느껴질 수도 있을 것 같아요~
제가 이런 경우로 그만 듣고 싶다고 하니...마음의 상처를 크게 받았어서 이별통보를 받았어요~
(물론 성향/가치관 차이도 있고 저의 현실적인 문제때문에도 있구요^^;;)

한번 글쓴이님이 남자친구분을 유심히 지켜보세요~잔소리가 우리의 미래를 위해서 하는것인지, 글쓴이님을 위한 잔소리가 아니라
자기 자신이 편할려고 잔소리를 하는지, 지금부터 면밀히 관찰해보시는 것을 권해드립니다ㅎㅎ

사람이 좋은데 잔소리한다고 헤어지는 건 좀 그렇잖아요??^^;;",에반셀린 ENFJ
"https://cafe.naver.com/mbticafe/714176?tc=shared_link

이거 참고하세요! 저도 방금 글 둘러보다 댓글에 요 링크 참고하라길래 보고 왔는데 도움됐어용 궁금증 하나는 아직 안 풀렸지만!",ENFJ양양
저도 이 글 보고 글 쓴거에용...ㅋㅋㅋ 찐사랑이면 눈에 하트뿅뿅이라는데 지금 제 남친은 저를 보면 좋아하는 눈빛이긴 한데 약간 딸보듯 하는느낌이라 해야하나...물가에 내놓은 애 처럼 보는 느낌이라 좋아하는게 맞는건가 라는 생각에용,화아앙
아 보셨군요!! 음.. 역시 어려워요 엣티제.. 저 글처럼 일상공유도 해주고 그러나요? 엣티제의 애정표현은 일상공유가 제일 크다던데.. 이게 맞다면 좋아하는데 쓰니님이 너무 신경을 쓰고 계신걸지도 몰라요!,ENFJ양양
맞음,estj확실함
왜 애정표현이 잔소리인거야...? 더 발전시키고 싶어서??그냥 잔소리 안하고 자기가 해줘도 되는거 아니야?? 내가 잔소리 하지말고 니가 해주면 되잖아 라고 하면 남친왈: 맨날 못붙어있으니까 잔소리하지! 옆에 붙어있으면 내가 하지! 이럼,화아앙
"자기사람이 아닌 남이라 생각되면 옆에서 똥을싸던 브레이크 댄스를 추던 관심없음 뭐 이걸 관심의 척도라고 포장하지만
내가 하는 잔소리를 받아주는 사람 입장에서 고맙다고 생각하길 여겼으면 하는 마음일겁니다.
물론 내 눈에 거슬려서 하는 경우도 있지만",estj확실함
눈에 거슬려서 하는 경우도 있어요 ㅋㅋㅋ 그래서 요즘 이 남자칭구랑 안싸우고 잘만나려고 어떻게 하면 저런 잔소리에 내가 더 현명하게 반응해서 남자친구가 저를 더 좋아하게 만들까 라는 생각입니다. 잔소리라고 안받아들이고 [나 잘되라고 하는말이지? 고마워] 라고 해야겠네요~,화아앙
잔소리 애정없으면 안하는게 아니고 못합니다.....,Bee ESTJ
엣티제 엔티제인데 맞습니당 애정 없으면 잔소리 안해요,피같은엔티제
와 아니 제 남자친구인줄 알았어요..저희도 장거리커플이라 만나야 애정표현이 가득한데 카톡으로 하면 이모티콘이나 그런게 잘 없어서 무뚝뚝 그자체^.^..그리고 잔소리...은근 많더라구요..? 왜 그렇게 해? ~~~하면 되지않아? 어 이거는 ~~하는게 좋아...잔소리꾼,짱엔티제짱
헐 말투 완전 제 남친인데요...?ㅋㅋㅋㅋㅋ저희는 그래서 많이 싸워ㅛ어요 이제 제가 잔소리 하면 저게 다 애정이겠거니 해서 애교 부리고 장난식으로 넘기면 장난치면서 또 넘어가더라구요 ㅎㅎ 대처방법을 좀 익힌 것 같아요,화아앙
