comments,comments_writer
"퇴근길에 10번정도 차로 데려다 드리면서 잇티제가 생각보다 말이 많구나라고 느낄 정도로
수다도 많이 떨고 해서 친해진 줄 알았나 본데 아니였나봐요 ㅎㅎ",으헤으헤으어어
엄청 비싸고 잘깨지는 유리컵 손에 들고있다 생각하심 될거 같아요ㅠ,쭌INFJ
똑같은 질문 여러번 하면 진짜 화나요!!!😡 발끈했는데 또 그럼 영영 안 볼 수도...,럭키쏭Istj
친해지기 전에 선 넘는 농담은 무례하게 생각해서 아 이 사람은 무례한 사람이구나.. 생각하고 이미지 각인 시켜버린답니다.,럭키쏭Istj
웃프네요ㅠ 초면에 무례하게 대하면 istj 멀~~리 도망갑니다 최대한 예의바르고 젠틀하게 해도 첫인상에 호감이 생기진 않을 텐데요,잇티제 ISNTJ
넹..아닌듯요,huaaaaaaa
"위에 댓글보면 같은 질문 계속 하셨다고 하셨는데 만약 상대방이
자기한테 자기한테 호감이 있으면 기억했을텐데 라고 생각들고 좀 맘접거나 할거같아요. 농담은 어떤식으로 하셨는지에 따라 다르지만 예의 없다고 느꼈을 농담은 ㅃㅃ2에용",ISTJ나먕이
무슨 사이인진 모르겠지만 커피로 호감이면 식사라도 하면 결혼수락이라도 되나요? 판단은 본인몫~,잉잉 ISTJ
"약속 잡으면 오케이
하는 유형인가 싶어서요",행농장
"관심있으니까 오프라인으로 알아보려고 그러는거겠죠. 호감도 없는데, 약속 안잡죠 귀찮은데 그시간에 집콕하면서 본인할꺼 하는게 낫지 관심없는 상대랑 시간써가면서 있진 않아요.",리톨 ISTJ A 5w6
여자는 아니지만 단둘이 만나는 게 이성적으로든 인간적으로든 내키니 않으면 누구 껴서 만남,비타500 istj
잘되숏나욤?,ㅁㄴㅇㄹㄱㅇ
쪽지주세요!,엣티제짱
"앗 혹시 채팅은 안되실까용 ,,?",슬픈잇티비
주세요!,엣티제짱
앗 채팅되는줄 알았는데 안대서 쪽지 드렸어용 !!,슬픈잇티비
쪽지보냤어요 확인해주세요!!,엣티제짱
옆에 있어주는게 제일 행복해요,estfj여니
엣티제의 관한 고찰이 재밌네요 ㅋㅋ,그래내가infj
재밌게 봐주셨다니 기분 좋네요 ㅎㅎ🩵,isfj단단지
앗 맞아요... 아무래도 그렇게 적게되는 경향이 있는 것 같아요ㅠㅠ 사실 저렇게 적었지만 저두 회사에서 짱친인 동생이 엣티제인데 저랑 너무너무너무 잘맞고 진짜 찰떡콩떡이여서... 그 친구만 떠올리고 쓰려다보니 그냥 냅다 자랑글이 돼버려서 고찰이라 적기 민망하더라고요😅😅 제가 느끼고 겪고 있는 엣티제는 정말 유쾌하고 사랑스러운 사람이랍니다!!!,isfj단단지
엣티제인데 많은 부분 공감되네요,그럴수도 있지
"이 부분엄청 공감요~
남들이 볼때는 답정너 성향이 있음에도 본인들은 꽤 쿨하고 관대하고 유연하다고 착각함 ㅋㅋ
남의 말을 듣긴듣되 수용하지는 않더라구요 말 안끊고 들어주는 자체가 최대의 노력인듯.

그리고 너보다 힘든사람 많다-> 이런 뉘앙스로 상대방 고민 해결해주려함
심지어 와이프가 진통하고 있는데도 너만 진통하냐 다른 산모들도 다 아파~ 조용히해 이렇게 말한 엣티제 남편 얘기 듣고 학을뗌;;",INTJ5w4팬더
엄청 디테일하게 잘 아시는 거 같아요..ㅋㅋㅋㅋㅋ,아토찡 ESTJ
"1. 선물 받으면 한푼이라도 더 비싼 선물 주려고해서 비슷한 가격대로 주면 좋을 것 같아요.
아니면 가격대가 있다면 다른 사람이랑 같이 하는게 좋을 것 같아요.
당연히 안챙기면 사람인데 서운은 하죠..ㅎㅎ

2. 금요일 저녁에 미리 보내는게 나을 것 같아요",huaaaaaaa
금요일 퇴근 직후에 보내시는게 좋을 것 같아요!,ㅣSTJ
금요일 퇴근바로전에 보낸다 ! 비슷한 금액대로 하세욥 받아도 부담안느낄만한걸로,곤다
금요일에 보낸다! 선물은 부담스럽지 않은 가격이면 괜찮을 것 같아요.,ISSUE
처음부터 끝까지 다다다 공감입니다,STJ A 1w9
혹시 또 있을까요? 저도 ISTJ 의도하지않은 플러팅 궁금해요!,huaaaaaaa
"1번 공감
플러팅이란 단어도 몇달전 엠헬 가입하고 알게됨
동성끼리도 친해지고 싶으면 플러팅을 한다는 것도 그저께 알게됨
밀당 작업등 새침하고 음흉한 캐릭과는 정반대..",잇토끼ISTJP
"앞 뒤 다른 거 매우 싫어하고 계산적으로 구는 사람 매우 싫어하기 때문에
인성 박살나지않는 이상 그런일은 없다고 보면 되는게 ISTJ죠..",huaaaaaaa
장난으로라도 떠보는거 그켜미ㅜ,잇토끼ISTJP
"맞아요..떠보면 내가 그렇게 쉬워보이나 싶고, 가벼운 사람으로 보여서 손절하고
손절할 수 없는 관계면 그냥 진짜 존재를 알고있는 사이 정도로만 지내죠 ㅋㅋ",huaaaaaaa
"토끼님,, 오랜만요~~^^
저 본문처럼 진짜 잇티제가 이정도의 텐션이 있었던가??
놀랄때가 있어요. 요새ㅎㅎ",쭌INFJ
"짝꿍이 맨날 찐따라고 놀려요ㅋㅋ
정반대의 모습이 많을껄요..?!ㅋㅋ
잘지내시는것 같아 넘나다행입니다ㅎㅎ",잇토끼ISTJP
"어떤 유형은 예를들어 연락이 잘 되는 걸 애정의 척도라고 생각하는데
ISTJ 만의 애정의 척도가 있을까요??",ISFJ구로옴
"애정의 척도라기보단 어떠한 인간관계든 최소한의 예의 배려가 있어야한다 생각해요.
예를 들면, 너가 바쁘기 때문에 연락을 많이 못하는 건 이해할 수 있어서

내가 이렇고 이래서 너무 바빠서 평소처럼 연락을 자주 못할 것 같다.
가능하면 중간중간 연락하고 안되면 몇시쯤 마무리될 것 같다 끝나고 연락할게 걱정하지말고 있어
이런식으로 먼저 최소한 언질이라도 주면
날 신경써주고 배려해주는구나 느껴서 그렇구나~ 신경쓰지않게 나 할거해야지 해요.

위는 예시라서 조금 길게 더 예쁘게 쓴 말 이지만 간단하게라도 말해주면 좋아요.

그리고 설명을 하면 이해를 하고, 진심이라면 머리로는 이해안가도 마음으로 이해가 가능하고
대화를 통해서 해결해야지 말을 안하면 모르기 때문에 말을 해줬으면 해요.
설명을 구구절절 한다는 거 자체가 상대를 위하는 마음이 있기 때문에 오해가 없으면 해서 하는거니까
피곤하다, 감정소모된다 이렇게 받아들이면 이해하려는 들으려는 배려하는 마음이 없구나 생각해요.

내가 배려해달라고 기본 예의는 지켜달라고 요구를 해야하는 상황에서
관계에 대해 회의감도 들고 현타도 오고 분노해요.",huaaaaaaa
"플러팅 잘읽고갑니다
선물은 없나요???ㅎㅎ자기꺼 사면서 샀다든지 실용적인 그런선물 주던데",테스형 enfp
"오 맞아요 선물!
상대방이 좋아할지 원하는지도 모르는 걸 추측하는 거 너무 힘들고..
도움이 되고싶고 필요한 걸 주고싶고 챙겨주고 싶어서 실용적인 선물을 주로 해요!

물론 관계가 깊어지고 상대에 대해서 어느정도 알게되면
그사람이 좋아하지않을까해서 하는 선물도 있긴 한데
보통 그사람과 나누는 대화, 옆에서 보면서 좋아했던 것 들 생각해서
취향에 맞는 걸 선택해요 ㅋ_ㅋ

너무 어려우면 대놓고 뭐가 필요해? 뭐 갖고싶은 거 없어?
아니면 갖고싶어하는 거 있는데 안사면 사준다던가..
좀 더 적극적이라면 이거 내가 사줄게, 사줘도 돼? 이래요!",huaaaaaaa
"맞아요 ㅋㅋㅋ 저도 아주 가끔 ISFJ나오는데 기본적으로 마음에 없는 빈말 때려죽어도 못하기 때문에
그런말을 한다면 마음이 있고 진심으로 그렇게 생각하기 때문! (물론 그때 그 당시에 한함..사람일은 어떻게 될지 모른다, 지금 당장으론 모른다 어떻게 보면 의심으로 보이지만 열려있는? 생각 때문에ㅎㅎㅎㅎ)",huaaaaaaa
키키 아네요. 저도 제 자신에 대해서 알고싶은걸요! 감사합니당,huaaaaaaa
넹넹!,huaaaaaaa
보냈어요!,huaaaaaaa
칭찬은 해주는데 선톡은 없으면 호의겠죠?... 다른 사람들보다 유독 칭찬을 많이 해주는 것 같긴한데... 원래 친절한 사람이라...,허브로스팅
"칭찬이 어떤건진 모르겠지만 단순히 칭찬만 하는거면, 그 분이 생각하기에 진짜 잘해서? 칭찬하는거일 확률이..",huaaaaaaa
"오 인정,,, 너무 공감되네요",노잼 istj
공감하는거 너무 신기해요 ㅋㅋㅋㅋ,huaaaaaaa
선톡도 오고 연락도 잘되고 특히 밤쯤에는 자기 전까지 계속하는데 호감이라고 생각해도 될까요?? 그냥 심심하니까 재밌어서 하는건지 헷갈리네요...,vmfhvlf
그정도면 호감이 맞는 것 같은데 만나긴 하세요?,huaaaaaaa
둘 다 밖에서 만날 수 없는 상황이라서 그런 얘기는 아예 안하고 있긴 해요!,vmfhvlf
음..왜 만날 수 없어요..?,huaaaaaaa
"istj분께 질문있어요. 알기는 전부터 알아왔는데....그 전엔 안그러다가 올해 초부터 갑자기 남들처럼 저의 별명을 부르거나, 밝게 인사하고, 자기 비밀도 털어놓았습니다. 더 찐친 모먼트로 볼 수도 있긴한데...이런건 연인으로 발전할 때 좋은 시그널일까요? 아니면 친구가 되어버려서 연인이 되기 힘든 시그널일까요?",창조적진화infp
음..찐친 모먼트일 것 같아요.. 마음 있는 사람한텐 엄청 긴장해요..,huaaaaaaa
"답변 감사해요^^ 역시 그렇군요. 바짓가랑이 부여잡는 느낌의 질문이긴 한데...
찐친이 된 사람은 다시 이성으로 느끼지 않나요? 혹은 찐친 스타일과 사귀고 싶단 생각은 안하나요?",창조적진화infp
음..원래 마음이 있던 사람에서 찐친이 된게 아니라면 없을 거 같아요. 애초에 딱 구분되어서..찐친 스타일 이런건 개인취향일 것 같아요 ㅠㅠ,huaaaaaaa
결국 기본적으로 이성적인 끌림이 있었어야 하는 거네요 ㅎㅎ 답변 정말 감사합니다^^,창조적진화infp
"재밌게 놀았는데 (사귀자는 얘기도 나왔는데) 다음 날 연락 없으면 마음 식은 건가요?
혹시 연락하겠다고 해놓고 연락 없는 상황에서 제가 연락을 보내면 싫어할까요?",엔프제aily
에?? 연락 없어요???,huaaaaaaa
"오긴 왔어요! 담 약속도 잡고 다 하긴 했는데 연락 텀이 좀 기네영,,",엔프제aily
음..원래 연락하는거 귀찮아하는편이긴한데 너무 신경쓰지마시구 나중에 한번 얘기해보세요!,huaaaaaaa
네!! 감사합니당!,엔프제aily
"그렇다면 잇티제와 잇티제가 만날 확률은,,,",잇티제엥
만나봤는데 편하긴했던 것 같아요..,huaaaaaaa
완전 공감하고 갑니다. 특히 1번 ㅎㅎㅎㅎ,릴리
ㅋㅋㅋㅋㅋ 그쵸 애초에 계산 밀당 플러팅 이런거 모르죠,huaaaaaaa
귀찮게 왜하죠 ㅋㅋㅋㅋ,릴리
제 얘긴 줄 ㅎㅎ 동질감들어서 너무 즐겁게 읽었어용,ISTJ라니
너무똑같아서 웃겨요 ㅠㅠㅠ,istj입니다1
개미,Yellowintp
저도 이 생각,Iamfj
3,거래자 8w7
ㅋㅋㅋ고양이소리많이듣습니다,곤다
꼬부기,Yellowintp
222,STJ A 1w9
안경을 쓴 무표정 다람쥐...,데구르르 인팁 8w9
2222,치로로ISTP
고양이....,잇프핑구
,쩡 ISTJ 다시 T 1w9
바뀐거 같아용 잇티제가 티벳여우 같고 잇팁이 고양이같음,물음표악마
거북이,잇프피 흉내내는 ENTP
저도 거북이 한표,Episode
고양이소리 듣돈대여 ㅋㅋ,intjt후추코
"https://youtu.be/U1_AMB2j-s8

거북이네요",is tp
고양이같아요,huaaaaaaa
만나시는 분이 직급 강등되었나요? 일단 아픔보다는 자존심 스크레치... 평소에 일 못한다는 말을 안 듣고 살았기 때문에 회사에서 직급 강등되면 한동안 제정신으로 못 지낼거 같아요,엣Tf제리
2222 자존심 상해요 어디 가서 말도 못할 거 같아요 ㅜ,루로리
하... 인생 최악일듯......,아토찡 ESTJ
"1. 제 기준의 외적기준에 도달한 사람이면 관심이 갈텐데, 관심이 없다는 전제하에 내가 관심있는 분야에 대해 잘 알거나 좋아하거나 잘 하면 관심이 가요~ 예를 들면, 운동 골프 요리 같은거요
2. 덜 친한 사이면 피할거 같은데, 아래 상황을 보아하니 같은 회사이신거 같은데 그러면 한번 정도는 억지로 나갈거 같습니다. 이 식사 자리가 정말 불편했으면 그 다음은 없는거고, 생각보다 좋았거나 상대방의 의외의 모습을 보거나 하면 없던 관심이 생길 수도 있구요.",엣Tf제리
"답변 감사해요 그분은 잠깐 있다 가시는 상황이에요

상대방 관심사를 알 필요가 있겠네요

엣티제가 본인 이야기 하는 걸 좋아라한다고 봤고 또, 관심있다면 질문폭격기가 된다고도 하던데요

아직 제겐 그렇지 않은 현재상황에서 대화 이어나가려면 지금 제가 질문을 많이 하는걸 불편해하진 않을까요? 제가 어떤 스탠스를 취하면 좋을지 조언 부탁드려도 될까요",옴므 ESFJ
"일단 상대방의 관심사를 알아내신 다음에 대화를 하는게 중요할거 같아요~ 그 분이 잠시 있다가 가는 상황이면 아무랑 엮이지 않고 조용히 있다가 가야지 하는 생각일 수도 있구요(딱히 다른 직원들과 친하게 지내는 사람이 없다면)

엣티제가 본인 이야기 하는거 좋아하고, 관심이 있으면 질문폭격기가 되는게 맞긴 한데, 이렇게 되려면 어느 정도 서로 알아가려는 대화는 있어야 되거든요 음.. 질문을 적당히 하면서 관심사를 알아내고 적절히 대화하는게 좋을거 같아요.
사람마다 다르겠지만 저라면 그럴거 같아요",엣Tf제리
"질문 적당히 하면서 적절히 대화! 좋은것 같아요.
늦었는데 제 이야기 읽어주고 도움주셔서 감사해요
어찌 다가갈지를 어려워하던 중이었는데 알려주신 내용들 많은 도움 됩니닷",옴므 ESFJ
전 해외에 있어서 시차가 반대라 낮입니다 ㅋㅋㅋ 좋은 인연이시면 좋겠네요!,엣Tf제리
다른 고민글로 게시판 찾아올수 있음 좋겠어요 좋게봐주셔서 감사해요🙇ㅎㅎㅎ,옴므 ESFJ
"1. 저는 제 진정한 가치(구체적으로)를 아는 것 같은 사람에 대해 다시 생각해 보게 되어요. 저는 갠적으로 인정 받는 거 좋아해서요.
2. 그 사람에게 정말 1도 관심 없으면 저는 바쁘다고 거절하고 그게 아니면 한번 정도는 그냥 나가볼 것도 같아요.",그럴수도 있지
"상대방의 구체적인 가치를 알려면 지금 제 상황에서보다 좀 더 가까워져야 알 수 있을것 같아요😢

찾아봤을땐 주로 업무적 인정으로 높은 충족감을 얻는것 같았는데, 인간적인 인정으로도 좋아하겠죠?
글 읽고 답변해주셔서 감사해요",옴므 ESFJ
플러팅을 거의 잘 안하는것 같아요...신랑을 봐도 빈말도 못하는 사람중의 하나라 ㅋㅋㅋㅋ,susannaINFP
그럼 어떻게 호감을 표현하나요....?,2iNTj5w6
질문....?,2iNTj5w6
엄청 솔직하게 얘기해요~나는 너의 이런부분이 좋아. 이런부분은 아쉬워! 이런식으로요 ㅋㅋㅋㅋㅋ,susannaINFP
알아가고싶은 상대에게는요??,2iNTj5w6
"자기가 좋아하는 영화나 음악같은걸 얘기하면서 그거에 대한 생각도 물어보고, 인생관 같은거 엄청 많이 물어보더라고요!",susannaINFP
오오 감사합니다,2iNTj5w6
"선톡이 플러팅인 그들 ,,",잇티비야
오우 진짜요...? 선톡만 하는 사람이 있긴한데 대화가 오래가진 않아요 ㅋㅋㅋㅋㅋ,2iNTj5w6
잇티제한테 간택당한 입장이었는데 플러팅은 못하지만 헷갈리게 하지도 않는 유형인 것 같아요 ! 보이는게 다인 ..(?),잇티비야
오히려 좋아,2iNTj5w6
선톡...............이네요 윗분 공감요,곤다
연락에 집착함 거의 하루종일 뭐하는지 알아야함 같이 있는 시간 긴거요,ing푸제
"플러팅? 모릅니다 그런거 윗분들 말씀이 맞아요. 상대 인스타 페북 카톡프로필 보는건 기본이요. 선톡 그리고 말 혹은 행동(선물) 으로 호감표시 저는 ㅇㅇ님이 좋아요. 웃을때가 예쁘세요. ㅇㅇ님을 위해 준비했어요 등등등 평소에 관심없는 사람에게 돌취급 혹은 밖조차 나가지 않고 집이 최고야 하는게 잇티제인데, 자꾸 어디가자 어디서 뭐하자 이게 다 호감표시입니다. 아 그리고 T성향도 있어서 만약에 무슨일이 있어서 얘기했는데, 공감하는것처럼 보이진 않지만, 공감하려고 하는것 같다 이건 그냥 최고죠",리톨 ISTJ A 5w6
"플러팅 하는 법은 모르는데 잘 생각해보면
누구랑도 연락하는 거 내가 흥미있을때 빼곤 귀찮고 안하는데 연락잘하고 선톡하고
만남을 계속 하려고 하고 약속 잡는거에 부담스러워하지않고 잘 응하고..
칭찬도 하고 질문을 하는데 마음이 있을수록 더 많이하긴 하는데
상대가 부담스러워할 수 있고 확신이 없으면 조심스럽게 해요.
아 그리고 얘기듣고 이경우라면 이렇고 저경우라면 저렇고 해결방법에 대해서 진지하게 얘기하면 마음있는거에요",huaaaaaaa
플러팅을 하긴 하는군요 이 유형도 ㅠㅠ,잇프제송강강
네... ㅠ 그러다보니 더 가깝게 느껴지는 감정이 본인은 힘든가봐요... 먼저 같이 뭔가 취미 활동을 해보자고 하고 그러길래 왜 혼자 쿨한척인가 그랬는데.... 정작 제가 챙겨주고 걱정해주고 그러는게 감정이 깊어지는 것 같아서 거리를 두고 싶은건지... 흠....,Isfp 눕는게 최고
"본인도 아예 생각이 없는게 아니니깐, 그냥... 국내에서 박사를 하면서 저랑도 만나면 될텐데... 다 쉽지 않은가보네요...",Isfp 눕는게 최고
네~ 그런 것 같네요. 제가 영향을 받는 것도 동시에 본인이 영향을 받는 것도 다 싫을테니까요.... 곧 다음 학기 입학시즌이니까 조금 기다려봐야겠네요~ ㅠ 이해는 되지만 참 속상하네요...,Isfp 눕는게 최고
국내박사랑 해외박사가 커리어측면에서 차이가 클거고.. 그걸 잇티제님이 신경쓰고계시다면 어쩔수 없을거같긴합니다..,ESTP메로
네. 맞아요~ 제가 국내에서 먼저 했는데... 예전보다 차이가 적어졌어도 차이가 나긴 나죠~ 잇티제 부모님도 너무 고생하지 말고 한국에서 하라고 하신다고 해서 고민인 것 같은데... 저도 현실을 아니까 초반에 더 못잡았던 것 같아요~ 근데.... 심리적 거리가 필요하다는 말은 이해하지만 속상하고 너무 독하다 싶고 그래요~,Isfp 눕는게 최고
깊은사이었다면 잡혔을거기때문에... 깊어지기전에 선긋는거네요 힘내십쇼....,ESTP메로
"네~ 이제 시작하는 단계였어서...
그리고 후회 안하려면 결극 본인이 선택해야하니까 알아사 결정하라고 했는데 그때 잇티제는 잡아주길 바랬거든요 ㅠ 지금 그때 제 쿨힌척 했던걸 후회합니다 ~ 응원 감사합니다!!",Isfp 눕는게 최고
잇티제입니당.... 전 .....헤어지면 당일 바로 칼 정리에요. 재회는 절대 없다고 생각하구요. (속으로는 슬픕니당 당연히..) 그런 제가 유일하게 재회연애를 한게 바로 isfj였네용...,설린a
아 진짜요..? 이유가 뭐였던거같아요 제 잇티제도 이런게 유일한데 저를 못끊어내겠대욬ㅋㅋ,ISFJ딩
저요... 3번 헤어졌어요,밤 산책ISTJ
"저요 전전남친 잇티제 였는데 연락 잘 안되고 통화는 자주함, 퇴근하고 본인집에서 붙어잇기를 좋아함,
엄청 욱하는 성격이고 싸우면 회피형에 동굴로 들어가 버려요 제가 거기에 헤어지자고 할때마다 헤어지자는거에 답장 안하고
2-3일 정도 있다가 본인이 다시 잡아요 무한 반복하다 마지막에 제가 끊어냈습니다.....",별홍 ISFP
"단순하게 잘 풀어주면 잘 풀려요
방법은... 그냥 대화 시도하고 말실수한 부분의 오해 풀어주기
뭔지 자세히 몰라서 이정도로만 대답을",S가 좋은 잇티제쟈나
"단순하게 .. 대화해서 말실수의 대한 오해를 풀어주는 게 좋을 것 같네요!
감사합니다 ~",ISFJ구로옴
화 난 건 아니고 .. 제게 직접 이런 말들이 속상했었다고 말 했었어요!,ISFJ구로옴
"그냥 얘기하다보니 말실수한거다, 기분나쁘게 할 의도는 진짜 없었다. 혹시 기분이 나아질때까지 시간주는게 좋겠냐 물어봐주세요. 대화를 통해서 해결하는 걸 선호해요..근데 혹시라도 너무 감정적으로 상해있는 상태면 혼자 시간이 필요한 것 같으니 나아지면 말해달라하고 정말 실수다 정말 미안하다 하시면 돼요..",huaaaaaaa
오 .. 네네 ! 감사합니다 ㅎㅎ,ISFJ구로옴
장문으로 써주세요 무조건 길고 장황하고 얘가 절절하구나..,블루ISTJ
오오 ! 감사합니당 !,ISFJ구로옴
잇티제들 은근히 귀여운거에 약하던데 .. 애교 ..?? 아님 할 일 열심히 한 모습 보여드리거나 일을 도와드리거나 .....?,lemonmint
"엄마가 맞다고 엄마 편을 들어주면 젤 좋을듯 해요. TJ는 논리가 우선이라 요목조목 엄마 입장에 서주면 좋죠.
하지만 아빠는 모르겠음다ㅋ 두분이 원만히 해결되시길",이디스ISFJ
자식에게 화가 난건 아니라서 굳이 님이 풀어주려 애쓸 필요 없어요...ㅋ 그냥 본인 할일 잘 하고 있으면 됩니당... ^^♡,쩡 ISTJ 다시 T 1w9
남자친구 엣티제인데 기독교에요 모태신앙이였대요,누워있는 잇프피
"우와 빠른 답변 감사해요 얘기듣고 모태신앙이려나? 싶기도 했거든요.
남자친구 분은 매주 나가는 등 종교에 열심이신가요?
+)잇프피랑 잘 맞는거 같아요 두 유형이 만나는 커플 많이 보이더라고요(인터넷에서)",옴므 ESFJ
사회초년생인데 입사 후엔 잘 안 다녀요 ㅋㅋㅋ 믿음이 깊다기보단 어렸응 때부터 다니니까 습관? 같은 느낌이라고 하더라구요,누워있는 잇프피
답변 감사해요 😃 습관을 오래토록 유지하는 엣티제다운(?) 모습이네요ㅎㅎㅎ,옴므 ESFJ
없습니다.. 제 자신만 믿을 뿐 ㅋㅋㅋㅋ,ESFTJ 띵동
없어요 나만 믿어요,ESTPizzzza
"즤신랑 무교러면서, 불교가서 밥잘먹어요 ㅋㅋㅋㅋㅋㅋㅋ 맛잇는 밥은 항상..챙겨먹는다능...",intj사임당맘6w5
저도 무교인데 굳이 따지면 불교예요 ㅋㅋㅋ 제 가치관과 비슷한 부분들이 있더라고요,옴므 ESFJ
엣티제 종교있습니다!!,엣티제야나는
신앙심 가지게되신 스토리 여쭤봐도 되나요?!?,옴므 ESFJ
"아 저는 모태신앙(태어나보니 집안이 기독교..)이기도 하구요, 살아보니 하나님은 존재하시는 분이시라는걸 부인할 수가 없었습니다ㅎㅎ",엣티제야나는
"정말요? 생각해보니 주변에 엣티제 많이 못본 것 같긴하네요 ㅎㅎㅎㅎ ㅋㅋㅋㅋ
교회엔 엔프피가 엄청 많은 것 같습니다 ㅋㅋㅋ",엣티제야나는
저도 여자지만 공순이에 제조회사인데 엣티제 종교인은 못본 것 같아요ㅋㅋㅋㅋ,엣티제야나는
ㅋㅋㅋ두분 닉네임까지도 비슷한게 신기해요 좋은 답변과 대화 감사해요 ㅎ.ㅎ,옴므 ESFJ
엄마손 교회 저도 공감가네요 ㅎㅎㅎ 저역시도 딱 똑같은 삼박자예요 엄마손부터 지금무교 마음불교 ㅋㅋㅋ,옴므 ESFJ
조금은 보수적일거란 제 편견이 무색하게 남자친구 분께선 여러 사상에 오픈마인드시군용 ㅎ.ㅎ,옴므 ESFJ
"전남친 entj 현남친 estj인데 둘 다 똑같이말햇어요ㅋㅋㄱㅋ 종교 없다구
본인만 믿는다구.....🥲",IiiiiIill
ㅋㅋㅋㅋㅋ 마지막 이모티콘이 눈에 띄네요 e_tj의 사랑을 차지하는 바코드님은 무슨 mbti신가요?,옴므 ESFJ
전..인프피여....,IiiiiIill
뚝딱거림(?)이 매력인 인프피시네요 ㅎ.ㅎ 답변 감사해요 :),옴므 ESFJ
싫다는거 같은데요,S가 좋은 잇티제쟈나
네..ㅠ,Isfj 1514
222,STJ A 1w9
네.. 감사합니당 다시 다른거에 집중하면서 살아가봐야겟네요 ㅋㅋㅋㅋㅋㅋ,Isfj 1514
네..ㅠㅠ 감사합니당 이제 다시 저한테 집중하면서 살아야겟네요 ㅋㅋㅋㅋㅋㅋㅋㅋㅋㅋㅋ,Isfj 1514
간파당했다,istjjjjjjj
으항항 간파했다요,엔프제임다
"24578910 완전 공감요
특히 47 ㅋㅋ",S가 좋은 잇티제쟈나
또 마음에 안드는부분이 있으면 그사람의 사정이나 상황 상관없이 비판해버린다는것...저는 뭔가 그사람한테 이입해서 무슨 사정이 있어서 그랬겠지~하는데 istj는 그건 그거고 이건 이거지 이런느낌ㅎ,엔프제임다
사정이고 나발이고~ ㅋㅋ,S가 좋은 잇티제쟈나
그건 잇티제만이 아니라 극T 들 다 해당될것 같은데 아닌가요? ㅋ,쩡 ISTJ 다시 T 1w9
4번 특징이 있어서 인맥이 좁아요 하하,스톡 istj
진짜 저네요...,밤 산책ISTJ
"1빼고 다 저예요 ㅋㅋ
1은 찐부지런한 사람 같고, 저는 가까운 계획만 세워요
언제 달라질지 모르는게 인생이라 주어진 상황에만 열심히 사는 것 같습니다",STJ A 1w9
