comments,comments_writer
보고싶다는 말에도 현혹되지 마시고요 저 사람도 당연 힘들겠죠 근데 진심으로 보고싶다면 지난 과오에 대한 사과부터 먼저 했어야 하는게 맞지 않나 싶어요 그게 아니라면 지금 힘들고 아픈 감정 앞세워서 한번 더 관계가 유지 되더라도 또 다시 글쓴이님을 혼란스럽게 하거나 얼마 못가 헤어질 가능성이 있어 보여요..,ISTJ1vv9
"네 감사합니다.. 저렇게 와서 지금 보는건 아닌 것 같고 내일 만나서 얘기해보자 해서 만나서 대화했는데, 정말 많은 고민을 했으나 당장의 제가 힘들어서 다시 사귀게 되었어요. 주변사람 말을 듣고 좋아하는데 급하게 결정한 것 같다 뭐라뭐라 하는데 헤어지자한 이유가 또 다시 저에게 상처가 되서 이 관계가 오래갈 수는 없을 것 같네요....",잇푸제댕
"이왕 헤어진거 전 안만날거 같아요 구남친 문자왔을때 열받아서 뭐라고 하려다가.. 읽씹하고 저는 핸폰번호를 바꿔버렸어요
(저는 5년 연애하고 권태기도 없었고, 곰신이었습니당)

댕님이 너무 힘드시면 만나서 점점 마음 정리하고 끝내시는게 덜 힘든 방법일거 같아용",잇프제바니
네 저는 당장 너무 힘들어서 만나서 점점 마음정리하고 끝내려고 생각 중입니다...이미 헤어진 관계를 돌이키는게 너무 어려운 것 같아요...다시 돌아가고 싶네요..,잇푸제댕
어떻게 되셨나용 ㅠㅠ,와아아압
"다음날 만나서 이야기하고, 사과하고 다신 안그런다고 약속하고 둘이 광광 울다가 다시 사귀게되었습니다..ㅎㅎ 그런데 기쁜 감정보다는 아직 우울한 감정이 더 커서 복잡하네요..ㅠㅠ",잇푸제댕
"저도 다들 ef로 보더라고요. ㅎㅎ
한분도 못맞춤. ㅎㅎㅎㅎㅎ",istj 사탕
ㅋㅋㅋㅋㅋ뭔가 이중인격 같아진거 같아 재밌습니다 쿠쿠,사회화 ISTJ
속마음이랑 말할때랑 다르지않으신가요 ㅋㅋ,istj 사탕
ㅋㅋㅋㅋㅋㅋㅋㅋㅋㅋㅋㅋ맞아요 진짜 공감할때도 있는데 한없이 안맞는 사람하곤 1부터 100까지 다 속마음하고 반대로 얘기해요 ㅋㅋㅋ,사회화 ISTJ
적이 없으시죠? 저도 그래서 적이 없답니다 사회화된 잇티제 맞으신가봐요,istj 사탕
"네 적을 만드는걸 정말 싫어해서요 ㅠ
누군가한테 미움받는게 싫어서 그런거 같아요",사회화 ISTJ
ㅋㅋㅋㅋㅋㅋㅋㅋㅋㅋㅋㅋ후 누가 절 이렇게 업그레이드 시켜놓은건지..,사회화 ISTJ
이중생활 잘 해요 그래서,춥파춥스콜라맛
"저는 여행 때문인 것 같아요
개인시간도 중요해서 혼자도 아니고 친구랑 갔다면 친구랑 놀아야하지 않을까요?? 핸드폰만 보고있는것도 친구에대한 예의도 아니고....놀다보면 시간 빨리가고...뭐 했다~ ~하고 있네 ~ 자나~?.... 이정도면.. 연락 꽤... 하고 있는 것 같아요....",그믐달 INTJ
정말.... 엄청 혼란스러웠는데 감사해요 ㅎㅎ,Dldleiej
여행때문일듯합니다. 개인적으론 전혀 문제없어 보이는..?,에단INTJ 3w4
사실 제일 이해 안되는건 답장안하고 인스타 확인인거같아요.. 보통이면 답하고 보니까...😥,Dldleiej
여행에 집중하고 싶어서 그럴 수도 있어요. 인스타는 상호작용할 필요가 없이 눈으로 확인만 하면 되지만 답장은 확인한 게 표시가 되고 계속해서 에너지를 소모해야하는데 여행은 쉬러가는 거니까 아무래도 여행에 집중하고 싶은 걸수도있으니 상대에게 여유를 주어보시고 여행다녀온 후 어떻게 행동하는지 지켜보는 편이 더 좋을 듯 합니다.,에단INTJ 3w4
다시 말하면 상대가 님을 위해서 어느정도 답장의 템포를 맞추기 위해 에너지를 소모하고 있다는 말로도 해석할 수 있겠네요. 두분이서 연락주기를 잘 맞춰가보는 것도 좋을 것 같습니다.,에단INTJ 3w4
"네 ㅠㅠ 오늘 통화가 오더라구요 하고나니 마음이 편해졌어요 🥰 잇티제 너무 어렵지만 에단님의 댓 보고 욱했던 마음이 가라앉었어요 ㅋㅋㅋㅋㅎㅎ
감사해요!",Dldleiej
좋은 감정만 가져가세요~ 😊,에단INTJ 3w4
그냥 놀아 하고 선생님도 잼있게 노시는게 나을듯요,난나나나난나나나나나
여행중인데 저정도면 답변잘해주는거 아닌가요..??,양념고구마
전혀 문제를 모르겠는데 ….,라크 INTJ
"여기 답변하시는 분들이 다 T 라서 F랑 너무 달라서 신기방기네요 ㅎㅎ문제가없다고 하는게 진짜 다르네요!
저도 잇티제랑 썸타는데 연락은 일주일에 2일 정도 하는 것 같네요, 걍 연락 안좋아한다니까 저도 신경안쓰려고 하고 연락 잘 안하는듯,, 근데 또 만나면 엄청 서로 잘 챙겨줍니다. 연락은 어떻게 해야할지 저도 뭐 나중에 가볍게 물어보려고요,",너무잇프제
"그쵸..j면서 왜 연락은 안되나요 ㅋㅋㅋ
전화할때랑 만날때는 진짜 너무 잘해줘서... 헤어지면 불안함...😥😥",Dldleiej
"이게 너무 이해가 안가실테지만
istj....
내가 실수할때
아 난 왜 이러지 미쳤나봐. 진짜 한심하다 순으로 본인 자책을 너무함.이 상태에서 남이 뭐라하면 상처에 소금 뿌리는격

남이 실수할때
몇번 참다참다가 잔소리 폭격

남편분께 차분히 말투는 화내듯 말하지 말아달라고 해보셔요
본인은 모를수도...",istj 사탕
그니까요 뭐라고 안해도 스스로 충분히 반성중이거든요 ㅜㅜ 내로남불 끼가 있는것 같아영,INFJ 쪼뇽
위 댓글보니 넘친게 두번째면 안전관리 문제라...쪼뇽님도 그렇고 아이한테도 위험하니 조금 신경쓰시는게 좋을거같아요. 말투는 그 다음문제...,istj 사탕
네 신경써야죠 ㅠ딱 max에 맞게끔 .. 남편은 이 대답을 듣고싶어하던데 혼내고 그러니까 여태 내가 배려했던게 다 쓸모없어진 기분이라 이 대답은 안했네여..,INFJ 쪼뇽
자기가 실수하는걸 아예 말안하시면 모를수도... 집안일 같은 경우는 직장일이 아니니 더더욱요 잔소리 하세요 ㅎㅎㅎㅎ,istj 사탕
그래야겠어요 아주 .. 나도 잔소리 할수 있는데☹️ !!,INFJ 쪼뇽
근데 뜨거운물 끓이는거라 아내가 안 다쳤는지부터 걱정되고 혹시 계속 그랬는지 물어보고 선 보다 아래로 채운다고 생각하고 적게 넣으라고 할 것 같아요 분유 물이면 아기도 어린 것 같은데 아내도 정신없었거나 잘 모르고 그럴 수 있지 할 것 같은데요,ENTJㅁ
넘친게 두번째이긴 해요 .. ㅠ,INFJ 쪼뇽
나도 조심하겠다 말투 부드럽게 해주면 너무 좋겠다 걱정해줘서 고맙다 해버리세요 ㅎㅎ,ENTJㅁ
그래야겠네요 에고 .. 답답해서 여기까지 와서 글을 남겼네용,INFJ 쪼뇽
당사자랑 풀지 못하는 쪼뇽님이 제일 힘드시겠죠 대화로 잘 풀리셨으면 하네요☺️,ENTJㅁ
감사해요오 ㅜㅜ,INFJ 쪼뇽
거울치료 고고요,S가 좋은 잇티제쟈나
똑같이 실수 하나 할때마다 마구 혼내봐야 나아질까요🥹,INFJ 쪼뇽
"네 그래봐야 고쳐져요
내가 내로남불이구나 기분 나쁘구나 느껴야죵",S가 좋은 잇티제쟈나
오케이 .. 한번 거울치료 들어가볼게여!,INFJ 쪼뇽
"잇티제면 istj 인가요?아직 이렇게 부르는게 넘어려워서 ㅠㅠ
상대의 감정 공감 해주기보다 문제해결본능이고 잔소리하고 모라하는게 자기는 챙기는걸로 생각할수있어요.
감정에 호소를 해볼수 있는게 아니라는거죠.서운하다라는 말이 맘으로 와닿지 않기에 답답하다고 느낄거에요.

분유포트 얼마든지 넘칠수있어요. 저도 아내랑 실수의 연속이고 그러면서 우리도 성장하는거라고...
애기 안다치고 우리도 안다치는게 우선이니까 실수 겁먹지 말고 육아해야죠.
아내가 한번말한거 전 잘안되요.
그래서 포기하더니만
자연스레 업무가나눠지고 ㅋㅋ

서로 차분하게 우리가 이런이런 성격이니까 갈등시 이렇게하자 저렇게하지 라고...대화가 답이더라구요 ^^
애기 잘키우시구여 ^^저희도 이제 17개월째 ㅋㅋㅋ",orange77k ENTP
"어머 육아동지 반가워요 ☺️
저흰 21개월, 7개월 키우고있어요!
감정 호소가 안통할거다란 말씀이 딱 공감가요! 이게 nf 와 st의 차이인건지 대화를 하려하다 싸운거라 .. 진짜 포기가 답인건지 .. 뭔가 넘 부당해서 ㅜㅜ 항상 제가 포지션이 을인것 같은??? 이 사람하고의 관계까지도 뭔가 회의감이 들더라구요 .. 멘탈 다잡고 해결해봐야겠죠 ㅎㅎ ..",INFJ 쪼뇽
"스트레스 상황에서는 열등기능의 발현이 우선이에요.
남편분이 istj라면 n이 열등기능이기에
자꾸 그러한상황이라면 과대해석하고
작은것도 크게 보려고(이심리기능이 성숙하지 않은것이기에...)하는거죠.
infj 라면 주기능이 n이고 열등이 s라서 작은것 하나에도 꼬치꼬치 따질수있어요 그후엔 내맘 몰라주는 감정 호소가이어지구여.^^

지금 애기 노는데 아빤 뒤에서 폰하구 ㅋㅋㅋ아내는 출근 ㅠ ㅠ 힘내요.^^",orange77k ENTP
오 .. 열등기능 풀이는 처음 봐요. 제 자신을 돌아봐야겠어요 그걸 토대로 .. 감사해요!! 육아 화이팅 입니다 ☺️,INFJ 쪼뇽
네 .. 🥹 앞으로 생색 필수 메모입니다 .. !!,INFJ 쪼뇽
감사해요!!,INFJ 쪼뇽
"완전 경험이 없는 업종으로 자영업을 시작하면서 처음엔 많이 낯설고 힘들었는데
어느 순간 점점 자기개발의 도구로, 발판으로 그렇게 받아 들여지면서
성취감과 스스로가 발전하는 모습을 보며 굉장히 만족스럽게 살고 있더라구요
2회차를 살고 있다고 표현 될 정도로요~ 화이팅입니다!",잇토끼isstj
저라면 안읽씹 답답해서 안하고 그냥 거절해요,엣ㅅ티제
한 얼마만에 거절하실것 같나요?,IXXP2
영화 말고 딴게 하고싶으면 바로 딴거 하자고 하고 그냥 만나기 싫은거면 핑계 찾아서 늦어도 1시간 이내에는 거절해요,엣ㅅ티제
아하.. 그럼 뭐 일이 있는걸까요..?,IXXP2
저는 항상 칼답하는 편이라 진짜 갑작스러운 일 아니면 웬만해선 다 일 있다고 말해줘요 혹시 말 못했으면 나중에라도 꼭 말해주는 편이에요,엣ㅅ티제
저는 이유를 대서라도 거절해요,그럴수도 있지
감사합니다..,IXXP2
정 답변 듣고 싶으면 상대에게 전화로 물어봐보세요,그럴수도 있지
"아뇨... 뭐.. 이미 들은것 같네요
그냥 내가 아는 ESTJ는 이럴 성격이 아닌것 같은데 좀 의외인것 같아서 글 올려봤어요 받아들여야죠 뭐",IXXP2
그냥 당장 바쁘면 나중에 답장하지 하고 연락 안하다 시간나면 해요. 말없이 잠수타진 않고 상대가 재차 물어보면 바빠 나중에 라 짤막하게 남기고 시간날때 답해요,루나 ESTJ
거절 개잘하고 읽씹도 할말 없으면 잘해요 카톡 쌓여있는거 못견뎌서,꼬륵 estj
성향 차이같아요 물어보세용ㅎㅎ 저도 읽씹하면 했지 쌓여있는건 못ㅂ보는..,잉앵뿌삐
놀기로 한 상태라면 나중에 답장하지 않을지... 저도 쌓인 거 못 참아서 ASAP 읽답합니다. 물론 거절도 잘 합니다.,ESTJ A 3w2 3w4 팀장
"안녕하세요
저도 같은 경험으로
힘들었던 시간이 있었습니다
이별문제로
많이 힘드실텐데 힘내세요
감정적으로 대응하지 않고
이성적으로 대응한다면
재회가능합니다
네이버에서
사랑은 고백에서 부터
라는 카페인데 가보시면
많은 도움이 될거에요
간절한만큼 1%희망을
포기하지 마세요",뚱뚱이22222
"저의 경우는 이런상황이라면
1. 정말 제 미래를 위해 중요한 결심을 했거나. 다른이유가 있는데 좋게 헤어지려고 하거나. 내면에 감춰진게 더 많죠.",쥴리어스ISTJ
주변에서 맴도는거?,스톡 istj
은근 챙겨주는 거요!,istj이다
심심할 때마다 저한테만 전화하는데 그냥 친구로써 할 수 있나요?,엣프제다 이 말이야
"카톡칼답 물론바쁜일있을땐칼답이안될수도있음...
그리고 콜백(?)이된다...? 전화를걸었는데 상대가못받았는데 상대가걸고 내가걸고했는데도 서로받을때까지콜백이되는거요....허허",구름ISFP
헐 엣티제 다 왜이래요 ㅠㅠㅠ힘내세요,엣프제 엣프피
"붙잡아보고 싶어서 하는 건 아무래도 좋은데, 변화 없는 재회는 의미가 없을 거라 확신하고 있을 겁니다.",ESTJ A 3w2 3w4 팀장
"제가 태도를 다 바꾼다고 말을 해도 힘들까요...
1달 정도 지난 후에 제가 바뀌었다고 말 해도 괜찮을까요? 근데 빨리 정리한드는 말아 있어서 1달은 뭔가 늦을거 같아서요 ㅠ",셎엉
"제가 그 분은 아니니 확답은 어렵지만, 저는 사람 바뀌지 않는다고 믿는 편이에요. 그리고 사실 글 내용으로 미루어 보아 상대 엣티제가 본인이 변화하거나 희생할 여지는 없어 보이니 그건 또 그 나름 글쓴이 분께 스트레스이지 않을까요. 전 잠정 이별한 상대와 1개월 후 관계 지속에 대한 답을 내리기 위해 재회했는데, 결국 그 날 시큰둥하게 이야기하고 끝냈습니다.",ESTJ A 3w2 3w4 팀장
"그냥 두세요.. 저는 8개월만에 다시 연락오고 오늘부터 다시 사귀기로 했어요
헤어지고 연락 절대 안했어요",iiiiiiiijliliiiiiiii
"음 안좋게 헤어졌는데 감정도 별로면 바로 삭제하구 안좋게 헤어져도 감정이 있으면 바로 지우진 않구 좀 있다다 지우긴 지워요
근데 결국 지우긴 지우는데 감정에 따라 조금 지우는데 걸리는 시간이 다른거 같아여~",ISTJ별별
222,다정 ISTJ
"전 엔프제인데 블로그에 둘이 여행갔던거 사진있던거
그대로 있었어요
귀차니즘이 심해서 그냥...
mbti 보다는 개인 성향?...
내가 공들여 쓴 게시물인데 하나하나 찾아서 언제 수정 삭제해 귀찮아!!!
딱 이거...
인스타, 카톡, 페북처럼 제 지인들 모두 볼수있는 sns가 아니니까요..!
굳이 신경안쓰는걸꺼에요
저도 블로그 글을 핑계로 연락오길래
ㅇㅇ지울게 연락하지마 하고 지우고 차단한적이있네요",부자대꼬영
헉 그렇군요 ㅋㅋㅋㅋㅋ,eINTPj
딱히 지울 이유까진 없는 것 같아요. 그냥 지나간 추억 느낌으로 남겨두는 경우도 있는 것 같습니다 !,잇티제 dori
저는 그냥 추억으로 냅두자 이런 마음으로 잘 안지워요,엣ㅅ티제
"남이 보는 공간은 괜히 오해사거나 헤어진 사람한테도 민폐일 수 있으니 지우는데, 혼자 갤러리나 예전 일기 사진 편지 이런건 거지같지 않았던 이상 냅둬요 그때의 제가 추억이라서",고고무
"이거는 저도 반성해야될 지점이네요.
않좋게 헤어지거나 크게 좋아하지않았으면 미련없이 흔적 다 지우고, 그게 아닌 흔적들은 소품정도로 느끼며 추억으로 남기는 정도인데.. 현 여친이 어떻게 알고 없애자고 하면 바로 없애버려요. 근데 안걸린건 걍 놔두는듯 ㅋㅋㅋㅋ 다 찾아내세요.",쥴리어스ISTJ
22 굳이 지울 필요를 못 느낍니다,비타500 istj
남자 ISTJ 애인으로 어떨 거 같아요 ?,레드립드 ISTJ
저는 저랑 거의 반대성향을 좋아하는 거 같아요!!,가나다라마하반야
"인팁은 만나본 적이 없슙니당..ㅎ
좋아하는 사람 생기면 좀 지켜보다가 확신이 생기면 먼저 다가가서 말걸고 표현하는 거 같아요!",가나다라마하반야
"아마 연락 답장 속도가 빠를 거고

만나자 하면 '주기적'으로 볼 거에용!",가나다라마하반야
무슨생각으로 사시나요,ESTPS2
제 커리어 생각하면서 살아요,가나다라마하반야
Isfp 남 어떤가요?,재뇸
지금 제 남친이 잇프피인데 완젼 좋아요!,가나다라마하반야
카톡 상담은 안될 거 같아요 ㅠ!,가나다라마하반야
"잇티제가 연애 관심 없다는데 바쁜시간 쪼개서 매주 만나고 데이트 합니다, 절 맘에 들어 하는 것 같아요,
어떻게 고백해야 돌파될까요? 흰트좀 주세요",너무잇프제
밤에 같이 조용한 공원 산책하다가 말씀하시면 될 것 같아요!! 약간의 부끄러움+조심스러움 가지고 말씀하시면 받아줄 거 같아요!,가나다라마하반야
"이미 부끄러움 장착 된 잇프제라,, 편지 준비했는데 편지보단 떨리는 음성이 더 괜찮을지 고민입니다",너무잇프제
"음성으로 하시는 게 제일 좋을 거 같아용!!
아니면 ""너무 떨려서 내가 말을 까먹을까봐 편지도 써왔는데 편지를 읽어줘도 될까?""라고 말씀하시면서 편지를 읽어주셔도 괜찮을 거 같아요!",가나다라마하반야
저는 그 사람 말투나 성향을 잘 몰라서 확답은 하지 못하지만 저는 장난으로라도 그런 말 듣기 싫을 거 같아요 돈 맡겨놓은 것도 아니고 엄청 오래 본 사이 아니고서야 ㅠㅠ,가나다라마하반야
"음 만약 저라면 그쪽에서 덜 안달나하는 거 같으니까
1)그런 말 한번만 더 하면 안읽씹할 거 같아요..ㅎㅎ

2)아니면 ""너가 사주면 생각해볼게~.~(+이모티콘)
이렇게 보낼 거 같고 만약 이렇게 보냈는데 또 너가 사란 식으로 계속 말하면 걍 진짜 정떨어져서 연락안할 거 같긴해요ㅎ",가나다라마하반야
"ISTJ 여성분들은 상대방이 아무리 좋은 사람이고 의지가 많이 됐던 사람이라도 성향, 가치관등의 이유로 싸움,
그리고 상대방이 지금 처한 상황을 봤을 때 미래가 안그려지면 이별을 생각하게 되나요?
그리고 성향이나, 가치관 차이가 있더라도 상대방이 맞춰줄 의향이 있고 지금 상황이 잘 풀려서 나타났을 때 재회 가능성이 있을까요?",에반셀린 ENFJ
"아무리 그랬다하더라도 미래가 안그려지면 이별을 생각하는 거 같아요
반복되는 다툼 혹은 의견 충돌 속에서 미래가 안그려진다는 판단까지 나온 상태일 거니까 아프더라도 이별을 할 거 같아요
한번 이별하면 어떻게든 다시 재회를 안하고자 마음을 단단히 먹을 거긴 한데 정말 1%의 재회라도 바라신다면
되도록 빠른 시일 내에 자신의 문제점+개선점을 전달해보는 게 제일 확률이 높을 거 같아요 만나서 말하면 젤 좋긴한데 혹 안돼서 연락을 한다하더라도 너무 다다닥(?)이렇게 여러개 보내진 마시고 적당하게 보내고 딱 기다리고 있으면 될 거 같아용!!",가나다라마하반야
"아이쿠 ㅜㅜ 엣티제가 첨부터 별로 안좋아한 상태로 사겼었나봐요 그럼 상대적으로 후폭풍이 없을 거 같긴한데
힘찬 토끼님이 언제 그랬냐는듯 잘 사는 모습 보이시면 순간 흔들리게 할 수는 있을 거 같아요 파이팅입니다:)",가나다라마하반야
"헐.... 그럼 무조건 후회할 거 같아요
혼자 보낼 시간이 부족함+
주위 신경쓸 여유가 안됨+
자기 일이 제뜻대로 되지않아서 스트레스받음 등이
복합적으로 섞여서 고민하다 헤어지자 한 거 같긴하네요
힘드시겠지만 연락하지 마시고 자기계발하시면서 살고 계시면 자기일 해결되고 여유생기면 연락올 거 같아요:)!!",가나다라마하반야
"여친이 istj인데 낮선 남자들에게 번호나 선물을 좀 많이 받습니다 ㅠㅜ
저는 좀 질투도 나고 약간 불안하기도 한데 막상 본인은 오히려 스트레스 받는다고 걱정말라고 합니다.
당연히 제 여자친구를 믿지만 이게 거의 일주일에 한번씩은 번호 따이는거 같은데
막상 본인은 어떻게 생각하는지 궁금합니다.",ENFJ 남자야
"여친 말 그대로죵! 자기가 여지도 안줬는데 이유없는 호의를 자꾸 받는다면 괜히 여지도 주는 거 같고 불편할 거 같아요
번호따이는 거는 진짜 번호 주는 거 아니면 걱정 안하셔도 될거같아용",가나다라마하반야
"istj 남친 잡았는데 잡히질 않네여 ㅎㅎ 미래를 약속했고 저를 만나서 행복했다는것도 진심이고, 저랑 헤어지면 너무 힘들어할것도 안대요.. 그럼에도 이제는 그냥 그만 힘들고 싶대요..! 이런 다시만나자 이야기만 아니면 만나서 시간 보내는건 문제 없대요 .. 웃기긴한데 저한테 밥 한번 맛있는거 사주고 싶대요.. 뭐 어떻게 해야할까요..",와아아압
"음.. 오랜 다툼 혹은 지속된 관계 속에서 자기만의 판단이 내려져서 헤어지자한 거 같네요
밥 사주고 싶다고 해도 그냥 거절하시는 게 장기적으로 봤을 때 더 나을 듯합니다
저라면
""어차피 다시 시작되지 않을 관계로 정리를 너가 한거라면 우리의 관계도 너의 선택대로 여기서 마무리 잣는 게 맞을 거 같아""라고 말하고 그만할 거 같아요
매몰차게 뒤돌아서 떠나야 없던 미련도 생길 거에요",가나다라마하반야
이런 글을 올렸다는건 이날 기분이 무척 좋았다는 증거죠 ㅋㅋㅋ,쥴리어스ISTJ
ㅎㅎㅎㅎㅎㅎㅎㅎㅎㅎㅎㅎㅎㅎㅎㅎ,가나다라마하반야
"잇티제가 바쁘고 여유없을 때 그냥 내버려 두기도 하는데..
응원톡으로 괜찮은거 추천해주세용!
그나마 잇티제가 강아지를 좋아해서 귀여운거 캡쳐해서
말풍선 넣고 하고싶은말 간단하게 덧붙이는 정도로 하고 있어요 ㅠㅠ

F라 감성적인것 밖에 없네용 ㅠ",ISNTFJ 뭐징
정리 안하면 계정이 2개인 거에요? 그럴 수가 있나?,S가 좋은 잇티제쟈나
댓글 감사합니다,Cosmic23
잘모르긴하는데 번호변경 탈퇴하면 바로 로그인 안되지않나요..? 투넘버이신게 아닐지..,인크루팅istj
댓글 감사합니다,Cosmic23
와 생각해보니 그렇네요 아ㅠㅠㅠㅠ그냥 디올 흰티를 사줘야하나 딱 이미지가 디올이라 디올사주고싶어서욬ㅋㅋㅋㅋㅋㅋ,적재적소entp
"아 화장을 저언혀 안하세요ㅠㅠㅠ제가 그래서 립밤이라도 사줄까 예전에 떠봤는데, 피부가 예민해서 사양하시더라구요ㅠㅠㅠ그래서 옷이라도...지갑은 너무 뭔가 의미심장한 선물같애서요ㅠㅠㅠ",적재적소entp
"같은 대학생 신분이라 좀 부담스러울 것 같긴 해요ㅠㅠ 그 분이 귀걸이 하시면 귀걸이가 명품 중에선 그나마 가장 실용적일 것 같아요!
저는 선물 받았는데 필요 없음 방치해두거나 안 받는 편이긴 합니다!",샤론 ㅎㅎ
"완전 제대로 된 망상이네요
전 이런 의미부여가 너무 싫드라...",S가 좋은 잇티제쟈나
네 다른 의미는 없을 것 같아요..,돌돌 istj
정리하시고 다신 연락 안 하는게 나을 것 같아요,ENTJㅁ
신경쓰고 있는고같아요!,2STP
혼자 여행중이신가요?,잇토끼isstj
아뇨 ㅎㅎ 절친이랑 둘이서요!,Dldleiej
일행과 여행중이라 그쪽도 집중해야하고 짝꿍이라 답장도 성의껏 해야하는데 저라면 좀 나중에 읽고 아예 편히 연락할 수 있을때 답할것같은데.. 좀 무뚝뚝해 보여도 계속한다는것 자체가 엄청 노력하고 있는중인거 같아요ㅎㅎ!,잇토끼isstj
"특히나 사진옵션이라니...!
썸남분은 평소에 어떠신지 모르겠지만 저도 밑에분처럼 사진 안찍는편이라ㅎ",잇토끼isstj
"뭔가 대화가 되는 느낌이 아니라 자기말만 하는데.. 자기 이거중 이러고 저한테는 질문이 없는? 그래서 대화가 이어안나가는거같아요 ㅋㅋㅋㅋ
여행중이라 그런거겠죠...?? 마음이 식거나 그런건 아니겠져 훅흑 휴ㅠ",Dldleiej
그럼 굳이 더 이어가려 하지말고 '아~ 그렇구나 바쁘겠네 나중에 연락해'한번 시전해보세요ㅎㅎ 아차 싶어서 질문이 금방온다면 안심포인트가 될 것같은데~ 남자분이라 더 멀티가 힘들 수도 있을것같아요!,잇토끼isstj
"헤헤 알겠어요 안심이 되네요 히히
괜히 관심이 식었나..싶었던 😂
멀티가 안된다니 이해해야겠어요..😤",Dldleiej
"헉 님...답장안하고 스토리를 읽었어요
머져....... 서운왕서운.....",Dldleiej
"악 지금 왔어요
진짜 답장이 의무적우로 보낸다는 느낌이 강해요 ㅋㅋㅋㅋㅋ 연락하는게 어려운거구나 잇티제들은.....★★ㅠㅠㅠ",Dldleiej
"그래도 계속 보내준다는것 자체가
다들 공통적으로 좋은 반응이니까
마음 편히 갖고 있어볼까요 우리ㅎㅎ!!!",잇토끼isstj
"아무래도 좀 식은거 같아요 토끼님..
새벽에 또 인스타는 보고 답장은 안했더라구요...ㅠㅠ물론 엄청 늦은시간에 본거같아 잠결에 본거같지만 😥 그래도..
그냥 대놓고 물어볼까요 연락하기 싫나구 😥",Dldleiej
"헉.... 아니요! 연락보단 만나서 행동으로 직접 보여주는 타입이라..
그리고 아직 여행중이면 성급한 선택일 수도 있어요 ㅠㅠㅠㅠ 안되요~~~~~~~",잇토끼isstj
