,mbti,comments
708,ISTP,댓글 감사합니다 ST와 NF의 차이가 이렇게나 컸던가요 그렇다고 흥미가 떨어지거나 한 건 아니고 전 여전히 인프제분이 너무 좋습니다 저희는 지금 본인의 욕구보다는 상대방의 평안과안녕이 서로에게 우선입니다 내가 좋아하는 걸 하는 거보다 상대방이 싫어하는 걸 안 하기 아직 제대로 사귀기 전인데 이게 맞나 싶지만요 분명 저는 나 혼자 좋아하나 싶어 맘고생 엄청 했습니다 그런데 지금은 어디서 이런 강한 신뢰가 왔는지 모르겠어요 제가 원하던 신뢰를 기반으로 한 사랑을 충족시켜 줄 사람이라 저도 더 소중하게 대할게요
709,INFJ,여러번 상대방이 날 좋아하나 믿을 수 없어하다가 확신이 생기고 신뢰가 생긴 후 보여주는 모습입니다 착하고 순수한 사랑을 하는편예요 인프제인 저를 대입해보면 예쁜사랑하시길 
710,ISTP,제가 인프제분을 좋아하는지 계속 의심을 했었나보네요 지금이 참 편안하고 행복하지만 계속 이렇게 썸만 탈 수는 없으니 다시 확실히 관계 정립하고 지내겠습니다 그리 오래 걸리진 않을 것 같아요 감사합니다
711,INFJ,상대의 행복을 그리며 행복해하고 행복하게 해줄 확신이 있어서 본인의 마음이 커지면 항상 미래를 그리죠 평생 갈 생각을 하며 상대쪽에서도 미래얘기 같이 맞춰주면 더확신할거에요 이런부분에있어서 저희는 신뢰가 바탕이되는 안정된 확신을 가지고 평생갈 인연을 항상 찾는거같아요 그렇기에 마음여는것도 느릴수있고 마음 열었다가 호구처럼 악용당하거나 나랑다르게 시간이 지날수록 미래를 점점 놓아버리는 사람이면 상처를 크게 받고 동굴가듯이 마음의 문이 하나씩 닫혀가는거같어요 대신 문이 많기에 이해도 많이해주지만 다 닫혀버리면 뒤를 돌아보지 않죠 난 행복하게해줄 자신있고 그렇게 노력했으니 후회가 없으니깐요
712,ISTP,댓글 감사해요 이제는 마음에 대한 믿음이 없어 불안한 건 없는 상태입니다 다만 내가 이 사람이 생각하는 미래를 따라갈 수 있을까 하는 고민은 좀 드네요 혹여나 혼자 김칫국 마시는 중이래도 혼자 생각하고 혼자 판단 내리진 않으려고 합니다
713,INFJ,김치국 상대도 똑같을걸여 백프롴 인프제와 잇팁이 비슷헌듯 정반대라 결혼하면 잘살것같아요 화아팅
714,ISTP,죽겟네요 아주 철벽인지 미치겠어욬
715,ISTP,제가 부담스럽나요그럼 왜 선톡 했냐구요으허허허헝 너무 들이되엇나봐요
716,ISTP,저게 저말아닌가요 
717,ISTP,하미치겟네요 증말 
718,ENFP,인프제는 진짜 무슨 생각이 그러케 많은지 그냥 백괴사전 같아여 이 관문 통과하면 저 관문이 기다리고 있고 계속 다가가야 하고 다가올 줄은 몰라 삐걱거리는 유형 중에 원탑이에여 귀엽고 소심한 유형이라 저희가 마음껏 다가가서 마음의 문을 열어야 합니다 부담스럽고 싫으면 싫다고 하는 유형이라 싫은 건 아니고 그냥 다가오는 사람 되게 오래 지켜봐여 제가 이런 식으로 인프제 친구 6개월만에 제 친구로 만드렀어요
719,ISTP,제가 자꾸 들이미니깐 부담스러워서 말 돌린건 아니겟죠
720,ENFP,아녀 그냥 눈치 없어서 나한테 쓴 이모티콘은 아니겠지 그냥 쓴 거겠지 이런 생각 엄청 하고 이쓸걸여 그냥 귀여워서 쓴 건가부다 생각할 수도 있고 
721,ISTP,미치겟네요 증말 좀 받아 먹어라구
722,ENFP,인프제한테는 그런 거 기대하시면 안 대여 그냥 대놓고 말하거나 솔직하게 말하면서 천천히 다가가거나 근데 문제는 말 안 하고 다가가는 것보다 내 감정 미리 이야기하고 천천히 스며드는 걸 좋아해여 제일 철벽 유형 힘내세여
723,ISTP,그럼 먼저 저 오빠 좋아요 이렇게 말하고 스며들어야 좋은거에요이게 잘 먹히는 거에요 저라면 저란 여자 너무 흥미 없어질 거 같은데요 인프제 넘 어렵네여 
724,ENFP,호감이 있고 호기심이 가고 좀 더 친해지고 싶다or다가가고 싶다 이런 식으로 호감을 확실하게 표현하고 천천히 다가갈 것을 말씀드리세여 조금이라도 빨리 다가가면 인프제는 엄청 부담스러워해서 진짜 속도 절제하셔야 해여 
725,ISTP,헐속도 마저넹 와감사합니다 자꾸 치고 들어가려다가 팅겨나올뻔했네요
726,ENFP,힘내세여 그래도 인프제분들 무너뜨리는 것도 재미 있더라구여 화이팅
727,ISTP,감사합니다 꼭 잡아보게씁니다 오기가 이제 생기네요
728,ISFP,저는 8개월째인데 아직도 안읽씹 자주하던데 엔프피 님도 이러셨나요
729,ENFP,저 반 년 넘었어써여 진짜 무슨 계란으로 바위치기 같았는데 마음 열기 위해 부단히도 노력했던 것 가타요 제가 다 약속 잡고 다가가고 주제 만들어 얘기 꺼내고 엄청 힘들었는데 이 단계 지나니까 누구보다도 단단한 관계가 완성돼 있어써요
730,ISFP,안읽씹하는 이유가 뭘까요 심지어 본인이 선톡해놓고 안읽씹할때도 있더라고요 근데 또 보내기에는 부담스러워할까봐 못하겠고 팁 좀 알려주세요 
731,INTP,임티 위에 글자가 눈에 안 띄네요
732,ISTP,네 
733,ISTP,하그래도 오늘 선톡 해주셔서 다시 다가가는중인데 하갑자기 부글부글하네요 
734,ISTP, 인프제가 다가와서 감자님이 고백했는데 바쁘다고 차이셨다구요 속도도 맞춰줘야하나보네요
735,ENFJ,아 임티보고 답장하기까지 많은 생각을 했을 것 같아서 귀엽기도 하고 웃기기도 하고
736,ISTP,네 읽고 칼답 오는 사람인데 바로 읽고 좀 있다 답변 오더라구요 하다음 데이트 날짜 좀 잡자구요
737,INFJ,아 저 이모티콘이 진짜 산책하러가자는 얘긴가요 저같으면 그냥 이모티콘으로만 받아들였을것같은데 텍스트로 직접 써주세요 
738,ISTP,네하 네 다시 시도 기회봐서 해뷸게요 지금 저 부담스러워서 말 돌린건 아니겟죠
739,INFJ,부담스럽다기보단 긴가민가했을것같아요 진짜로 산책가자는건가 아닌가 하면서 고민했을듯해요 
740,ISTP,하갑자기 또 톡 왓는데 분리수거하고 산책하고 왓냐고 물으시네요 오빠랑 산책하고 싶어서 안하고 들어왔다 할까요
741,INFJ,오 좋아요 
742,ISTP,드디어애프터 갑니닷
743,INFJ,축하드려요 곧 남친생기시겠네요 
744,ISTP,근데 저 남자분 뒤에 소개팅분 한분 더 있으시데요 이번 주말인거 같은데 쩝 금요일 잘 하고 와야겠어요 조마조마
745,INFJ,엇 이럴수가 화이팅입니다
746,ISFJ,잇프제이지만 저도 저 임티를 받으면 저게 그냥 임티로 보낸걸까 아니면 진짜 가자는걸까 하고 헷갈려서 전자의 의미로 보고 답할거 같긴 해요 같은 ixfj지만 어려운거 인정
747,ISTP, 위에 글짜로 같이가자 오빠 적혀있잖아요 
748,ISFJ,그냥 이런 임티 귀여우서 쓰는 사람일 수도 있으니 의심에 의심을 거듭하며
749,ISTP,의심에 의심 하이젠 글짜로 무조건 말할거에요
750,INTP,정말 예상 못한 답변 저 분이 부끄러움 많고 신중한 타입인가여
751,ISTP,네 소개팅때도 칭찬 조금만 해줘도 얼굴 빨개지고 생각도 많으시고 그러시더라구요
752,ENFP, 봐도 봐도 너무 웃겨여 귀여우시고 아 인프제분들 매력 덩어링
753,INTP,귀엽네여 근데 연애 초반까지 상당히 답답하시겠어요 님이 리드하시는 건 어때요
754,ISTP,하 저 스샷 나중에 사귀면 추억으로 간직하려구요
755,ISTP,네 선톡만 잘 해주신다면 제가 자꾸 상황보면서 이젠 직접적으로 치고 나가야겟어요
756,INFJ,어디 산책가자고한건지 찾았는데 이모티콘텍스트로 해보세요
757,ISTP,네 이제 무조건 텍 스 트 로 해야겠어요 어질어질하네요 
758,ISTP, 한달전 제가 인프제분과 약속 잡았던 톡 올려드리며 지나가겠습니다
759,ISTP,하이렇게 해야하는군요 감사합니다 
760,ISTP,사랑해 오빠오빠 입니다 
761,ENFP, 제발 이 글 지우지 말아주세여 잇팁님 너무 귀여워여 
762,ISTP,네 
763,INFJ,구매하러갑니다
764,ISTP,약속 잡았습니다 감사합니다 
765,ENFP,뭐야 천천히 다가갈 필요가 없얶네여 축하드려여 제 일처럼 기쁘네여
766,ISTP, 하불도저 성격 어디 안가나보네요 저기서 팅겼으면 그때부터 소심해졌을거 같아여 같이 기뻐해주셔서 감사해용
767,INTP,아 드립치려다 말았습니다 축하드립니다안읽씹 아닌거죠
768,ISTP,네네 메뉴 정하고 있습니다 
769,INTP,아니 산책하자고 해놓고 급 밥약속은 완전 급발진 아닌가요 밥먹고 산책하려 하나요
770,ISTP,네 밥묵고 산책해야졍
771,ISTP,넹넹 이번년도 행운을 여기에 다 쏘아붇고 싶습니다
772,INTP,부디 급 한파가 찾아오길 바랍니다
773,ENFJ,꺄 축제다 맛있는 것도 먹고 즐거운 시간 보내고 오셔요 후기도 슬쩍
774,ISTP,와아 부디 썸 오래 안가고 결론 나시길 
775,ISTP,제발용 응원 감사합니다 
776,ISTJ,님연재 계속 해주세여 넘나 재밌어
777,ISTJ,어우 춥다추워
778,ESTP,글 또 써주세요 infj에게 호감을 느끼는 istp분들이 생각보다 많네요
779,INFJ,축하드립니다 만나서 오늘부터 1일 해요
780,INFJ,인프제는 용기가 잘 없는 것 같아요 동시에 글쓴이님이 부담될까봐 걱정되기도 하구요 직설적으로 드러내주시면 더 잘 받아주실거에요 눈치가 없는 유형은 아니지만 용기가 너무 부족합니다 저도 3년을 짝사랑을 해봤었는데 제가 생각해도 제가 너무 답답하게 굴었었다고 생각합니다 
781,INFJ,할말없어서 그렇게라도 이어나가는거 아닐까요
782,INFJ,네 뭐 친구들 와이프들도 챙기고 그래요 친구들 통해서 하지만요 관심있는 분이라서 가족들도 챙기는거에요 본인스케줄보고는 인프제 플러팅이에요
783,INFJ,잔소리는 편해지신모양이네요 관심이죠 없으면 그런얘기도 안해요
784,INFJ,반갑죠 인프제 선톡은 생각이 많아서 그렇게 쉽게 못해요 어떻게 시작할지 고르느라요
785,INFJ,안 이상하고 고마워해요
786,INFJ,사실 이성적인 호감이 크면 티가 확나요 물어보시지 않아도 알정도로 근데 호감이 생기기시작한 상태나 인간적인 호감이면 저희가 봐도 모르겠어요 본인에게 물어봐야지 알아요 용기가 필요하신거면 나답게 그냥 하세요 인프제가 맘이 커지면 알아서 직진할거에요 뭐 행동한거 없어도
787,INFJ,두분다 정상적으로 보이네요 누가 틀린건 아니고 두분성향이 맞지 않는거 같아요
788,ENFJ,그렇다고 나쁜 친구는 아닌데 대화하면서 저런 사소한게 삐그덕거리니 둘 다 뭔가 꿍해진달까요저 혼자 일수도 뭔가 이것만 맞으면 정말 편하게 대화할수있을것같은데하는 그 지점을 넘을 수 가없네용
789,INFJ,내가 나 해서 예민해 라고 얘기하는거랑 다른 사람이 너 오늘 해서 예민하겠네 혹은 해서 안 예민하겠네 하는거랑 기분 달라요 다른 사람이 날 아는 척 하면 기분 안 좋아요
790,ENFJ,아는 척하려한게 아니라 친구가 준 정보로 대화하자고 말을 건건데 그렇게도 생각하는군요
791,INFJ,그냥 오늘 기분 어때 라고 물어보시는게 젤 좋아요 그렇다고 오늘은 기분 어때 라고 하면 또 기분 안 좋아요 오늘은 왜 오늘은 이라고 하지 내가 어제나 그제 기분 안좋다고 했나 합니다
792,INFJ,와 적어놓고 보니 진짜 무슨 초 예민 덩어리 그냥 친하게 지내지 마세요
793,ENFP,
794,INFJ,진짜 전 누가 저를 파악한 척 저를 아는 척 하는게 싫어요 물론 저를 진짜 아는 사람이면 괜찮은데 직장에서든 사적으로든 나를 이미 정말로 아는 사람 그것도 아니고 어줍잖게 그냥 밥이나 같이 먹는 사이 정도이면서 날 안다고 생각하면 기분 나빠요
795,ENFJ,어렵네요 읽으면서 이해가 되려다가 다시 원점으로 돌아와서 다시 읽어보게 되네요 하 쉽지않당
796,ENFJ,아전 고기나와서 안예민하겠네 였는데 인프제에겐 고기나와서 안예민하겠네 로 예민이란 단어에 초점이 맞춰진걸까요
797,ENFJ,다른 인프제님들 댓글에서 말씀주신 고기나와서 좋겠네의 문장이 오히려 저에겐 제가 짐작하고 판단해서 묻는걸로 생각이 든단말입죠 고기가 안나와서 기분이 예민하다 인프제가 준 정보 고기가 나와서 기분이 좋다 인프제가 준정보를 통해 내가 판단한 정보 이렇게 생각이 드는데 판단 기준을 제가 잘못 정의한걸까용
798,ENFJ,아 진심 마지막 문단에서 인프제 친구가 무슨 생각으로 말한건지 이해 확 됐어요 계속 저는 대화자체에서 문제점과 해결방안을 찾으려 했거든요 감사합니다
799,ENFJ,진짜로 저는 제가 더 잘 파악해서 맞춰야지 생각을 가지고 친구를 대했는데불가능하군요 밑에 적으신 것처럼 불편한거 차라리 말을 해달라고 말해봐야겠네요 저런말안하면 죽어도 스스로 먼저 불편하다고 말안할 친구라서 어렵지만 한번 맞춰나가봐야겠씀니다
800,INFJ,생선구이에 국한해서 예민한거죠 먹는거에 따라 예민 하다 안하다 보다 그냥 생선구이가 먹기싫었던겁니다
801,INFJ,분석할 필요없습니다 그냥 생선구이가 잘못한거에요
802,ENFJ,고기반찬 안나오고 생선만 나왔어 그래서 예민해라고 말을해서 다음날 오늘 고기나와서 안예민하겠네 한거란말이죵 고기반찬나온걸 반겨준거였는데 생선구이가 잘못했네욬
803,INFJ,그냥 고기 나와서 좋겠네 라고 했으면 됩니다 안예민 하겠네에 내포되어 있는 의미가 상대방이 음식으로 예민하고 안하고 결정짓는 걸로 해석될 수 있잖아요 본인은 그냥 생선구이가 싫었던겁니다 다른 음식이 뭐든 예민한게 아니고 그냥 생선하생선구이가 싫은거라구요
804,INFJ,오 맞아여 그냥 고기 반찬 나와서 좋겠넹 하면 됩니다 근데 삔또가 좀 틀어져있으면 물론 그것도 다 싫긴 해요
805,ENFJ,어후 어후 어떤 말씀인지는 이해하겠네요 해석을하지마라그냥생선구이가잘못이다
806,ENFJ,편하게 스몰토크할랬는데 딱 잘라버리듯이 말해서 제가 좀 속상했나봐요
807,ENFJ,예민이란 단어가 문제였군요 무슨 생각으로 말씀하신건지 이해는 되네요 나름 몇년지기라서 전 친하다고 생각했는데신경쓰이는구나
808,ENFJ,본인도 뭔가 아차 싶은 생각에 생선도 고기야같은 답변으로 무마 시키려는 걸까요 인프제 친구가 가끔 그래요 디게 막말처럼 툭툭 뱉어서 제가 너가 하는말이 이런생각으로 꺼낸 말이야 그러면 뭐가 내 말은 얼룩말이였는데 이러면서 진심 어이없게 무마시키려고 하거든요참 알수가 없습니다요
809,ENFJ,당시엔 저딴말로 무마시키는게 짜증나는데 또 생각해보면 귀엽네요애증인가봐요
810,ISTJ,헐 전 기억해주고 신경써쥬는거 같아서 좋을거 같은뎈
811,ENFJ,맞아요 오히려 지난일 기억해서 신경써준건데 역시 생각하는게 모두들 다르니 쉽지않아요
812,ISTJ,저는 저 말씀이 어제는 고기 안나왓는데 오늘은 고기 나외서 좋겠네 라고 들리거든요 그래서 왜 기분이 상하는지 잘 모르겠어요 아님 먼가 평소에도 비슷한 일들로 쌓이신게 잇으셨나봐요
813,INFJ,제 경우엔 Enfj 지인이 한명 있는데 꼰대에 오해를 잘하고 넘겨짚기를 잘해요 그렇다는 전제하에 저에게 저번에 형이 고기 없어서 예민하다했지 이렇게 장난을 치고 나는 예전에 그런말을 했다고 가정하면 그때 바로잡습니다 아닌데 라고요 이유는 의미없이 한 얘기를 확대해석 과대해석해서 남에게 전하고 Enfj스스로 오해해서 넘겨짚은뒤에 왜 그런 생각을 했어 라고 물어보면 그냥 웃으며 넘어갑니다 아님 말고 형 매번 말 바뀌네 이런식으로 그러면 속으로 히틀러가 깨어납니다 그래서 그 이후에 일어나는 모든 잘못된 그 사람의 착각과 판단을 전부 하나하나 세세하게 원인 과정 결과까지 나열해 알려줍니다 그래서 그런것일수도 있습니다 저는 그런 경험을 했어요 말이 바뀌는것이 아닌 가벼운 농담과 그 상황에서의 흐름에 맞는 드립과 그걸 잘못 해석해 넘겨짚은뒤 나를 판단하고 무례하게 넘어가는 Enfj지인의 우둔함이 복합적으로 섞여 있전 제 경험담
814,ENFJ,어떤 상황이고 어떤 생각으로 엔프제 지인분한테 바로잡는 말씀하신건지 어느정도 이해가 가네요 저도 그런상황이 있었는지 곰곰히 생각해봐야겠네여
815,ENFJ,제가 저 이해간다는 말적으면서 부가적으로 적으려했는뎈 이렇게 제가 말했다고 또 너가 뭘이해해 라고 생각하시는건 아니시죠라구요
816,ENFJ,웃겨요 저도 얘가 어제말한거 까먹고 지금 저렇게 대답한걸까봐 어제 니가 그랬잖아 하면서 짚어주는데 참 그냥 아 그랬네하면서 인정을 해줬으면 좋겠는데 죽어도 인정안하고 무마 시키려하네요 본인이 그래도 어느정도 자각이라도 한다면 오히려 다행이네요 헿 오오 까먹지않게좋아요 그렇게도 한번 말해봐야겠어요
817,ENFJ,22제가 인프제는 아니지만 딱 저런거아닌가요 아 아는 여자애가 딱 저런식의 대화했던거 생각나서 스트레스 확올라오네요 그여자앤 그냥 엄청 예민하고 지멋대로라서 어제한말도 아니라고 우기고 자길위해말해도 예민하게 반응하고 진짜 별로였어요 저러는 사람은 걍 관심안주는게 답
818,INTP,어렵다 엔프제들도 어려워하는 인프제 나랑은 어떻게 대체 친구하는거지
819,ISTP,두분 다 생각들이 참 많군요
820,INFJ,아오 상대방이 사회성 0인걸 글쓴이가 속상해하지마요
821,INTP,별 신경 안 쓰일 것 같긴 해요
822,INFJ,네 의견 감사합니다
823,INTP,왜요 뭐가요 인팁이 뭐 어쨌다고요 습관적인 화법은 그냥 흘리는 것이 나을 것 같아요 욕이나 모욕적인 발언은 아니니까요
824,INFJ,선임이자 팀장이라 괴로워요
825,ISTP,썩 좋은 상황에서 들으시는 말은 아닐 것 같아요 다만 저분의 생각과 행동이 일관성있다면 그것대로 괜찮은 사람이고 그러지 못한 사람이어도 보통 다 그렇다고 생각합니다 그래도 그런 식으로 말을 하면 본인에게는 불편하고 조금 신경써주면 감사하겠다고 말씀해보시는건 어떠실까요 무시하기엔 이미 괴롭다고 표현을 하셔서요
826,INFJ,제 생각도 그래요 저런 워딩 저는 너는 이런 기본적인걸 아직도 몰랐니 라고 들린다고 면담요청 해보려구요
827,ISTP,제 경우 업무적으로 이런 상황이 생기면 뻔뻔하게 나갑니다 네 제가 놓치고 있었던것 같습니다 죄송하지만 제가 찾아볼 수는 있겠지만 혹시 직접 가르쳐줄 수 있겠는지요 잘하셨다면 기분이 나쁠것같지가 않은데 뭐가 문제였을까요
828,ISTP,친구든 사회든 어떤 그룹에 속해있으면 각 그룹의 성향이 있습니다 그 구성원 개개인의 특성까지 알게모르게 짬뽕된 혼돈의 카오스 그 자체죠 당연히 라는 말에 대해서는 개선을 요구하실 수 있으나 그만한 능력을 보여주지 못한다면 책임또한 본인의 몫일 뿐이라는 생각입니다
829,INFJ,팀장님이 다른 곳에서 제가 있는 곳으로 배정 받으셨어요 그래서 업무 자체는 1년 정도 제가 먼저 하고 있었고 업무도 제가 이렇게 하는거라 인계 해드렸어요 2018년 데이터는 이런 형식으로 코딩이 되어있는데 2023년 코딩값은 다르다 어떤 코딩값 정의를 따라야 하냐의 질문이었습니다 2023년의 코딩 정의가 바뀐 것이 이러이러한 이유같다라는 저의 코멘트와 함께요 그랬더니 제가 언급한 그 이유 떄문에 코딩값이 2023년 파일이 맞는 상황이었어요 근데 제가 물어본 이유는 팀장님도 2018년에는 아래의 피드백 처럼 데이터를 관리하셔서 저희들이 헷갈려서 제가 대표로 물어본거였는데 다음과 같이 호들갑 떠셔서 황당했거든요 네 당연히 안적죠 파일로 주신 으로 바꿔야죠 했으면 당연히 없어야죠
830,INFJ,팀장님도 저도 배운대로 업무를 하고 있었던거에요 근데 팀장님은 데이터 관리를 하시다 보니 코딩값을 자기가 바꾸어서 입력을 하시고 계셨고 본인도 그렇게 첨엔 입력했는데 아닌것 처럼 저만 바보 만드는 것 같은 코멘트게 화가 났습니다
831,ISTP,이런 비슷한 상황들이라면 면담통해서 충분히 원만한 조율이 될거라고 생각합니다 서로 기분나쁘지 않게 어떤 방향성을 잘 맞춘다면 업무효율도 그만큼 올라가지않을까요
832,INFJ,떡볶이 예시 같은 상황이면 완전 긍정이니 기분이 나쁠 이유는 없는데요 업무에 대한 질문을 하면 당연히 이렇고 저렇고 하니까 당연히 이렇게 처리 하셔야죠 이런식으로 항상 말하세요
833,INFJ,그러니까요 특정 질문에 당연히가 남발 되는것 보면 그 분도 제 질문이 위협적으로 느껴지셨나 싶네요
834,INFJ,기본 값이 좀 부정적인 분인것 같긴해요
835,ISTP,좋게 들으라고 하는 소리는 아니예요 그런 기본 적인 건 말 안해도 당연히 알아야하지않나 라는 의미가 내포되어있는거죠
836,INFJ,그쵸
837,INTJ,22 그 선임도 모든게 처음부터 당연했을지 궁금하네요
838,ISFJ,이거 먼느낌인지 알아요 예를들면 처음 보고를 받은내용이라 알려줄려고 말하면 당연히 이건 이렇게하는게 맞죠 이런식으로 아는척하는데 이런사람 저는 이렇게 대처합니다 이거는 라고하네요 이거알고계시죠 라고말하고 그사람이 예맞아요 이건당연히해서 인거에요 라고 아는척하면 제가 다시말하죠 아 이게아니라 이거에요 이건에요 라고 다시 수정해서말하면 이사람 말버릇 고쳐집니다 이거 한번말고 몇번만 해보시면 싹 고쳐집니다 자기가 뻘쭘해하거든요
839,INFJ,지금 거울 치료를 해볼까 합니다 저는 항상 물어볼때 이전 데이터는 이런데 선생님이 입력하신 데이터는 이럽니다 뭐가 맞는거죠 이런경우가 많아요 근데 데이터가 누적이라 매뉴얼의 정의나 코딩값은 같아야 하는데 이전 데이터를 왜 따르지 않고 당신이 이제 데이터 관리하니까 맘대로 바꾸냐 이런 의미가 내포되어있어서 팀장도 기분이 나쁘셔서 당연히 내 데이터가 맞지 이렇게 반응하시는건가 싶기도 하네요
840,ISFP,개복치인 저는 당연히 죠라고 하면 내가 뭔가 당연한걸 물어봤나하면서 리액션같은거 안하고 대화도 안하게 되는것 같슴다 
841,INFJ,저도 개복치 딱 그 느낌이에요 게다가 제가 질문한것도 아니고 다른 사람이 물어본거 제가 대표로 정리해서 물어보겠다고 한건데 저혼자 똥멍청이 되었어요
842,INTJ,그냥 그 사람이 자주 쓰는 단어일거예요 저 아는 사람은 자체라는 단어를 한 문장에도 여러번 써요
843,INFJ,그 사람 성향이니 냅둬야 할까요
844,ISTJ,저는 내가 당연한것도 모르고 있었구나 이제 알아야겠다 이렇게 생각할거 같아요 상사면 나보다 잘알텐데 그사람 입장에선 당연한거고 난 초년생뽀짝이라 모르는거니까 그걸 귀담아 알게 되면 나도 성장하니까 개이득
845,ISTJ,긍정주의 작용이 어떤 말씀이실까요
