title,contents,author,comments
엔티제(ENTJ) 남사친 편지,['군대에 있는 남사친이 일주일동안 손편지를 써서 보냈습니다 내용은 군 얘기랑 휴가 나오면 놀아준다는 내용 뿐 이였습니다 지금은 연락 따로 안 하고 있는데 저한테 호감 있는 걸까요 없는 걸까요 연락이 없어 헷갈리네요'],IeSFtJJ,"['엔티제가 편지까지 쓴다...? 효울적이지 못한 행동이고.. 차라리 전화를 하지.. 호감아닐란가요', '연락도 따로 안하고 있어요..', '연락먼저 해보는게 맘편할듯요', '손편지?? 호감입니다']"
Entj 남자 상대하는 팁이 있을까요,"['Entj 남자랑 사귀고 있는데요', ""제가 장난을 치는데 저보고 장난으로 '장애같다'라고 하는거에요"", '제가 천박하게 왜 그런 말을 쓰냐며 장애인 비하하는 거라며 지적하고 화를 냈습니다.', '너는 나를 교양없고 못 배운 사람으로 취급한다며 기분이 나쁘대요. 장애같다는 말은 표현의 자유고 자기는 장애인 비하할 생각이 없고 그럼 덜 떨어지는 모습 보이는 개그도 장애인 비하냐면서 나는 너가 귀엽고 웃기고 편해서 그런 표현이 나온거다라며 나름의 철학적 논리를 펼치는데.', '정말 이 사람은 어디서부터 뜯어 고쳐야 되지? 생각이 들고 단전에서부터 화가 나지만 설득이 안되더군요.', '자기는 생각을 바꿀 생각이 없다고 하더라구요. 다만 제 앞에선 조심하겠다면서 그럼 된거 아니냐면서.', '내가 이런 사람을 좋아하는 게 힘이듭니다.', '평소에도 자기 색깔이 강하고 호전적인 태도가 피로하지만 내가 좋아하는 사람이니 어느정도 수용해야지 생각은 하는데 좀 지쳐가네요. 물론 그 모습이 매력적이라 좋아하게 됐지만 진짜 맞추고 다루기 힘듭니다.', '엔티제와 어떻게 지내시고 어떻게 다루시나요 ?', '']",겸릿EstJ,"['100퍼센트 논리적으로 엔티제가 하는 말을 어디가 어떻게 잘못됐는지 잡아주면 납득하고 고치겠다고 하더라고요. 근데 이게 거의 10중에 3정도고 나머지는 자기 생각, 자기 의견이 무조건 맞다고 합니다 저도 이게 너무 힘들었어요', '일로 엮이는거 말고는 피해다닙니다', '장애라는 단어도 천박이라는 단어도 선택이 잘못된 것 같은데요.. 그리고 장애라는 말을 귀엽다의 대체로 쓰는 사람은 국어를 못하는 거에요. 그런데 고집도 세니까 말이 안 통할 것 같네요.. ㅠ', '22222', '???? 논리적으로 대꾸할 것 없이 문제의식을 못 느끼는 것 자체가 문제인데요?', '222222', '저도 entj인데 그냥 워딩자체가 문제인듯요. 그걸 희화화 하는 것 자체가 문제이니 논리는 필요 없다고 생각함', '222222', ""귀엽고 웃기고 편함 = 장애 ????\n저 표현은 이해가 안되지만 엔티제 논리는 뭔 말인진 알겠음 ㅋㅋㅋㅋ\n\n장애 라고 했을 때 '천박하다 장애인을 비하했다' 라고 지적을 했으니 '그렇지 않은 의미로 사용'한 엔티제 입장에선 반박한거죠 엔티제가 쓰는 '장애' 는 나쁜 의미가 아닌데 쓰니님이 부정적으로 받아들인거니까요. 왜???? 이 표현이 나쁜건데? 에 반응.\n(정말 엔티제스럽다...)\n\n남친분한데 '장애의 사전적 의미'를 보면\n'귀엽고 웃기고 편함'이 아닌\n신체 기관이 본래의 제 기능을 하지 못하거나 정신 능력에 결함이 있는 상태\n..인데 내가 그래? 라고 말해보세요"", '제가 엔티제인데.. 서로 지내기 힘들듯 합니다. 엔티제는 뭔가 꽂히면 물어뜯는데... 물어뜯는다 표현보다는 대화 한다는 수준정도? 글쓴이 분께서 엔티제 남자친구에게 설득당했다 표현하시면 아 그렇구나 정도로? 하면 관계가 좋아질거에요 그게 싫다면 힘들어 보입니다.']"
엔티제 찐사랑은 바로 ‘이것’,"['당신에게', '시간을 낼 수 있느냐 없냐의 차이', '입니다.', '대부분 다른 분들도 사랑한다면 같은 반응이겠지만', '개인적으로 엔티제가 시간을 낸다는건', '좀 의미가 달라집니다.', '', '예를 들어', '독립적이고 사람도 잘 안만나는,', '일정이 아주 빡빡한 엔티제에게', '사랑하는 사람이 생겼다?!', '언제', '시간 되냐는', '질문에', '‘난 언제든지 너에게 맞출 수 있어’', '라는 말이 나오면 이건 진짜 사랑해서', '나오는 말입니다.', '', '원래 급약속 되게 싫어하는데(꾸며야하는 경우)', '잠깐 보는 상황에서도 꾸미고 나오면', '엄청나게 호감!', '', '가끔 엔티제라고 하면서 심심해서 사람 만나고', '이사람 저사람 만나고…어장치는 놈들이', '사연에 올라오고는 하는데 둘 중 하나입니다.', '1. 엔티제가 아닐 가능성', '2. 그냥 단순히 놀고 싶을 때', '(쓰레기는 얼른 버리세요)', '', '사실 저도 엄청 바쁘고', '안바쁘면 일을 만들어서 가져오거든요', '심지어 누가 불러도 잘 안나가는데', '단순히 심심해서 만나는거 별로 없고', '(혼자 노는게 더 편하다는..)', '', '당신에게 내 시간을 준다는 것 자체가', '엄청나게 좋아한다는 뜻,', '그리구 엔티제가 먼저 약속을 잡는다?', '그건 당신을 아주 좋게 보고', '심적으로 편안하게 만들어주는 사람이라는 것', '*그래서 의외로 isfp tp친구들이 많은 듯', '', '여기서 덧붙여서', '엔티제가 자꾸 나중에~ 미래에', '결혼하면~ 이런', '미래에 관련된 이야기', '를', '한다는건 당신을 58000% 사랑하고', '반려자로 선택했다는 증거입니다.', '뭐 여기서 좀만 틀어지면 경고주고', '언제든지 떠날 잉간들이지만..최대한', '이런 분들에게는 푹 빠졌으니', '성격도 많이 죽이고 경고도 잘 안주겠죠', '', '만약에 궁금한 점 있으시면', '물어보세요! 감사합니다:)', '', '']",ENTJ 203페이지,"['엔티제가 사랑하는 애인에게 바라는 점 같은게 있을까영', '음.. 그 사람 그자체를 좋아하는거라 바라는건 없고 제가 좋아했던 그 상태로 변하지 않기?.. 아님 제가 사랑하는 마음보다 더 저를 생각해줬음 좋겠다?가 되겠네요 ㅎㅎ', '저도 그래요\n그 사람, 지금 그 모습이 좋은거라서요', '맞는말 ㅎㅎ', '감사합니다 ㅎㅎ', '극 공감 !! 동족은 좋아요 누르고 갑니다', '공감 감사합니다 ㅎㅎ', '저도 찐 엔티제를 만나서 연애는 이렇게 하는구나! 하며 비록 짧은 만남이였지만 엔티제의 사고와 연애방식을 알아볼 수있었어요~ 지금 글을 읽어보니 진짜 다 맞네요~~ 연애도 일과 동일하게 최선을 다하더라구요~', '맞아용 연애할 때 최선을 다하는 것 같아요:)', '엔티제도 상대방도 똑같이 최선을 다해주길 바라죠? 제가 그게 좀 부족 했던거 같아요', '그쵸 제가 하는만큼 해주길..그 이상으로 더 사랑해주길 바라는 것 같아여 ㅋㅋ효율충이라 그런가..', '오호 ㅋㅋㅋㅋㅋ 최근 제가본 엔티제의 모습과 똑같군용 😶😶 얼마전 타임테이블에 제 이름과 시간과 장소가 들어가있는걸 보고 너무 웃겼어요. 당일에 만나자고 한건데도 넣어놧더라구요 ㅋㅋㅋ 웃김', 'ㅋㅋㅋㅋㅋ사랑받고 계시네요☺️', '썸인데도 계속 결혼이나 미래얘기 계속 하는데\n단순히 좋아하는 감정으로도 이런 얘기를 하나오?', '그리고 다음날 출근인데도 제가 사는 지역(편도1시간반) 놀러와서 숙소잡고 자고 새벽에 올라가고, 2시간보려고 왕복 3시간 운전해서 오고,,이런거 안좋아해도 가능해요? 알아보려고?\n좋아하지 않는다면서 그냥 알아가보고싶다면서 위두행동을 하는데 전 어떻게 해석하져', '대충 뭐라고 말 하나요?', '행동만 봐서는 좋아하는 것 같은데 좋아하지 않는다구 한건가요? ㅠㅠ', '네..! 자긴 사람 오래봐야한다고 아직 좋아하는건 아니고 더 알아가보고싶대요! 제가 재촉하니까 자기도 너무 혼란스럽고 이런감정 처음이라 힘들대오 ㅠㅠ\n\n결혼얘기는 자식은 몇명낳고, 저녁마다 뭐 이런잏을 할거고, 장모님 데리고 여행가고, 자긴 아내랑 여행많이다닐거다 이런 구체적인 상상이오(S는 할수없는)\n\n그리고 사업적인부분은 자기 직업하고 괸련된 자격증을따서 어떤 사업을 몇살때쯤 하고싶은지 한 30분을 혼자떠들어요.\n\n그러고는 이런얘기하는게 처음이라고까지햏어요', '음 그 결혼얘기는 엘프제님이라고 딱 정해진게 아니니까 단순히 자기 결혼관에서 말한 것 같고(은근히 사귀게 되면 이럴거다~ 언급 정도) 처음이라고 하는거에 너무 휘둘리지 마시고, 재촉 하지마시고 오히려 여유있는 태도 보이시면(재촉x 오면 오는거고 안보이면 관심 안주는) 남자쪽에서 안달날겁니다! 사업적인 부분 떠드는건 엔티제 특성상 본인 얘기하는거 좋아해서 그런거니까 그냥 들어주시면 돼요:)', '재촉하면 있던 마음도 떨어지나요?\n이미 재촉하고 끝내고 제맘대로 다했어요..ㅋㅋ', '맞아요\n\n저는 진짜 제가 좋아하는 사람 아니라면\n굳이 나의 소중한 시간을 빼고싶지 않아요.\n시간 있더라도 집에서 혼자 쉬고말죠.\n\n어장 바람 이런거 하지도 못해요\n여러여자에게 관심을 주기엔, 내가 할거는 많고 시간은 부족하니까요\n\n근데 사랑하는 사람이 생긴다면\n상대도 그만큼 최선을 다했으면 좋겠어요', '금전적으로 너무 힘들고 정신적으로도 여유가 없을때도 진짜 좋아해도 헤어지자고 하나요? 정말 상황적인 여유가 없을때에요!', '아뇨 어떻게 해서든 방법을 찾으려구해요.. 그냥 거기까지인 사이..ㅠㅠ 음 내가 이러이러한 상황이라 너랑 만나기 미안하다~ 여유가 된다면 다시 만나도 될까, 이런 느낌으로 다시 만날 수 있냐의 말이 있음 진짜 좋아하는거고 없으면 만나지마세요..! 날 사랑해줄 여유도 없는 사람 만나서 뭐합니까', 'ㅠㅠ 다른것도 물어보고 싶은데! 채팅 되나요 ㅠㅠ!', '넵 제가 도움이 된다면야…', '어 근데 채팅 어떻게 하는건가요? ㅠ ㅋㅋㅋㅋㅋㅋㅋㅋㅋ', '프로필 누르시구 채팅 누르시면 돼요!', '명예가 아니라서 안된데요 ㅠㅠ 쪽지 드릴게요!!', '넵!', '홀 너무 똑같아요.. ㅋㅋㅋㅋㅋㅋㅋ\n표현을 엄청 하는데 저는 아직 좀 쑥스러워서 받는만큼 표현을 못하고 있다고 스스로 느낄정도인데 이걸로 많이 서운해 하려나요ㅠㅠ?', '잇팁 잇프피 넘 기여워요잉>.<\n내가 널 마니 조아하지만 표현이 아직 서툴다는 식으로 주입해주면 이해해줄거에영']"
엔티제 헤어지고 연락 하나요?,"['서로 직무는 달랐지만 업무 얘기하면 넘 재밌고', '관심분야도 비슷하고 재테크 얘기 좋아하고', '아무튼 서로 비슷해서 너무너무너무 재밌게 연애했던 엔티제 전남친인데ㅋㅋㅋㅋ', '너무 비슷해서 그런가 둘 다 약속부자라 만날 시간도 적었고 기싸움도 장난아니여서 결국 제가 헤어지자하고 대화나누다가', '서로 생각해보자로 끝났는데 제 마지막 장문 카톡에 엔티제가 답을 안했어요', '그래서 저는 답하기 싫은 게 답이구나하고 헤어짐이라 결론내리고 잊고 살았는데', '오늘 뜬금없이 몇달만에 엔티제가 생각해본다 해놓고 연락을 못했다고 너무 늦게 연락해서 미안하다며 연락이 왔는데ㅋㅋㅋㅋㅋㅋㅋㅋㅋㅋㅋ', '엔티제도 몇 달씩 생각을 하나요......?ㅎ', '딱히 연락에 의미부여할 생각도 없고 다시 만날 맘도 없는데', '너무 신기해서요ㅋㅋㅋㅋㅋㅋㅋㅋㅋㅋㅋㅋㅋㅋㅋㅋㅋ', '첨엔 아 또 술 마시고 찔러보네 생각했는데', '엄청 진지하게 본인이 최종적으로 생각한 걸 얘기해주길래ㅎㅎ', '당황스러웠습니다ㅠㅠㅎ........ 엔티제도 이럴때가 있다니....?', '아니면 mbti 상관없이 극심한 회피형인걸까요ㅋㅋㅋㅋ']",땅콩엣티제,"['원래 지 꼴리는 대로 행동하는 인간이라.. 뭔 생각해본다고 연락 늦었다고 개소리를... 죄송해요 엔티제 볼 때마다 너무들 똑같아서 감정이입했어요. 걍 시간 지나니 생각나고 한번 건드려보는거라 만나도 똑같을 거예요.', '와 진짜요? 엔티제들마다 똑같았나요?ㅋㅋㅋㅋㅋㅋ 전 반대일줄 알았는데 신기하네여,,, ㅎㅎㅎ저 지금은 넘나 다정한 남자친구 만나는 중인데 어제 엔티제 연락받으니 현남친이 더 다정하게 느껴져서 다시한번 잘해야겠다 생각했네용,,ㅜㅜ', 'ㅋㅋㅋㅋ 제 엔티제도 썸타다 끝내자했는데\n자기 몇주만생각허고 연락준대요.. 제가 끝이라했는데 자기가생각헌더구..', 'ㅋㅋㅋㅋㅋㅋㅋ아ㅠ 엔티제 이렇구나ㅋㅋㅋㅋㅋㅋㅋㅋㅋ 저도 분명 헤어진거라 생각했는데 헤어진거아니래요ㅋㅋㅋㅋㅋㅋㅋㅋㅋ', '자기중심적인 사고방식이 있어요', '그딴 예의없는 놈은 후… 먼 멍멍이같은 소리래요 갑자기']"
sfp랑 ntj조합이 딱 친구하기 좋은거 같아용,['서로 상호보완해주는ㅋㅋ'],벼리이,"['친구까진 좋은데 그 이상이면 서로 성향이 다르고 성질건드려서 별로에요…', '그 조합 저희 학교에 실제로 있어요!', '딱 친구까지만!', '2222', '친구도 별로인거 같은데 sfp 생각보다 제멋대로라서']"
