title,contents,author,comments
INTJ는 어디서 인연을 만나셨나요?,"['안녕하세요?', '저는 직장인 31살 여자입니다.', '', '직장인+내향인+신중하고 진지충성격이라 새로운 인연을 만드는 게 쉽지 않다고 느끼고 있어요.', '', '1. 소개팅', '최근 남자친구랑 이별 후 소개팅을 몇번 했는데,', '도저히 소개팅으로는 연애감정으로 발전이 안되어 문제를 겪고 있어요.', '1번 만나서는 모르니 더 만나보자 생각해서 3번째 뵈어도 도저히...ㅠㅠ', '이러다보니 매번 상대방께도, 지인분들께도 너무 죄송해서 소개는 못 받겠어요.', '', '2. 사내연애', '연구기관에 근무, 사내에 남여 비율은 남6:여4 정도입니다.', '그치만 사내연애나 유관기관 연애는 리스크가 커서 피하고 있어요.', '', '3. 자만추', '원래 소개팅보다 자만추 스타일인데..그것도 쉽지 않아요.', '평일은 집 주차장 - 회사 주차장 자차 이동하고,', '아파트 커뮤니티에 있는 헬스장, 수영장에 다니고 있어요.', '주말에 집앞 카페에 나가면', '번호 물으러 오시는 분들은 종종 있는데', '혹시나하고 나이를 여쭤보면 죄다 20대 중후반이에요ㅠ (저는 최소 동갑~연상 선호)', '', '이러다보니 어디서 사람을 만나야하는지 모르겠어요.', '찾아보니 소모임, 소개팅어플 같은 것들이 있긴 하던데 성격상 그것도 두렵고 막막하네요.', '', 'intj 직장인 분들은 어떻게 새로운 인연을 만나셨나요?']",INTTTFFFJ,"['스터디에서 같이 공부하다가 회사에서 같이 일하다가 천천히 호감이 생겨서 정도였네요\n앞으로는 둘다 더이상 안할거지만 인연 만나야지 하다 악연 만날까봐 인연에 관심이 없어요', '두려움을 극복하셔서 이성 많은 곳에 최대한 노출시켜야죠. 변하지않으면 내년 내후년 똑같습니다.', '22..입니다아..나가야 만납니다 ㅠㅠ', '인연을 만나고 싶으신거면 어느정도는 감수하고 넘어가야 합니다 ㅜㅜ...번호도 종종 따이시는거 보면 인기없진 않은거같은데 열개중에 일고여덟개만 마음에 들어도 일단 고 해보세요ㅎㅎ', '요즘은 사람 만날일이 없네요']"
엔티제분들 도와주세요ㅠㅠ,"['1. 이번주 일요일 약속이고 어제 저한테 먼저 먹고싶은거 없냐고 물어보긴했는데 제가 당장생각나는게 없다고했더니 찾아보고 알려준다고 하고 아직 연락이없어요 이건 그냥 기다리면 되는거겠죠?', '', '2. 제가 몇시쯤 볼지 물어봤더니 저녁에 보자해서 그럼 밥먹고 술 아님 커피먹자고했는데 요즘 술마시면 다음날이 힘들다고 커피먹자고 하더라구요ㅜ 호감이없으니까 그냥 커피 간단히 먹고 끝내려고하는거겠죠?', '', '3. 친구로 지내던 사람이 이성으로 보일때가 있나요? 있다면 어떤 때에 그렇게 느끼시나요?']",ISFP집순이,"['마지막 연락후 씹으신건가용? 그럼 연락 기다려보심이 좋을것같구 술이나 커피를 제안하셨으니 맘에 든걸 고르신것 같아여 ㅋㅋㅋ 저도 담날 출근이면 지장줄까봐 술 잘 안마셔요 ㅋㅋㅋㅋ', '앗 그렇군요! 제가 알겠다는 이모티콘 하나 보냈고 그 친구가 안읽씹중이에요! 자주는 못봤지먼 매번 만날때 술과 함께해서 그런지 카페가자고한게 약간 거절표시인가 싶었어요 ㅎㅎ..', '아니 왜 이렇게 부정적으로 생각하세용~ 술과 커피 중 먹자고 했으니 엔티제는 선택을 한 것 뿐이구요. 메뉴는 생각하고 있는 도중일지 모르죠. \n\n그리고 쓰니님이 아 나 생각났어 먹고 싶은 거! 이건 어떰? 하면서 메뉴를 택해서 선톡을 남겨놔도 되는 부분이구요~', '이미 꽤 친구로 지낸 기간도 길고 가끔 연락하면 질문은 그래도 한두마디에 한 번씩 하는데 연락이 자주 끊기는 느낌이라 너무 부정적으로만 생각해버렸어요..ㅎㅎㅠㅠ\n\n그 친구가 아직 안읽씹중이라서 일단 기다려보고있었어요 ㅎㅎ! 제가 먼저 생각나면 그냥 제안하는것도 좋은 방법이네용 너무 조바심내지 말아야겠어요 감사합니다~', '1번은 같이 찾아보고 가볍게 제안해주면 조아할거 같아요!\n2번은 진짜 선택하다보니 내 루틴에 영향 없는 정도로 커피 선택하신거 같구요 ㅎㅎ\n3번은 저는 갑자기 이성으로 보이는 경우는 거의 없었고, 처음부터 호감은 가지고 있다가 서로에게 좋은 타이밍이 오면 이성으로서 접근하려고 시도하는거 같아요 ㅎㅎ 꼬셔버리려고 ㅎㅎㅋㅋㅋㅋㅋ', '그럼 처음부터 호감이 있던 상태가 아니라면 가능성이 희박하군요!! ㅠㅠ 1 2 3번 다 세세하게 답변해주셔서 감사합니다 ㅎㅎ', '인간적이 호감이 있었으니까 약속 잡고 만나려고 하는걸꺼에요! 자신감 있게 직진하세요 ㅎㅎ 파이팅!!']"
정신의학과 진료 받고 싶은데..,"['진료비도 많이 나온다고 하고 근처에 좋은 병원도 없네요...ㅎ', '멀리라도 다닌다고 해도 진료비가 걱정인데 혹시 병원 다녀보신 분 계실까요??', '팁이나 정보좀요 ㅠㅠ']",생선꾸꾸 intj,"['진료비 많이 안나와요. 진료비보다 사후에 문제될게, 실비보험 만료 후에 실비보험 못들으세요.\n\n단 한건이라도 정신과 진단+약 탔으면요..\n\n그래서 저 몇년째 실비 못들고 있고\n\n저희 친척이모는 정신과 의사가 오진으로 우울증약 처방 해줬는데\n\n그거 하나 걸려서 실비보험도 다시 못들고 항암치료때문에 돈쓸거 많은데 실비처리도 못받았어요.\n\n유의하세요', '저는 병원보다 상담실 추천이요 지금 정신의학과 병원에서 근무하고 있어요 .......', 'ㄹㅇ 저도 지금 너무 마음이 힘겹네요 사람들은 남의 가정사를 너무 쉽게 떠들고 다녀요 꾸꾸님 그냥 나는 신경질을 내고 화를 낸거뿐인데 남의 가정사를 이야기하고 다녀요 엄청 무례하죠 눈에 보이는데 ..\n어쩌란건지 모르겠어요 내가 화를 내는거지 남이 쑥덕거리라는게 아닌데. 이러면 이런다 저러면 저런다 오해해가지고 쑥덕거리고 뒷 말하고 어쩌란건지 모르겠어요']"
엔티제에게 결혼은 어떤 의미인가요,"['전 엣프제 제 남편은 엔티제인데요 ㅋㅋ', '', '엔티제 남편은 연애 경험도 짧게 여러번 있었고 거의다 본인이 찼더라고요 그러다 저랑은 3년 연애하고 연말에 결혼합니다 ㅋㅋ 원래는 첫인상이 서로 마음에 들어', '둘다 가볍게 연애하려고 만난느낌이였는데 개그코드, 성격 등등 너무 잘 맞아서 결혼하게 되네요ㅋㅋ', '', '사실 엔티제 남편이 애정표현은 서툴러도 본인기준에서는 최선을 다해 ㅋㅋ 애정표현, 좋아하는 모습을 보여주고 있는게 느껴져서 넘 귀엽더라고요 ㅋㅋ (사실 이걸 이해하기까지가 힘들긴해요 ㅋㅋ)', '', '또 결혼준비에 있어서 주변가족들과 제가 감정적으로 힘들어하면 본인이 다 조율해주는것보고 <이 사람이다.. > 생각이 들더라고요 그리고 결혼준비에 있어서 극j라 든든하고 믿음직스럽고 완전 굿.. 가끔 까탈+예민보스 있지만 ㅋㅋ 그냥 고양이같아요 ㅋㅋ 엣프제인 제가 잘 타이르고 지나갑니다 ㅋㅋ', '', '여튼 저도 가볍게 시작했고, 남자친구도 전 애인들처럼 짧게 만나고 헤어질수도 있겠구나 생각했지만 이렇게 결혼까지..!!!', '', '엔티제들은 결혼에 있어서 누구보다 신중하다는데', '', '여러의견 듣고싶어 글써봐용 ㅋㅋ']",사교적인엣프제,"['저도 답변이 문득 궁금해지네요\n저는 일단 현실적인 목표를 함께 할 수 있는게 중요할듯해요(사회/경제적 목표)\n그리고 성격/가치관도 맞아야 되고, 대화 통하는건 너무 당연히 필요하고...\n외모는 아마 유형 떠나 비슷할듯한데... 스킨십/같이 다니는 거 가능한지 여부가 기준이 되려나요?ㅎㅎ\n\n저는 사회 경제적 목표가 어느 정도 달성된 이후에 엔티제가 어떤 배우자를 원하는지가 너무 궁금하네요. 제가 생각하는 엔티제는 능력이 되면 어느정도 사회경제적인 거 달성되면 결국 정치로 갈 것 같은데... 제가 본 엔티제만 그런지... 평생 현실적인거 안보는? 결혼은 못하는건지ㅋㅋㅋㅋㅋㅋㅋㅋ', '댓 너무 공감가네요 남자친구와 저는 경제적목표가 완전 같아요.. ㅋㅋ 그리고 결혼 후 지향하는 생활하는점도 일치하고요 ㅋㅋ 연애초에는 외적인거에 칭찬이 많았다면 요즘은 장난반 진담반? ㅋㅋㅋ 으로 외적보다 내적인게 너무 잘맞는다는 말을 하고는 하는데 ㅋㅋ', '저도 엣프제 남자친구 엔티제인데 이 글 너무 공감돼요!저랑 남자친구도 둘다 사업을 하고싶어하고 지금은 힘들지만 노후에는 풍족하게 살고싶어해서 둘다 열심히 하고있거든요! 제 엔티제는 표현이 오히려 저보다 많아서 가끔 당황스러울때도 있는데 1년 만나는동안 한번도 불안하게하거나 이사람이 날 안좋아하나? 하는 생각을 들게 한적이 한번도 없어서 결혼 생각하고있어요! 넘 부럽네요 ㅎㅎㅎ', '저도 둘다사업생각하고 있어용ㅋㅋ.. 사실 사업 크게 생각없었는데 엔티제가 제 전공 살려 좋은 방안으로 계속 구상해줘서 천천히 준비중입니다 이런거 보면 ㅋㅋ 확실히 미래 목표가 맞아야 하는것 같아요', '맞아요..저도 원래 사업생각 진짜 꿈에도 생각안했다가 엔티제만나고 좋은쪽으로 영향받아서 제가 잘하는거 살려서 준비하고있어욯ㅎㅎ', '엔티제 남친이랑 싸우신 적은 없나요?', '싸운것보다는? 제가 좀 서운한 적이 많았죠 ㅋㅋ 일단 기본적인 t랑 f의 차이점 때문에 ㅋㅋ 요점은 많이 겪고 자나가봐야 알거같더라고요.. 그거말고는 크게 싸우거나 이런거 없었어요\n엔티제 남친도 이렇게 안싸운 연애는 처음이라면서 결혼 결심한것도 있다했어요', '우선 결혼 축하드립니다! 인사가 늦었네요ㅠㅠ 어제 2년만난 엔티제 남자친구랑 싸우고 속상해서 댓글 남겼어요.. 저희도 진짜 일반적인 문제로는 안 싸우는데 가끔 t와 f로 싸우는 것 같아요ㅠ', '근데 제 남자친구가 t이긴해도 감정을 좀 풀어주려고 하는 느낌은 있어요 그래서 잘 넘어가는 느낌인거같고 저도 t의 표현같은거 잘 찾아보고 그래여 ㅠㅠ 근데 요건 서로 한발짝 양보해가면서 고쳐나가야하더라고요']"
"엔티제 뭔가 쎄한데, 제 촉이 맞을까요?","['', '', '', '']",복숭아봉숭아 ISFJ,"['사람을 볼 때는 1. 가족 대할 때 2. 친구 대할 때 3. 가게 종업원 대할 때 를 보라던데...\n저라면 마음 접을 것 같아요ㅠ.ㅠ', '제 말이요.. 2번이 넘 마음에 걸려요..', '1번은 트라우마에 가까운 듯 보여서 별로긴 하지만 그러려니가 되긴 하는데,, 2번은 정말 :(\n싸울 때 어떻게 대할지가 보인달까요...', '1번은 가스라이팅이고요, 2번은 고객의 입장에서 서비스가 불만족스러우면 할 수 있는 불평일 수는 있지만 중국인 비하에서 인권감수성 떨어지는 게 보이고 선민의식도 엿볼 수 있는 부분인데, 이 부분은 작성자님과 가치관이 안 맞는다면 진지하게 고려해 봐야 할 부분이에요.', '꼬실때만 존나 잘하고 ㅋㅋㅋㅋㅋㅋㅋ\n엔티제 게시판 다른글들 찾아보세요 ㅋㅋㅋ ㅂㅅ 같은거 개많음 ㅋㅋㅋㅋㅋ', '와..그런건가요 다른 글도 읽어보고 싶은데 뭐라 검색하면 나올까요?', '부추님의 엔티제는,, 어떤 분이셨나요?', 'ㅋㅋㅋㅋㅋㅋㅋㅋ무슨말인지 알거같아요\n제 구썸남 엔티제도 저한테 몇번씩 느닷없이 여자 지인을 디스했는데 시간지나고 알고보니 엔티제남이 그 여자 지인한테 차여서 저한테 디스하는거였어요\n\n그래서 1번 같은 경우도 지도 남한테 못되게 똑같이 굴어놓고 까였던 억하심정있어서 복숭아님한테 자기가 착하다고 강조하는거같아요', 'ㅋㅋㅋ 엔티제 게시판에 올라오는 ㅄ들의 전형이요', 'ㅋㅋㅋㅋㅋㅋ 아는 사람은 앎 ㅌㅌㅌㅌ', '주변 엔티제 자기가 착하고 배려심있다 생각하던데ㅋㅋ 여기도 그러네여ㅋ\n다 자기멋대로 하면서 무슨ㅋㅋ\n촉을 믿으세용', '불건강한 엔티제인것같아요! 제 엔티제 남자친구는 저런모습 1도 없습니다ㅠㅠ 사람마다 케바케인것같아요!', '어우 글만봐도 쎄해요 촉을 믿으십쇼 부디!', '이건 건강 불건강도 아니고 그냥 쎄한사람 그 자체인듯', '아 종업원한테 저러는거 진짜 극혐요 ㄹㅇ 저런 쎄한응 거의 확싷함요 ㄷㄷ 헤어지세여', '아빠가 entp이고 엄마가 isfj신데 두분 성향이 너무너무너무 달라서 특히 많이 싸우세요. 평소엔 나름 잘 맞지만 대판 싸우는 원인은 대부분 엔팁 아빠가 원인 제공을 하고... ㅋㅋ 그걸 엄마가 당연시 여기며 배려해줘서 잘 맞는거지 다른 사람 만났으면 대판 싸웠겠다 싶어요. (쓰레기 버리면서 아 이래야 청소부가 먹고살지라고 헛소리) 에휴... 사업적으로 뛰어난 거 맞고 잘난 거 맞는데 제 식견에선 그런 타입 진짜 극혐이에요. 유형말고 불건강인 점!', '단순히 성향 차이면 맘 놓고 만나보겠는데 이게 성향 차이인지, 그 사람이 이상한건지 모르겠어서요ㅠ 아아 추가된 댓글 내용보니까 불건강에 가깝다는거군요!', '그 사람이! 이상한 거에요 계속 연애하시면 아주 높은 확률로 좋지 않은 큰 상처 입으실 걸요 ㅠㅠㅠ', '타인을 업신여기고 후려치기하며 자신의 태도와 생각을 정당화하려는 사람은 거르세요.', '유형마다 대표 단점들이 있는데 그 단점이 보인듯요.', '단순히 그 유형의 대표 단점이라고 치부할 수 있는건가요..? 그 사람이 이상한 거 아닌가 싶어서 적어봤어요ㅠㅠ', '단점은 그 개인이 절제력이 있고 건강한 상태일때 커버가 되는거 같아요.', '오.. 저도 전 남자친구가 저런스타일이였는데요.. 안좋은 촉이 맞을 것 같아요... 다시는 만나고 싶지 않아요', '2번 같은 태도가 있었어도 인프피님에게만큼은 지극정성이었나요? 저한테는 지극정성이라서 헷갈려서요 ㅠㅠ', '저도 지극정성으로 잘해주다가도 그 사람의 본연의 모습이 나오더라구요 위에 말한 것처럼 저런 내용들이요,,', '저는 엔티제이지만 남을 통제해보려는 생각한 적도 없고(귀찮음) 저 자신을 통제&계획하는데 변수가 생겨 뜻대로 안 됐을 때 스스로에게 분노하는 것뿐..\n\n종업원에게 함부로 하는 건 엔티제와는 무관하고 그 사람 인성 혹은 절제력 문제인 것 같아요. (순간 계획대로 안 되서 짜증이 날 수도 있지만 그건 잘 갈무리해야죠.)\n\n자기 착하다고 여러번 강조해서 얘기하는 건 트라우마거나 나쁘단 얘길 들었거나 아님 스스로 자기가 착하다고 굳게 믿고 있는 것. 근데 여러번 입 밖으로 얘기하는 건 좀 이상하네요.\n\n저라면.. 거릅니다.', '2번에서 거름ㅋㅋ\n그게 나중에 내가 그 대상이 될 수 있음\n콩깍지 벗겨지면', '불건강한 사람같아요 제가 아는 엔티제와는 완전 다르네요 저 사람의 문제인듯 합니다', '지금 저도 저런 점 떄문에 헤어졌다 다시 만나는데.,, 좀 저런 면이 있어요 저한테는 엄청 지극정성인데 자기 계획대로 안되거나 시간을 소모적으로 들이게 될 때 화가 많아요', '그럼 다시 만나고 나서는 그런 모습이 좀 줄어들었나요? 저런 이유 때문에 헤어졌는데 다시 만나시는 이유도 궁금해요!!', '줄여보겠다고 약속은 했고, 노력도 많이 하는거 같아요 근데 본질이 그런 사람이라 아예 고치기는 힘들 것 같아요.. 불현듯 튀어나오고 지적하면 아 미안...이러곸ㅋㅋ,,..그래도 일단 저는 노력해주는 모습이 아직은 좋아서 만나고는 있는데 언젠가 지칠까봐 스스로에 불안하기도 하고 그래요ㅠㅠ', '같은 엔티제인데 영 파인데요 사귀기 전에는 잘 하다가 사귀고 나서는 종업원 대하듯이 할 거 같음 일단 조금 더 살펴보시고 안전하게 손절하시는 거 추천드려요', '1번 2번 둘 다 그냥 글로만 봤을 때 읽히는 차이가 있는 건지 그렇게 심각해 보이지 않는데..\n1번은 그런 말 그냥 여러번 할 수도 있다고 봐요. 뭐 행동으로 그에 반하는 내로남불에 뭔가를 보여준 게 아니라면 그냥 말을 그렇게 한 것 뿐이고\n2번은 옆에 사람한테 민망해서 순간적으로 저렇게 할 수도 있다고 생각해요. 물론 매번 반복되는 패턴이면 당연히 안 좋은 거고요', 'mbti거르고 2번은 쉴드불가', '쎄하다면 걸러야 하는게 맞다고 봅니다.\n저는 건강할 때(?) 종업원이랑 싸운적이 있었는데, 보통은 빌드업을 하게 되는 것 같아요.\n논리적으로 안 통하고 상대가 싸가지 없게(?) 나오면 전쟁 치릅니다. 저렇게 바로 짜증내고 비하하는 발언은 하지 않는 것 같아요.\n오히려 같이 갔던 사람들한테 ""내가 이러이러해서 저사람이랑 싸울 것 같은데 괜찮은지?"" 물어보고 괜찮다고 하면 싸웁니다.\n큰 소리 나는걸 싫어하는 사람도 많으니까요(그 때 회사사람들이랑 같이 있었음)']"
이 정도면 불안장애일까요?,"['- 천장이 무너져 내려서 목이 꺾일까봐 불안함', '- 아파트 살고 있는데 아파트가 무너질까봐 자꾸 두려움 (전에 해외에서 무너진걸 봐서 그런지..)', '- 층간소음 때문에 몇번 다툼이 있었는데 윗집이나 아랫집에서 칼들고 찾아올까봐 무서움', '- 지나가는 사람들이 다 무슨 짓 할까봐 두려움 (칼부림 사건 때문에 요즘 그럼)', '- 엘리베이터 타면 사람들이 갑자기 칼꺼내서 찌를까봐 무서움', '- 엘리베이터가 떨어질까봐 무서움', '- 아파트 복도에 창문이 열려있으면 걸어가다가 떨어질까봐 두려움 (트라우마 때문인듯)', '- 무슨 일이 생기든 다 최악의 상황을 걱정함', '- 지진, 전쟁날까봐 무서움', '', '거의 항상 이런 걱정을 달고 살고 사는데 가슴도 많이 답답해지고 ㅠㅠ 불편합니다', '심한 날은 숨쉬기도 갑갑해지고 엄청 불안해져요', 'mbti n인 분들도 이러시나요..? 아니면 제가 심한건지..']",생선꾸꾸 intj,"['회사 업무중에 기사 스크랩이 있어서... 어쩔 수 없이 매일 기사를 다 찾아봐야하거든요 ㅠㅠ 난감하네요..', '많이 심한편이신데요 ~ 최근에 더 불안감을 많이 느낀다면~\n심리 상담을 한번 받아보는게 좋을듯 해요\n자극적인뉴스를 너무 많이 보신건 아닌지?', '회사 업무 때문에 ㅠㅠ 매일 그런 기사를 찾아봐야하거든요... sns는 거의 끊으려고 하는데.. 제 담당이라서 곤란하네요 ㅜㅜ', '많이 심하신 것 같아요ㅠㅠ', 'ㅠㅠㅠ 치료 받으면 나아질 수 있을까요?', '그럼요 가벼운 약물 치료만 받아도 금방 나을 것 같아요', '저는 요즘 4,5번 ㄹㅇ..', '이건 다들 그런가보네요 ㅠㅠ', '상담 한번 해보시는 게 좋을 거 같네요.', '저도 그런 생각은 많은데 이걸로 많이 불편하거나 불안해지진 않아요.(겁이 많음)\n일단 정상은 아닌거같으니 상담이라도 한번 받아보시는게 어떨까요', '무서운 거 >> 정상\n숨쉬기 힘든거 >> 공황일 수 있음. 초기에 잡아야 좋음', '같은 N인데.. 이런건 상상만 하고 무섭진 않습니다. 내원해보시거나 신경안정 영양제도 나오던데 찾아보심이...', '저는 친한 사람들이랑 멀어질까 걱정, 헛소문날까 걱정, 가족이랑 헤어질까봐 걱정.... 저도 요즘 너무 두렵고 불안해요 ㅠㅠ 우리 힘내요...!', '보니까 다 경험에 의한 트라우마네요.\n칼부림과 해외에서 경험한 붕괴사건때문인듯 합니다.', '트라우마 극복했으면 좋겠어요 ㅎㅎ 좋은 링크 남깁니다!!\n안녕하세요! 청년 멘탈랩입니다💙\n하반기에도 멘탈랩으로 멘탈잡자! 취업, 이직, 고민 멘탈관리 프로모션 참가자를 모집합니다😊(모집시 마감)\n📌프로모션 신청링크 : forms.gle/Rmrp3qEQM23vRJbV8\n(추천인 : 조씨네 잊지말아주세요💓)', '오은영 박사님 금쪽상담소에 세번 재혼하신 부부상담에 부인분이랑 비슷한것 같아요! 충분히 불안해할만한 사회지만 힘드실것같아요! 심리 상담 추천합니다!']"
제 엔티제가 너무 귀여워요..,"['둘다 나이도 먹을 만큼 먹었는데.. 연애 안해본 것도 아니고 ㅠㅜ', '아니 길에서 먼저 손 한번 안잡는게,..(고민하다 주로 제가 팔짱끼고 감)', '오늘 혼자 머뭇머뭇하다 어깨한번, 허리한번 한 2초잡고 바로 풀고 그러는게 진짜 쑥맥같아서 너무 귀여워....ㅠㅠㅜㅜ..', '새벽에 혼자 곱씹으면서 예뻐죽고있습니다 ㅜㅠㅋㅋㅋ... ㅜㅠㅠㅠ']",intjt후추코,"['엔티제가 그러니까 더 귀여운 ㅋㅋㅋ', 'ㅎㅎㅎㅎㅎ', '맞아요ㅋㅋ 엔티제라서 더 귀여워요. 갭모에랄까 ㅋㅋ', '전 인프피. 제가 지금 엔티제 좋아하는 중이라 괜히 상상하며 감정이입되서 입가미소. ㅎㅎㅎㅎㅎㅎ 괜히 더 사랑스러운 너낌이에요 ㅎㅎㅎㅎ']"
