mbti,comments
ISFP,"자주 만나려고 하세요 카톡하는거 보다는 자주 만나서 친해지는게 우선이고 
그럴 여건이 안되면 카톡 중간에 혹시 할 일있으면 시간 보내고올래? 물어보세요! 썸녀분이 아니 괜찮아~ 계속 연락하자 하면 계속 연락하면 되고 잠시 개인시간 가져야할거같다고 하면 알겠어~ 할거하구 연락줘~ 하면 될거같아요~"
INFJ,"같은 그룹안에 이해관계 때문인지, 제가 맘에 안들어서 인지는 몰라도
밥을 한번 먹자 했을때... 완곡하게 거절 당했었어요. (보는눈들이 많은걸 의식)
그런데 또 벚꽃을 누구랑 보러갔는지 물어보면서
혼자 갔을거 같아서~~~ㅎㅎ 하며 놀리듯 얘기하다가
워낙출중하시잖아요 라는 말을 하다가...또

몇일전에는 예전에 제가 선톡한것을 빌미로 선톡을 한뒤
MBTI 뭐냐구 물어보더라구요...
(분명 예전에도 제 MBTI 무어라고 얘기한 상황)

실제로도 제가 업무 때문에 만나기 힘들고
상대방도 주말에 한번 교회서 보는거 빼고는 만나기가 힘들어요"
ISFP,"밥먹는건 살짝 부담을 느낄수도있어요! 주말에 드라이브겸 괜찮은카페 찾아서 보내드리는거 어떨까요?
잇프피는 리드해주는걸 좋아해서 그냥 밥먹자 카페가자 보다는 여기 이쁘던데 드라이브겸 주말에 카페 같이 가실래요? 해보시는것도 괜찮을거같아요~"
ENFP,"저는 잇프피의 비유적인 대답때문에 힘들었어요ㅠ ing이겠지만ㅠㅎ
아직도 자주 싸우는데 그래도 성향이 맞고 잇프피도 여러연애했지만 이렇게 편한사람 처음 이라 그래서 유지되고 있네요..

다 인연이 있죠..ㅠ 토닥토닥ㅠ"
ISFP,제의 들어온적은 있는데 칼같이 거절 ㅜ
INFP,그죠. ㅠㅠ 저도 칼같이 다 쳐내면서 어쩌다 한두번 하는데....관심이 가야 말이지요
INFP,적절햇나유? ㅋㅋ
INFP,으악.. 상상만 해도 어색하고 싫네요
INFP,ㅎㅎ 인프피도 비슷하시죠?
INFP,"소개팅에 대한 인식은 좀 바뀌었지만 여전히 껄끄러워요.
몇번 하신 것도 대단하신데요 ㅎㅎ"
INFP,"지인들 등쌀에 밀려 나간거지요. ㅎㅎ 진짜 항상 커피만 마시고 도망온 것 같아요.
전 몇번 나가면서 오히려 인식이 안좋아졌어요 ㅠㅠ"
INFP,오오 보기 힘든 타입 아니십니까? ㅎㅎ
INFP,ㅎㅎㅎ 저도 30대 중반되면서 참 만날 일이 생기지 않지만 소개팅은 영 안되더라구요
ISFP,저도 남자친구도 둘 다 소개팅 이런거 극혐이요 ㅠㅠㅠ 원래 알고 있는 사람이 편하고 진짜 그냥 자연스럽게 알게되서 만나는 사람이 좋아요 !!!!
INFP,저두요. 천천히 알아가면서 친해지고 좋아하고 싶어요 ㅎㅎ
INFP,ㅠㅠ 전 오히려 소개팅이 부담이라서
ISFJ,집에서 혼자 쉴 때 뭐하시나요~
ISFJ,"혼자만의 시간 가지면, 재충전 되시나요?
남자친구가 잇프피인데 일요일은 오롯이
연락 안하고, 혼자 쉬게 두거든요
그게 정말 재충전이 되나 싶어서요^^;;"
ISFJ,"그래서 일요일에 혼자 쉬게 두면
월요일날 목소리가 밝은거 였군요ㅎㅎ
감사합니다^^"
INFJ,제 MBTI를 묻는 선톡이 왔는데 뭘까요? 저는 환상의궁합을 말해주려합니다...ㅋㅋㅋㅋㅋ
INFJ,"뜬금없다기보다, 1주전에 동네에 줄서는 빵집 보았느냐고 물어봤는데, 그 빵집 보았다며 선톡오고 제 MBTI를 물어보더라구요. 자기는 ISFP라면서"
INFJ,제가 업무때문에 좀이따 연락드리겠다고 미안하다 했어요
INFJ,"예전에 1주전에, 벚꽃보러 누구랑 같이 갔느냐는 질문을 했던것? 제 프로필타시고 ㅋㅋㅋ 한번 읽어봐주세요"
INFJ,Infp님들 누구랑갔었는지
ISFJ,소개팅 사프터까지 잡아서 만나오고있는데 선톡은 절대안하네요 근데 답장은 칼답에 열심히 답해줌 무슨심리인가요?..
ISFP,"정말 관심없으면.. 나가지 않을거같은데요..
마음을 조금씩 부담주지 않는선에서 표현해보면 어떨까요..?
만났을때 잘 웃고 대화 잘 하는건.. 누구한테나 그럴 수 있습니다.
애프터 물어본건 어떤 건가요?"
ISFP,"굳이 만나야할 필요가 없는 상대에게 다음에 언제 만나는지 물어본거라면 그린라이트 확실해 보이는데요...!
저같은경우 엔티제의(물론 호감으로 발전가능한) 불도저 같은 면이 참 멋있었습니다.
저와 다른 모습이 너무 신기하더라구요.
아, 물론 불호인 상대가 불도저같이 다가오면... 부담느껴서 도망갑니다..
조금 더 표현해 보심도 괜찮을듯 합니다.!"
ISFP,"첫만남 후에 마음이 바뀌었을수도 있어요..!!
카톡으론 표현이나 대화자체에 한계가 있어서
상대방 시간 괜찮은지 확인 후 통화를 좀 해보시는것도 좋을거같아요!"
ISFP,"그분이 많이 바쁘신거면.. 톡이 좀 덜 할수도 있어요..
카톡 연락은 편하게 대답할 말 생각할 수 있는 여유가 있을 때 읽고 답장하는 경우도 많아서..
정말 편한사람이거나 정말 좋아하는사람이면 빠른답도 하지만요..!!
좀 더 그분과 서로 스며들 수 있게 기간을 좀 오래 잡고 연락해보심이 좋을거같아요..!!"
ENTJ,"엔티제입니다. 현 엣푸피 남친 있습니다.
일단 낭인님에 대한 이미지는 좋은걸로 생각되어지네요.
관심없으면 아예 연락 안한다고 그랬었거든요.
다만 아주 관심있는 정도는 아닌거같아요. 저는 현 남친과 매일 끊기지 않고 시도때도없이 톡했었어요.
사귀기 직전엔 통화도 하루 한시간 이상씩 하고..ㅎㅎ
썸녀분과 잘되시길 빌어요~!"
INFP,
ISFP,먹을것만 아니면 괜찮을거같아요
ESFP,너무 제 모습을 보는 것 같아서 소름 돋았어요 ••• 저도 얼마 전 그랬는데요 정확하게는 헤어지고자 하는 마음이 확실해지면 그걸 바로 행동으로 옮기는 편이라 그런 것 같아요 한번 아닌 마음은 끝까지 아니라서 디데이도 내리고 하이라이트도 내리구요 같이 찍은 사진 같은 경우엔 미처 생각하지 못한 느낌이랄까요 ..? 저도 시간 가지자고 할 땐 그정도로 정리했고 확실히 끝맺음으로 헤어질땐 나머지까지 찾아서 없애버렸습니담 ..
ESFJ,혹시 시간지나서 후회되거나 다시 붙잡아본적 없으신가용..
ESFP,"사람마다 다르긴 한데 전 보편적으로 오래 만난 사람이면 아쉬움이 없는 편이라서 좀 빨리 잊었던 것 같구 오히려 썸에서 깨지거나 사귄지 얼마 안됐는데 어쩔 수 없는 상황 때문에 헤어진 상황에만 미련이 남았던 것 같아요 ,,,! 결론적으론 제가 먼저 찼을 땐 그렇게 후회해서 잡았던 적은 없는 것 같습니담,,,"
ESFJ,"그렇군요... 일년 반 정도 만났는데 상대가 헤어질때 너처럼 착하고 속깊은 사람 다시 만날 수 있을진 모르겠지만 후회하지 않을거라고 생각해. 라고 했거든요.. 헤어진이유는 저랑 템포다 달라서요.. 직장인이 된지 오래된저와 상대적으로 사회초년생인 남친, 거기에서 오는 서로 먹고싶고 하고싶은게 다른 괴리감들이 있었어요. 남친은 저랑 사귀는게 자기가 너무 욕심내는 거 같고 무리같다며, 자기 삶의 여유를 찾고싶다네요.. 둘이 진짜 좋아했는데 나중에 시간지나서도 연락올리 없어보이나요..?ㅠ"
ESFJ,"뭔가 첫 댓 보자마자 제 남친이랑 너무 비슷해서 혹시하는맘에 댓글 남겼는데 역시 비슷하시네요..ㅜㅜ 비슷해서 조금 더 여쭤보고싶은데요.. 그럼 제가 좀 시간을 갖고 한 한달? 이나 두달 정도 뒤에 연락해도 안받아줄까요..? 제가 남자친구를 좀 억압하고 하고싶단걸 못하게 했던 것도 있구, 저도 헤어질때 제가 못맞춘게 아니라 자존심때문에 안맞춘거다 이렇게 처음으로 솔직하게 내려놓고 이야기했거든요.. 그랬더니 남친도 이제 제 행동들이 이해가 간다면서 너도 날 이해해주는 것 같아 후련하다. 라고 하기도 했구요.. 물론 백프로 제말에 설득이 안된것도 있고 맘이 식어서 지쳐서 당연 헤어진거겠지만 시간을 두고 어느정도 본인이 하고싶은것도 하면서 여유 찾게하고 연락하면 좀 나을까 싶어서요.. 그리고 본인이시라면 헤어질때 상대가 계속 붙잡았으면 어떠셨을지, 시간지나면 빨리 잊는지 궁금해요ㅜㅜ"
ESFP,그래도 제 생각은 엣프피가 잡힌다 안잡힌다를 떠나서 하고싶은 말은 해보시는게 좋은 것 같아요 그래야 후회도 덜 남고 하니까요 !...!
ESFJ,그렇군요... 답글보니 그냥 연락 안오겠다 생각하면 되겠네요... 서로 인스타 친구는 그냥 두기로해서 그냥 뒀는데 눈치보여서? 신경쓰여서 게시물도 스토리도 안올리고있거든요 ㅜㅜ 물론 시간지나면 남친이 걍 제 게시물을 안보게 가려버릴 수 있지만.. 그렇지 않다면 그냥 원래대로 올리는게 좋을까요 아님 아무것도 안올려야 그래도 좀 신경쓰일까요....? 헤어질때 정말 좋게 헤어졌고 나중에 가끔 밥먹자 라고 했어요
ESFP,"흠,,, 전 올리는게 더 궁금한 것 같긴해요,,어떻게 사는지 ,,,ㅜㅜ 오히려 뭘 올리면 뭐 올리나 궁금해서 눌러봤어요 나중에 가끔 밥먹자도 그냥 예의상 한 말일수도 있어요 ㅜㅜ,,, 전 헤어지면 끝이라고 생각해서 ㅜㅁㅜ,, 근데 사람마다 너무 다르고 제 말이 전부가 아니니까요 ㅜㅜ 그렇게 말하고 진짜 나중에 밥 먹을수도 있졍,,,,너무 어렵네요 ㅜ"
ESFP,"그나저나 제가 말씀드린 내용이 너무 개인적인 내용이라 댓글은 삭제했어요 !!...! 더 궁금하신 점 있으시면 편하게 질문해주셔도 돼요 :),,, 많이 힘드시겠네요,,,엣프제님 ㅜㅜㅜ,,"
ESFJ,ㅎㅎ근데 성격이 정말 비슷하신것 같아요..! 제가 근데 밥먹다 서로 상황 좋아지고 맘 생기면 다시 만날 수 있지 않을까.. 라고 했더니 맘생길것 같으면 밥을 안먹겠다 하긴했어요 ㅋㅋㅋㅋㅜㅜ 그럼 보통 헤어지면 사진도 바로 다 지우세요..? 저희가 여행을 엄청 다녀서 사진이 어어엄청 많은 케이스 이긴합니답...
ESFJ,네에 ㅜㅜ 친절하게 답장해주셔서 감사해요 ㅠㅠ
ESFP,"흠 전 빨리 잊으려면 아예 미련을 발생시킬 요소들을 다 제거한다 ! 주의라서,,,ㅎㅁㅎ,, 사진 바로 다 삭제하는 편이에요,, 근데 사진이 넘 많으면 귀찮아서 나중에 정리할 것 같기도 하네요,, 저도 정리하면서 좀 귀찮았어요,,,"
ESFJ,"그렇군용..!!! 그럼 혹시 지금까지 먼저헤어지자 하고 다시 붙잡아본 사람이 전혀 없으셨나요..? 전남친은 전에 군대가기전에 자기 집안 사정이 너무 힘들어서 헤어지자 한 사람을 나중에 전역하고 한번 먼저 연락했다고 했던 적이 있긴하거든요...,,, 후 자꾸 연락왔음 좋겠다고 생각해서 여쭤보네요ㅠㅠ"
ESFP,"흠,,, 전 고등학교때 한번 있었어요 ㅠㅠㅋㅋㅋㅋㅋㅋㅋㅋ근데 그 사람은 아무래도 자주 보다보니까 미련에 속아서 다시 만났던 것 같아요,,,아무래도 엣프제님과 엣프피님이 자주 만나는 사이라면,,, 연락 올 가능성이 좀 높아지긴해요,, 전 그때 아무래도 학교에서 매일 보다보니까 신경쓰였거든요,,, 그 이후엔 한번도 없어용,,,"
ESFJ,흠..... 그럼 그냥 인스타 스토리도 계속 아무렇지 않은척 올리는게 낫다는 거죵..!!!?? 눈에 알짱거려야 생각이 좀 더 나나보네용 ㅜㅜ!! 전여친들이랑도 인스타 친구는 맺어있는데 소식이나 스토리는 숨김처리해뒀던데... 제거도 이렇게 되려나요?ㅜ
ESFP,네네 맞아요 ! 그게 오히려 눈에 띄기 쉬워요! 흠 그건 안좋게 헤어진 경우라서 그럴수도 있고 제가 처음에는 남자친구 카톡 친구도 그대로 두고 인스타도 그대로 뒀었어요! 뭔가 성가시게만 안하고 오히려 연락이 안하시면 숨김처리 안해둘거에요 •••
ESFJ,넵 ㅜㅜ 근데 갑자기 그러다 저한테 미련..? 생기면 인스타 끊어버릴거같아 걱정되긴해요 ㅜㅜ 괜한 걱정인가요 ㅋㅋㅋ ㅠ 그럼 그냥 원래대로 모습+긍정적인 부분들 계속 보여주면서 알짱거리면.. 재회확률이 조금은..? 높아진다고 생각해도될까용 ㅜ
ESFP,"음,,, 미련이 생긴다고 끊진않았던 것 같아유 ㅋㅋㅋㅋㅋㅋㅋㅋㅋㅋ 오히려 역으로 연락이 오는 상황에서만 ㅇ ㅏ 보기싫다 이런 느낌이었어요 ㅋㅋㅋㅋㅋ ㅜ 네네 아무래도 잘사는 모습을 보여주면,,,신경쓰였어요,,ㅎㅁㅎ,,"
ESFJ,네!! 정성스레 답글 남겨주셔서 감사해요..💗 덕분에 조금 숨통이 트이는 느낌이에요 ㅎㅎ 가끔 답답할때마다 댓글 남겨주신거 봐야겠어용 ㅜㅜ 좋은 하루보내세요 :)
ESFP,ㅠㅠㅠㅠ 이별하셔서 힘드실텐데 제 말이 조금이나마 도움이 되셔서 다행이에요 :).. 꼭 좋은 인연 만나시길 바랄게요 🌸… 그게 그 엣프피님이든 다른사람이든 누구든지요!
ESFJ,안녕하세요..!! 시간이 좀 지났지만..궁금해서 또 댓 남겨용 ㅜㅜ 전남친이 계속해서 제 스토리 보는데요.. 아무 의미 없는건가요..? 미련이 없는데도 그냥 궁금할 수 있는건가요? 관심이 아예 없으면 그냥 안보게 되나요? 아니면 오히려 관심이 없어서 아무렇지않게 보는건가요?
ESFP,"흠,, 전 미련이 없어도 궁금해서 봐요 ㅜㅜㅜㅋㅋㅋ,,, 미련이 있든 없든 궁금하면 보게 되고,,, 한가지 차이가 있다면 미련이 있으면 스토리를 어떻게서든 좀 빨리 보는 것 같기도 하구요,, 근데 사실 스토리는 그 대상이 친구든 전남친이든 누구든 다 궁금해서 보는 것 같아요 ㅜㅜ 근데 보다가 너무 잘사는 것 같으면 좀 신경쓰이기도 하고 그럽니담,,허허"
ESFJ,답글 감사해요 :) 그럼 관심이 있으면 오히려 못눌러보고 관심이 없으면 그냥 보고 .. 뭐 이런게 아니라 걍 단순 궁금해서 라는거죠..? 그럼 전남친이 스토리 보는게 미련 있을 수도 없을수도 라는거구요...ㅠㅠ?
ESFP,"관심이 있으면 눌러보는 건 똑같은데 아마 그분 보는 속도를 좀 지켜보셔야 될 것 같아요 ! 전 미련있는 사람이 스토리올리면 너무 너무 궁금해서 못참아서 ㅂ엄청 빨리 봤었거든요 ㅜㅜㅋㅋㅋㅋ 한 몇초만에 본적도 많코,,, 한번 올리시고 구경해보세요 얼마만에 보는지 !!"
ESFJ,ㅋㅋㅋ엄청 빨리 보긴해요.. 뭐 인스타를 붙잡고 살진 않은 사람이지만 올리면 본인 인스타 들어갔을때 보이면 바로 눌러보는고같아요.. 근데 제가 아마 스토리 젤 앞에 떠있어서 그런거 같긴한데.. 젤 앞에 떠있어도 관심없으면 제거 띄고 다음거부터 보려나용?
ESFJ,리나님이 미련있던 분은 본인이 헤어지자고 하신건가용??
ESFP,젤 앞에 있어도 그걸 건너뛰고 보거나 그건 아닌뎅 저 같은 경우엔 친구들이 여러개 올려져 있으면 친구들꺼 안보고 제일 먼저 보고 싶은거 눌러보긴 해요 ㅋㅋㅋㅋㅋ ㅜㅜㅜ
ESFP,"미련있던 사람은 ,, 썸붕됐던 사람입미다 ㅜㅜㅋㅋㅋㅋ 서로 썸타면서 엄청 좋아헀지만 상황적인 이유로 연락못하겠다고 통보당했던 터라 미련이 컸습니당,,어찌 보면 제가 썸에서 차였다고 볼 수 있졍,,,"
ESFP,"전에도 말씀드렸지만 아무래도 미련이 남는 사람은 무언가 많이 해보지 못하고 아쉬웠던 사람들이 생각 많이 나는 것 같아용,,,"
ESFJ,흡 리나님 ...ㅋㅋ ㅠㅠ 전남친이 계속 스토리 보다가.. 이제 안보는것 같은데용 ㅜㅜ 갑자기 제 스토리 안보는 이유가 뭘까요..? 저 연락도 안했고 절대 진상짓 안했어요 그저 친구들이랑 원래대로 잘 만나고 일하고 그런 모습들? 아무렇지 않은것처럼 스토리쭉 올렸었는데.. 계속 읽다가 오늘은 안읽네요 ㅠㅠ 이제 숨김처림 한거같은데... 왜 그런걸까요?ㅠㅠ
ESFP,ㅇ ㅏ… 혹시 너무 마니 올리셨나용…?
ESFJ,음.. 약간 그런거 같은데.. 주말에 한두개 올리고 며칠 안올리고 또 한두개 올리고.. 이정도요!!
ESFP,흠 근데 벌써 헤어지신지 한달이 되어가니 이미 마음 정리하셔서 안보시는 걸수도 있을 것 같네요 … 저도 지금 한달 딱 지나니까 생각도 안나거든요 ㅜ
ESFJ,아.. 그럼 맘 없어지면 굳이 숨김하기도 하나요? 스토리 보이는 것도 싫어진건가요? 만약 맘이 없다해도 굳이 왜 숨기기까지 하는지 궁금해요ㅜㅜ
ESFP,"마자용 .. 그냥 굳이 보기 싫은거긴 해요ㅜㅠㅠ 숨김하는건 ,, 저도 그냥 보다가 보기 싫으면 숨김 처리하거든용 … 스토리도 꾹 누르면 숨김할 수 있게 편하게 되어있기도 하구용…"
ESFJ,"리나님,, 또왔어요..!! 하하.. 그때 전남친이 이제 안읽는거 같다했는데 그 뒤로도 지금도 스토리 아직 계속 읽고있어용! 오늘은 제가 헤어지고 처음으로 게시물을 올렸는데 좋아요도 누르더라구요...? 도대체 이건 뭘까요...ㅋㅋㅋㅋ ㅠㅠ"
ISFP,먼저 만나자고 해보세요 ㅎㅎ
ENFJ,그렇군요 ㅎㅎ 알겠습니다
ENFJ,"ㅋㅋㅋㅋㅋ아 왜 말못하는거에요? 귀엽다 잇프피,, 전 진짜 불도저같은데 자제하고 있어요"
ENFJ,"그렇구나! 뭔가 저와 다르게 조심조심스러워보이기는 하더라구요, 분위기 봐서 제가 먼저 말 꺼낼게요 ㅋㅋㅋ"
ISFJ,"잇프피에게 연락은 옵션,
만나서 행동으로 보여주는걸 좋아해요"
ISFP,타자치기 귀찮아서 전화를 선호해요
INTP,카톡이나 디엠 안읽씹하고 스토리는왜자꾸보는거죠?
INTP,그럼상대가 그걸 보고 기분나쁠거란생각은 안하는거겠죵???
ESFJ,"직장동료분(isfp)을 좋아하다가 몇달전에 고백했는데요
고백하기전에도 제가 안부인사로 선톡하면 늘 두줄이상 답장이오곤 했구요
최근에는 제가 기분이 안좋아보이면 퇴근후 무슨일있냐고 선톡도 하시고
카톡 답장도 10분내로 해주시는데
이게 상대분도 호감인건지 아니면 본인을 좋아한다고해서 베푸는 단순친절인지 궁금해용~"
ESFJ,"손편지로 고백했구요 그후 2주뒤쯤 일문제로 통화하다가 얘기를 나눴어용
편지를 읽고 처음엔 당황하셨지만 고맙고 기분좋았다고 말씀하셨어요~
그후엔 제가 질투심에 서운한거 있으면 카톡으로 솔직하게 얘기하는데 다 받아주시더라구요
현재는 저는 떨려서 말도 잘 못거는데 상대분도 그래서 서로 대화가 별로 없어요ㅜㅜ"
INTP,만날땐 재밌고 개그코드도 맞는데 카톡으로는 일상대화 거의 안하고 집도착 일도착 운동한다 인증샷도 간혹 보내주고 이런 보고 형식 톡으로만 하는데 호감 맞나요?
INFP,"4,5번은 극공감이요.
싸운 후 풀기 싫은게 아니에요.
저 혼자 정리를 하고 생각을 해봐야
되는데... 그자리에서 풀려고 하면
저도 무슨소리를 하게될지 모르겠어요"
ENTP,그럴때는 그 얘기를 해야해요 그 댓글 그대로 상대방한테 말을 해야 알아들어요 말을안하면 너무답답하고 뭔생각인지 몰라서 머리가 터질거같음
ISFP,"흐흐흐 백곰님 ㅎㅎㅎ 너무 좋습니다

저도 싸운후에 바로 푸는건 어려워요~

생각을 정리할 시간이 필요합니다

그리고 7번 스트레스 받는거 정말 저....엄청나게 초초초 예민합니다 정말로요

사소한거에도 스트레스 받으면 뭐든간에 그냥 다 싫어져요"
ISFJ,"잇프피 남자친구 생각하며
글을 보니 모두 공감 가요^^
말로 하는 표현 서툴지만
행동으로는 세상 달달하고,
다투면 혼자 생각 하도록 시간 줘야 하고
개인시간 보내며 에너지 충전,,,ㅎㅎ
신기합니다😂"
ISFP,"3번 특히 공감하구요. 3번이 인프피랑 크게 다른점이죠. 인프피처럼 예민,섬세하진 않지만 인프피처럼 말랑이도 아니죠;; 같은 다정이지만 결이 달라요."
ENTP,"T성향 상대방이라면 말을 해줘야 알아들으니 배려하고있어도 배려하고있다고 말씀해주시고, 애정표현도 마음껏 하시기 바랍니다. 안하게되면 집착 강요 연락해달라는 문제가 발생할수있어요. 대답회피 하지마시구요 (지금 이러이러하니 이야기 하기 어렵다 나중에 나 생각정리되면 말하자) 등등 제대로 말해주세요^.^"
ENFP,"2222
이건 t성향 뿐만이 아니고
가까운 사람간 관계에서는 해야될 행동이라 생각함ㅠ
연인입장에서는 힘들어요ㅠㅋㅋ
그러니 다양한 mbti들이 잇프피 고민글이 올라오는거구ㅠ"
ISFP,"그래서 이것저것 요구하는 사람과 안맞아요 이렇게 해달라 저렇게 해달라
맞춰주긴 하는데 사회생활의 그것과 겹쳐져서 점점 지침
배려해주는 사람이 좋아요 그게 고마워서 서로 배려해주며 만날 수 있음"
ISFP,헤어지자고 하는말은 정말 마지막일때 하는거이거늘..........참...........
INTJ,22
INFP,333
ENTP,결혼과 연애는 다르니까요..신중하게 선택하셔야겠어요
INTJ,연애면 조율되겠지만 결혼문제라면 헤어지시는게 조아보여오
ENTJ,세심하고 배려가 많은데 숨이 막히게 하나요 ㅠㅠ
ISTP,"스치며 말했던거 다 기억하고 들어주고 챙겨주는데

사진을 유심히 보며 창가에 비친 것까지 캐치하고
제가 집에 도착하는 시간까지 계산해서 돌려서 물어봐요 ""오늘은 좀 늦었네?"" 이런 식으로

일반 남자들이라면 아~그렇구나 넘어갈 법한 이야기도
뭔가 조금이라도 이상하다 싶으면
직구로 물어보면 되는데 계속 유도심문 하고 떠봐요 ㅠ"
ENTJ,"세심한 건 맞는 거 같아요.
근데 유도리가 좀.."
ESTP,더 정들기 전에 빨리 도망가세요~
ENFJ,"좋아해주는건 연애에서 너무기본요소인데
그거하나보고 ? 사귈이유는 절때없다고봐요

잘생기고 님을 좋아해주고 집착덜하는 존중해주는사람 만나요"
ISFP,"와 ㅋㅋㅋㅋㅋㅋㅋㅋㅋ 3,4 번 진짜 공감 ㅠㅠ
3번은 그냥 풀어주기만해도 잘 풀리고.. 4번은 다녀와^^ 하면서도 가지말라는건 속에서 .."
INFP,"그죠 그냥 옆에서 조금만 달래줘도 풀리죠
어디간다 그러면 보내쥬지만 뒤에서 부글부글 ㅎㅎㅎ"
ISTP,그냥 상대방이 본인 기질에 좀 부담스러운 사람인거 아닐까요?
INFP,전 정말 헤어질 결심을 하고 나서야 그런 맘 느꼇어요. 그전까지는 정말 생활의 일부라는 느낌이라 그런거 전혀 못느꼇거든요
INFP,이런말씀 뭐하지만 전 그럴때 헤어졌어요 ㅠㅠ 열정다해서 사랑하지 못할 것 같으면 안되겟더라구요
ISFJ,"초반엔 많이 합니다, 언제 사라질지 몰라요😅
귀차니즘이 강한 잇프피라😂
지금을 즐기세요ㅋ.ㅋ"
ENFP,22222
ISFJ,"네 애정표현 엄청 많이 합니다
말이든 행동이든요
찐 사랑이면 줄어들지 않아요"
ISFP,흐흐 감사합니다
ENFP,"1번 제외하고 저의 잇프피는 잇프피가
아닌건가.. ㅋㅋㅋㅋ
isfp-a 인데
제가 그렇게 만들었을수도😅
4번은 오히려 잇프피가 저 자꾸 약올림ㅠ😡"
ISFP,잇프피 by 잇프피 니깐요... ㅎㅎ
ENFP,"넹 저질체력은 맞아여ㅋㅋㅋㅋ🤣
급 표정어두워지는ㅋㅋㅋㅋㅋ"
ISFP,그럴땐 어떻해 대해 주십니까?
ENFP,"그럴때는 왜엥 피곤해? 집에가까? 이렇게 물어보거나 그래요ㅎㅎ
저두 체력이 엄청 많은건 아니라서..🤣
집가서 같이 뒹굴거리며 겜하거나 넷플보거나🤭"
ISFP,현명 하시네요 배려도 해주시고
ISFP,"잇프피 by 잇프피 입니다

4번처럼 생각하시는분도 계실거고

아닌분도 계실거고 그런거 같습니다"
ENFP,"오잉 이건좀 다르네요ㅎㅎ
최대치 플러팅은 +
자꾸 만나려한다거나,
저 있는곳으로 보러오더라구요?

잇프피 남자3명이 이런식이더라구요.

1.선톡
2.칭찬
3.선만남약속
행동파라 자꾸 만나려고함

저런것이 최대치 이였군요..ㅋㅋ"
ISFP,본문 내용도 맞고 님이 말한 것도 맞아요 ㅋㅋㅋㅋ
ENFP,"아 3번이 같이라길래 꼭 같이껴있는줄ㅎㅎ
둘다 맞아요? ㅋㅋㅋㅋ"
ISFP,"네ㅋㅋㅋ 둘 다 맞아요 
잘파악하신 것 같아요
단둘이 보는 것도 좋아 하고
어색할 것 같으면 다른 사람껴서 만나는 것도 좋고
셋이서 볼 기회라도 있으면 셋이 보는것도 좋아요
상대방 보러 가는 것도 맞고 행동파도 맞고 ㅋㅋㅋㅋ"
ENTP,ㅋㅋㅋㅋㅋㅋㅋㅋ넘귀엽다
ENFP,"잇프피 뚝딱일때 귀여웠는데...
톡으론 능구렁이 같은데 만나선 눈도 잘못마주치고 뚝딱거림🤭"
ENTP,더 올려주세요 100개 올려주세요
ESFJ,잇프피는 너무좋아
ENFJ,잇프피ㅋㅋㅋ 귀여워~
