mbti,comments
ESFJ,엄청 신중하게 생각하고 스스로 확신이 들어야 고백하는 편이에요 제기준 최소 1달은 보는거 같아요
ESFJ,저도 호감이 있더라도 그 사람이 어떤 사람인지 어느정도 파악을 해야해서 한 달 이상 걸려요
ESFJ,주변에서 오래 서성이며 스며들려하다가 서로가 호감인걸 확신하게 될 때 바로 직진해요 확신 없을 떄는 모르는 사람이라도 스며드려하는게 오래걸려요 누군 답답하다하고 어장이다하고 오해할 수 있구요 친구관계면 더 오래보아요..
ENTJ,저 아는 엣프제 중엔 있었어요
ESFJ,넹..
ESFJ,한번은 시도해봤다가 상대에 대한 미안함과 본인의 죄책감에 다신 안그래요
INTJ,호오 이성간에 남사친 여사친 잘 안만드는 유형 아닌가요? 친한 여자동생 가능한것인가요...@@
INTJ,인티제랑 잘 안맞으신거죠?
ENTP,그렇군요.. 감사합니다!!
ESFJ,솔직하게 말하면 신경쓰고 배려할거에요 그래도 호감은 있다라는 표현정도는 해주셔요
ENTP,저도 표현을 확실히 해야겠어요.!!! 감사합니다
ENTP,"같은 엔팁이시군요 ㅠㅠㅠ
저도 한 화끈 한다고 생각했는데 상대가 넘사네요.. ㅎㅎ 생전 듣도보도 못한 칭찬을 마구 해요
익숙해져야겟죠??ㅎㅎ ㅠㅠ"
ISFJ,"남녀관계는 경험 없어서 그 부분은 설명을 할 수 없지만, 기본적으로 갈등 생기는 거 싫어합니다. 하지만 사소한 다툼으로 성향을 알게되거나 또는 오래 보다보면 그 사람 스타일을 우선적으로 보게되죠.. 그러다가 잔소리가 늘거나 챙겨..? 라기 보단 내 사람이 됐다 (가까운 사람) 생각되면 속 이야기도 꺼내고 하게 됩니다... 그러다가... 이 다음은 생략하겠습니다...

시간이 좀 걸린다는 거..? 그게 문제지 이후는..."
ISTP,앗.. 저도 최근에 그렇게 느꼈어요. 저도 작은 싸움도 싫어해서 왠만하면 다 넘어가는 스타일인데 상대분의 연애스타일에 자꾸 물음표가 생기고 서운함이 생겨 좀 삐쳤다가 진지하게 이야기를 나누었어요. 저한테는 그게 갈등이고 나름의 다툼이었어요. 그런데 오히려 마음을 더 확인하고 서로 원하는 걸 조금 더 이해하고 조금더 노력하는 계기가 된건지 요즘 더 가깝고 편하게 느껴집니다.
INTJ,"관심있다면 생일이 연락하기에 좋은 핑계이긴한데... 거리두는거 보니 더이상 가까워지지 않으려 하는거 아닐까요
혹은 생일 챙겨주면 너무 관심있는걸로 보일까봐 그러는 거던지...
어떤 쪽이든 그쪽이 막 불타는 상태는 아닌가보네요
더 확신이 필요한건지 흠 그렇다면 남자가 너무 소극적이라 사겨도 답답터질듯
월요일되서야 아 지난주 생일이셨죠? 이럴지도 ㅡㅡ"
ENTJ,빨래 몇 번 나눠서 하나요?
ENTJ,저번달 관리비 얼마 나왔어요?
ENTJ,헉 경기권 거주하시나요
INFJ,왜 지옥에서 온 잇프제라고 생각하시는지 궁금합니당
INFJ,우와 모든 가족이 잇프제면 어떤느낌인지ㅋㅋㅋ궁금하네요 신기해요
INFJ,잇프제에 더 가깝다고 생각하시나요?
INTJ,"가족분들이 다 잇프제라니 신기하네용
전부 계획적이신가요? 휴일에 막 갑자기 외식가고 그런건 없어요?
혹시 해외여행 다녀오신 가족분들 있으신가요? 잇프제는 외국 잘안가는것 같아서요"
ISFJ,쿠크다스에다가 생각도 많은편이여서 힘드네요 😣
ISFJ,저 혼자 빠져있어도 괜찮을정도로 멘탈이 강했으면 좋겠어요 🥺 부럽습니다..
ISFJ,"저도 그래요ㅠㅠ 따돌림이 이리 스트레스인줄 몰랐는데, 정신적 타격이 엄청 나더군요;;
(그래서 잇프제분들 모여있는 여기와서 놀고 있는건지도요ㅎㅎ)
이게 무관심한 성격이면 남이야 알게머람 하겠는데, 잇프제는 두루 편안한 관계여야 안심이 되는 성격이라;

전 그냥 하던데로, 마이웨이로 친절한 모습 보이는 중입니다. 나중에라도 누군가 알아주면 좋고, 아니어도 어차피 퇴사하면 남남될 사이, 내사람인 가족만 잘 챙기고 응원 받음 되지 하면서요.
그러다가 한두명과 어울릴 때가 오면 개인적인 얘기 꺼내면서 약간이나마 가까워지기도 하죠.
힘내세요~!! 응원드려요~!!!"
ISFJ,너무 위로가 되네요... 감사해요 🥲 계속 친절하게.. 너무 상처받은 상태여서 생각하지도 못해봤어요! 감사합니다 🙇🏻‍♀️
ISFJ,"음 저도 내향적이라 초반에 그런 경우가 자주 있는데요. 그럴수록 일 더 잘 하고, 더 친절하게 대해요. 사실 혼자 있으면 편하긴 하지만 주변에서 이상하게 보는 것도 꽤나 신경 쓰여서... 주변 사람들이 봤을 때 제 문제가 아니라, 저 사람들이 이 사람한테 왜 저러지? 싶게 해요.
그리고 그런 직장 분위기에선 본인들끼리 잘 어울리다 조금 사이 틀어지면 결국 제 삼자를 찾기 때문에... 뭐 오래 갈 외로움은 아니에요 ㅎㅎ 뒷담에만 안 섞이면 돼요"
ISFJ,"안그래도 단호히 쳐내면 사회성없다는 얘기가 돌까봐 걱정이였어요! 오히려 친절하게, 내 문제가 아닌듯이..! 조언 감사합니다 🤍"
ESFJ,사소한 배려 자주하시면 가능성이 높아질거라고 봐요!
ISFJ,사소한 배려...(메모) 어떤게 있을까요?
ESFJ,부담안주는것들이요! 순서를 양보한다던지~ 사내에서 챙김못받은걸 챙겨준다던지~ 너무 의식하지 않는 선에서요!
ISFJ,존재감이 중요하군요..! 어렵네요... 막상 무리에 들어가면 별거없는게 진짜 느껴지긴 하는데.. 너무 소외감들고 외롭더라구요 😭
ISFJ,그냥 출퇴근길엔 혼자 가고싶어서 그런게 아닐까요?? 노래듣는다던지 유튜브보려던지... 상대방에게 호감이 있고 없고를 떠나서?
ISFJ,몇달동안은 글쓴님 생각해서 본인 혼자만의 시간을 없애가며 출퇴근했겠죠ㅋㅋ 근데 계속 반복이 되니까 본인도 슬슬 힘들어지셨던거 아닐지? '이 사람은 이런 사람이구나' 하고 이해를 해주시면 좋을 것 같아요! 연락 빈도나 일상카톡 등을 통해 관심이 있어보이는지 아닌지를 판단하심 좋을듯요
ESFP,남친이 출장을 가서 제가 힘들지는 않아? 라고 보낸게 마지막이에요 ㅠ
ESFP,서로 그동안 서운한거 얘기하다가 싸웠어요 ㅠ 제가 먼저 미안하다고 했는데도 화 푸는둥 마는둥 하더니 그 이후로 저래요
ESFP,아! ㅠㅠ 네네 회피형은 아니라 우선 조금 더 놔둬볼게요 감사합니다
ESFP,그나마 다행이네요 ㅠㅠ 감사합니다
ESFP,네 답장 기다려볼게요 ㅠㅠ 감사합니다!
ESTP,이해 안가는 관계라면 잇프제 형님이 먼저 끊어냅ㄴ시다
ISFJ,"전 희한하게 친하게 지내는 여사친들이 대부분 enfp였습니다
개인적으로 힘든건 isfp랑 entp"
ISFJ,"생각보다 이성이지만 친구로 지내기 좋은건 enfp infp 들이였어요 ㅎㅎ entp은 친한누나로 지내면 잘 맞는거 같고, 연인관계로는 esfp, istj 연인경험이 있는데, esfp는 친구로 시작했다면 이어지지도 않았을거 같아요 오히려 인만추 여서 그동안 잘 맞았다 느낌?
istj분은 이곳저곳 조금씩 같이 다녔고 더블데이트도 해봤지만 대부분이 잘 맞는데 어쩌다보면 서로 느끼고 이해하는게 정말 다른게 많아서 거기서 부터 틀어졌던거 같아요"
ENFP,맞아요 넘 공감했어요 제 남친도.... 미래얘기나 어떤 현상에 대한 분석 얘기할때 대화가 안되요 얘기하면서 재밌어지는데 깊은 얘기가 안되는 너낌
ENFP,평화비둘기
INFJ,모든 대화가 기승전 <그럴 수도 있지....> 좀 재미없어요
ENTP,예민한게 아니시고 그냥 상대가 좀 이상한데요.
ISFJ,남자 잇프제인 제가 느끼기에도 뭔가 이상해요. 뭔지는 몰라도 거짓말 치고 있다는 느낌이 강해요.
ISFJ,다른 사람이 있을거라고 확신까지는 못 하겠습니다만 회원님이 예민하신건 아닌듯 합니다. 확실히 뭔가 행동이 부자연스럽고 이상해요. 일단은 좀 더 지켜보심이 좋을 듯 싶어요.
ISTP,일단 전화피하는 사람은 백퍼 의심각
ISTJ,유부남 아니에요?????
ENFP,저도 잇프제 남친있어요 좋은뜻이에요 솔직하게 말하는거고. 다른 사람 앞애러는 좋은 사람인척 연기하느라 힘들어하고 눈치보다가 솔직한 모습 보이고 싶은 상대 가족같은? 그런것 같아요
ISFJ,"잇프제가 다 부정적인건 아니지만 좋고 싫고를 분명하게 정하는건 있습니다.
좋고 싫고를 정하는 기준선은 잇프제들마다 차이가 있겠지만 대게 속으로 생각하고 일정 횟수 선을 넘으면 넌 싫어로 판단하고 아웃시키곤 하죠.
이걸 얘기해준다는건 글쓴분을 꽤나 의지하고 있는 내편으로 생각하는것으로 보이구요."
ISFJ,222 아무리 친하고 바운더리 안으로 들어갔다 하더라도 계속 부정적인 이야기 하는건 조심해야죠. 저도 자기 사람에겐 긍정의 힘을 보여야 한다고 생각합니다.
ISFJ,어느정도의 선까지는 부정적인 말들을 들어주다가도 한번씩 콕집어주긴 해요.. 너무 그런말들만 하면 그게 본심인것처럼 들린다구..ㅋㅋ
INTJ,불건강한 f의 모습이 보이네요~ 방구석여포 ㅎㅎ
ENFJ,"마지막 시기때는 솔직히 인정하지만.. 중간에 뜨뜨미지근한 그 관계가 서로 막 불타서 상대가 계속 같이 있자고 하고 , 보러오고 집에안보낸다고 난리였을때도 나중에 보니까 겹지인 여자애한테 애매한 호의? 처럼 그러고 있었더라구요 . . ."
ENFJ,"마음이 크지않아서라... 초반엔 몰라도 여러가지 이유로 더 깊어지기보단 서로 안맞는다고 생각이들었을지도 모르겠네요. . . ㅎ 좋아한다에서 사랑한다까지 온거같다 결혼생각까지 온것같다 라고 말한와중에도 그게 그냥 나온 소리일수도있는데 , 너무 잇프제 성향을 믿고싶엇나봐요😅"
ENFJ,그러니까요... 잇프제분들 하나같이 다 후폭풍 안온다고 대동단결로 말씀하신거보고 역시 과학이구나 싶었다가도... 잇프제에 제일 큰 장점인 저 부분은... 정작없는 잇프제남.. 심지어 제가 알면 기분나쁠까봐 읽씹도했는데 또 말걸고 그랬다더군요...허허허
ENFJ,"그냥 같은 모임에서 알게되서 사귄거라 같은 모임에 친한 여자동생한테 그런거구... 그 외에 싸웠을때 그와중에 다른 사람이랑 톡한거 걸렸을땐 , 그냥 답답해서 스몰토크할 사람이 필요했다 라고하는데... 잇프제는 뭔가 마냥 즐겁고 웃기기만하고 친구같은 대화상대가 이상형인걸까..싶기도햇네요 😂"
ENFJ,역시 결론은 미련하지만..그래도 아닌건 아닌걸로.. 🥲
ENFJ,그러니까요.. 자발적으로 누구한테 연락도 잘 안한다고 그랬는데..허허 .. 너무 순둥이 처럼 굴어서 속았나봐요😅 재회는 바라지도않우이 뼈져리게 후회라도하고 연락왓으면 하는 미련이 남네여 ㅠㅠ
ISFJ,"엇.. 전 애인이 있더래도 친한 사람들한테 그렇게 대해요.
실제로 그런 걸로 남친과 싸웠던 적도 있었지만..
모두에게나 애정표현 한다는 게 아니라 모두에게나 다정하단 말이 더 맞는 건가...암튼
그러면 전
아니 내 남친이 너인데 왜 뭘 걱정을 하느냐
하고 말했던 거 같아요.
너는 좋아하는 거고
이 사람들은 우정, 친한사이.
이런 거요...
흠ㅠ"
ENFJ,하트가 섞인 이모티콘이라던가 .. 외모에대한 칭찬을하면서 안부를 묻는다던가.. 대화를 상대가 씹었음에도 계속 하는경우... 이런거는 잇프제님은 적어도 없으셨을것같아요 ㅠㅠ
ISFJ,"친한 사이면은 저는 되는데.. 흠
오래된 친한 이성친구 관계는 아니던가요?

제가 워낙에 그런 거에는 또 전혀 다른 개념, 관념을 갖고있는 건지.. 내가 이상한가? 라는 생각을 많이 하기도 했어요"
ENFJ,"오래됐다면 됐을 수도 있는 사이도잇구.. 일년에 한두번? 정도인 경우도있구요... 근데 스토리에 씹어도 계속 답장한 여자는 같은모임에서 제가친한 동생이고 , 심지어 둘이 안지도 얼마안댔구, 안친해요..ㅎㅎ 그부분에 대해서 남자친구분을 이해시켜드렸고 그 이후로 잘 유지하며 지내시나여? .. 저는 연락하는거까진 이해했는데 말투가.. 여자친구한테 하는거랑 크게 다른점이 없다는거에 더 충격이였어용..ㅎㅎ"
ISFJ,그러면 관심 있는 거 아닐런지요 그 여자분한테..
ENFJ,하핫..다른 또 여자애한테도 그러고 ㅎㅎ 바람끼가 다분한 놈인가봅니다.. 꽁냥거릴때도 그러더니 헤어지고나선 대놓고 그러던디.. ㅎ 잊어버려야하는데 아직까지 미련을 다 못버렸네영 ㅠ
ISFJ,"아 헤어지신 거예요?
과거형이었군요..

헤어질땐 님께서 먼저 헤어지자고 하셨고
남자분이 안 잡으셨나요?"
ENFJ,"네 헤어진지 3주정두요 ㅎㅎ 회피형에 지쳐서 제가 헤어지자고는 했는데 얘기를 하다보니까 어째... 제가 차인것처럼 상황이 그렇게되었네요..ㅎ 서로 울며불며 얘기하다가 자기가 자기상황이 좀 안정적이여지면 용기내서 오겠다 라고는 했지만 , 그냥 예쁘게포장한거같아요 ㅎㅎ"
ISFJ,"흠...
왠지 님을 그렇게까지 깊게 진심을 다 해
좋아했던 건지 의문이 들고요!
그러지 않는 이상 여기저기 추파던지는 일이 없을 건데.."
ENFJ,뭔가... 깊게 좋아했다. 라는 말을 다시 생각해보게되네요 . . . 😂 그게 오히려 포인트였을지도 모른다는 생각이들어용.. 결혼얘기고 뭐고 그냥 너무 믿지말껄 그랬어요 ㅎㅎ 늦은시간까지 고민 들어주셔서 너무 감사합니다 🙏ㅠㅠ
ISFJ,"엇 그렇게 말씀 하셨다면... 거짓말을 하진 않을텐데요...
흠 오해가 있다거나 한 거 아닐런지요!
아님 그분이 자유로운 영혼이던가..
저는 글 보고 그 분이 이해가 갔거든요
저도 그런면이 있는지라

제 댓글 보고 너무 그쪽으로 취우치지 마세요! ㅠ 어디까지나 단편적인 글만 보고 얘기해드리는 거니까요...
형편없게 헤어진 거라면 별로 안좋아했나보다 할텐데
그렇게까지 얘기하고 결혼얘기까지 하셨단 걸 보니요."
ENFJ,ㅠㅠ 좋아한다에서 사랑한다에서 결혼상대자에서 지금은 현실적으로 좋아할 여력이없다 이게 결론으로 난건데... 사실 상대방입장을 이해해보고 싶어서 글을쓰는거거든여 ㅠㅠ 그리고 시간이지나서 내가 어떤말을 건네면 가장 마음이 흔들릴까 싶기도하구요 ㅠㅠ
ISFJ,"현실적으로 좋아할 여력이 없다라
저도 이해는 가요 그 말 충분히..
저도 자주 했던 말이고요.
별로 그렇게까지 안 좋아할때 하는 말이거나,
너무 좋아해도 우리가 서로 극복하지 못하는 문제들이 반복될때,
서로 앞으로 둘다 엄청나게 힘들겠다 싶을때 하는 얘기거든요.
진짜로 내 마음이 더 커지기 전에 우리 둘을 위해서요.

극복해보자가 아니고 어차피 안 될 거기에 더 힘들어져서 개막장까지 보고 둘다 서로 너무 힘들어지기전에 그 전에 차라리 이때라도 유종의 미를 거두자.

그런 생각이요..."
ENFJ,"자기직징을 못잡는 상황이얐고, 옆에서 계속 응원하고 알이봐주고 해도 못정하다가 서로서운한게있어서 헤우진거같은데 그럼 재회는..어렵겠네요..만약 상대가 어떤말로 연락이 오면 조금이라도 흔들릴거같으실까요..? ㅠ"
ENFP,잇프제 원래 여사친 많아요 제 남친이 여사친 많음 성격이 스윗해보여서 오는여자 안막는 느낌
ESFJ,"아닐 수도 있지만 혹시나 너무 힘들어한걸보니 다시 잘 해보려고는했으나 연애하면서 정떼기? 정리하는과정같은기분이듭니다...
오히려 역으로 그만하자하면 알겠다고 할 것 같기도하고요ㅠㅠ ...

제 경우는 받아주다가 어느포인트가 넘어가면 좋아하는 마음이 그걸 안고 만날정도의 크기가 아니면
탁 놔버리는 경향이있어서...

그리고 전 정말 보고싶으면 장거리때도 그냥 무조건 보고
언제보냐 계속 그랬어가지구용.."
ESFJ,일단 미련이 남으신 상태고 헤어지기싫으시니 계속 지금처럼 꾸준한 표현과 관심은 해주셔여할것같은데 하지만 상대가 반응이없고 원래 사귀고 일정기간지나고도 쓰니님이 그거에대해 표현이 줄었다고 서운해했엇던걸 생각하면 쓰니님 스스로가 지치실거같기둥
ESFJ,어떤 연애든 처음보다 행동이 달라지는건 대부분인거 같아요. 오히려 처음이 평소의 엣프제가 아닌 모습이었고 평소의 본인으로 돌아가는 모습일텐데 속상하시고 엣프제도 지쳐감에 변화하려는 노력마저 약해진거 같아요. 다시 잘해보려면 엣프제에게 속상함을 털어내기보단 본인의 시간을 즐기시고 여유를 찾아가는 노력을 해보면 엣프제도 변화를 맞이할 거 같아요. 서로가 건강한 연애를 할 수 있는 환경을 만드시는게 좋을거 같습니다.
ESFJ,"이별 판독기: 이별 끝
미련 판독기: 미련 없음 단, 10%는 있는듯"
ISFJ,선연락
ENTJ,"선연락 + 사소한 것 챙겨주기(생일선물, 약속 일정 구체화, 예약 등 포함)/기억해주기의 빈도가 1~2달에 한 번씩 정도면 어떤 걸까요? 너무 띄엄띄엄이라 헷갈려요..."
ISFJ,실제로 유튜브 채널에서 잇프제를 사슴으로 그리는 채널이 많긴하더라고요!
ENFP,저는 미어켓이요 ㅎ
INTJ,인정 ㅋㅋ 주변 엄청 살피고 예민한거 비슷하네요
ISFJ,"전 반대로 가족들한테 낯가렸죠.
가족들이 많이 서운해했던 기억이 나네요..
그리고 어떤 사건이 생길때마다 저의 그런 180도 다른 모습을 보고 많이 놀랬던 기억...

그치만 친구들은 어릴때부터 말하고요.
넌 가족들을 너무 사랑한다 떠올리기만 해도 눈물 흘린다 라고요.

다 가족들한테표현 부족한 제 탓이죠ㅜㅜ"
ISFJ,"잇프제는 내사람~타인 영역이 많이 달라요. 타인을 처음 보면 낯 가리고 경계도 하고 그런 와중에 예의도 갖추거든요. 잘 모르는 상대니까
근데 가족은 가장 가까운 사람이잖아요. 내가 어떤 모습을 보여줘도 자연스럽게 받아주고 서로가 서로를 잘 이해하는 관계다 보니 거리낌이 없는 것 같아요. 편안한 사이니까 감정을 그대로 표현하죠.
저도 어릴 때 가족이나 친한 친구들 앞에서는 장난도 치고 나름 개그캐이기도 했는데, 완전 처음 본 사람이나 대하기 어려운 사람들 앞에서는 낯가림 모드에요 ㅋㅋ 그래서 언니가 저보고 왜 내숭떠냐고 하기도 했는데요 ㅋㅋ 지금은 성격 유형을 알다보니까 나도 이런 다양한 성격을 가지고 있구나 싶어요.
그래도 잇프제가 잔소리를 한다면 내사람이라고 생각하는 거니까 이런 부분은 좋게 생각해 주세요 ㅎㅎ"
ISTP,2
ISFJ,"주변에 있으려고 노력하는 정도?
엄청나게 용기내서 표현한 것은 선톡이에요!"
ISFJ,질문많이하고 상대방이야기 반박없이 잘 들어주려고 해요
ISTJ,무슨의미에여?!!
ISTJ,감사합니다!! 천천히 다가가볼게요☺️
ISFJ,"-인간적 호감으로는 딱 한번만 가능하고 지속적으로 단 둘이 만나는 건 이성적 호감이 있어야 가능해요!
-집순이라 혼자만의 시간이 필요하기 때문에 폭격 수준으로 연락하기 보다 조금씩 연락 빈도를 차차 늘려보세요
-이미 단둘이 자주 만나고 있다는 것은 인간적 호감 이상이라고 볼 수 있구요. 잇프제는 사람을 알아가는데 되게 신중해요. 사람을 알기 까지 시간이 오래 걸리는데다 연락을 먼저 하는 스타일은 아니에요. 저도 가까운 친구나 주변사람한테 선톡 잘 안해요 ㅎㅎ 일단 친해지는 거 잘하셨어요! 성급히 생각하지 마시고 요렇게 천천히 스며드세요 ㅎㅎ 따뜻하고 다정하고 매너 좋은 사람을 좋아합니당 아 그리고 첨에 너무 부담스러운 선물은 주지 마세요! 꼭 뭔가 주고 싶다면 비타민이나 커피? 정도 소소한 걸로도 충분히 감동할거에요."
ISTJ,조언 감사합니다..! 노력해볼게용!!
ISFJ,"'선 넘네'라는 표현이 딱 맞는것 같아요ㅎㅎ 서로 잘 얘기하다가도 어느 하나에서 내 심기를 건드리면 맘 속에서부터 쎄해지죠.
댓글 감사해요~! :)"
ISFJ,"잇프제시면 S가 조금씩 N으로 바뀌고 계실지도..
인프제가 다수가 선으로 보는것에서 악을 보고, 다수가 악으로 보는것에서 선을 보곤 하지요.
잇프제가 사람 사이에서 생각이 많다면, 인프제는 자기 안에서 자아와 생각이 많더라구요."
ISFJ,"저도 성격 바꾸려고 많이 애를 썼는데 안되더군요; 그리고 MBTI를 알게되면서 인정하게 되었어요.
아, 잇프제는 원래 그랬고 그래서 내가 그렇구나. 내가 이상한게 아니라는 생각하니 그런 모순도 이젠 인정하려고 해요.
머 어떤가요, 착하지 않게 보이는 사람이 더 많은 세상에서 착한 가면쓰고 사는것도 저희만의 세상 살아가는 처세술이죠~!"
ISFJ,"공격적이거나 위협적인 분위기를 극히 싫어하는것 같아요. 일부 T분들은 논쟁도 즐기고 납득되면 오케이라는데, 전 과정과 분위기를 중시하죠. 평화적, 협력적을 좋아하고 예의상 선 넘는걸 용서치 않죠. 물론 맘속으로요ㅋ"
ISFJ,다 맞는댓글들.... 한번 선 넘으면 그뒤로 아무리 잘해줘도 인식이 바뀌지가 않고 그냥 그대로 낙인이 찍혀버리는거 같아여...착한 가면 쓰고 살아가고 있단 생각을 한번씩 하긴 하지만..사회생활에는 처세술이 필요한거니까..그거는 그거대로 나쁘지 않은거 같아요...
ISFJ,"넵, 솔직히 전 이런 저의 잇프제 캐릭터가 별로 맘에는 안들지만, 변하기도 어렵고해서 이젠 걍 인정하는 상태예요ㅎㅎ
오늘도 일하면서 눈에 거슬리는 사람들, 상황들이 많은데 제게 직접 요청오지 않는 이상 그냥 못본척 넘어가고 있고, 겉으로는 아~무 일도 없는것처럼 ""식사 맛있게 하세요~^^"" 하고 있네요ㅋ;;
마음 복잡한 잇프제는 오늘도 퇴근시간만 기다립니다~"
ISFJ,나 스스로 받아들이는것말고 다른 방법이 있을까요..나 자체인데...ㅎㅎ 너무 깊게 생각하지마셔요ㅠㅠ
ISFJ,"성격유형은 많은 노력이 필요하지만 바뀔수는 있다고 하더라구요.
또 MBTI라는게 정해진 질문에 답해서 나오는 결과이기 때문에, 16가지 성격유형을 조금만 알면 이제 질문이 눈에 보여요. 이 유형이 나오려면 이렇게 답하면 되겠구나 하게요. 그래서 신뢰성이 없죠.
지금 잇프제로 나오지만, 진짜는 아닐수도 있고, 나중엔 또 다를 수도 있구요.

저는 저대로 채룡이님은 채룡이님대로 자유롭게 열려 있어요. 원하시는대로 자신있게 삶의 방향타를 잡으시길 바래요~!!"
ESFJ,아시네요 ㄹㅇ 입니다 진심ㅋㅋ
ESFJ,저또한 공감합니다...⭐️
ENTJ,헐 왜요?
ESFJ,님은 아니겠지만 상대방은 오해할 수 있으니 친하게 친구로 지내고싶다는 그런거 하지마요 아니면 사귀든가
ESFJ,아 그럼 하세요 ㅋㅋ 걍 플러팅 갈귀면 그때 나 진지하게 싫어 확신차게 말씀하셔요 ㅋㅋ
ISFJ,네ㅔ 깊은 감정되기 전에 부담스럽게 하거나 선 넘는 행동하면 정 떨어져서 호감이 안생겨요ㅠㅠ... 한번 아니면 진짜 아닌거라 희망을 드릴수가 없네요...
ESFJ,"음 네.. 깊게 좋아하는 게 아니라 얕은 호감정도, 
안 지 얼마 안된 사이인데
너무 훅.. 들어오거나 선 넘는 건
오히려 반감이 생겨요ㅠㅠㅠㅠㅠ...."
ESFJ,"네넹
어느정도의 호감, 감정 깊이나
원래 어떤 사이였는지라던지
여러가지의 요소들이 있겠지만요!


아주 자연스럽게 플러팅 살짝씩 스윽~하몈
심쿵...꺄아아앙!💛 하는데
휙 바꾸거나 너무 오글거리면..ㅠ 
저는 조금 불편해요

막 저도 모르게 어느틈엔가 푹 빠져서~
이런걸 좋아하지
어? 나를 빠뜨리려고 하는데!..? 
이런생각이 들면 좀 식는거 같아요..;;ㅋㅋ

물론 이미 푹 빠진 연인사이면 다릅니다ㅋㅋ"
ISFJ,그렇겠죠...? 후회는 없지만 기억에 남는게... 너무 힘드네요
ISFJ,아..... 힘드시겠네요 맞아요 진짜 미래를 봤을땐 잘한거 같아 후회가 없네요...
