mbti,comments
ENFJ,"1. 쓰니님께 연애감정 있는 경우, 나는 이런 연애관 가지고 있다고 알려주는 것
2. 쓰니님과 상대분이 썸이 확실하다면 사귀는 걸로 슬슬 넘어가자는 의미
3. 두 분 사이 연애감정 기류가 없다면 연애상담이나 잔소리일 가능성 있음

마지막에 경계 중이라고 하셔서 1번이나 2번이실 거 같긴 한데, 제가 보기엔 그래여ㅎㅎ"
INFP,"2번이 맞았던거같습니다.. 제가 좋다고하니까, 세상을 다가진듯 엄청나게 좋아하네요...... 부디 이번연애는 제발 오래갈수있게 해주세요...... (제발!)"
INFP,해산물 좋아하신다는 걸 알고 있어서 모른 척 넘길수가 없더라구용 ㅎㅎ
INFP,"ㅎㅎ 그러면 참 다행이구용.
딱 제가 좋아하는 타입이라 잘되었으면 좋을 것 같아요"
INFP,"여자분이세요. 연상분이시구요. ㅎㅎ
잇프피들 착하고 상냥하신분 좋아하자나요. 딱 그런 느낌이라 너무 호감이네요. 언젠간 대화가 시원스럽게 될 때를 기다린답니다 ㅎㅎ"
INFJ,저도 비슷하네요. 상대는 esfj 입니다. s와 n의 차이가 크네요 ㅠ
INFJ,아 진짜 s와 n의 차이인가 저도 상대방이 s거든요ㅠㅠㅋㅋㅋㅋㅋ
INFJ,ㅋㅋㅋ 후 …….
ENFJ,"표현을 잘못했나 생각해봤는데
수백번 말했는데도 그러는거면, 내가 고려대상이 아닌것 같아서 실망스러울것 같아요,, 한두번도 아니고,,"
INFJ,물론 표현도 잘못한 적 있어요 수백번 말했는데도 해결이 안되니 욱해서 화내곤 했거든요ㅜㅜㅜㅜ
ENFJ,가족중에 누구일까요
INFJ,엄마요..ㅠㅠ
ENFJ,"저희엄마도 그런데요, 적당히 거리두고 여행이나 선물을 해드리고나서부터는 제입장으로 조금씩 바뀌더라구요.

여행가서 피곤하게 하면 피곤한티내고 다음엔 안올것처럼 해요. 말이아니라 느낌적으로요

원래제일가까운곳에서 가스라이팅한다하죠. 다그런건 아니지만 저희시대 어머니상들이 자존감낮은분이 많으시니 이해해드려야하는데 제가 살려면 어쩔수없더라고요

부모가아니라 사람이 다그래요

꼭 여행이나 선물이 아니더라도
어머니의 결핍을 아시면 좋을것 같아요

그것도 서로를 이해하는과정중에하나이니
저희어머니는 결핍중에 하나가 외로움이에요
그래서 시간을 같이보내거나 대접을 하면 좋아하시죠"
INFJ,앗 정말 생각지도 못한 좋은 방법인것 같아요 맞아요 저도 늘 화내고 자책하는 이유가 엄마를 어느정도는 이해하기 때문이거든요ㅠㅠ여태까지 말로만 시도해봤는데 다른 방법도 시도해봐야겠어요 도움주셔서 정말 감사합니다!
INFJ,맞아요 상대도 저를 위해서 한 행동인데 제가 싫다고 화내면 속상하고 서운하겠죠? 그래서 되도록 화 안 내고 싶은데 아직 해탈의 경지가 안 온지라ㅠㅠㅠㅠ어렵네요
INFJ,자립하다 못해 적은 나이도 아닌데 가끔 만날 때마다 이런 문제가 생기네요ㅠㅠ역시 감정적으로 대응하지 않는게 최선이겠죠? 화내는 것도 싫지만 화내고 나서 후회하는게 제일 싫네요ㅠㅠㅠㅠ
INFJ,한번도 제가 후회하는 이유에 대해서는 생각해본 적 없는데 그런 거였군요ㅠㅠ반복적으로 같은 상황에 놓이게 되면 좋을게 없긴 하겠죠 우선 감정적으로 대응하지 않으려는 노력부터 해봐야겠어요 감사합니다ㅠㅠ
ENTP,전 걍 끝까지 싫다고 몇번이고 말해요;;;
INFJ,그럼 예를 들어 본문 예시 같은 상황일 때는 어떻게 하시나요? 이미 상대방이 상황을 벌려놨을 때 마지못해 져주지 않으시고 끝까지 안 먹고 안 입으실 것 같나요??
ENTP,음 네 여러번 별로라고 했는데 계속 그러면 전 그렇게 할것같아요😅
INFJ,저보다도 더 스트레스 많이 받고 사셨겠어요ㅠㅠㅠㅠ전 이정도인데도 화나고 스트레스 받는데 다른 사람한테 내 얘길 나쁘게 하고 다니고 내탓으로 돌리기까지 한다면 진짜 자존감도 바닥치고 너무 우울해질 것 같아요..여러모로 고생 많으셨어요ㅠㅠㅠㅠ그리고 말씀해주신 그런 걱정들을 제가 똑같이 하고 있네요..ㅠㅠ정말로 제 인생이니 우선 저부터 생각해봐야겠어요 경험에서 우러나오는 진심 어린 조언 정말 감사드려요ㅠㅠㅠㅠ
INFJ,아니에요 직접 겪어보시고 진심어린 조언해주신 프퓌님이 훨씬 따뜻하신 분이죠 감사합니다 한결 마음이 괜찮아졌어요!
INFJ,ㅠㅠㅠㅠ역시 쉽게 해결되는 문제는 아닌가봐요ㅠㅠㅠㅠ장기전으로 가니 영 지치기도 하고ㅠㅠㅠㅠ힘내요 저희..
INFJ,헉…ㅋㅋ
INFJ,역시 살아온 시대가 달라서 쉽지 않군요ㅠㅠㅠㅠ얼굴 좋아졌네 라니 얼마나 독립이 크게 작용했으면ㅋㅋㅋㅋㅋㅋㅋㅋ웃퍼요 정말ㅋㅋㅋㅋㅋㅠㅠ
INFJ,숨기고 싶은데 자꾸 그걸 캐내려하면 너무 불편하더라고요..
ISFJ,저도 말하기 싫은데 그렇게 물어보면 싫을꺼 같아요ㅠㅠ 연인이라고 너무 사적인 부분까지 모두 공유할순 없죠..근데 쓰니님의 서운함은 이해가 가요..저는 내로남불인지 내껀 다 공유하기 싫어도 상대의 모든것을 알고싶긴 하거든요..ㅎ
ISFJ,저같은 경우는 워낙 저의 이야기를 하는편이 아니고 들어주는 편이고. 사실 굳이 사적인 나의 이야기를 하고싶지 않아요. 항상 앤애를 할때 상대는 왜 너의 이야기는 안해? 라고 했거든요. 그냥 내이야기를 하는게 뭔가 발가벗겨지는 느낌이 들때가 있어서요..저는 제 자존감과도 연관있다 생각이 들기하는데..어쩌면 애인분도 뭔가 드러내길 좋아하는 성격이 아닌가 싶네요. 막상 제 애인이 저처럼 감추는 느낌이 든다면 애정의 깊이를 의심하며 속상해 할듯한데.. 제 이야기는 하는게 힘들어요ㅠㅠ그냥 그분 성격이 그러겠거니 하고 이해해주셨으면 좋았을텐데..연애할때 중요한건 상대가 좋아하는걸 하는것보다 상대가 싫어하는걸 하지 않는것.. 근데 참 쉽지않죠ㅠ
ISFJ,쓰니님의 심정도 이해되는데 애인분도 이해가 되요ㅠㅠ 저도 몇년을 사귀어도 제 학창시절이라거나 저의 사회 초년생활 가족사 말안해요ㅎ 쓰니님처럼 너의 모든걸 다 알고싶어 막 원했다면 감동받고 알려줬을지도 모르겠지만요. 제가 t를 이해 못하듯 쓰니님도 애인분 이해 안되는부분이 있을꺼에요ㅠㅠ(이해는 하려고 노력하지만 저는 도저히 왜 그러는지 모르겠고 상처투성이거든요). 혹시 쓰니님께서 댓글에 적으신부분을 애인분께도 진솔하게 이야기 해보신적이 있나요? 싸울때 말고 그냥 서로를 알아갔으면 하는 태도로요.. 저라면 이렇게 나늘 생각해주고 사랑해준다면 바뀌진 못해도 뭔가 노력을 해보려고 했을꺼 같은데요ㅠㅠ 결이 다른 사람이 사랑할때 더 사랑하는쪽이 아프죠ㅠㅠ
INFP,"상대방의 감정보다는 본인의 감정이 더 우선이였던거 같아요. 싫다고하면 ""알겠어~ 몸조리잘하고 나중에 얘기하고싶을때 얘기해~ ""했으면 좋았을텐데요.
인프피나 인프제나 깊은 속마음 얘기 잘 못하는 유형이라서..인프제맘이 어땠을지 이해가되네요."
INFP,"왜 꼭 속마음을 오픈해야 건강한 연애라고 생각하시나요?? 사람마다 성향이 다른데..난 오픈하는사람이니깐 상대방도 오픈해야해!! 이건 아닌것 같습니다.
서로 다름을 인정하는것이 건강한연애가 아닐까 싶어요.
두분이 다른 성향으로 안 맞는것 뿐이고,
님의 성향에 맞는 분과 연애를 하심이 서로에게 좋을꺼같아요"
INFJ,"mbti는 변하지않나요?
근본적인 가치관이나 생활관은 바뀌지않겠지만
사회성이 발달하면서 근본이 살짝 가려진다고 생각해요ㅎ
인프제가 J성향이강하면 T성향도 어느정도 가지고있다고해요
그래서 적으신걸 보면 사회성 발달된 인프제성향으로보여요"
ENFJ,"그렇군용
답변 너무 감사합니다ㅠㅎㅎㅎ!"
ENFJ,"E I 는 극이 아닌 이상 환경적 요인의 영향을 많이 받아요! 더군다나 엔프제는 E 치고도 I 조심스러워 성향도 많이 보이는 편이구요.

저도 엔프제이지만 시끄럽고 사람 바글거리면 기 빨릴때도 있고 다수의 사람들과의 모임도 좋지만 또 일대일도 좋아해요!

엔프제는 E와 있으면 비교적 I가 I와 있으면 비교적 E가 되는거 같아요 ㅎㅎㅎ 또 윗 분 말씀처럼 인프제 인티제가 되게 비슷하다 들었어요. 프제 중에서 제일 T 성향이 높은.. 인프제로 추정되십니다!"
ENFJ,"인프제맞는거 같기도하면서 또 사회생활 인간관계 엄청중시하고, Fe를 넘 잘써서 헷갈리더라구요ㅠㅎㅎㅎ
답변 너무 감사합니다!ㅠㅠ"
ISTP,i e 는 에너지 방향성을 나타내는거라 적어주신거보다는 안밖에너지를 어디에 소모하고 받는지에 따라 달라요 반반이라면 둘다 겠죠 ㅎㅎ
ENFJ,"ㅎㅎㅎ저랑 있을땐 기안빨리고 편하다고 그랬는데
다른사람들이랑 있으면 기빨린다구 표현하긴하던데
에너지방향
주기능이 ni 인지 fe인지 헷갈려요ㅠㅎㅎㅎ"
INFJ,"제 절친중에서도 짱친이 엔프제에요(동성)
어릴땐 저를 제 의도와 상관없이 하도 밖으로, 여러사람과 엮어주려해서 손절까지 갈뻔했는데..
지금은 이런 사이가 또 없슴다..ㅎ
말씀대로 결이 비슷하다보니 대화가 끊이질 않고 쿵하면 짝하고ㅎ
위에 문제점들이 개선된 이후론(친구가 저를 인정해줬어요.. 넌 혼자노는아이구나라고..) 단한번도 싸운적이 없어요
아직 보지못했지만 엔프제 남자여도 잘맞을거같아요ㅎ
엔프제 짱조아요🥰"
INFJ,그쵸? 뭔가 비슷한 사고방식 가져서 통하는 부분이 많더라구요 물론 친구가 외향적인 게 분명 ㅋㅋ 새로운 사람 금방 친해지던 ㄷ
INFJ,저는 엔프제 친구랑 안 맞습니다 ㅠㅠ 손절까지 생각할 정도라서 mbti보단 이 사람 자체랑 안 맞나 하고 있어요 참고로만 봐주세요)
INFJ,감사합니다 ㅎㅎ 역시 사람 따라 다르군요
INFJ,저도 잘 안맞는것걑기도 애매..
INTP,"내, 내가 왕을 해도 괜찮겠니? 인팁이 왕인 나라, 괜찮을까?"
INTP,스트레스 받으면 잠행 나가서 숨을지도..신하들이 왕 찾다가 야근해야할지도..ㅋㅋㅋ
ENTP,재능부자 나인이네요ㅋㅋㅋㅋㅋ
ENFJ,엔프제남 저 왕떴습니다 ㅎ
ENFJ,"아니요...절대 농담 아니였어요
그 비열한 표정과 비웃는 웃음 잊혀지지가 않아요
1년이 지나서 그나마 나아졌는데요 진짜 너무 고통스러웠어요ㅜㅜ

그리고 개인적으로 농담이란건 서로가 웃을 수 있어야하는 수준이어야 한다고 생각해요...

'여태껏' 이 말에 내가 알기시작한 1년 간 호구였구나...
암튼 너무 아픈 말 이었네요ㅜㅜ"
ENFJ,"넵넵 엣잇프제님 첫 댓글주시고 넘 고마와요:) 한 동안 그랬는데 점차 살아났어요^^ 세상에는 좋은 사람들이 훨씬 더 많으니 조언대로 잊어버릴게요:) 그럼 굿밤 보내시고, 바쁜 일상이지만 소소한 행복도 챙기시길 바래요:D"
ENFJ,"네네 닷지님 댓글 감사합니다! 맞아요 아무런 별 생각없이 뱉은 거 겠죠:)
당시에는 매우 혼란스럽고 힘들었는데 이제 저도 조금 더 단단해지고 의연해지는거 같아요.
내 진심의 가치를 몰라주는 사람한테까지 소중한 에너지 쏟지 말자:) ^^"
ENFJ,"엥???? 깁티콘 몇번 받았다고 상대방이 보내준 배려와 호의를 호구라는 단어로 무례하게 내뱉다니니요.... 말인가요 이게....
mbti 를 떠나서 기본적으로 예의와 도리가 없는 사람같은데요.
몽구름님 스스로 호구가 아닌데 상대방이 무례하게 내린 단정에 휘둘리지 마세요!!

고양이한테 어 저기 강아지 지나가네 하는 사람한테 사람들은,
강아지가 아닌 고양이를 나무라지 않고
강아지로 보고있는 그사람 눈에 문제가 있다고 생각하니까요"
ENFJ,"넵넵 로스코님 댓글 고마와요:) 그러게요. 호의로 대했더니 다가오는 건 호구라는 조롱이네요
진짜 mbti를 떠나서 기본이 아닌거 같아요. 누구나 사람이니까 실수 할 수 있는데요. 사과 한 마디도 할 줄 모르네요
제가 원한 건 진심 담긴 사과 한 마디였는데 말이죠^^ 한 동안은 정말 힘들었는데 시간이 약이라고 지금은 괜찮아졌네요:)
그럼 굿밤보내셔요:)"
ENFJ,"네네 냥코님 댓글 고맙습니다:) 진짜 mbti를 떠나서 뭐 저런 사람이 다 있나?
본인한테 진심으로 대하는 사람도 몰라보는 바보 같아요. 시간이라는 약 덕분에 지금은 괜찮아요:) 마음 써주시고, 위로도 감사합니다! ^^"
ENFJ,저도 베프한테 그런말을 들었고 너무 힘들었던 기억이 있어요 저는 돈보다 우정이였던 사람이고 친구는 2년간 그냥 쉬고 싶다고 해서 만나는 족족 제가 다 계산하고 일부러 불러다가 맛있는갓도 사주고 그랬는데 어느날 너 호구잖아 라는 말에 너무 실망해서 연을 끊을려고 했던 기억이 났고 연락을 안주니 친구가 먼저 연락을 해서 평고 처럼 대해서 만나서 이야기를 했어요 니 그런 말을 했는데 나는 서운했다 라고 하니 장난으로 말했는데 그렇게 느낀지 몰랐다 진짜 미안하다 라는 말과 함께 내가 해선 안될 말은 한거 같다라는 진심어린 사과를 받았고 지금 그 친규하고 다른 친구하고 정선을 가고 있답니다!
ENFJ,하지만 구름님의 상황은 진짜 그렇게 이야기 했다면 엠비티아이를 떠나서 인성이 글러먹은 사람입니다 그런 사람은 만날 필요가 없고 감정소비를 할필요가 없어요 구름님은 호구가 아니고 선한 사람이기에 더 소중하게 사랑받아야 합니다 잊어버리세요!
ENFJ,"넵넵 꿀벌맴매님 댓글 위로 고맙고, 감사드려요:) 아 진짜 mbti를 떠나서 뭐 그런 기본도 안 된 사람이 있는지ㅠㅠㅠ 이후로는 자기한테 살쪘다고 외모 평가 하는 사람들이 많아져서 자기 정신과가야 될 것 같다는 말을 건너 들어서요. 내로남불ㅠㅠ 실수는 누구나 할 수 있기에 제가 원하는 건 진심담긴 사과였는데요.

자신을 진심으로 여기는 사람도 몰라보는 바보구나, 남한테 상처 준 건 아무렇지 않고, 남들한테 본인이 상처 받는 건 정신과 가야겠다고 하고 진짜 어이 가출이요:) 어떻게 보면 밑바닥을 빨리 보여줘서 다행이기도 하네요. 겉으론 가면쓰고, 속으론 호구로 조롱하며 이용당하는거 그만 멈출 수 있게 해줘서요^^ 그럼 굿밤하시구요. 항상 몸과 마음의 건강 챙기셔요:D"
ENTP,"이성끼리 인간적으로 저렇게 보내주는걸 이해하기 힘들수있어요.
이성적으로 보냈다고 생각할수도 있어서 그래서 장난반 진담반 이야기한것같네요
나는 너한테 이성적인 마음이없다고 확실하게 표현한것같아요.
은근 마음에 부담이였나봐요.
인간적으로의 관계에 선이 다 다르다보니까 그럴텐데 상처줄려고 한 말은 아닐거에요."
ENFJ,"에구 오늘 몸이 안 좋아서요. 고마운 댓글 달아주신 분들게 대댓글 드려야 하는데 그건 내일 몸 회복 후 해야겠네요:)
그런데 우선 제가 간략하게만 써서 가제님이 충분히 오해하실 수 있는 부분이 있길래 우선 이 대댓글만 오늘 남겨요

저희는 각자 호감인 사람이 있던 상황이었고, 둘 다 그걸 알고 있었습니다.
그리고 서로 안 맞는 성향인 면이 매우 많다는 것도 둘 다 알고 지냈어요^^

그리고 기프트콘은 상대방이 보내달라고 자주 그래서 보내줬던거거든요
전체적인 내용이 아닌 제가 일부분의 내용만 올려서 충분히 가제님처럼 생각하실 수도 있는데요.
그 내막은 이렇다는걸 말씀드리고 싶었어요. 소중한 시간 댓글 주셔서 감사드리고요 , 그럼 좋은 굿밤 보내셔요:)"
ENFJ,"어머낫, 애매한님 따수운 말씀이 이미 제 마음을 포근하게 안아주셨어요:) 순간 뭉클하고 감동 받았어요! 고맙습니다:)"
ENFJ,"차마시는 인프퓌님 댓글 감샤감샤해요:) 처음부터 일부러 그랬는지 도통 속을 모르겠어요.ㅠㅠ
그 사람도 이후 들리는 소식으로는 자기한테 살쪘다고 외모평가하는 사람들 때문에 정신과 가야 할 것 같다면서 힘들다고 불행한 소식은 들었네요:) 네네 앞으로 조금 더 사람한테 진심을 주는데 신중해야겠다고 느끼게 된 계기였네요:)
그럼 편안한 굿밤 보내셔요:D"
ENFJ,"아이고 엔티티티팁님 대신 사과라니요. 따수운 댓글 하나만으로도 너무너무너무 고맙습니다:)
그냥 사람 좋아해서 상대방이 힘들어하면 그게 마음에 걸려서 챙겨주고 그랬던 건데 어케 또 이런 일도 겪네요^^
이젠 조금 더 단단해지고 의연해졌으니 걱정마셔요:) 그럼 항상 몸과 마음의 건강 챙기시고요.
엔프제 성향이신 분 주위에 계시면 정말 챙겨주고, 퍼주는거 좋아해서 정신적으로 많이 행복해지실꺼세요^^"
ENTJ,그 사람이 이상한 사람이에요. 신경쓰지 마세요 구름님. 사랑받을줄 몰라서 세상 꼬아보는 사람인 것 뿐..
ENFJ,"넵넵 슈크림라떼님 댓글 고맙습니다:) 진짜 살다보니 별의별 상황을 다 겪네요^^
그 이후로는 사람한테 진심으로 대하는거 조심스러워져서 예전보다는 신중해지더라구요:)
덕분에 슈크림라떼분과 다른 분들에게 댓글로 위로 받아서 마음이 몽글몽글 따스하게 차오르네요:D"
ENFJ,"저도 예전에 비슷한 경험이 있는데,
호구란 말을 하더라고요 ㅎㅎ
물론 취중이긴 했지만요.
당시엔 좀 기분이 그랬죠.
너에게만 하는 이 배려와 잘해주고 싶은 마음이
그렇게 받아들여진건가 해서...
제가 마음에 담아두는 스타일도 아니고 곱씹진 않았지만,
선이 다르다고 생각은 하지만 아직도 여전히 이해할순 없습니다. ㅎㅎ
그냥 다르다고 인정만 한거죠.
저는 타인이 어떻게 받아들일지까지 생각하면서 말을 하려고 신경쓰는데,
자기 생각대로 상대방도 당연히 알아줄거야라고 생각없이 말하는건
너무도 화가 났어요ㅡ 그당시에는요.
말실수 한 것일거야ㅡ라고 생각하려고 했고
제가 좋아하는 부분만 보려고 했던거 같아요.
너무 상처받지 마시고 하루빨리 회복하시길 바랄게요 :)"
ENFJ,"에구 마도석님 공감과 위로 그리고 조언이 담긴 정성스런 댓글 감동입니다:)
물론 말 실수를 할 수 있는데 참 아프더라구요. 이후로는 점차 회복해서 지금은 괜찮습니다!
바쁘신 일상에서 이렇게 소중하고 귀한 시간 내주셔서 에너지 주셔서 고맙습니다! 좋은 밤 보내셔요:D"
ENFJ,제가 대신 그분 뺨이라도 치고 싶네요...
ENFJ,"앗ㅋㅋㅋㅋㅋ 허브님! 순간 저 말 들었을 때 뇌절 온 듯한 기분이었는데요. 마음으로 후드려 팼습니다:) 고마워요! 덕분에 웃고, 힐링했어요:D"
ENFJ,"넵넵 맞아용! 더 오래가서 밑바닥 내보일 수 있었는데 그래도 하루라도 더 빨리 보여줘서 다행이라고 생각되더라구요.(시간이 지난 후) 이런 경험을 계기로 더 사람한테 마음주는데 신중해지는게 필요한거 같아요. 배고픈님도 오죽하셨으면 충격과 현타가 오셨을지 에구 토닥토닥 위로 드리고 싶어요. 그럼 편안한 밤 보내시고, 하루 빨리 기분 털어내시길 바랄게요:D"
ENFJ,"어우야...토마토님 어케요ㅠㅠㅠ아니 어쩜 표현을 골라도, 그리고 어떤 말투로 이야기 했을지 안 봐도 DVD네요ㅠㅠㅠ
토마토님도 보듬보듬 마음 잘 어루어만지시고요, 그래도 시간이 약이더라구요. 지금은 액땜했었네 하는거 보면요.

한 마리 미꾸라지가 물 흐린다고 딱 그격이에요. mbti 유형 여부를 떠나 설사 같더라도 기본 예의 갖추신 분들이 대부분일텐데요. 연초부터 무슨 마가 꼈나 저런 기본 안 된 사람한테 딱 걸렸네요. 그 비열한 웃음과 조롱이 담긴 말투 진짜 상처ㅠㅠㅠ

제가 제일 속상한 건 사람이 누구나 실수는 할 수 있는데요. 진심이 담긴 사과 한 마디면 되는 걸 끝내 안 하더라구요...
그게 제일 마음 아프더라구요. 사람한테 마음을 열고, 진심으로 대했는데 저런 소리나 듣고 참 인간관계 어렵네요:D"
ENFJ,한번 대쉬 해보세요. 안물어보면 모르죠…
ENFJ,너무 부담스럽지 않게 친해지도록 해봐야겠네요~
ENFJ,"네~ ㅎㅎㅎ 20대 경우에는 몰랐지만, 30대 되어서는 깉은 성향의 여성이 선호하게 되더라구요. 포기만 안하면 좋은 결과 얻으실꺼에요 ㅎ"
ENFJ,"그 날 바로 애프터가 없으셨다고 나한테 관심이 없구나 단정짓지 마시구요~
한 번 톡으로 제가 맛집을 발견했는데요. 같이 밥 한끼 하자고 하셔보시는건 어떠셔요?

예를들어 홍대에 흑심이라고 돈까스 집인데요. 돈까스집인데오 불구하고 솥밥으로 나오는데 있거든요ㅎㅎㅎ
돈까스가 대중적이고 남자들이 특히(?) 많이들 좋아하시고, 남녀 만남에는 고기가 들어간 걸 먹는게 좋다는 속설도 있고^^
그 분 호감 있으시면 한 번 용기내 보시는 거 추천드려요:)

저는 여자ENFJ이고, 남자 ENFJ님 짝사랑 중입니다:) ㅎㅎㅎ
ENFJ 특으로 보면 초기부터 대쉬하면 오히려 부담스러워 할 가능성이 높으니까요.

가랑비에 옷 젖듯 우선 친구처럼 친분부터 맺고, 일상에 차츰 젖어드셔보셔요.
그럼 점차 그 분 일상에 큰 의미가 있는 분으로 자리매김 하고 두 분 관계에도 발전이 있으실꺼에요:) 분명!"
ENFJ,맞아요~ 저도 초기부터 대쉬하면 좀 부담스러워서 ㅎㅎ 천천히 친분부터 맺어야 겠네요!!
ENFJ,엔프제 남자 등장!
ENFJ,"선생님 에프터는 사람마다 틀리다고 생각하는데 에프터를 받는 꿀팁은 사람에게 힘을 얻는 엔프제에게는 이렇게 말하는게 좋아요! ""지난번에는 ooo했으니까 다음엔 ooo하는거 어때요??"""
ENFJ,ㅡ예를 들면 이번엔 커피마셨으니 다음엔 밥먹는거 어때요?
ENFJ,저도 상대방이 저렇게 말하면 부담없고 좋을거 같아요 ㅎㅎㅎ 역시 같은 엔프제인가 ㅎㅎ 제가 어떤 상황에서 좋을지 생각하면 행동하면 되겠군요!! 감사합니다~
INFJ,제가 서울 살면 한강에 피크닉 갈것 같아요!
INTJ,"차 있으면 노을질 무렵 드라이브도 괜찮아요 서화나래 휴게소쪽 드라이브로 다녀오기 괜찮았어요
뚜벅이시면 한강이나 큰 쇼핑몰 데이트도 괜찮았어요"
INFJ,지방 살아서 서울은 잘 모르지만 자연 가득한 곳 좋아해요 ㅎㅎ
INTP,"한강, 드라이브, 가까운 서해바다, 윗분처럼 청계천 산책도 진짜 좋았고
날 좋으니까 야외로요 저녁엔 분위기 좋은 엘피바 칵테일바 술 별로면
사람 많이 없는 분위기 좋은 조용한 카페 ^^"
INFJ,주말에 서울에서 데이트하신다면 인프제같은 데이트는 어렵다고 봅니다. 어딜가든 사람이 넘쳐서요. 그나마 근교 카페 드라이브가 취향이에요.
INFJ,"1. 일단 사람많은곳은 빼세요
2. 윗댓처럼 자연과 함께하는곳들
저는 스트레스풀때 조용한곳 숲길같이 산책하면서 걸어다니는것만큼 힐링되는게 없습니다ㅋㅋㅋ"
INFJ,조용조용한 공간 감성적인 체험 이런거 많이들 좋아하시더라구요ㅋㅋ 그림그리기카페 북카페 향수만들기 이런거 대체로 호일듯합니다. 글고 전 진짜 다 좋아서 좋다고 하는편이에융
ENFJ,오오 이나님 어디로 가시나여? 저도 혼자 여행 좋아해서 국내 투어를 열심히 혼자 다녔어요!
ENFJ,사실 여권보다 네일받으신거 이쁜게 눈에 더 가네여ㅎㅎㅎ
ENFJ,나트랑으로 갑니다! 따라오세요! ㅋㅋㅋ 꿀벌님도 홀로여행 좋아하시는군요! 사람 좋아하는 엔프제라 혼자서도 잘 다니는지 궁금했는데 신기하네요
ENFJ,아잇 감사합니다😆
ENFJ,냐쨩 가시는 군여! 부러워여 따라가는건 조금 그렇구 이나님 캐리어에 넣고 데리고 다녀주세요! 헤헿헿헿헿ㅎ헿헤헿ㅎ 나 이나님이랑 여행갈래여~
ENFJ,맞아요 냐쨩~ 그럴까요?? 이번에 캐리어 큰 걸로 하나 장만했는데 꿀벌님 넣어가면 딱이겠네요!😆
