mbti,comments
ISTP,"스트레스 너무 심하실거같은데요ㅠㅜㅜㅜㅜㅜ 저는 제가 겉이랑속이 같아서 남들도 그럴거라고 생각하는걸 페시브로 사는 사람리라 남들이 겉속 다르게 행동하거나 제 말 의심하면 너무너무너눔 힘들어요,,, 전 자기 좋자고 하는 (까놓고보면 남은 너무 불편한) 배려는 더욱더 싫어하는지라"
INFJ,산책할 수 있는 공원같은곳에서 커피드시면서 진솔하게 대화해보세요
ENTP,"좋은점은 참 좋았는데 내 모습 내감정을 드러내보일수가 없고 늘 살피고 눈치보고 맞춰주고 그랬어요.
그런사람이니까 배려해준다 여겼는데 내내 혼자 눈물바람이였어요. 힘들었어요. 이젠 내려놨는데 편합니다. 더이상 가슴으로 대하지 않고 내 이성으로 대하겠다고 했어요. 당연 제가 노력하지 않으니 거리감이 생겼는데 이 또한 인연이 될거라면 다시 오겠거니 해요"
ENFJ,화이띵😆
ENFJ,멋져용
ENFJ,헿ㅎㅎ헬린이라 안멋져용🤣
ENFJ,전 눈치 채요ㅋㅋ
ISTP,눈치가 빠르군요.ㅠㅠ눈치를 채는데도 더 다가오지 않는건 저한테 관심이 없는거겠죠?슬포잉..
ISTP,어떤식으로 툭툭 던져보는지 여쭤봐도 될까요?ㅠㅠ
INFJ,앞으론 절대 함부로 헤어지지 마시길..
INFJ,"문제해결후 좋거나(나쁘거나)결과가 예상되는 지인이라면, 좋은경우만 적극적으로 최선을 다해 도와주려합니다. 나쁜결과에 대해선(해주고욕먹거나 찝찝하거나 등등) 곱씹어 자책하기 때문에 스트레스 많이받습니다ㅠㅜ 바라는거 없이 적극적으로 나서준다면 애정에서 우러나오는 행동으로 생각하시면 됩니당 :)*"
ISFJ,"연애를 하더라도 상대방이 아닌,
나 자신에게 집중하면 불안한 마음 없어지더라구요
힘들 때 회피를 하지 마시구,
짧게 짧게라도 표현 하는 연습을 해보세요
한결 편해져요"
INFJ,"오 이것도 맞는 것 같아요. 쓸데없이 배려한답시고 계속 연애에 과몰입하면 저를 잃어버리는 것 같더라고요.
그리고 짧게 짧게 표현하는 건... ㅋㅋㅋㅋㅋ 정말 어렵지만, 연습해봐야겠어요. 이런 거 보면 장난 잘 치는 사람 너무 부럽고 멋진 것 같아요. 재치 있게 표현해보고 싶어요.

답글 감사합니다!"
ISFJ,"말로 표현 하는게 어려우시면
감정일기를 써보세요, 그게 저는 도움 되었어요"
INFJ,"네네, 재미있게도 저는 일기도 한동안 솔직하게 못 썼는데요. 일기를 솔직하게 써보라는 조언을 얻고 나서 발견한 게 많았어요.
열등감, 질투, 이런 부정적인 감정들도 내 안에 있음을 인정하는 연습하는 게 중요하다는 생각이 들었었는데,
다시 일기장을 쓰면서 어떻게 다룰지 더 고민해보면 좋을 것 같아요.! 조언 고맙습니다, 잊고 있던 걸 떠올릴 수 있었어요 🙂"
INFJ,"상상금지
함부로 생각하고 판단하기요"
INFJ,"오 이것도 진짜 맞는 것 같아요, 상상에 불과한 걸 사실이라고 생각하는 순간 불행 시작...

함부로 판단하는 게 제일 예의 없는 거라는 걸 까먹고는 하는데 잘 기억해두겠습니다! 😄"
ISFJ,"눈앞에 보이는것만 믿으세요,
상상하면 끝이 없으니까요"
INFJ,저는 그냥 사람에 대한 기대감을 안 가지면 상상을 안하게되더라고요
ISFP,인프제분들 워낙 매력적이셔서 굳이 입아프게 말할것은 없지만 상대방이 s라면 말하는 그대로 믿어주세요. 말뒷면에 의미 없어요^^ 간혹 상대가 바라지않은 배려와 애정 퍼주시고서 그에 못미치면 감정이 휘몰아치실때 좀 버거움이 느껴지는거 같아요
INFJ,"저도 댓글처럼 남이 아닌 나에게 집중할때
그럴때에도 편히 옆에있어주는 이성에게
점수를 많이준것같아요
그러다가 나를 혼란스럽지않게하는
구남친 현남편을 만나살고있지만
결혼하고서 수많은 장애물을
넘고넘어살고있네요…허허허"
ENTP,"제 친구를 보면서 글을 이해하게 됐어요.
제 친구도 enfj.isfj 인데 이글처럼 묘하게 안맞아요.
Isfj친구가 은근 피하더라고요..
질려하고 피곤한듯한 느낌이더라고 열정을 쏟기 싫은?
같이 만나자해도 놀고오라면서 끼지 않아요.
대신 enfj가 원할만한것을 알아주라고 저에게 팁을 알려줍니다 ㅎㅎ"
ENTJ,"주위 엔프제들 보면 확실히 장점도 많고 좋은 사람들인데 의외로 좀 사람 딥빡하게 ㅋㅋㅋ 하는 면이 있긴 하더라고요? ㅋㅋㅋㅋㅋ
특히 저런 약속 부분에서 저로서는 ??? 인 면을 여러번 겪고부터는 그냥 제가 먼저 약속잡지는 않게 됐어요. 만나면 만나고 말면 말고.
그냥 마음 편히 가지세요. 사람 올때가 있으면 갈때도 있는거고 갈때가 있으면 올때도 있죠, 뭐.
가족은 이게 안되니까 힘든 사람들이 많지만 다른 관계는 그래도 어느정도 가능하니까요... 너무 힘쓰지마세요.

자기가 먼저 언제 몇시에 만나자 해서 미리 일정 비워뒀는데 한 하루이틀 전인가 약속 변경 하고 싶다고 해서 이유를 물어보니까
매일 약속이 있어서 한 이틀 정도는 쉬어줘야겠대요. 그 이틀중에 우리 약속이 있었던거죠 ㅋㅋㅋㅋㅋㅋㅋㅋㅋ
이런 일이 몇번 정도 있고나니까 그때쯤엔 얘가 지금 제정신??? 하는 생각이 들어서 언젠가는 아 그럼 그냥 약속 취소하자고 했어요.
다른 날을 제시하길래 나 그날 연차내고 놀거니까 그날은 안된다고 했더니 당황하는 눈치길래 뭐 니가 다른 약속들 때문에 피곤해서
우리 약속은 미루는거나 내 연차때문에 우리 약속 미루는거나 차이 없다고 했더니 한동안 말을 못하더라구요.
이후로는 우리 약속은 나름 열심히 미루지않고 지키려고 애쓰는것 같긴 한데, 이미 저 부분에서의 신뢰는 일단 깨진거죠 ㅎㅎㅎ"
ENFJ,"잇프제분이 너무너무 치지신듯 보여요 그리고 대화속 저 엔프제분은 정말 엔프제가 맞을까요...?
저는 시간약속을 제일 중시하는 사람이라... 제기준이긴 하지만 상대방 기분을 최우선으로 생각
하는 성격인지라 통보식? 절대 안하고 하물며 약속을 잡을때조차도 미리 다 양해구하고 괜찮냐고
물어보고 정하는데... 저분은 너무 일방적이라 잇프제분이 더더더 지치신듯요 에구구ㅠㅠ"
ENFJ,그러게요ㅠㅠ 회피를 선택하기까지의 그 과정들이 얼마나 힘들고 속상하셧을지... 정말 말그대로 오죽하면..이라고 밖엔ㅠㅠ 친구분의 행동성향이 무조건 적으로 나쁘다는 건 아니지만 한번쯤은 돌아볼 필요가 있을 것 같은데 다들 이렇게 포기해버릴 것 같네요 에효효
ENFJ,"일단 약속파기를 당일통보로 한다는것 이나 여러가지를 봤을때 님을 친구로 생각하는지 의문이네요. 상대방에게 지치신거같은데 상대도 님을 전만큼 친구로 생각안하는거같아요. 원래 그랬다면 인성이 문제인거구요.

일단 엔프제가 약속을 당일취소한다? 게다가 사과도 없이?? 너무 사람 좋아하는 엔프제랑은 멀구요. 오히려 사람을 좋아하고 계획적이라 당일취소는 잘안하고 해도 진짜 실례라고 생각하고든요…
힘든일을 말 잘안한다는건 항상 잘안하는건 아니고 전 상대가 무슨일 있냐고 물어보면 항상 말해요. 근데 굳이 다 힘든데 누구나 힘든 일땜에 피곤해~ 힘들어~ 이런 징징대는 듯한걸 말안하는거구요
믿을만한 친구한텐 많이하고 전화로 조언구하구, 믿을만하지않거나 애같다고 느끼면 말안해요
그리고 엔프제가 피곤해한다? 오지랖이 넓어서 피곤한 일을 사서 하는게 사실 가장 엔프제인데…. 사람좋아하고 모임도 좋아하눈 성격인데 피곤하다 피곤하다 저런말 하는 자체가 엔프제스럽진 않은거같아요.
평소에 계속 부정적인 말만 계속 하는건 엔프제뿐 아니고 누구든 싫어할거같구요.
여러모로 엔프제로 알고계신게 확실히 맞나 싶네요.

그리고 저도 딱 님처럼 사람에게 질려서… 그냥 그러려니~ 그러려니~ 하고, 또 뉴구한테 화나기보다 서로가 다르니 그냥 연락안하는게 좋겠다 싶은데
무슨맘인진 알거같아요…..
그냥 그대로 지내시는게 사실 마음이 편한거같아요. 저도 요즘 마음이 편하더라구요.
만약 얘길하고싶다면 그냥 감정적으로 욕하고 뭐라하는게아니라..
너가 당일 취소하고 통보하고 이런모습이 나한테 좀 실망이라고 솔직하고 담백하게 말해보심을 추천드려요.
근데 저런 상태인게 내 자신이 힘드신거니.. 굳이 일만들기보다 지금 맘상태가 차라리 좋을거같긴하네요. 저도 그러고 있어서…"
ENFJ,"신기하네요. 저는 제인생에 가장 친한 중학교때부터 아는 두친구한테 한번도 긴세월동안 당일취소는 한번있었나?? 취소해도 전날이고, 전날취소라도 진짜 미안하다고 꼭 사과하고, 너무 미안하면 내가 다음에 볼때 꼭 밥사겠다고 하고 밥도 꼭 사거든요.
엔프제끼리 글쓸때 약속취소를 정말 싫어한다는 글들도 많이 봐서.. 저분이 특이하다고 생각이되요.

제일친한친구한테도 선을 넘는다해도 팩폭을 날리는거지.. 이런 기본 매너를 넘는 경우는 흔치않을거같은데,, 피곤해서 싫다하거나 저런얘기도,, 저는 듣는 상대도 피곤할까봐 함부로 말도 안하는 스타일인데 ㅠㅠ 뭐 정말 가끔 너무 피로한날은 말할수있어도 약속잡을때 하고
저는 친한친구한테는 새벽에도 힘든일 잘얘기하는데.. ㅎㅎ
여러모로 저랑은 다른거같네요…
저는 친한게 아니라 만만하게 보는거같아요. 제가 절대 저러지 않아서 ㅠㅠ

아무튼 그래도 회피가 편하다는 그말을 이해해서,,, 그게 맘 편하시면 그렇게 하시는게 낫죠.
뭐든 그러려니 하는게 저도 맘편하도라구요. 서서히 멀어지는것도 맘 편하고 ㅋㅋ 물론 저였으면 친한친구가 당일취소를 통보식으로 자주한다면 그러려니 넘어가진 않을거같지만요…"
ENFJ,"만약 닷지님이 똑같은 행동을 했는데 상대도 그러려니 넘어간다면 그냥 성격이고, 기분나빠하면 만만히 보는거일거같아요.
전 당일취소를 비매너라고 생각해서 그렇지만 또 저분은 당일취소 친구니까 이해가능~ 이럴수도 있으니…
닷지님 주변에는 다 편하게 좀 막대하는 친구들이 많은가보네요ㅠㅠ
저도 그런친구들이 많았다가 점점 심해져서~ 결국 인연 다 끊었네요 ㅎㅎ"
ENFJ,"웃자고 한말에.. 눈치못채고 🥹
그랬군요… ㅋㅋㅋㅋㅋㅋㅋ"
ISTJ,"우와 저랑 너무 비슷한 상황이여서 댓글 남겨요! 제가 조금전에 ENFP 친구의 심리를 잘 모르겠다고 글을 썼는데
친구랑 카톡한걸 주욱 읽다보니 J라고 말을 했던게 있더라구여 제가 알고 있는거랑 mbti가 바뀐거 같은데
P랑 J랑 반반인거 같아요 ㅋㅋ 근데 제 mbti랑 글쓴이님 mbti랑 같고
제 친구랑 글쓴이님 친구 mbti가 비슷한거같아요
와,,, 약속 파토 ㄹㅇ,, 저도 이거때문에 손절 할까 싶었고 제 성격때문에 또 그래도 좋은면이 많고 소중한 친구라고 잃고싶지 않아서 노력중인데 ㅠㅠㅠㅠㅠ 저희는 둘다 여자고 제가 또 싫은 소리를 잘 못해서 좋은게 좋은거지하면서 넘긴적이 많아요
서운한게 있어도 속으로 삭히고 아닌척하구요,,
친구의 마음을 모르겠어서 글을 쓰긴했는데,, 한번은 터놓고 얘기해봐야할까요?ㅠㅠ
댓글보니 지금 그 친구랑은 아예 관계를 정리 하신건가요?"
INFJ,"닷지님, 안녕하세요:)
잘지내고 계시죠? 문득 안부가 궁금해서 닷지님 글에 댓글 남깁니다!"
INFJ,"사소한거 기억하고 다 챙겨주기, 주변 맴돌기"
INTJ,갑자기 기다렸다는 듯이 질문하고 맞장구치고는 뭘까요!!
INFJ,그거는 진짜 공감되어서 그런거일수도요
INTJ,오호 그렇군요 생각보다 말 잘 걸어서 신기했어요
INFJ,초반에는 궁금한게 많아서 질문 많이해요
INTJ,아 친해지고 싶은 사이한테요???
INTJ,사람!!
INFJ,"친해지고 싶으니까 그렇겠죠?
아니면 억지로 둘이 놓여있는 상황에서 침묵 깨려고 그럴수도요"
INTJ,아아 단 둘이 있는 상황은 아니었어요 ㅎㅎ 답변 감사합니다 여러명이서 길가고있는데 갑자기 뒤에서 말걸어서 이것저것 물어보는게 귀엽더라고요
INTJ,오호 선톡이 어려우시군요!!
INTJ,오 보통 뭐라고 선톡하면 부담스러워하지 않을까요
INTJ,오 전화는 뭐 ㅋㅋㅋㅋㅋ
INTJ,대화할 때 너무 가까이 붙으려고 해서 놀랐는데 뭘까요...?
INTJ,폭풍 공감하면서요 ㅋㅋ
INFJ,"칭찬,질문"
INFJ,음.. 집안일이 있다고 하는 거 보니까 안 좋은 일이 있어서 그 일에 집중하느라 폰 볼 시간이 없는 것 아닐까요?
INFJ,넹 멀티가 안돼서 집중 빡세게 해야 하는 일이 생기면 연락 잘 못해요ㅠ 중간중간 상황보고 같은건 할 수 있겠지만 하나의 일에 에너지를 쏟아붓기 때문에 힘들어서 연락 못했을거예요. 하루종일 운전했으면 피곤할만했겠는데욥!!
INFP,"집안에 신경쓸일이 있다고 했지만,,, 출근을 해서도,, 그 집안일을 해결하는 건 아닌데,,, 그냥 그쪽으로 온신경이 쓰여서 그런거라고 보면 되겠죠...?"
INFJ,"아ㅠㅠ 상황설명 없이 냅다 연락이 안되면 실망할만하죠... 뭐지 싶을거같아요ㅠㅠ 연락이 안될 것 같으면 미리 얘기해야한다는 입장이라서 그 행동은 잘 이해가 안되긴 하네용..

으음.. 그리고 두번째로 말씀해주신 서울 주차에 대해서는 사람들마다 운전실력이 다르기 때문에 누군가에게 쉬운 길 이라도 다른 누군가에겐 어렵게 느껴질 수 있다고 생각합니다ㅠ 마지막으로 피곤해서 흐트려져 있다면 집에 가는게 낫다는건 인프제 나름대로 피곤해서 집에서 충전하는게 더 좋다고 판단했기 때문이 아닐까용 저 같아도 계속 피곤해하면 에너지도 없고 힘들테니까 집에 가는게 나을 것 같다는 생각이 들것 같거든요. 정확한 상황을 몰라서 함부로 말씀드리기 죄송스럽지만요..!!
데이트가 일이다... 음.. 그건 마음이 아직 크지 않기 때문이 아닐까 싶습니다. 호감은 있으나 깊게 좋아하는 상태는 아닌거용.. 좋아하는 마음이 크면 데이트가 일이라고 생각 안들거든요ㅜㅜ"
INFJ,네 맞아욥..!! 여유가 없을 때 주변을 잘 못챙기는 경우가 있긴해요ㅠㅠ 두 달 동안 별 일 없었는데 갑자기 그런거라면 조금 더 지켜보시는것도 좋은 방법입니당
INFP,"그럼 제가 먼저 또 선톡을 해도 되는걸까요...? 신경쓸일이 많은데 밥은 먹었냐는둥 그런,,
여기서 인프제를 읽어보면, 적극적으로 다가가면 도망가버린다고 하니깐,,ㅎ 그냥 납둬야 하는건지,,,"
INFP,"아,, 그럲네요,,, 집안일과 안조은일은 모든사람에게 일어나는거 맞네요,,,ㅎ 알겠습니다, 감사합니다 :)"
INFJ,"기다려보셍.
님과의 문제가 아니라 본인일이니.
추스르고 연락 줄걸요ㅎ"
INFP,"인프제가 무슨일이 생기면 동굴로들어간다고 설명들을 해놓으셨던데,, 그런건가요..? 그냥 동굴에서 나오도록 기다리면 되는거겠죠,,,ㅎㅎ 하,,, 어려운사람"
INFJ,좋아하는 상대에겐 동굴링을 ㅎㅏ고 있더라도 제일 먼저 연락줄겁니다ㅎ
INFJ,"맞아요... 친구나 지인의 연락은 안읽씹해도 좋아하는 사람이나 연인에게는 그러지 않습니다... 에너지를 뺏길 것 같을때 안읽씹, 좀 지나면 읽씹으로 없애는 편이에요"
ENFJ,"어떻게하면 우리 사랑스런 infj 남친을 더 아껴줄 수 있을까, infj글만 보러 들어오는 사람입니다 ㅎㅎㅎㅎㅎㅎㅎㅎ. 이제껏 만나본 사람과는 결이 달라요. 말도 항상 예쁘게해서 날마다 반하고 있구요, 누가 마음을 더 줘서 상처를 받네 어쩌네 이런 고민 정말 쓰잘때기가 없어요. 원없이 잘해줘도 아깝지 않은 됨됨이가 된 인간, 어떻게 이런사람이 나한테 왔나 신기하고 감사해요. 윗분처럼 사귀기까지는 저도 시간이 좀 걸려 저는 미쳐도는줄 알았는데 시작하자마자 초초초 직진, 다정, 저를 완전 지껏(?)으로 만들어버리는 마성의 매력도 있고........앞서나가고 싶지 않지만, 솔직히 결국은 인프제 아닌가 싶어요. 안목있는 사람은 인프제!!! 지금도 너무 소중해서 사라져버릴까 무섭고 그렇지만 내일 헤어질지도 모른다는 생각으로 오늘하루하루 최선을 다 하고 싶은 사람?... 존재해줘서 감사합니다 ㅠ"
ENFJ,붕어빵 찍어내듯 똑같은사연 ㅋㅋㅋㅋㅋ김치찌개에 참치 진짜깨알이네요. 전 아직 눈이 멀어있는지라 좋은면뿌니 안보이는데 여기댓글 다시는분들 붕어빵찍어내듯 제 남친이야기같아서 얼마나 반가운지 몰라요ㅋㅋ 엠비티아이는 정말 과학인가봐요. 인프제를 사랑하는 모임을 수면위로 끌어주신 아르테님께 감사드립니다. 좋은밤 되세요♡♡
ENFJ,실례지만....상담 요청드려도 될까요?
ENFJ,괜찮으시다면 1대1채팅 걸어주시면 감사하겠습니다 ㅠㅠ
ENFJ,쪽지 보냈습니다 3통이에요...감사해요 감사해요.
ESTP,Arte님~~ e/infj가 보기에 estp랑 entp의 차이점이 뭐라고 생각하시나요 !!
INTJ,오 저는 엔프제님들의 부드러운 말투가 부럽던데^^ ㅎㅎ 지나가던 인티제 괜히 칭찬 한번 받고 갑니다~
ENFJ,저두요 이해못했는데 이해한다 그럴때 다 티나는데.. 무조건 적인 공감에 오히려 상처받는 저..ㅎㅎㅎ
ESFP,오 다행이네요 ㅎㅎㅎ 혹시 어떤식으로 연락하셨나요!!?
ESFP,ㅠㅠㅠ 그래도 다행입니다 ㅎㅎㅎ! 댕이조님은 재회를 바라시고 연락하신거에요~?
INFJ,좋게 헤어지셨다면 악감정이 없으니 평소대로 한 거 아닐까용?
INFJ,평소보다 과한 느낌이었다면 일부러 그런거일수도 있겠네욤ㅋㅋㅋㅋ
INFJ,으음 마음에서 정리가 됐거나 악감정이 없으니까 일부러 딱딱하게? 해야할 이유가 없어서일수도요! 어떻게 헤어지신건진 모르겠지만.. 서로 합의 하에? 헤어진거면 가능할거같아욤
INFJ,"상대도 기다렸었나 보네요.
무지허게 기뻐하는듯ㅎ"
INFJ,네 그거 가깝다는 표시에요 안그러면 보여주지도 않아요
INFJ,일주일만에 맘에 들었나보죠 일련의 사건이 있었나요?
INFJ,"사진 보내면서 일상 나누는거..ㅎㅎㅎㅎㅎ 저도 정말 가까운 사람들에게만 엄청 합니다!!
역시 과학이다...ㅋㅋㅋㅋ"
INFJ,"성심성의껏까진,,, 그냥답변해주심되요ㅎ"
INFJ,적당한 리액션이랑 그 사진에 대해서 관심있다는 느낌 주면 아마 더 많이 보낼겁니다..ㅋㅋㅋㅋ
INFJ,"저는 남자고 다른건 모르겠는데 4번은 맞는거 같아요.
가까이 늘 있다고 생각되면 인프제는 좀 마음이 식을듯ㅎ

님이 이상황 계속 할수 있으면 유지하시고 다른 대안찾는게 낫다 생각하면 끊으셔야져~"
ISTP,답변 감사합니다. 이왕 이렇게 된거 6월까지만 유지해보고 안되겠다 싶으면 접어야겠어요.
ISTP,소개팅하고 2주동안 만난게 처음 소개팅에 1번 그리고 나중에 한번 2번만난것 뿐이라 그렇게는 못다가갔어요 ㅠㅠ
ISTP,답변 감사합니다. 말씀하신것처럼 아직 이성으로 느껴지지는 않는다고 하더라고요. 지금부터 마음에 정리를 시작해야할것 같네요.
INFJ,"그렇게 애매하게 지낸 남사친들은 많은데.. 그땐 사귈까 말까 고민 오래하는 경우도.. 사귀기 싫은데.. 관계는 끊기 싫어서 그런 경우도 있었어요.
소개팅에서 만났는데 애매하게 하는건 잘 모르겠네요.. 전 소개팅은 연애할 마음으로 하는거라."
ISTP,저도 이게 애매한데 거절 당시에 자기 자신도 자길 모르겠다고 아직 연애할준비가 안된상태로 소개팅한것같다고 미안하다고 하더라고요....
INFJ,소개팅으로 만났는데 이성의 감정이 안느껴지면.. 거기서 끝 아닌가요? 위 상황이라면 답답해서 연락 안하게 되는 각오까지 하고 한 번 딱 이야기 하고 끝낼듯요..
ISTP,그래서 이야기하고 한번 끊으려고 했었는데 그 분이 잡아서 이렇게 유지가 됬어요... 제가 그 분을 너무 좋아하나 봅니다 ㅜㅜ 그래서 힘드네요.
INFJ,"엔프제도 아니고 가오갤3은 안봤지만..
1~2는 봐서 멘티스는 알고 있는데...
너무 공감합니다..ㅎㅎ"
ENFJ,저 그부분에서 멘티스가 많이 힘들었구나 느꼈어요ㅠ 전체적으로 가오갤3는 캐릭터 각자의 성격이 잘 드러나서 애정이 많이 가는 편이더라구요..!
INFJ,"유도하거나 대놓고 요구하는건 좀 그렇네요ㅠㅠ
왜 챙겨줄수록 관계가 번잡해지는지 아직도 아이러니해요🥲"
ISFP,퍼주는게 님이 좋아서 하는 거지 남은 “ 왜이러지” 생각할수도 있어요! 저는 퍼주는 행동 자체가 부담스럽거든요. 퍼주면 돌아오지 않길 바라고 퍼줘아 맞는거 같습니다.
INFJ,넹 당연히 바라지 않고 퍼줬죠ㅎㅎ 그렇게 한 행동들이 생각지도 못한 방식으로 문제삼거나 만만하게 보거나 하더라구요
ENFJ,"저랑 완전 똑같아요!!
저도 원래 저보다 남을 더 챙기는 편이었는데 감정 소모가 너무 크다는 사실을 깨닫고 난 이후론
그냥 그 시간과 돈으로 저를 더 챙기게 되었어요.
물론 내 바운더리 안에 있는 사람에겐 여전히 잘 챙겨주려고 노력한답니다.
근데 시간이 지나면서 바운더리 안에 있는 사람들 정리도 싹 되더라구요.
제가 잘 챙겨주면 상대방도 저의 배려를 알아주는 사람들만 남았어요.
저를 좀 더 아끼니 저를 함부로 대하는 사람들에겐 저도 그 정도만 해요
전의 모습이 그리워지기도 하고 내가 많이 무심해졌나 싶을 수 있지만
저는 지금의 제가 너무 좋아요,, 감정 소모도 덜해서 스트레스도 덜 받구요!
어쩌면 나이가 한 살 한 살 먹을 수록 책임져야 할 일도 많아지고 신경 써야 할 일도 많아지잖아요.
내가 가진 마음의 여유가 줄어드는데 그걸 좀 더 가치 있는 사람에게 쓰는 건 당연한 것 같기도 해요!"
INFJ,나도 인프제 남자지만... 인프제 여자들 친해지는 것도 너~~~무 어려움.
INFJ,"어떤 말로도 위로가 되진 않겠지만, 저도 예전에 사람에게 너무 큰 상처를 받아서 한 달 정도 혼자 생각하는 시간을 가졌었어요... 그래서인가 글에서 느껴지는 슬픔에 마음이 쓰이네요.

저의 경우에는 생각도 몸으로 하는 거라 그런지, 몸이 건강한 상태여야 더 좋은 생각들이 가능했던 것 같아요. 지금은 자신의 건강을 챙기는 것마저 너무 힘든 일일 수도 있지만, 조금 털어내실 수 있게 될 때 건강한 음식과 약간의 산책으로 조금 더 기운을 회복하셨으면 좋겠어요. 모든 게 나 자신에게 달린 거라지만 때로는 남탓도 해보고, 나를 지키는 여러 생각들을 하시면서 지금 상황에서 조금씩 나아지시길 바랍니다."
ESTJ,나에게 배신과 상처준 사람들에게 보란듯이 더 잘 지내고 살아가세요 성장하세요 저 또한 배신과 상처로 힘든 나날을 겪었지만 지금 생각해보면 도리어 성장할수 있던 동기부여가 아니였나 좋게생각하고있어요!!
ENTP,미움받을용기. 책 읽어보시길추천합니다. 바닥을 치고 휴식중이시니 솟아오를일만 남았네요. 쫄지마세요. 파이팅입니다.
INFJ,힘내세요. 토닥토닥.
ENTP,"마지막 댓글이 거의 한달 전인데, 아직까지 아무런 리플이 없는 걸 확인하고 나니까 더 마음이 걱정스럽네요.
세상에 절대적으로 좋은 사람도 나쁜 사람도 없을거에요
그렇지만 글쓴이님에게 진심을 건내는 한 명 정도는 있으리라 믿어요
정말 너무 힘드시면 쪽지라도 주세요! 커피라도 한잔 사드리겠습니다~
다 단절하셨다고하지만, 얘기를 하기만 해도 혹은 누가 들어주기만 해도 마음이 정말 조금이라도 가벼워진다면 제가 얘기 들어드리겠습니다.
절대 나쁜 생각하지 마시고, 꼭 다시 생각해보세요
지금 얼굴도 나이도 이름도 모르는 제가 적은 이 글도 글쓴이님이 오늘 이 시간까지 잘 버티고 계셨기를 바라는 마음이 진심입니다.
혼자가 아니에요~"
