mbti,comments
ISFJ,음.. 저도 예전엔 실수하면 어쩌지? 예상 밖의 일이 일어나면 어쩌지? 이런 류의 불안감은 갖고 있었던 적이 있었는데 그런 생각들수록 더 완벽해지기 위해 스스로를 갈아넣었더니 그런 류의 불안감은 많이 사라졌고 요즘엔 되려 매사에 긍정적인 마인드예요. 근데 우울감은 잘 모르겠어요. 저도 윗윗분처럼 소소한거에 행복을 자주 느끼는 편이라 일상 생활하면서 우울감은 그닥 못 느껴봤어요.
ISFP,ㅋㅋ 저랑 비슷하네요 옛날 mbti가 ISFJ여서 공감합니다
ESFJ,이해안되는 고집 부릴 때?
ENFP,첨엔롤하는지몰랏는데 한시간쯤됫을때 계속 타탁거리길래 뭐행? 물어보니까 롤중이라고...ㅎㅎ 전겜을안해서...;;;
ENFP,eisfj들은 워낙착하고 남맞춰주니까....가능한가 싶어서욜...ㅎ
ENFP,어렵네용 ㅠㅠ 단체로이상형말할땐 저랑은 너무달라서.. 밀어내는거같고ㅋㅋㅋㅋ
ESFJ,저는 이상형이 따로 있어도 안정감 주는 사람한테 호감생기는거 같아요~
ENFP,오옿... 잘챙겨주면서 스며들기 가능일까요
ESFJ,자주 만나고 관심이 없진 않다면 친구관계에서도 이사람이다 하고 확신 얻는구 같아요
ESFJ,다만 소극적이여서 나중에는 상대방의 확신을 기다리기도 해요
ENFP,아핳 의외로소극적이구만요...ㅎㅎㅎ
ESFJ,네네 확신 얻기 전까진 소극적인데 서로의 마음이 맞는걸 알면 그 누구보다 적극적이에요…
ENFP,내일 단체모임으로 술먹는데 먼저다른되는친구랑 카페서 같이기다리로했는데 그친구만 숙취해소제챙겨줘볼생각인데..ㅎㅎ 호감표시 알겟죠?!
ESFJ,네네 다같이 있을때보다 단둘이 일 때? 주세요 편의점 갈래? 하고 둘만 간다던지..
ENFP,ㅎㅎㅎ네넵 ! 낼 틈봐서 줘야겟으여 ㅎㅎㅎ
ISFJ,"저도 남편의 이상형은 아닌 거 같은데 제가 먼저 들이대서 결혼까지 했네요
평소에 싫어하는 정도 아니면 이상형 아니어도 괜찮은 거 같아요 ㅋㅋㅋ
대신 성격이나 외모나 엣프제가 생각하는 어느 기준치 이상정도는 되어야 하는 듯.."
ENFP,우왕...ㅎㅎㅎ 도전요....ㅎㅎ.. 서서히 들이대셧나용
ISFJ,"아뇨 ㅋㅋㅋ 저는 반하자마자 마음먹고 직진했어욥..!
오히려 계속 보챈 편.."
ENFP,와웅...ㅎㅎㅎ 단체로엮여잇어서 전 무셔워성...ㅎ ㅠㅠ
ESFJ,교대근무하시는 분인데 ㅠㅠ 저랑 나중에 뭐하고싶은지듀 말씀하시던데 ㅠㅠ 애프터신청을 절대안하시는데 여자가 해도될까요….
ESFJ,답장 텀은 3-4시간같아요
ESFJ,"다음엔 크림파스타 먹자고 했구,, 김밥얘기 나왓는데 담에 유부초밥 도전해보겟다하시규,,
좋으면 손잡는다 하셨는데 손도 살포시 잠시 잡으셨었어요..!
제가 사실 잇프제인거 알아서 첨에 넘 다가가면 그럴까봐 천천히 다가가겠다하니까 본모습 그대로 보여달라고 그렇게하셔도된다햤어요! 
다만 제가 일욜에 만낫고, 이후로 야간 야간끝내고 지금 회사행사가 있어서 애프터 말을 진지하게 꺼내기 힘든 상황인거같아요~ 넘 성급히 잡을 필요없겠죠?"
ESFJ,"글구 제가 넘 맘에들어서 저 맘에들면 오지라퍼라,, 밥드셧냐 이런것도 챙기고 그랬는데 그러지말까용 ㅠㅠ 허엉 ㅠ"
ENFJ,잇프제가 제 행동보고 아 귀여~ 하는데 좋은 신호로 봐도 되는거죠?!
INFJ,잇프제는 정말 사랑의 스나이퍼 인가요??
ENFP,아...선물주는건 받던가요? 번호 바꾸고 신경꺼야겠네요.
ENFP,차단은 안 했어요.
ISFJ,얼굴 봐야하는건 이유가 있는건가요? 그게 핵심일듯
ENFP,저번달에 안부연락을 했을때 먼저 보자고 봐야되는데 라고 그랬고 시간 맞춰보자고 했었어요.
ISFJ,그럼 그냥 예의상 보자구한거였던거네요 근데 자꾸연락오니 안읽씹으로 만남에 대한 거절표현한듯요
ENFP,그렇군요
ENFP,아...그렇군요
ENFP,그런 느낌이 들어요.
ESFJ,음.. 저는 전혀 관심 없는 분에게 그렇게 하는 것 같습니다 ㅎㅎ
ENFP,그렇군요. 대학동기(동성)예요.
ISFP,"아이가 하는 말이 감동이에요.
작은 성인 같아요 😍"
ENTP,"아이가 참 따셔요
20살까지는 자기 mbti의 심리기능이 잘발현 안되고 학습되어진게 강해요.
기질은 나오겠지만요.
그래도 따뜻한 아이들 두신듯해요 ^^"
ESFJ,혹시 상대방분 나이대가 어느정도신가요!?
INFP,"저는 현재 엣프제와 연애중인데
엣프제는 다정다감하고 자상하고 챙겨주는거 좋아해요!
일단 말이 많아서 일상생활도 투명하게 다 이야기 하고 믿음 주고 싶어 해서 뭐든 상세하게 얘기해주고 그런점이 인프피 입장에서 너무 좋아요!
엣프제는 인프피의 솔직함과 애정표현이 좋대요 ㅎㅎ
아 그리고 저의 엣프제는 저보다 만약에~ 더 좋아해요 ㅎㅎ"
ISFJ,"저는 읽고 답을 하지 않는다는건,
중요한 내용이지 않거나...
내사람이 아니라서 답 안해요
현실적으로 연인이 되기 무리가 있으시다면
얼른 끊어내세요ㅜㅜ"
ISFJ,"맞아요,, 아님 뭐라고 보내야 할지 몰라서
그냥 답 안보내셨겠죠~
내사람들 톡은,,,
읽씹은 잘 안하거든요"
ISFJ,"글쓴님께서 말씀하신 내용이 상대방이
보셨을 땐 무슨말이지 이런 생각 하셨을수도
있어요"
ISFJ,"중요한 내용이 아니라고 생각 들거나,,,
상처 받을까봐 답을 안하셨겠죠~
사귀는 사이가 아닌거 아니세요?"
ISFJ,"이런 말을 왜 하지? 속상해... 가 아닐까 합니다 ㅎㅎㅎ
음 저도 경험담인디 서로 붙잡으며 유지하는 관계에서 '힘들다' 뉘앙스의 말을 들으면 '내가 놓아줘야 겠구나'란 생각을 해요... 좋아하는 마음으로 버티고 있는데 속상해서..? 얼른 아무렇지 않게 기분 좋은 대화 이어가심이 어떨까요;;"
ISFJ,제 말이 그 말이에요 ㅠ
INFJ,"친구 잇프제도 일 못하는 사람도 사람이지만 본인 일에 책임없는 사람, 해보지도 않고 떠넘기는 사람, 윗사람에게 알랑방구 끼며 이간질 하는 상사 엄청 싫어하더라구요ㅋㅋ 근데 어느 유형이나 저런 인간들은 다 싫어하는거 같아요. 저도 엄청 싫어요 저런 직원들"
ISFJ,진짜 제가 딱 싫어하는 사람들만 모였네요...
ESFJ,"내 여자를 다른 남자들에게 보여줄 이유가 있나요..? 가장 멍청한 짓인거 같은데요... (보통 남자는 동성 친구들이 많을테니)
엣프제는 돈과 워라벨이 반비례하고, 직장상사나, 거래처 사장님들에게 제 개인생활 (가족생활 등등)을 알리고 싶지 않아요. 굳이 알리고 싶으면 티 내고 싶으면 진짜 친한 친구들 몇몇 선정해서 카톡 멀티프로필로 설정해요.
제가 겪은 예시로 서울 신촌에 있는 유명 명문사립대 약대를 다니고 있는데, 어렸을때 친구들이 얼굴평가하고 왜 만나냐, 약사 잡을려고 그러냐 등등 신촌에 와서 제 여친 얼굴 쳐다도 못 볼 사람들이 눈도 못 마주칠 사람들이 이런말 하기도 하고 해서 그냥 친한 친구들이나 지인 주변으로 멀티 프로필을 설정하곤 한답니다."
ESFJ,사람 외모 평가하는것도 받는것도 싫어해서 안해놔요!
ISFJ,"남자는 아니지만...
성향 이신듯해요,,,
맞지 않으시면 썸일 때
이건 좀 과한거 같은데,,, 라고
한번 말씀해 보세요
여자 이지만,,,
저도 저런 스타일은 별로 라서요"
ESFJ,잇프제가 신뢰를 쌓아가는 과정이라고 생각하면 될 것 같아요~ 밀당같은건 없는 잇프제라서 있는 그대로 궁금한 상대에게 오로지 집중하는 거거든요~ 신뢰의 장벽이 높아지면 서서히 줄어드는 부분이에요~
ESFJ,"-계획을 꼼꼼하고 세심하게 짠다
-연인의 작은 변화에도 잘 눈치챈다
-감정적 공감+상대가 바라는 해결책 제시를 잘한다
-S가 높을수록 지극히 현실적이라 자신의 상황을 잘 파악하고 언제든 대비하려고 한다
-크고 작은 이벤트 등을 준비하는 것을 좋아하며 좋아하는 연인의 반응을 보며 더 행복해한다+뿌듯해한다
-연락 관련 걱정이 없다
-모두에게 두루두루 모나지 않게 예의 바르게 대하나 연인에게는 그를 넘어서는 애정과 호의를 베풀 수 있다

정도로 쓰겠습니다."
INFP,단점도 알려주세요
INFP,"어떤식으로 계산적이에요?
계산적이라는 말 많이 들었는데
어떤 계산을 하는지 궁금하네요"
INFP,ㅎㅎ 어떤식으로 계산적이세요?
ESFJ,"저도 공감합니다. .ㅎㅎ 보통 데이트 코스 라던지, 같은 비용을 지불함에 있어 최대의 효율과 상대방이 쓸모 있을거 같은 선물을 선택하는거 ?"
INFP,"공감해요 ㅎㅎ
그런 이유로 현금 선물을 자주 해요 ㅋ.ㅋ
저는 너무 좋습니다😆"
INTP,"장점은 제가 쓴 글 참고해 주시고 ㅋㅋㅋ 단점은

찐 내 사람이라고 생각되면 그 관계에 무비판적으로 몰입해서 옳고 그름까지 놓치기도 함

너무 안정적인거 추구해서 연인이 새로움 긴장감 느끼는 맛은 없음

가끔 과잉친절 + 자발적 호구짓 하는거 옆에서 보면 속상하고 답답할 때 있음

제가 N으로서 N들의 대화 1도 안통하는거 꽤 아쉬웠음(근데 이해 못해도 또 일단 공감은 해줌ㅋㅋㅋ)

너무 배려하느라 리더십은 없는듯

내로남불 좀 있는편.. 근데 또 말은 예쁘게 해서 애매하고 찜찜

윗분들이 써주신 계산적이라는거 뭔지 알것같은데 겉으론 남들 챙기는듯 보이면서도 한편으론 자기것도 손해 안보고 챙길 줄 아는 거 말하는 것 같아요. 근데 전 이게 오히려 무작정 희생하는 것보다 상호적 관계를 할 줄 아는 것 같아서 좋게 보였어요 ㅋㅋ"
INFP,연인한테는 계산적인면 없어보이는데 챈쮸님이 느끼기엔 어떠셨나요?
INTP,"제 전 연인도 계산적인 면 있었던 것 같아요ㅋㅋ 근데 그걸 센스없게 티 안내고 기분 좋게 처세술로 가릴 줄 알고, 그마저도 머리 굴려가면서 하는 게 아니라 특유의 상대방에 대한 배려+공감으로 자연스럽게 숨쉬듯이 나오는 거요!"
INFP,자꾸 뭐라도 챙겨주려고 하는거랑 믿음 주려고 하는거 공감이요 ㅎㅎ 근데 마지막이 뭐 저래요?
INFP,"회피 진짜 싫어요..
엣프제가 우울감성을 이해 못하고 힘들어한다는거에요?"
ISFJ,"결혼한 지금도 연애때랑 같은 거 같네요 🙂
장점
-자상하다(새우같은 거 일일이 다 까주고, 자기는 안 먹고 쌈 계속 싸줌)
-꼼꼼하다(많은 부분에 신경쓰고 있는 듯 해요)
-센스있다(매너가 몸에 배어있고, 타인이 원하고 필요로하는 것이 뭔지 금방 캐치)
-예의바르다(모든 어른들에게 예쁨받는 스타일)
-감정기복이 없다(진짜 감정기복이 이렇게 없는 사람은 처음 봤어요..)
-변함 없이 사랑해준다(기복이 없으니 사랑에도 서로 트러블이 생기지 않는 이상 변함이 없는 거 같아요)
-숨기지 않고 표현한다(밀당같은 거 안 함)
-물욕이 없다(사치 없고 물욕도 크게 없어서 돈을 크게 안 쓰고 열심히 모으는 듯 해요)

단점
-팔랑귀다(타인의 말에 너무 흔들림. 좋다는 거 다 따라하고 안 좋다는 거 절대 안 함)
-계산적이다(가족한텐 안 그러는데 친구나 타인에게는 좀 계산적인 듯 해요. 딱 받은만큼만 해주려 하고 누가 먼저 해주지 않으면 본인도 절대 안 하려는 느낌)
-감정적이다(싸울 때 감정이 앞서서 사람이 바뀌는 거 같아요 😅)
-우유부단하다(본인의 의지대로 행동하는 모습 많이 못봤어요)

제가 느낀 건 요정도네요 ㅎㅎ..!"
INFP,"엣프제 만나고 있는데
장점, 단점 공감해요 ㅎㅎ
사람 자체가 인간적이고 따숩고
너무 매력적이에요
오지랖 넓은 것만 빼면 ㅎㅎ
연인&배우자로서 최고인 것 같아요!"
ESFJ,거의 안하는데... 자신이나 상대가 정떨어질 정도의 실수 했을 때....?
ISTP,"뭔가 I성향이 강하다고 전부 집돌이는 아니더라구요 E성향이 강하다고 전부 밖에만 돌아다니는것도 아니고
조용히 혼자 쉴수 있는 시간만있다면 어디든 좋더라구요 ㅎㅎ I 성향 90~100프로 입니다"
ISFJ,왜 여기서 셀소를 하세요 ㅋㅋㅋㅋㅋ 여기서 여자만나시려고요? 내용 너무공감가고 저랑 완전비슷해서 저인줄 알았는데 소개팅이 답인거같습니다
ESTP,ㅋㅋㅋㅋㅋㅋㅋ 2222
ISFP,"저도 집돌이 입니다만...허허허

일이나 볼일 외엔 밖에 안나갑니다 ㅎㅎ"
INFJ,저도 집순인데~~만약 사랑하는 사람이 집에만 있고 집데이트만 하려고 하고 밖에 나가는 것도 여행도 등등 밖을 싫어하면 너무 싫을 거 같아요.
ENTJ,비슷한 집돌이 집 밖으로 꺼내왔었어요 ㅋㅋㅋ
ISFJ,천불까지는 안나요!
ISFJ,근데 같이 사는 입장이면 좀 답답하다고 생각할수는 있을 것 같아요
ISFJ,"이성이랑 둘만의 시간이라.. 그냥 사람 대 사람으로 호감이든 이성적 호감이든 
조금이라도 관심없거나 안중에라도 없다면 절대 안만나요 적어도 인간적인 호감은 있다고 봐요!
정성스럽게 길게 답장 보내는것도 잇프제한테는 꽤나 많은 에너지가 들어가기에(별 관심이 없다면 정성스레 답장을 할 필요성을 못느껴요 귀찮고요)
텀이 긴건 바빠서 그런걸수도 있고 사바사기때문에 딱 잘라 말하기 애매하네요
확실한건 상대방이 끊었는데 또 답장이 온다거나 이런 행동은 잘 안하는 행동인듯요,,
약속도 잡으셨으니 그냥 답장하지마시고 있어보세요
관심 있거나 할말 생기면 어차피 잇프제는 또 연락 먼저 할거에요
어느정도 관심 있는 티를 내셨다면 잇프제가 눈치가 워낙 빨라서 이미 알고 있을거에용"
INFJ,저두ㅜㅜㅋ똑같아요
INFJ,"잇프제님 반가워요 ㅎㅎ! 궁금한거 몇가지 질문드려요
1. 소개팅으로 한달째 연락중인데 마음없는데 카톡, 만남 이어나갈수있다고 생각하시나요? 예를들어서 거절을 못하거나, 주선자때문에?
2. 상대방 눈치 많이보나요? 예를들어서 이사람이 나한테 관심있는지없는지 신경많이쓰고 그 마음만큼 본인도 마음주는지 궁금하네요!!"
ISFJ,"1. 마음 없는데 카톡,만남 한달동안 못해요(내 시간 아깝다는 생각 들어서 좋게좋게 말해서 거절할 것 같아요)
2. 상대방 눈치 많이 봐요 나의 감정보다 타인의 감정을 우선시하고 생각하는 경향이 있는 것 같아요
다만 이 사람이 나한테 관심이 있는지 없는지 신경쓰는건 잇프제 본인이 관심이 있어야 신경써요
마음주는건,, 내가 좋아하는 마음이 있고 관심이 있으면 속에서는 최대한 퍼주고 많이 주고 싶은 마음이 굴뚝 같은데
상대방이랑 나랑 쌍방이라는걸 알아야 마음을 줄 수 있어요
상대방이 날 관심 없어하면 절대 마음 못줘요.."
INFJ,정성스럽게 답변해주셔서 넘 감사해요 ㅎㅎ 그럼 잇프제입장에서는 상대방이 먼저 적극적으로 관심보이고 그거에 대해 잇프제 스스로 확신을 가져야 잇프제도 다가갈수있다고 해석해도 될까요?
ISFJ,"네! 확신이 있어야 행동을 적극적으로 할 수 있는 힘이 생겨요
적극적으로 표현하시는데 잇프제가 약간 뜨뜨미지근한건 아직 님이 어떤 사람인지 관찰하는중인걸수도 있어요!
의외로 사람에 대한 호불호가 강해서 한달동안 그짓은 못해요"
ISFJ,"남자분이 그쪽한테 호감이 있어서 잘 해줬는데 같은 마음이 될 수 없다는 걸 느꼈나보네요!
잘 챙겨주고 호감을 표시해봤자 관계가 진전이 안되고 그럴 가망이 없으니까 마음을 정리한 것 으로 보여요 
자신의 에너지를 쏟을 필요성을 상실한거네요"
ISFJ,원래 맺고 끊음이 확실한 잇프제의 특징이 나타난게 아닐까 싶습니다!
ISFJ,"1. 주변에 ISTP가 없네요.. 근데 같이 알바할때 제 밥 메이트가 ISTP였어서 그때 기억을 좀 되살려보자면! 
처음에는 다가가기어려웠어요 뭔가 사람이 겉으로봤을땐 감정기복이 없어보여서 차가워보이기도..?
근데 친해져보니 다정했어요! 말도 잘 통해서 재밌던걸로 기억해요

2. 이건 완전 네 상대에게 맞춰요 약간 너가 좋으면 나도 좋아! st에요 상대방한테 맞추는게 내 마음도 편해요

3. 음.. 사바사 같은데 일상대화 하는거 저 개인적으로는 좋아해서 주절주절 하긴 하지만 그게 너무 길게 지속 되면 좀 피곤해요
혼자만의 시간도 필요해서 매번 뭐 하고 있다 하나하나 다 보고 하지는 않는 것 같아요
물론 제가 그렇다는거에요!
일상 공유를 좋아하고 즐거워하는 잇프제는 또 다를 수 있어요"
ISFJ,"잇프제는 다른 사람한테 피해주는걸 극도로 싫어하기 때문에 그냥 잇프제한테 솔직하게 말해주세요
어차피 회사에서 같이 맨날 봐야하는거면 공과 사는 구분을 반드시 해야한다는건데
솔직하게 그냥 내 생각은 이렇고 우리 관계는 이렇게 했으면 좋겠다 말 하시면 완전 불건강에 구질구질한 잇프제 아닌 이상 이해할거에요"
INTJ,"제 입장에서는 별거아닌 질문인데 잇프제 후배는 왜 얼굴이 빨개지고 몇초간 대답을 못했는지 궁금해요
서른살 직장 후배인데 키 얘기하다가 제가 너는 더 크고싶은 생각있어? 했는데
몇초간 얼굴붉히면서 말못하다가 아니요 전 그냥 만족해요~
하던데 이게 뭐 어려운 질문이라고...

잇프제가 보기엔 말도 안되는 상상이라고 생각되나요? in들은 밥먹듯이 하는게 상상인데 ㅋ
솔직히 더 크고싶다고 할줄 알았는데 그렇게 솔직히 말하기가 부끄럽나요?"
ISFJ,"ㅋㅋㅋㅋㅋㅋㅋㅋㅋ왜그랬을까요..?ㅋㅋㅋㅋㅋ
생각지도 못한 기습 질문에 당황한걸까요
그 이유밖엔 떠오르지않아요,,,
후배분이 키가 작으신편이면 그 질문을 듣고 뭔가 정곡에 찔리는 느낌이라 부끄러워서 그런걸수도 있고요!"
INTJ,"아~~ 크고 싶다고 말하는 자체가 본인이 지금 작다고 생각하는걸 인정하는게 되는군요~ 후배는 작은건 아니고 큰것도 아닌 정도...
더 크고싶다고 하면 욕심부리는 사람처럼 보일수 있어서 당황한것 같네요
사람들에게 알리고 싶지 않은 자신의 욕심을 드러낸뻔한 위기를 제가 의도치않게 조성했네요 ㅋ
잇프제의 행동은 숨은 의도 맞추기 퀴즈풀기 부문에서 난이도가 높아서 재밌습니다!"
ISFJ,"ㅋㅋㅋㅋㅋㅋㅋㅋㅋㅋㅋ숨은 의도ㅋㅋㅋㅋㅋ 무슨 말 하시는지 알 것 같아서 너무 웃기네요ㅠ
말씀하신게 정말 맞는말이에요 약점은 너무 들키기싫고
욕심 부리면 자기자신이 겸손하지못한 사람이 된 것 같은 느낌이 들거든요! 겸손 is 미덕...
잇프제를 재밌게 생각해주시다니 감사하네요ㅎㅎ"
ISFJ,에.. 왜 말이 없으실까요..? 연애 시절에도 말이 별로 없으셨나요??
ISFJ,"원래 잇프제가 말수가 없는건 맞고 필요한말을 위주로 하는것도 맞습니다만.. 
일 하고 와서 힘들고 기빨리고 딱히 할말도 없어서 그런거 아닐까요?
먼저 대화 시도 하면 반응은 어떠세요?
저도 말 진짜 없는데 술만 먹으면 말이 많아지거든요 기분 좋아져서ㅎㅎ
그냥 말로 표현을 하는거에 좀 서투신분이 아닐까요?"
ISFJ,"이성이신지 동성이신지 어떤 관계이신지는 정확히 모르겠지만 이성 기준으로 일단 잇프제의 주변에서 눈에 띄어야해요!
그리고 잇프제가 말을 한다면 리액션 같은것도 열심히 해주세요! 그렇다고 막 파워 E 처럼은 말고요
잇프제가 도움이 필요한것같으면 살짝 가서 도와준다던가 그러면서 말 붙여보세요
그러면서 좀 친해졌다싶으면 처음에는 그냥 간단하게 초콜렛.. 마이쮸.. 커피.. 이런걸로 은근슬쩍 챙겨줘보세요
그러면 어..? 이 사람 왜 나한테 이렇게 까지 해줄까 약간 의식하는게 생길거에요!"
ISFJ,"여기에 다 답변할게요!
환자의 입장이시라면 상대방은 의료진이신가요?
친밀감 형성이 어떻게 어느정도로 되었는지가 중요한 것 같아요 어느정도로 되었나요..?"
ISFJ,"우와 저도 의료계열이라 뭔가 내 일도 아닌데 콩닥콩닥한 그런ㅎㅎ 선물의 종류는 전혀 상관이 없어요! 
그저 상대방이 나를 생각해서 선물해줬다는 그 마음 하나면 돼요 좋아할 것 같아요!!"
ISFJ,"호의일 가능성도 없진않지만 사적인 관계로 전환 하는것도 완전 불가능으로는 보이지않아요
마음이 가는대로 하세요 그게 제일 베스트🙂"
ISFJ,"사람을 오래보고 만나는데 스킨쉽..? 음...
제가 생각하는 사람을 오래본다는건 스킨쉽이 포함되지않기는 하는데
썸 3주면 긴건 아닌 것 같아요 더 길게 봐보세요!
저도 사람 오래보고 만나고 신중해서 썸 길게 타는 편인 것 같아요
그리고 음... 이건 기분 나쁘게 들리실수도 있겠는데 아무리 생각해도 신중하고 사람 오래 보는데 집 데려가고 스킨쉽하고 이거는 말이 좀 안맞는것같아서
썅놈인 잇프제면 어장일수도 있겠어요..!"
ISFJ,한달이상이요! 한달반?
ESTP,"소개팅으로 만났고 둘다30대초반이고 제가 남자입니다. 첫만남에 말 편하게하라고해서 말편하게하고있고(소개녀는 존대말합니다. 오빠 ~했어요~ 느낌) 애프터는 가볍게 커피한잔했고 삼프터는 다음주에 하기로 약속은했습니다. 카톡에서 막 재밌게이어지는 느낌은 아닌데 만날땐 좋고요 저보고 자기가 연락잘못해서 미안하다는얘기하길래 카톡 너무 부담안가져도된다는 얘기는 했습니다.

잇프제분들 글들읽어볼땐 나쁘지않은데 아직 2주정도밖에안된지라 좀 천천히가야하는지... 소개팅은 애초에 호감있으면 잘해보자니까 만나보자해야할지? 살짝 고민됩니다 나님 의견부탁드려요!"
ISFJ,"음 원래 잇프제는 노잼인간이라 카톡이 재미없는게 정상이에요ㅋㅋㅋㅋㅋ
연락 잘 못해서 미안하다고 얘기하는것도 의식하고 있고 정말 미안하다는 감정을 느끼니까 하고요
저는 좀 더 지켜보시는걸 추천합니다!!"
ISFJ,적어도 3~4번은 만나보시는거 추천
ESTP,전 진중하고 배려심깊은 모습이 마음에들었거든요 오래보고 만난다는얘기도 했었고 첫만남에 주변에 결혼많이해서 신경쓰인다고도 하고 저도 가볍게만나는건아니라... 천천히가볼게요!
ISFJ,"사람 오래 보고 만나죠 왜냐면 한번 연애하면 자동적으로(?) 모든걸 퍼주게 되버려서..
내가 퍼주는게 안아까운 사람을 열심히 찾는... 그런 느낌이랍니다..!!!
연애를 시작하면 꽤나 다정하고 헌신적인 해바라기를 보실 수 있으니 꼭 성공하시길 바래요!!!"
ESTP,잇프제관련글을 많이봐서... 먼저 결혼준비관련얘기하길래 나이도 30대초반이고하니까 두번째만남때 경제적인부분오픈했거든요 저도 어느정도 준비된편이라 오픈하면서 넘치지는않아도 나도 만남에진지하고 사람일이 어떻게될지모르지만 결혼을 생각하는거면 이부분도 중요할거고 이건 정들고나서 빚더미인거알게되고 하는거보단 이부분은 미리오픈해서 너랑 내가 맞을지 알아가는데 집중하고싶다했더니 먼저 그런거까지 얘기해준거 싶지않았을거같았을거같다고는 하더라구요...(이게 잘한건지 뭔지는 모르겠어요 전 진심이었고 생각나는대로 행동한거라) 그래도 만나자할때 거절은안하니까 나쁘지않네? 하는 무한긍정회로...가봅니다
ESTP,아 참고로 첫만남때 소개녀가 먼저 결혼준비관련 얘기를해서 오픈한거에요~! 집 마련관련얘기가나와서 하다가요ㅎㅎ
ISTJ,"10년 넘게 짝사랑한 여자랑 연애하게되면
좋으면서도 조심스러울까요?
남자친구가 isfj이고 저를 오래 짝사랑했고
그 도중 상처도 받았나봐요
결국 연애하게됐는데
가끔 그때 상처주지 말지 라던가
그런말도하고
다정하고 잘해주는데
상처받을까봐 조심하는거같아서요"
