mbti,comments
ISFJ,"저도 이렇게 헤어졌습니다.
헤어지는 방식이랑 하는 말까지 어찌나 똑같은지 소름이 돋네요.
썸탈때 이전 남자친구가 8년을 만났는데도 카톡으로 이별통보를 했다!라니
'너무 예의없는 행동 아니냐, 우린 헤어지게되도 그러지말자' 이래놓고
전화도 아니고 똑같이 카톡으로 이별통보하더라구요.
말할 용기도 없고 자신도 없다나?
'너는 너무 좋은 여자고 너무 좋은 사람이니 나보다 좋은사람 만나라'라면서요..
차라리 나한테 정이 떨어졌다고 말을 하면 잊기라도 쉬웠을텐데,
헤어지는 순간까지도 지혼자 좋은 사람이고 싶었나봐요.
예쁜 말로 때리면 안아플거라고 생각하나봐요.
저건 진짜 지밖에 모르는 이기적인 행동이고 예의없는 행동이라는 생각밖에 안드네요.."
ESTJ,"ㅎㅎ.. 세상 이런사람 많았던거군요ㅎㅎ 오래사귀면 좀 다를줄알았어요. 짧게 사귄 사이라면, 이럴수도 있겠다했는데.. 제가 아직까지도 남자를 모르나봅니다ㅎㅎ 예의없게 이게 무슨짓이냐 했더니 그냥 계속 미안하다고, 자기가 나쁜놈이라고 그렇게 생각해달라더군요. 점점 잊혀지겠죠 😁 이럴때마다 더 자괴감드는건, 내가 이런남자를 맍났다는거에요ㅎㅎ"
ISFJ,"말로는 나쁜놈이라고 생각해달라면서, 막상 나쁜놈은 되기 싫으니 너는 좋은 사람이다 시전.. 모순이죠.
자괴감이 드는 건 잔상님이 좋은 사람이라 그런 거에요.
저도 사람보는 눈이 없어 이런 남자를 골랐구나 싶어서 자존감 떨어지고 자괴감에 몇 개월을 시달렸는데
이렇게 사람보는 눈이 업그레이드 됐구나, 나 레벨 올랐다. 생각하니 그나마 조금씩 나아지더라구요..
시간이 지나면 확실히 무뎌지긴 해요. 그러니 조금만 버텨봐요!!"
ISTP,어떻게 끝내셨나요 저도 착한척코스프레 당하고 있는 거 같아요
INFJ,"안녕하세요! :)
음... 인프제 입장에서 말씀드리자면, 호감 신호 맞는 것 같아요!

INFJ 특성상 누군가의 고민을 잘 들어주고 해결하고자 하는 성격을 갖고 있어요!
사실 그 성격은 만인들에게 다 통용되는 거라... 단순히 그것만으로 호감이라 하기는 어렵지만,
”장난을 친다는 거“ ㅎㅎ
이 부분에서 약간의 호감을 갖고 있구나라는 점 느꼈어요! 😊

INFJ는 정말 친한 사람어도 장난 치기를 조심스러워하는 성격이거든요 ㅎㅎ

또한, 첨언드리자면...
정말 친한 사람이 아니면 제안도 잘 못하는 성격인데, 제안하시는 거까지 보면..!!

암튼 각설하고, 결론은 호감 맞는 것 같습니다!! 😊"
INFJ,"아 그러셨구나!
저같은 경우에는, 누군가가 고민 상담하고 그러는 거 좋아하는 편이라 이게 다른 분들에겐 호감으로도 보여질 수는 있겠네요.

INFJ가 대체로 고민 들어주고 해결해주는 거 자처해서 도와주려 하는 사람들이 많아서..., 전에 그래도 쉽지 않으셨을텐데 신경 써주셨다니..!
아마 그 안에는 은혜 갚는다는 차원의 의중도 포함되어 있을 거에요! ☺️

말씀드렸다시피, 인프제는 동성에게 장난 치는 것도 좀 못하는 스타일이라, 아마 인픕핍님께 소소한 장난 치시고 그러셨다는 것은 약간의 이성적 호감으로 봐도 될 것 같다는 조심스러운 생각 해봅니다! 🙂

이렇게 된 거 계속 잘 되시길 바랄게요!! :D"
INFJ,"아 안녕하세요! :)
혹시, 서로서로가 많이 친분 쌓으신 상황이신건가요?
그렇지 않은 경우면, 아마 제 생각에는 둘이서 대면하는 것이 부담스럽거나 의향이 크지 않으셔서 그런 것 같아요 ㅠㅠㅠ

아 그리고 첨언드리자면, INFJ가 약속 잡는 건 다른 성격에 비해서 소극적인 건 사실입니다.
아마 약속을 잡아서 먹는 것, 만나서 어떤 거 할 지 먼저 제안을 하시면, 특정 분야에 트라우마가 있거나 그러지 않는 이상 거절 잘 못하고 그거 하자고 할 확률이 높아요!"
INFJ,"아 그러시구나!! ㅠ.ㅠ 
그런 생각이 드셔서 속상하셨겠어요 ㅠㅠㅠ 😭
제가 만약 그런 상황(입장)이었다면,
둘이서 대면했을 때 과연 이 분은 어떤 성격을 가지고 있는 분일까..? 깊게 심사숙고하면서 약간의 부담을 갖거나
또는 그냥 편한 마음으로! 둘이서 보자!
이 둘 중 하나로 생각이 귀결될 것 같아요. :)

매일 연락하실 때, 상대방 측에서 답문은 잘 왔나요?
그렇지 않은 상황에서 대면하자 그러셨다면... 편안하지 않았던 것이라 봐도 무방할 것 같아요 ㅠㅠ"
INFJ,"헉... 그렇구나!!
마상 많이 입으셨겠어요 ㅠㅠ 🥲
연락하실 때 그 분위기였으면, 호감일 가능성이 높아보여요!!
INFJ가 원래 섬세하고 세심한 편이긴 하지만, 관심 있거나 친하거나 용건 있는 사람이 아니고서야 선톡하고 적극적이진 않아서요 ㅜㅜ

제 생각이지만, 그런 분위기였음에도 불구하고 대면이 어려운 게...
아마 외부의 어떤 사정이 생겨서 그런 게 아닌가 조심스럽게 추측해봅니다. 😭

또한 후술하신 다른 분 내용 첨언하자면, 완벽주의자 성격을 갖고 있어서 조심스러운 부분이 있으신 것 같아요.
하루하루 계획적인 INFJ인 만큼, 계획이 틀어지면 힘들어하거든요. ㅠㅠ

힘드셨을텐데, 원하시는 대면 꼭 이루시길 바랄게요! :D"
ESTP,"남자친구가 매 약속마다 책임을 저한테 떠넘기기 하는거 같아서
infj 약속 검색하고 들어왔는데.. 완벽주의 성향때문에 책임전가하는 모습도 보이는구나... 하 ㅜ ㅜ"
ESTP,"앗.. 생각에 비해 텍스트로 표현을 잘 못담기겠지만
매번 본인 일 처럼 생각해주시고 댓글 달아주셔서 감사합니다 :)"
INFJ,"글만 봤을때는일상에 관심을 가지고 있다는 거 부터가
좀 더 알아보고 싶다는거 같은데..

정확힌 내가 어디까지 선을 넘어도 되는가 가늠하는 단계인거 같아 보이네요

일단은 머리론 주도적으로 다 생각해놨지만
혹여나 관계가 틀어질까 최악의 상황까지
보고있는터라 조심하고있는거 같아요"
INFJ,엔티제욤
ENTJ,헉 혹시 어떤 점이 힘든건지 여쭤봐도 될까요..?
INFJ,음 솔직하게 말해도 될까요?? 좀 듣기 불편하실수 있어요
ENTJ,솔직하게 말해주셔도 별로 상처안받아서 괜찮아요~!
INFJ,완고한 완장이랄까요......죄송합니다ㅜㅜ
ENTJ,"어유 두 분 다 강행하는 자아도취 엔티제를 만나셨나봐요 고생하셨습니다..
근데 듣기 불편할 수 있다하셔서 마음굳게 먹었는데 충분히 그럴수있어서 하나도 안놀랐어요 정말 사려깊으시네요.. 알려주셔서 감사합니다 인프제 만나면은 참고하려고 여쭤본 거 였어요 ㅎㅎ
좋은 밤 되세요!"
INFJ,"하핫 정말 클내가 여기까지 풍기시는군요 완고함은 인프제에게 정말 손절 대상 1위거든요 ㅠㅠ 자아도취 엔티제를 만났었나 봅니다. 이렇듯 유형에 대해서 말을 하는 것을 인프제는 사실 밖으로 표현하는 것이 옳지 않다고 생각해서 쉽게 말을 하지 않고, 말을 하더라고 최대한 거르고 거릅니다 ㅠㅠ 얼굴을 마주하는것도 아니지만 마음이 불편하네요 하하 좋은 인사말 감사합니다"
INFJ,"잘은 모르겠지만

어 라고 대답한거 보니 조금 차가운 감정이 있는듯 하네요

손절이면 어 라는 대답도 안왔을거에요"
ENFJ,"인프제는 어장을 싫어해요. 호감이 있었는데 아직 긴가민가 해서 그런걸수도 있어요. 친구 이상으로 생각해본적 없다는 것도.. 음.. 회피성인거 같기도 하고.
하지만 관계를 되돌리기는 어려워보여요."
INFJ,"인프제지만 어장 진짜 싫어합니다.
굳이 따지자면 어장할 에너지도없고 그렇게 사람을 교묘하게 갖고노는걸 극혐하기도 합니다.
일단 인프제라면 어장일리없고,
인프제가 인간 자체를 좋아하면
이게 이성적 사랑이 아니라 정말 인간으로써 사랑하는거거든요.
제 동성친구에게도 얘가 남자애였다면 선넘겠다 싶을정도로 애틋하게 좋아할때가 있는데. 진짜 친구고 사랑입니다ㅋㅋ... 그만큼 글쓴이님을 좋아했다생각하는데. 배신감이 들수있겠죠.
믿었고 좋아했던 사람한테 팩폭을 당했으니.. 하지만 그 이성간의 선은 인프제가 살면서 꼭 배워야할 하나의 관문같은거더라고요. (저도겪었구요)
무튼.""어""라고한거는 손절맞다고 보는데. 인프제 손절이 생각보다 그렇게. 짤없진않아요. 계속 그상태로 둘게아니라 두드리고 진심으로 사과도해보고 풀려고하면 또 그게 안통하지않거든요;;(진짜극혐하는인간빼곤)
무튼 끝내실거면 여기서.
계속하실거면 낯짝두껍게 두드리세요!"
INFJ,어장 자체를 싫어하고 감정소모하기가 싫어요...
INFJ,천천히 스며들거나 아니면 급발진으로 용기내보세요 그게 나을거같아요
INFJ,"제 기준에서도 그분이 오해할만한 행동을 많이 하신 것 같기는 해요

하지만 상식과 기준은 어떻게 보면 주관적인 부분이고
너의 그런 행동들이 나에게는 오해를 줬고 결국 상처를 준거다라고 말을 해버리면

그 다음부터는 그분이 어떤 기준으로 행동을 해야 괜찮은지 모르기때문에
어떻게 지내야할지 잘 모를 수 있는 것 같아요

마음이 힘든 것도 있겠지만 어떤 부분까지가 오해를 안사게하고
상처를 안주는 행동인지 모르겠다랄까요
그래서 마음도 머리도 되게 복잡한 상태일 것 같아요
그리고 본인이 지금까지 한 행동이 상처만을 준 행동이라 생각해서
좀 허무함도 있을꺼고 멘붕상태일 것 같아요

앞으로 계속 보실사이 같은데 한번에 모든 것을 풀려고 하지마시고
조금씩 말없이 자연스럽게 이것저것 챙겨줄만할때 챙겨주면서 가까워지셔야할 것 같아요
지금 현재는 나의 친절함 = 상대에게 상처라는 생각에 어떤 행동을 하기가 어려울 것 같아요
그리고 자신이 이상적으로 그리는 사람관계가 세상의 상식에 부딪힌 느낌도 있을 것 같아요

마지막으로 말씀드리자면 엣팁꾸리포님께 화나고 속상해서 지내가 싫다 이런 느낌은 아니에요
미워한다거나 그런건 아니니깐 그렇게 생각은 안하셨으면 좋겠어요"
INFJ,"다만 엣팁꾸리포님을 미워하는건 아닌데 마주할때마다 아프긴할꺼에요

어떤 사고가 났을때
사고를 낸 사람의 사정을 인정하고 이해하고 그 사람을 미워하진 않더라도
사고를 낸 사람을 보면 사고났던 상황과 아픔들이 자연스럽게 떠오르니깐요

그래서 조심스러운게 좋고
그 조심스러움이 나의 아픔을 그나마 존중하고 이해해준다는 생각이 들 것 같아요
적극적으로 어떻게든 해결하려고 한다면 나의 아픔을 존중받지 못한다는 느낌이 들 수가 있는거죠
그래서 조금 긴 과정이 될 것 같아요
다만 느리지만 어쨌든 시간이 흐르면서 기억이 좀 더 희미해질꺼고 새로운 기억들로 그 자리들이 채워질 수는 있겠죠
다시 회복하고 싶다는 마음은 좋지만 너무 과하면 엣팁꾸리포님이 빠르게 지치실 수도 있을 것 같아요"
ENFJ,"가까이서 보면 1인분 몫은 잘 하고 마음이 여리지도 않고 감정기복도 잘 없고 믿음직 스러워요.
다만 멀리서 보면 ISFP, ISFJ랑 별 차이 없어보입니다. (두각이 보이거나 튀는 스타일들이 아니죠)"
ENFJ,뭔가 칼같고 정없어보이지만 친해지면 나름 뜨끈한 사람같음.
ISFJ,그런가요? ㅠㅠ역시 헤어지고 나서는 회복이 오래 걸리는군요..
ISFJ,제가 안그래도 엔프제냐고 물어봤을때 사람을 좋아해서 엔프제라는 오해를 받긴하는데 절대적으로 인프제라고 하네요 ㅋㅋㅋㅋ 역시 초반에 적응 잘하라고 케어해준거군요… 만약 이성적 호감이었다면 본인이 연애중이었는데 그럴수가 있나? 라는 제 S 성향의 생각이 드는데 인프제들은 보통 연인에게 절대충성이지 않나요??ㅠㅠ
ISFJ,"맞아요 이친구 취미 활동이나 여가시간에 사람들하고 시간 보내는게 더 좋다고 한것도 보면 E 성향이 확실히 있는것 같아요~챙겨준건 역시 교회라는 테두리안에서의 환경적인 영향이 크군요..! 제가 혹시..? 라는 생각이 든게, 저 혼자서 관찰을 한결과 다른 이성이나 동성들한테도 저처럼 챙겨준걸 많이 못봐서요 ㅋㅋㅋ 어쨌든 이친구덕에 잘적응했으니 감사해야겠어요!"
ISFJ,맞아요 저도 인프제가 절 인간적으로 확실히 좋게 보고 있다고 생각해요!! 저도 인프제의 인간성이 먼저 호감으로 다가왔구요 :) 이젠 제가 호감과 호의를 구분하는 일만남았네요 ㅎㅎㅎㅎ
ISFJ,엇 아뇨 사이비 아니구 이친구가 저 말하기 전부터 이미 같은 교회 등록해서 다닌지 이제 거의1년 되갑니다 ㅋㅋㅋㅋㅋㅋ걱정해주셔서 감사해요!
INFJ,저는 진짜 질문 폭격기인데 말이에요😄😄😄
INFJ,맞아요ㅠ 제가 쓸데없이 넘겨짚어서 생각하는 스타일이라... 그냥 질문 하면 되는데 눈치를 보게되네요😅 그래도 이 댓글 읽고 위안이 되었어요 감사합니다😌
INTP,선생님.. 팁좀요..ㅜ
INTP,"나이차도 나고 쉽지않을거같아서 아직 뭐 시도 조차 안했긴 했어요..조심스러워서...ㅜ
슨생님 말씀 함 믿고 기회봐서 해보겠습니다. 장문 답글 감사합니다."
INFJ,대체 어떻게 당햇길래 자존감까지 떨어지는지 궁금하네요..ㅠㅠㅋㅋ
INFJ,"안녕하세요 :)
INFJ 남자 입장에서 말씀드리자면, 스며드는 게 나은 것 같아요!
바로 돌직구로 들이대면 부담스러워 하실 수도 있어서요 ㅠㅠ

그리고 좀 애매하다 싶으면, 스며들긴 하되, 돌직구로 들이대는 것처럼 하시면 좀 나으실 거에요!
(스며드는 것과 들이대는 것 중간)

INFJ 자체가 생각이 많아서, 스며들기만 하면 굉장히 오래걸릴 수도 있거든요..!
그래도 갠톡까지 왔다니, 아주 관심이 없진 않은 것 같고, 지켜보고 계신 건 맞네요 :)
잘 되시길 바랄게요! :) ㅎㅎ"
INTP,"제가 자기 좋아하는거 눈치깟다고 건너서 들었는데..(갠톡온날 저녁에 저 없는 모임자리서 말했다함.사람들없을때 )근데도 딱히 뭐 연락 안오고 하는거보면, 피드백이 없다면 여자로서 안느끼는 거겠죠....?"
INFJ,"헉... 근데 섣불리 말씀드리기가 조심스러운게 사람 성향일 수도 있어서.. 😭
음... 아마 그 남자 분은 속으로 저 여자 분이 날 왜 좋아하지?
어떤 면에서 나에게 호감 갖는 걸까? 라고 생각 중이실 것 같아요.
친분이 많이 쌓이지 않은 상황일 경우에 저라면 좀 당황스러울 수 있을 것 같네요. ㅠ.ㅠ
그런 경우가 아니라면, 아마 본인을 좋아하는 이유에 대해서 속으로 반추하고 계실 겁니다!
좀 더 천천히 기다려보시고, 많이 친분 쌓고 이야기 많이 나누다보면 좋은 결과 있으실거에요! 
응원할게요 :D ㅎㅎ"
INTP,감사합니다..ㅜ
ENFJ,아이궁 ㅜㅜ 정말 많이 지쳐계신걸까 싶네요~ 근데 또 힘들다고 동굴에 들어가는 타입은 아닌지라... 먼저 연락해보시면서 손을 내밀어보는건 어떠신가요? 저는 갠적으로 잠수로 사람 끊는걸 매우 무례하다 생각해서 절대 그러지 않습니당
ENFJ,흠 먼저 물어보세용! 연락 주라 했는데 안 오는거면 기다려도 올 확률만 희박해질거같아요! 눈팅 할정도면 그렇게 힘든거 아님
ENFJ,음 그냥 걱정되고 궁금해서 연락했다고 솔직하게 말하면 될거같아용! 꼭 다시 잘 되시길 바래요 ㅋㅋ
ISFJ,이성의 어떤점이 꽂히고 끌려하는지 궁금해요
ENFJ,어렸을 땐 저와 비슷한 감성적이고 재미있는 것에 끌렸다면... 요즘은 좀 제가 가지지 않은 면모가 많은 분에게 끌립니다. 이성적이고 간결하고 반듯한 사람이 좋죠! 참고로 전 STP컬렉터입니다...친구도...이성도...
ENFJ,기억했다가 챙겨주신다구요....? 생각만해도 눈물좔좔입니다....................님같은 친구면 완전 좋죠......................부럽다
ISFP,한번상처받은말들은 오래가는편이신가요?
ENFJ,네 아마 관짝 닫기전에 하고 싶은말 있으시냐 하면 귀에대고 속삭이고 죽을수도 있을지도....
ISFP,헉. 그럼 상처준분과 친구를다시하실수있으세요????ㅜ
ENFJ,음 먼저 왜 그랬는지 물을거같아요! 그래서 납득+사과에 진정성이 느껴진다 하면 회복할수도있을거같아요. 음... 근데 전 없는거같아요! ㅋㅋㅋㅋ
ENFJ,어...........상처를 사실 잘 안 받고 진짜 심한말만 기억합니다.... 너가 뭐 말해도 알아? 최근엔 이 멘트였던거같네요....
INFJ,"2
2
o
진심이 담긴거라면 무엇이든 좋아요"
INFJ,"1. 1번이요! 변화를 힘들어하는 저의 부족한 부분을 같이 채워나갈 수 있음 좋겠어요
2. 2번이요. 짝사랑 수준이 아닌 친한 사람 정도여도 남한테 상처 받는 거 그냥 두기 싫어요. 의견 무시하지 않는 선에서 조언해주면서 기댈 수 있도록 도와줄 거예요.
3. X 근데 제 스타일은 안 바꾸더라도 관련 대화는 조금씩 꺼내서 할 것 같네요
4. 어떤 내용이든 좋지만 자신의 생각이 솔직하게 드러나는 글이었으면 좋겠어요. 부족한 부분을 얘기하면 곱씹으며 고치면 되고 좋은 부분을 얘기하면 두고두고 간직할 것 같아요ㅋㅋㅋㅋ"
INFJ,"연애 상대 : 내가 의지할수있는 사람(희망:2) 현실적으로는 1(챙겨주다보니 그렇게 되는거 같습니다)

짝사랑 :  짝녀가 좋아하는 사람을 계속 지켜보다가 너무 상처받는게 보이면,, 현실적으로 슬슬 스며들려고 노력할거같아요.

O
 
이런 에피소드로 인해 내가 너에게 더 도움을 주고 성장시킬수있게 도와줄게 나하고 같이 할 수 있는 기회를 줄 수있을까? 뭐 이런식이면 좋은거같아요. 그리고 저는 신뢰와 진심을 중요시여겨서 상대방의 솔직한 심정도 편지로 더 써주면 좋을거같아요"
INFJ,"2
2
X긴한데 기억해 놓고 관계가 진전되면 조금씩 바꿔볼만할 거같네요
거짓이나 가식적인건 좀 그런거같아요"
ISFP,"제가 아는 엔프제랑은
계획도 다 짜서 이끌어주고
말 많고, 활기차고 뭔가 코드도 잘 맞고
그래서 환상의 짝궁이엇어요.
그냥 잇프피의 단점을 매꾸는 느낌?"
INFP,역시 저희는 FJ를 만나야 하나봐요 ㅎㅎ
ISFP,"그런데 싫어요🤣
너무 만인의 연인이었어요. ㅋㅋㅋ
연인인지 친구인지 헷갈릴 지경이었어요"
ISFP,만인 연인이 연인 기준 제일 기피대상인디...ㅜ
ENFJ,"주변인이 거의 잇프피인데 전적으로 동감..
서로 생각차이가 많은데 동의는 하면서 서로 고집부리는.."
ENFJ,잇팁이 더 생각이 얕고 적지않나요?
ENFJ,오홍 그렇구나! ㅎㅎㅎ 역시아르테님 👍🏻
ENFJ,"ENFJ와 ISFP가 잘 맞는다는 것은 일반화 오류를 범할 수 있다고 생각이드네요~
(MBTI로 사람을 구분한다는 자체가 이미 모순이긴하지만...ㅎㅎㅎ)


제가 경험하고 대화를 나누었던 ISFP 유형의 사람들 보면. ""잘 맞는다"" 보다는 ""나쁘진 않네""가 더 많았던 것 같아요.

오히려 ISFP 보면서 수동적이고 자기 주관 뚜렷하지 않고, 속 꿍꿍이가 있는 것 보이는데 애써 없는 척하고, 괜찮은 척 하는 모습들이 정직하지 않다는 이미지들이 강했어요."
ENFJ,잘안맞는뎅..
ENFJ,"저는 잘맞는다고 생각해요.
그냥 잇프피 성격 자체가 제가 좋아하는 성격이에요(이성으로서)"
INFJ,"저도 윗댓분들이랑 같은 생각하면서 글 읽으면서 내려갔는데, 팍팍 다가가세요! 약속도 먼저 잡으시고, 그럼 어?어?? 하면서 딸려 올 것 같아요.."
ENFJ,다가가세영 ㅎㅎ 준비도한거보니 마음있는듯
ENFJ,"연락이 잘 되는 것을 좋아합니댜
연락이 잘 안되면 미리 이러이러한 이유로 연락이 늦을거 같다고 말해주면 이해합니다"
ENFJ,"참다가 참다가 결국 폭발해서 너 나랑 연락 계속 이어나갈래? 아니면 끊을래? 한적이 있습니다
그냥 직구로 저는 물어봤어요"
ENFJ,"썸타는 사이거나 연인이면 연락 잘 되는게 좋아요. 별 다른 이유 없을 경우에요! 사전에 이유를 알고 있는 경우라면 이해할 수 있어요.
친구는 뭐... 그럴 수 있다고 생각해요.
썸타는 사이에서 연락 잘 없으면, 마음에 없나보다~ 하고 알아서 포기하는 느낌이에요."
ENFJ,"생각해요!
그런데, 상대편이 기다릴지도 모르니까 사전에 미리 연락 못한다는 이야기를 해주는 건 나의 연락을 기다릴 상대방의 시간에 대한 배려라고 생각해요.
그리고, 썸타는 관계에서부터 안 맞는데 굳이 연애를 해야하나...? 싶기도 하구요 ㅎㅁㅎ"
ENFJ,"20대에는 제가 일부러 안받을때도 있었던것 같아요
컬러링 들어달라고^^

좋아하는 사람들에게는 부재중만 봐도  
연락이 와있으면 좋아합니다^^ 

연락와서 수다떠는것도 좋아해요

근데 제가 먼저 전화로. 연락하는거는 잘 안하는편이예요 카톡이 생기고 나서는
카톡으로 생각을 장문의 메세지로 가끔 보내고 그래요.

이래이래서 연락못했어. 
그럼 거의 믿고 이해하는편이예요"
ENFJ,"좋아하는 사람과 연락 잘 되면 좋됴! 해서 연락에 민감한 편입니다.. 그렇다고 연락 왜 안해!! 라고 강요하기보다 답장 텀 보면서 혼자 배려하려고 생각해요.
처음엔 바쁜가 싶지만 그게 잦아진다거나 길어지면 저에대한 마음이 없오지는구나 라고 혼자 생각해요. 그러면서 저도 맞춰서 늦추거나 하는데, 그럼에도 좋아하면 답 빠르게 하려고 합미다. 늦으면 상대가 오해안하게 왜 늦었는지도 이유 알려주구요"
ENFJ,연락안되면 마음이 그정도구나 생각해여 ㅎㅎ
ISFP,아직은 생각 중인거 같아요 다시 연락하지 마시고 일단 기다려보심이ㅠㅠ
ENFJ,넵 쪽지주세용!
ENFJ,"네네^^
쪽지주세용"
ISFP,쪽지 드렸습니다~~
ENFJ,답장드력어용
ISFP,추가 쪽지드렸어요ㅎㅎㅎ
ISTJ,저도 쪽지 드렸습니당 🙇‍♂️
ENFJ,답장드렷어요^^
ISTJ,감사합니다!! 추가 쪽지 드렸는데 혹시 확인해주실수 있나욥
ISFJ,다들 쪽지를 ... 어떤 엠비티아이랑 궁합이 잘맞앗나요 아니면 성향? 성격
ENFJ,"동성과 이성이 다른데요!
동성은 가장 잘맞았던건 enfj랑 infj라고 생각되구요

이성으로는 istp 이었어요 ㅎㅎ"
ISFJ,오 istp? 어떤점이 잘맞으셨어용
ENFJ,가장 솔직하고 책임감있었고 완전 사랑꾼이었어요. 표현도 잘하고 자신보다 저에게 엄청 사랑을 쏟았거든요!
ISFJ,아하 연애하고나서인가오? 하기전은 어떤점에서 끌리셨는지 궁금해여
ENFJ,"연애전부터 사실 엄청 표현했고, 너무 금사빠식으로 달려들어서 좀 의심했는데, 그래도 일단 저를 너무 좋아하는게 느껴지고 남자답고 외모도 제스탈이었고
자신이 좋아하는것들을 얘기하는것이 멋있어보였어요
또 연하인데, 보통 연하는 금방 말을 놓는데, 꼬박꼬박 존댓말했고 허세가 없어보이는게 좋았어요"
INFP,"잉프피남자에요
혹시 지금도 쪽지상담 받으시나요..?"
ENFJ,네에!! 쪽지로 오픈카톡이런거 보내쥬시거나 카촉아이디 주셔두 되용
INFP,쪽지드렸어요!
ISFP,다정하지만 생각보다 만인에게 그래서…
INFP,음 그럼 친구정도로 곁에 있어주면 좋겠어요 ㅋㅋㅋㅋㅋ
ENFJ,저 인프피가 주뵨에 왜없죠🥹
INFP,제가 생각하기에 최고의 조합 같은데 ..!!!! 🥹
ENFJ,"맞아요 천생연분이라고 하잖아요!
저 주변의 있는 인프피를 제가 잘라냈어요 ㅜㅜ 너무 자기 위주로 행동하는 불건전한 사람이라
근데 좀 이기적인것뿐이지 천성은 정말 착한 사람이라고 느끼기는햇어요!
달이님은 여자분이시죵??"
INFP,네 저는 여자요 ! 아마 불건강 인프피였나봐요 ㅜㅜㅜ 워낙 천성이 예민해서 … 환경이 힘드니까 다크 모드로 바뀌어서 자기만 지키려고 했는지도 모르겠어요
ENFJ,"제가 말을 하면 자뀨 끊고 자기 말만햇거든요
그래서 조심스레 너무 내말을 끊는거같다고 하니까
응 원래 나그래~ 근데 어떻게해 나이먹어도 이러는데~ 못고쳐 ㅋㅋ
이런식이여서 ㅜㅜ 결국

그래도 정말 말끊고 자기위주만 하는거아니면 대화눈 잘통햇는데 ㅜㅜ"
