mbti,comments
ESFJ,내 엣팁이는 보고싶다가도 했다가 오늘봐 했다가 그렇습니다 ㅋㅋㅋ
ISTP,"보고싶다니 보여는 준다만 커텐은 니가 까라
(보고싶은건 너니까 네가 수고해라 ㅋㅋ)"
INTJ,저는 이글보고 배우네요..너무 솔직하면 안된다는걸..
ISTP,저라면 같이 연락 안 할 거 같아요. 속상할 순 있는데 사랑까지 가기 위해서 노력하는 게 아니라 삐져서 단절하는게 사랑인가요.....홀랑 깰 거 같아요. 10일만에 사랑이라니...
ENFP,"222
생각이 어리고 이기적인듯.."
ISTP,음 istp도 사랑한다는 덥썩 말 잘 안하는데 ㅎㅎ 아마 님을 많이 좋아하시나봐요
INTJ,"아니 보통 잇팁이 저렇게 말하는데 ㅋㅋㅋㅋㅋㅋ 솔직히 저는 10일째에 물어보면 저도 똑같이 답하거든요..? 10일째인데 막 사랑하고 그런게 가능한지.. 저는 한달동안은 좋아한다는 감정은 확실했고 한달 넘어가면서 아 이게 사랑이구나 싶었거든요
그리고 진짜 사랑하면 저 말을 듣고 삐진다기보단 이해하면서 진심으로 사랑하는 관계가 되기 위해 더 노력하지 않나요? 저 사람은 왜 삐져가지고 그러는거죠;;;; 어이가 없어요.."
ISTP,22 보통 잇팁이 저렇게 대답하는데ㅋㅋ 사귀기 전까지 어떤 과정이 있으셨는지 모르겠지만 잇팁 입장에서 당연히 사랑한다는 표현이 나올 줄 알았나봐요. 예측이 깨져서 기분상한 것 같은데 저라도 10일 사귀고 사랑한단 말은 안 나와요😅
ENFJ,"잉....??30대 중후반인데...??
저렇게 급발진 한다고...??어우...글쓴이님 속상함이 저까지 느껴지네요.,"
ISTP,"30대 중후반이시라는 나이에서 문득 미혼이 아닌 경우일 수도 있겠다는 생각이 들었습니다.
혹 그런 상황이라면, 잇팁이라는 성격 유형보다는 놓인 처지와 상황으로 인해 글쓴님의 대답이 섭섭했거나 못미더웠을 수도 있겠다 싶고요...
그런 상황이 아닌데, 남자분이 저런 태도를 보이신 것이라면, 님이 기대하시는 것보다 아마 아주 많이 정신적으로 성숙함이 부족한 사람이지 싶습니다.
상황에 대한 판단에 도움이 되길 바랍니다."
ISTP,"ㅋㅋㅋㅋ어이가 없네....
10일만에 사랑한다는 표현을 바란다는게 너무 성급하고 어린 것 같아요. 점차 사랑이 커져야하는데 저런식으로 나오면 커져가는 사랑도 짜게 식을 듯."
ISFP,"좋아해 도 아니고 사랑해요? 나에 대해서 뭘 안다고 벌써부터 사랑해? 너무 뻔한 거짓말이예요. 마음속에 없는 말 하면은 오히려 그게 더 별로인거같아요.
저희는 딱 18일째 되서야 더 마음 확인하고 속삭였는데 10일째는 너뮤 이르지않나 싶어요"
ISTP,"뭐지 ㅋㅋㅋ 글쓴님이 잇팁같은데 ㅋㅋ
표현에 약한 잇팁인데 그분은 10일만에 사랑느꼈나봐요 ㅎㅎ"
ISTP,"10일 만에 사랑 이라니 .. 헐.. 그걸 가지고 화낸다니.. 나이 30대 중반인데 그정도면
정신연령이 초딩 인데요 빨리 알아서 다행입니다 얼렁 헤어지세요
만날수록 피곤하고 기빨리겠는데요"
ISTP,걍 내버려두세요 너무 일방적인것같아요
ESTP,결혼해도 똑같을걸요..?
ESTP,222ㅋㅋㅋㅋㅋㅋㅋ
ESTP,냅두세용 원래그래요 ㅎㅎㅎㅎㅎㅎㅎ
ISTP,"항상 붙어 있으실려고요??
남친이 enfp라 고민이 되는구만요^^"
ESTP,쉬고싶다하면 쉬게해주세요 ㅎㅎ
ENFP,아 stp분들 다 공통사항이군요 ㅋㅋㅋㅋㅋㅋㅋㅋㅋㅋ 아 왜 킹받지ㅋㅋㅋㅋㅋㅋㅋㅋㅋㅋㅋㅋㅋㅋ
ESTP,개인 시간이 필요한거죠 연락은 서로 조절만 잘하면 협의가능한 부분이니까 저도 물론 귀찮으면 유튜브나 넷플보고 나중에 잠들었다고 합니다만ㅎ
ESTP,원래그래요 ㅋㅋㅋㅋ 그래서 전 남친이랑 같이 살고 각자 유튭봅니다 ㅎ
ENFP,"제여친이랑 같으시네여ㅜㅜ
결혼 아니면 답이 없어 보여요"
ISTP,오 저도 그랬어요 ㅋㅋ 마음이 커지셨나봐영 ㅋㅋ
INTJ,와 저도 이느낌이라 싱숭생숭 했는데 어쩌면 다들 겪는 자연스러운 감정일지도..
INTJ,저도진짜동감ㅎㅎㅎ글 올려주셔서 다른 분들도 그렇구나를 깨닫고 가네요
ENTJ,"저도 같은 경험이 있어서 ㅋㅋㅋㅋㅋㅋㅋㅋㅋㅋ 지금 돌이켜봐도 절대 미남 아니거든요. 비율도 안좋고 ㅋㅋㅋ
전 한번도 잘생겼다고 한적 없어요. 제가... 엄청난 얼빠라서 엔간해서는 잘생겼다, 예쁘다 생각 안하기도 하고;;;"
ENFJ,"신기하다.. 저는 겸손한 사람을 좋아해서 그런지 남들이 다 잘생겼다고 해도 그 말자체를 민망해하구 안좋아하는 사람만 만나봤는데, 자기애가 엄청 뿜뿜인 분인가봐용"
INTJ,제가....... 객관적으로 예쁜 편은 아니지만...... 애인에게 제발 예쁘다는 소리 좀 해주면 안 되냐는 부탁까지 했습니다........... 왜냐고요..? 남들한테 예쁘다는 소리 들으면 뭐해요........ 내가 좋아하는 애인한테 못 듣는 예쁨이 무슨 소용입니까... 현실 타협하고 나 만나나? 라는 생각까지 했어요
INTP,개지랄ㅋㅋㅋㅋ
INTP,"저는 제일 중요하거나, 시간이 좀더 급한거부터 준비해요. 저도 하나에만 몰두하는 편이라 여러개 한꺼번에 하는것보다는 하나 끝내고, 하나 끝내고 이러는 편이에요"
ENTJ,"만기일이랄까 마감일이랄까의 순서대로 일단 나열하고, 그 중에서도 가장 빨리 해야할것들을 먼저 합니다.
그런데 이 만기일 또는 마감일의 시기가 다 비슷하고 우선순위의 선별이 어렵다면 일별 시간표를 대략 작성해요.
학교 다닐때 시험공부 하듯이 그 일별 시간표에 맞춰서 차근차근 하는거죠."
ENTP,"3가지를 제 기준으로 순서 매기면
면접준비-돈줄인데 가장 중요하죠!
자격증시험-이력서 적을거리로도 의미있지만 일종의 증명서 역할도 되죠
어학공부-언제든 할 수 있는 거니깐"
ISTP,잇팁 인팁은 전혀달라요 현실감각능력자체가 전혀다름 사고도 너무다르고.. 인팁은 자기만의 세상이있고 잇팁은 간섭과 선넘는걸 싫어해 독립적이고 비슷해보이지만 전혀다름
INTP,잇팁 인팁 진짜 완전히 달라요 ㅋㅋ
INTP,그건모르겠어요…
ISTP,저도 궁금해요 대체 왜?? 왜… 일주일에 세 번만 만나도 되는데 왤까요
ISTJ,"와.매일 어떻게봐요 10대면 인정 ㅋㅋㅋㅋㅋ
그럴 에너지가 있으신분들 신기하네요 부럽 ㅋㅋㅋㅋ"
ISTP,저도 너무 좋고 맨날 보고 싶지만 사실 출근 하면 맨날 보는 걸요… 맨날 데이트는 무리죠
ISTP,ㅋㅋㅋㅋㅋㅋㅋㅋㅋ 매일우유도 아닌데 정말… 어떻게 말해야 기분 안 나빠할까 걱정입니다
ISTJ,아 씨 유머 너무 내취향 ㅋㅋㅋㅋ ㅋㅋㅋㅋㅋㅋㅋㅋㅋㅋㅋ
ISTP,서로 퇴근 시간을 아니까 좀 더 그런 것 같아요
ISTP,"저녁먹고 커피먹고 정도로 보고 헤어진다면 괜찮을 수도...?
근데 저는 매일보자고는 안할 것 같아요. 연인이 매일보자고하면
맞춰줄 수 있는정도? 근데 그러면 주말은 좀 놔줘라...."
ISTP,주말도 봐야 한대요 대체 왜 이럴까요? 이 텐션 그대로 쭉 이어지지도 않을 것 같은데
ISTP,"나이가 많이 어리신가요? 아니면 잇팁이 아니신가 ?.....
매일보면 서로 지치고 힘들텐데
특히 주말은 좀 쉬어줘야 일도 하고 그러져..."
ISTP,"20 초중반이에요, 저는 잇프피잇팁 사이고 그분은 극잇팁입니다 그래서 더 이해가 안 가요 찐사라도 이정도로 하나요? ㅋㅋ큐ㅠㅠ…"
ISTP,"음.... 저도 20초 쯤엔 잇티제였는데 매일 보긴햇거든요
아직 사랑에 체력이 짱짱하신 분인가봐요 그 잇팁분은...ㅎㅎㅎㅎ"
ISTP,내일은 빠르니까 모래보잔 사람이 생각나네여 이게 딱 보고싶어하는거 같으면서 좋아요
ISTP,너무 좋은 말인데요… 마음 준비 할 시간도 주고 보고 싶다는 사실은 전달 하고
ISTP,전 쌉 가능.. 그래서 사내연애 넘흐 조은뎅..
ISTP,내용 다 체치고 애인이란거 자체가 바운더리예요
ISTP,아... 그런거예요? 몰랐어요 ㅋㅋㅋㅋㅋ
ISTP,물질적인건 아직 없던데요 ㅋㅋㅋ
ISTP,"오... 10번은 저도 감동인데여
확실히 많이 좋아하고 있으신거같아용"
ISTP,네.. 완전 감동였죠
ISTP,네 전 돌직구요 원래 저 좋다고 먼저 고백하는 사람 싫어해요 제가 먼저 좋아야 해서...
INFP,"초반모습 지금 제남친이랑 똑같은데
그냥 묵묵히 뭐라 안하고 기다리는게 답인가요? ㅜㅠ"
ISTP,전 대화를 많이 했어요
INTJ,평소에 어떤 데이트 선호하시나요? 데이트 스타일??
ISTP,"남친이 저 만나기 전에 긴장된데요 이게 무슨말일까요? 설레인다가 아니고 .. 긴장이라니...
ㅋㅋㅋ"
ISTP,"그런거겠죠? 제가 ""나 사랑하는구나?? "" 하고 답장보냈더니 더 모르겠는 임티만 보내줬어요 ㅋㅋㅋㅋ"
ISTP,저 모르게 챙겨주고 그런건 있는데요 대놓고 표현은 안해요
ESTP,펑!
ESTP,쪽지드렸습니다!
ESTP,"마자요 항상 새롭고 자극적인거 ㅋㅋ
여자랑 남자랑 같은가 싶었는데 비슷하네요!
감사해요!"
ISTP,저는 확 타오르고 식을 연애면 그럴 것 같네요!
ISTP,그쵸 상대가 누구냐에 따라 다르겠죠?
ISTP,제 기준 일주일에 한번은 좀 적고 2-3번 보는게 애정도 유지에 좋은거 같아요
ISTP,찐사랑이라면 안 식을수도 있죠!
ISTP,일부러 애 타라고 하는거 잇팁이 눈치채면 애가 타는게 아니고 좀 싫을거 같은데…밀당은 잇팁한테 금물이요ㅠㅠ
ISTP,상대방 마음이 이정도 사이즈밖에 안 되네? 하는게 느껴지면 본인 마음도 그렇게 줄어드는 편이라…
ISTP,맞아요 밀당금지 그리고 말로는 또 표현안해서 속으로 멀어지는 중일수도
ISTP,아파서 그런거면 상관없죠ㅎㅎ
ISFP,사바사인것같아요~ 잇팁남친이랑 일주일에 두세번보다가 장거리하게 돼서 지금은 한달에 한두번 만나고 있는데 아직 애정전선 문제 없네용ㅎㅎ
ISTP,부럽네요 저희도 잇팁 잇프피 커플인데 저희는 뭐가 문제인지…🤔
ISTP,대충 가망 없어보이거나 각이 안나온다 싶으면 일찌감치 포기하는거 같아요
INFJ,엣...팁...ㅠㅠ
INFJ,그냥 엣팁들이 부러워서요 ㅠ(?)
INFJ,말을하기 시러하게끔 ㅋㅋㅋ
ESFJ,만나본 사람중엔 엣팁이요 진짜 하나도 안져줘요 절대 안져줌
ISTP,인티제 엔티제
ISTJ,진짴ㅋㅋㅋㅋㅋㅋㅋ 너무 신기해요
ESTP,전줄알았네요 ㅋㅋㅋㅋㅋ
ISTJ,거 이러시는 이유가 있을거 아니에요.. ㅋㅋㅋㅋㅋㅋ
INFJ,엣팁의 실행력은 진짜 미친매력이에요☺️
ISTJ,진짜 ㅋㅋㅋㅋㅋ 너무너무 신기한 매력...!!
ISTJ,유죄인간 엣팁 잇팁.....
ISTJ,ㅋㅋㅋㅋㅋㅋㅋㅋㅋ몇날 몇일을 고민하고 비교하다 결국 안사는 저에겐 너무 신세계ㅋㅋㅋㅋ
ENFP,저는 부탁하지도 않은 걸 저렇게 해주다 욕먹었네요 ㅋㅋㅋㅋㅋㅋㅋㅋㅋㅋㅋㅋㅋ
ISTP,잇팁이ㅜㅡ공감능력이 없긴해요ㅜ근데속마음은 따뜻해요.. 츤데레. ..표현받는건 좋아하면서.본인은 표현하는걸 못하는편이긴해요.또라이같은유형ㅡㅡ;;;;
ISTJ,저 근데 첫번째보다 두번째 예시가 더 편해요. 첫번째 벌써 기빨림 ㅋㅋ ㅋㅋㅋ
ISTP,저도 생각이 참 많은편이라 잇팁남친이 어렵습니다. 어제는 한없이 좋다가 오늘은 왜 저래? ㅋㅋㅋㅋ 알다가도 모르겠는 잇팁 단순하다는데 단순하지 않은것 같은 잇팁 ㅋㅋㅋㅋ
ISTP,아하... 그래놓고 나보고 감정기복 심하다고... ㅋㅋㅋㅋㅋ
ISTP,이말 공감해요
ISTP,잇팁을 만나는 잇프제는 참 힘들군요^^
INTP,가스라이팅은 아닌데 사람 대 사람으로 결이 안 맞는 거죠ㅜ.ㅜ 저라도 거북할 것 같아요.. 사회성을 얼마만큼 길렀냐도 크게 작용하는 것 같습니다...
ISTP,오~ 너무 잘 표현하셨어요. ㅠㅠ
ISTJ,와.. 소름이에요. 진짜 똑같습니다. 저는 잇팁하고는 안 맞나봐요 ㅠㅠ
ENFP,좋아하는거랑 연락은 별개죠?
ENFP,좋아하는 맘이랑 연락은 별개죠?
ENFP,연락 안한다고 안좋아하고 그런건 아니죠?
ENFP,좋아하는 마음이랑 별개죠?
ESTP,연락에대한 큰 중요성을 잘 못느껴요
ENFP,좋아하는 거 연락하는 거랑 별개죠?
ESTP,네!
ISTP,전 그냥 초장에 승부나는거 같아요
ISTP,맘에 든다고 다 먼저 움직이진 않고 일단 적어도 피하진 않습니다! 상대 템포에 맞추거나 좀 땡겨보는 정도?? 연락도 잘 하고 질문하고 등등
ISTP,넹 사귀고싶다 내지 사귀어도 괜찮겠다라는 생각이 드는 거 같아요 기회되면 여러 번 보는게 나은거 같고 급할 필요는 없는데 굳이 천~천히 알아가 볼 필요까진 모르겠어요
ISTP,3주 정도에 3-5번 정도면 안 루즈해지고 괜찮지 않을까용 연락 계속 하구요
ISTP,전 초장에 승부나는 쪽이요 썸 보통 짧게 타고 사귀는 편이에요 전
ISTP,저두 초장에 승부납니당~!
ISTP,초장입니다.
ISTP,얼굴보고 1분이면 답나와요
INTP,네.ㄱ2주면모.그때의 선택이 맞다고 생각하시구 열심히 본인일.취미하시다보면 잊혀지실꺼에요!
ISTP,잘해써요ㅋㅋ
INTP,"위로나 칭찬에 서툴러요 솔직히 말해서
솔직히 저도 받는거도 주는거도 불편해서ㅡ 풀어주지도 못하고 상대방이 풀어주려 다가오는거에도 고장납니다
그냥 냅두는게 제일 편해요"
ISTP,아뇨? 전 제가 알아서 풀리기를 기다려요.
ISTP,"아마 님이 말씀하시는 '제대로 풀어주는 법'을 모를 확률이 커요,, 받아들이시는 게 속 편하실지도 하하,, 아님 본인이 화났을 때 이렇게 대응하라고 매뉴얼처럼 말해보세요 (물론 그걸 받아들일지 말지는,, 잇팁 맘 ㅠ)"
ENTP,연락안하는게 끝장 보는거아닌가요
ENTP,"최대한달이라고 생각하고 똑같이 회피해 보세요
일주일 지났는데도 연락안오면
그냥 그 사람은 그정도인거죠..
정말 소중하면 어떻게 회피하겠어요"
ISTP,누가 잘못했냐를 떠나 상대도 기분이 상한 상태라면 먼저 연락 안 할 거 같아요 ㅜㅠ
INTP,방법은 이혼뿐 ㅠㅠㅠ
ESFP,부부상담 받아보세요ㅎ그럼 서로 조금 나아지던데..ㅎ
ESTJ,혹시 실례가 안된다면 결혼한지 얼마나 되셨을까요??
ESTJ,아 저는 삐진모드(?) 이걸 하고 싶어도 말하지 않으면 참을 수가 없어서... 다이렉트로 항상 말하거든요ㅠㅠ 그리고 제 냉담한 태도를 남편이 눈치 못채거나 모른척한다고 느끼면 그것조차 바로 말해서...ㅎㅎ 제 남편은 제가 잘못을 짚으면 사과는 잘 하거든요.. 잇프제님도 그냥 맘 상할 때 바로바로 말해보시는건 어떠실까요? 본인 잘못이라는걸 인지하면 사과하지 않을까요 ㅠㅠㅎㅎ I-F 이시면 잇팁의 무심함이 힘드시긴 할 것 같아요..
ISTJ,"저는 isfp한테서 비슷한 감정을 느꼈는데요. 그래서 참 무심하다. 정말 모르는걸까? 모르는 척 하는걸까? 둘다 문제다 싶어 헤어진 까닭도 있는데요. 심지어 헤어지고 붙잡을때도 그 문제를 언급하지 않더라구요. 정말 궁금해요. 제가 잘 삐지는(징징대는) 성격이냐고 물어도 그것도 아니라고 하는데
""뭣땜에 속상했어?"" 묻는게 어려운 사람들이구나... 싶고... 그것도 용기죠. 제가 속상한거 말하는것도 용기고... 둘 다 용기가 없을 뿐 ㅠ ㅠ"
ISTJ,감사해용!!
ESTP,일상생활 사진보내고 (음식/친구만난거/뭐하는지) 뭐 먹는소리 음성메세지 보내는데 이것도 호감이에요..?
ESTP,근데 갑자기 읽씹하는 이유는 뭔가요?
ESTP,아하! 감사합니다!
ISTJ,과하지않게 적극적인 스타일 여자 vs 얌전한 여자
ISTP,잇팁은 호감 없으면 선톡안하나요? 호감있어도 친한사이가 아니면 못하나요?
INFP,세네번 정도요
ISTJ,20번이상 ㅜㅜ
ENTP,1년에 0번이요
ISTP,어디안가고싶어요..
ISTP,"네 정확히는 에어컨 나오는 우리집...
주말 외출이란 동네 커피 맛집에 테이크아웃하러 5분이면 충분합니다"
ISTP,집이 최고네요..
ISTP,바다요
ISTP,소환사의 협곡이요
ISTP,집가고싶어요
ISTP,구석진 피시방이요
ISTP,롤 밖에 안해서 .....
ISTP,집이요.
ISTP,"집이 가장 좋지만, 기분 좋으면 어디든 갑니다. 단, 멤버가 좋으면 장소가 어디든 상관없어요."
ENFP,"오우 4가지 정반대네요
잇티제 분께서 많이 사랑해주실 거 같네요
저도 혼종이되어갑니다"
ISTP,"축하드립니다.
이해관계에서 나랑 틀리다가아닌 다름을 이해한다는게 힘들거같아요.
이상 술에 절은 잇팁 입니다."
ENFP,그러나 다름을 인지하고 있지만. 잇팁은 수용 안하죠ㅎㅎ
ENFP,"악 동의합니다......
엠비티아이는 편가르고 싫어하기위해 있는게 아니고 이해하기위해 있는 것인데.."
ENFP,맞습니다 존중할 줄 알아야 됩니다ㅎㅎ
ENFP,"경험한 것만 믿고요, 본인이 어떤 것을 확신하면 그게 항상 옳다고 믿어요"
ESTP,제가 엔프피 만날때 똑같았어요 뭐 할래?? 뭐 먹을래?? 오빠는?? 오빠 먹고 싶은거 난 다좋아 이래서 제가 계속 말을 하니까 나중에는 애는 자기 주장이 없나?? 이런 생각도 들고 말을 하면 싫어하는건 티를 내길래 그럴거면 너가 정하라고 싸운적이 있었네요 ㅋㅋ 가끔은 엔프피님도 자기 주장은 확실히 해주는것도 좋은듯 서로 티키타카가 되야 한다고 생각합니다
ISTJ,여친은 해벌쭉하고 있으니 사탄인가 싶네요 < ㅋㅋㅋㅋㅋㅋㅋㅋㅋㅋㅋㅋㅋㅋㅋㅋㅋㅋㅋㅋㅋㅋㅋㅋㅋㅋㅋ개격공ㅋㅋㅋㅋㅋㅋㅋㅋㅋㅋㅋㅋ
ENFP,표현없고 무미건조한 잇팁이 해주는 칭찬은 사막의 오아시스와도 같습니다ㅋㅋ
ISTP,두분다 멋있으세요.
INTP,콩깍지 얼마나 가나요?
INTP,오 저도 평생갔으면... ㅎㅎ 행복하셔요
INTP,안예뻐요ㅎㅎ 예쁘면 실컷 보라고 하겠죠
INTP,귀엽다고 해요ㅎㅎ 거짓말 못해서 예쁘다고는 안하네요
INTP,네 근데 저는 빤히 쳐다보지도 않고 웬만하면 혼자 속으로 판단해요. 외모보다는 말이나 행동을 분석하고요.ㅋㅋ 그래서 상대도 제 외모 하나하나 뜯어보고 분석. 평가할까봐 부담스러웠어요
ENFP,똑같이 말꼬리 잡고 늘어지고 이게 제 입장에서는 너~~~~~~무 피곤해요 ㅠㅠ
ENFP,"저는 장난으로도 남 때리는게 싫거든요?! ㅠㅠ 오은영 쌤 말로는 그것도 습관이 되고, 서로 장난으로 치다보면 강도도 점점 쎄진다고 하더라구요... 아예 싹을 잘라버리게 차분하게 정색하면서 말했는데 그걸로 꿍한듯"
ENFP,흠... 네! 만약에 또 한번 장난으로 그러면 매운맛을 보여주겠습니다...ㅡㅡ 군침이 삭 도네요...
ISTP,쌩까세요.없는사람취급해주세요..싹싹빌게
ENFP,맘 같아서는 기차타고 친정가고 싶은데 배터리 얼마 안남은 폰 하나 덜렁 들고 나와서 그러지도 못하네요 ㅠㅠ 그리고 잇팁들 왠만해서는 싹싹 비는 성향도 아닌듯요
ISTP,자존심에 빌지는 못하지만.ㅈ눈치는봅니다ㅋㅋㅋㅋㅋㅋㅋㅋㅋㅋㅋ
ENFP,그건 그래요 ㅋㅋㅋㅋㅋㅋ
ENFP,집에 오니까 맘편히 쳐주무시고 있네요🤗 꿀밤 한대 쎄게 갈기고 싶네요 ㅎㅎㅎ
ENFP,평소엔 엄근진 자체로 밖에서는 완전 진중한 엘리트 이미지에요ㅡㅡ;;; 결혼한지 1년 되니까 본성을 보여주는가 싶고...
ISTP,친구 만나러 가시죠 한잔해야죠!
INFP,앜ㅋㅋㅋㅋㅋ
ESTP,전 후폭풍없었어요 잔잔한파도는있었지만 엄청힘든적없음
INFP,오..신기해요 역시 엣팁
INFP,전남친 estp 였는데 헤어지고 차단하니까 1년 반동안 계속 전화왔었어요 6개월 정도 지나고 한번 전화 받았는데 너무 힘들다면서 울더라구요 estp지만 되게 잘 울고 감성적이었어요 암튼 후폭풍 오는사람도 있네요
ISTP,답장을 너무 안했네.... 싶을 때 답장해서 그런가 봐요 허허허
INTP,님의 행동에 지쳤고 화가난듯해요.그래서 도망가고싶고 놔주고싶은?좀더 시간이 필요하지않을까요
ENTP,"본인일이 되면 상대방말이 잘안보이게 되더라구요.
제가보기에는 실망했고 너는 나를 안중에도 생각하지 않았고 그래서 내가 힘들었다! 라는 내용같구요.
첫번째는 실망한이유
두번째는 해결방법을 알려준것같습니다.

날 불안하게하고 놀거다놀고 나를 좋아하는것같지않아!
너가 스스로 너의 연인이 그렇게 행동한다면 괜찮겠어? 스스로 챙피하지 않을까?
너가 잘못했다는걸 찐으로 받아들이고 나한테 굽히고 들어온다면 받아줄수있어.
잘못했다고 하는게 자존심상할수도 있지만 날 만나고 싶다면 그렇게해야해
날 불안하게했던 모습을 고친다면 우린 잘지낼수있어!
라고 해석됩니다."
ISTP,결과들이 궁금해요 ㅋㅋ
INTP,저 잇팁성향도있는데 이거나오네요.N과S가 60.40이래서.
INTP,저는 인팁맞네요.결과
INTP,잇프피ㅎㅎ
ISTP,오 저도 이거요 ㅋㅋㅋ 근데 잇팁성향이랑 좀 다른것 같져?ㅋㅋㅋ
INTP,요건엣프피ㅎㅎ
ISTP,엇 이게 진짜 잇팁같아요 ㅋㅋ
INTP,오.요게 잇팁결과네요
ISTP,저도 배고픈햄스터 나왔어요 ㅋㅋ
ISTP,저도 이거 나옴
ESTP,저도 이거나옴 ㅋㅋ
ISTP,잘못된거같은데요..
ENFJ,헐 ㅋㅋㅋㅋ신기해요!!! 저는 역시 엔프제로 나왔네요~
ISTP,엔프제 성향 같나요?ㅋㅋㅋㅋ
ENFJ,"네, 완전요~~ㅋㅋㅋ"
ENFJ,ㅋㅋㅋㅋㅋㅋㅋ
ISTP,저 예전엔 j였거든요 그래서 이렇게 나오는듯
ISTP,엇 이거진짜istj네요 ㅋㅋ
ISTP,인팁나왓다ㅏ ㅋㅋㅋ
ISTP,햅스터 나왔어요 ㅋㅋㅋ
ISFP,저는 잇프피 잇팁 반반 인데 이렇게 나와요
ISTJ,좋아하는 감정에 대해 의심해본적이 없으신건가요 ㅠㅠ?
ISTJ,답변 감사합니다.
ISTP,네 마자요 얘 없어도 괜찮겠네? 싶으면 헤어지려고 하는 편 입니당! 제 소중한 하루하루를 에너지 낭비하는 데 쓰고싶지않아용
ISTJ,허 .. 맘아프네여 약간 생각하는거랑 마음에 대한 확신이 저랑 많이 다른거같아요 ..
ISTJ,ㅋㅋㅋㅋ 저도 비슷한거같아요 .....
ENFP,제 친구(잇팁)가 그런 시기가 있었는데 사람이 여유가 없을 때 그런 거 같더라구요.. 건들면 삐뚤게 대답하고 ㅠㅜ 그럴때 주위가 조큼 힘들긴 하더라구요
ENTP,지금은 장거리지만 7년 봤구 저한테 사귀자고 했고 마음은 잘모르겠대요...ㅜ
ENTP,잇팁 너무 어려워요ㅠㅠ
ENTP,끊어내려고도 해봤는데 어떻게든 연락이 오더라구요...ㅠ 그러면 또 흔들리고ㅠ
ISTP,"저같은경우는 의심되어서 확신을 못하겠더라구요
상대방에 대한 의심이라기보다
그냥 관계변화에 따른 나중의 후폭풍이라던가
내마음이 금방 식을거같고 .. ㅋㅋ"
ISTP,내 옆에 있는 사람이 어느 날 갑자기 이별을 고한다면 슬플까? 아니..? 슬프겠지만 금방 극복 가능 할 거 같은데? 이런 생각하면서 내 마음이 어느 정도인지 측정해보거든요. 이 사람 없어지면 한동안 나 진짜 슬프겠다. 라는 생각이 들면 나 꽤 좋아하고 있나 보다 생각해요.
ISTP,이 사람의 유/무가 내 인생에 큰 영향을 미칠까? 정도로 생각하는 거 같아요.
ENTP,그래서 인연이 끊어지는건 싫어하는것 같아요...ㅠ 근데 자기마음은 모르겠다고ㅠ 어렵대요...ㅠ
ENTP,맞아요 사랑이란게 엄청 큰건줄알더라구요 그래서 사랑인줄 모르는건지ㅠㅠ
ISTP,제 잇팁이 저한테 느끼는 게 이런거구나 싶네요.
ENTP,저도 엔팁인데 제 글이랑 제목까지 비슷해서ㅐ 깜짝 놀랐어요 ㅋㅋㅋ
ENTP,저도 엔팁! 엔팁이 잇팁이 어려워하나봐요ㅠㅠ
ENTP,저는 아쉽지만 정리하려고 맘 먹었네용 ... ㅠㅠ
ENTP,진짜 잇팁마음알기가 정말 어려운것같아요ㅠㅠ 애가타요ㅠ
ENTP,그럴때 어떻게 이사람을 좋아하는구나 사랑하는구나를 알게될까요?
ISTP,7년인데 그런다고요..? 만난지 얼마 안됏으면 아직 감정을 다 받아들이지 못해서 그럴 수 있다곤 생각했는데.. 편안한 연애를 많이 안해보셨나..
INTP,계속 만나셨어도 맘고생하셨을거같은데 잘된일이라고 생각하세요 배우자로서는 좀..진짜 시간만 허비하고 나이만 찼을거같아요
ESTP,저도 엣팁인데 저랑 다르네요. 쓰신 글을보니 잘 헤어지신것 같습니다.
INFP,똥차 잘 거르셨네요~
ISTP,인정!
ISTP,저같으면 없을거같아요 잘안된후엔 마음정리가 싹되는편이라
ISTP,이성적일수록 더 그럴거 같아요 작성자분도 4시간이면 힘들어요 ㅠ 포기하시는게
