mbti,comments
ESFP,제 전남친 잇프피가 같이잇을땐 잘하는데 떨어져만 잇으면 연락도 많이안하고 말로 표현도 안하고 그래서 제가 처음엔 나 서운하니까 표현좀해줘... 라고 말을 했는데도 안고쳐져서 참다참다 헤어지자고했어요. 엣프피는 떨어져있어도 말한마디 표현해주고 연락잘해주면 안서운해하는데 질려할까봐 연락을 많이 안했다면 그건 쓸데없는 배려일거예요~ 저는 제가 무슨 사랑을 구걸하는느낌이 들기시작하니까 마음을 접게되더라구요 같이잇을때만 잘하는건 엣프피는 크게 의미없어요. 전 같이안잇어도 연락한통 더 해주고 애정표현 말한마디만 해줘도 사랑받는다는느낌들어서 만족해요 편지도 좋아하겠지만 그냥 카톡이든 전화든 길게아니여도좋으니 틈틈히 하면서 표현해주시는게 더 나을듯요~
ISFP,이미 헤어지자고 했으면 답은 없을까요? 너무 가슴이아파서 후회가돼요.. 편지로 진심을 담아도 불가능할까요?
ESFP,"헤어진지 얼마 안되셨으면 다시 연락해보세요
그래도 좋아했기때문에 엣프피는 진심으로 연락하고 자주 연락하면 다시 마음돌리기도해요~ 저도 전남친이 제가 헤어지자고하고 5일뒤에 다시 잘 만나고싶다고 연락왔는데 처음에는 안받아줄것처럼 쌩하게 답했지만 거기에 같이 기분나빠하지않고 자주 연락해서 마음표현해서 다시 만났었어요 대신 다시만난뒤에 또 원래패턴으로 돌아가면 굉장히 실망하고 그러면 정말 마음접어요"
ISFP,"정말감사합니다 혹시 시간을 2주정도 기다렸다 하면 괜찮을까요?
아니면 계속 카톡을해도 부담느끼지 않을까요?"
ESFP,"2주면 엣프피는 마음정리해요
엣프피는 빠르면 빠를수록좋아요 마음식기전에... 연락자주하라는게 엄청 많이보내라는게아니라 하루에 뜨문뜨문이라도 계속 나 너 생각하고잇다 느껴질정도로 보내시라는거예요 ㅎ 집착하는건 또 싫어하거든요~"
ISFP,아 정말감사합니다ㅠㅠ
ESFP,잘되시길 바랄께요~ 엣프피가 정이많아서 진심으로대하시면 다시 잡을수있어요~ 그리구 엣프피들은 호구같은 사랑꾼스타일이라 본인이 사랑받는다 느끼고 좋아하는마음잇으면 진짜 잘해요 표현많이해주세요 ㅎ
ISFP,네 진짜 진짜 재회하면 아낌없이 다 줄거에요ㅠㅠ 감사합니다
ESFP,연락텀 긴거때문만이 아니라 그거포함이예요 잘될땐 바로바로 칼탑하다가 갑자기 안읽씹하고 한시간뒤에 올때도잇고 세네시간만에 할때도잇고 텀은 들쑥날쑥이예요... 그나마 제가 얘기해서 요즘은 한참잇다 답와서 빨래하고왔다 뭐하고왔다 얘기하긴하는데 가기전에 얘기할순없나 그것도 속터지고... 애정표현이 너무 없어요ㅠㅠ 잇프피는 닥달하면 부담준다고 더 멀어진다길래 참다참다 열받아서 물어보면 좋다 너랑 잘 만나고싶다 이렇게 대답하고... 주변에 사람많이안두는거 알지않냐며 자기말고 내가 누구를 만나겟냐고 그러고...귀차니즘 엄청 심하고... 그게 저랑 너무 안맞아서 속이터져요ㅠㅠ
ESFP,말할때마다 정말 아주 쪼~금씩 나아져요... 처음이랑 비교하면 세달째인 지금 많이 좋아지긴했는데 제가 욕심인건지 그냥 둘의 속도가 안맞는건지 가끔 현타가 오더라구요... 연락하는건 연애초반보다 지금 횟수도 많이늘고 전화안하던사람이 전화도하고 지금 뭐하고왔다 얘기하는건 확실히 좋아지긴했어요... 제 성에 안차는건지 아님 제가 희망을가지고 착각하는건지 잇프피를 처음 겪는거라 너무 궁금해서 글쓰게된거죠결국...ㅠㅠ
ESFP,"저도 참 생각안하려고하는데 자꾸 생각하게 되더라구요... 근데 정말 말씀이 맞는거같아요 저렇게 발등에 불떨어지기전에 잘해주면 얼마나 좋을까... 제가 아쉬운 부분이거든요ㅠㅠ
그래도 댓글을 진심으로 써주신거같아서 너무 감사해요! 저도 저렇게하니 이번이 마지막기회다 생각하고 해보고 아니면 정말 접으려고하거든요~ 잘 생각해서 이야기 나눠볼께요!"
ESFP,네~ 유심히보고 말씀해주셔서 감사해요! 저도 잘 풀렸으면 좋겠어요!^^
ISFP,"ㅋㅋㅋㅋㅋㅋ 😆 😆 😆
그냥 저라고 대입하고 대답해드려요 ㅋㅋ"
ISFP,"ㅋㅋㅋ 몇몇분 의견 종합해봣는데요.
그냥 진짜 너무 종잡을 수 없어서 그렇다더라구요 ㅋㅋㅋㅋㅋ"
ISFP,"ㅎㅎㅎㅎㅎㅎㅎㅎㅎㅎ
종잡을수 없는게 매력이란건가요? 허허.."
ISFP,"그러게요. ㅋㅋㅋ 재미도없고 표현도 안하고 그런데...
엠헬에 아무리 물어도 종잡을 수 없는데
벗어날 수 없다던데요? ㅋㅋㅋㅋ"
ISFP,"허허허허 그렇군요 벗어날수 없다 ?

뭐.....결국은 매력쟁이인건 확실하네여"
ISFP,그것이 바로 잇프피
ISTP,잇프피 뭔가 강아지같은 이미지.....
ISFP,"그렇군요 잇프피는 인간 고양이 라던데요?

아니면 말구요"
ESFP,"제 경험상 상냥함 a, 상냥함 B 라는 것이 있다면 isfp는 상냥함 A에 올빵하고
상냥함 B가 부족해서.. 하지만 A가 B가 부족한걸 가려주는 역할? 그래서 어찌저찌 좋은사람이니 이어가는.. 그런 느낌이었던거 같습니다..........."
ISFP,"타로 님은 상냥함, 좋은 사람에 빠진거군요?

알겠습니다"
ESFP,넵 상냥함 스텟자체는 다른 사람들보다 훨씬 높아요!!!! 근데 상냥함을 기대햇던 부분 몇군데가 아쉬운 그런거겟죠?? 그래도 착하고 상냥하니깐ㅎㅎㅎ
ISFP,"그렇군요?

잇티제 잇프피 어울리는 구석이

있나보네요?"
ISFP,연구요? 실험용 쥐가 제발 아닌 잇프피를 살ㄹ.......
ISFJ,"인간 고양이 같아요,,,
다가가면 멀어지고,, 가만히 있으면
다가오고ㅋㅋ"
ISFP,"흐흐흐흐흐

그렇긴 하죠 잇프피는 인간 고양이가 맞아요

스트레스 받고 힘들때 그냥 마냥 가마안히 놔두면

알아서 풀고 나타나죠....허허"
ISFJ,"맞아요, 옆에서 왜그래~ 그럼
더 도망가더라구요
귀엽긴 한데 어려워요ㅜㅜ"
ISFP,"왜그래~ 하면 내가 이러는거 싫어하나? 싶어서

살짝 서운할것 같습니다"
ISFP,"아.......

네......

그런 글이 되게 많더라구요

저희 유형분들도 분명 매력쟁이지만

쉽지 않아요 ㅎㅎ"
ISFP,"잇프피도 잇프피 본인을 알 수가 없네여ㅠ
제 성격 좋은 점도 있지만 단점도 있는 것처럼
모든 사람한테 장단점이 다 있는건데
ISFP때문에 고민글이 많이 올라오는거 보면 약간 맘아파요ㅠㅠㅠㅠㅠㅠㅠ"
ISFP,"저도 저를 모를때가 있지요ㅠㅠㅠ 저도 고민글 보면
마음이 너무 아픕니다"
ISFP,"그쳐 저만 그런게 아니였어요ㅠㅠㅠㅠㅠㅠㅠㅠㅠㅠㅋㅋㅋㅋㅋㅋㅋㅋㅋㅋㅋㅋㅋ
제일 많은 성격을 보유하고 있는 느낌.."
ISFP,마음은 아프지만 힘내보자구욧 ! 빠이팅!
ESFP,정말 예측하기 어려워서 자꾸 묻는듯해요 ㅋㅋㅋ 전 더구나 잇프피남친을 처음만나봐서 더 헷갈리더라구요😂😂
ISFP,"그렇군요 흐흐

역시 저희 잇프피 역시나 종 잡을수 없는 분들이라 하하 ;;

잇프피 남친분과 이쁜 사랑하세요"
ESFP,"안그래도 좀전에 글올렸는데...ㅠㅠ
일주일전에 헤어지자고 했는데 또 붙잡혀서 못헤어지고 있어요...하...
잇프피정말 멀어지려하면 자꾸 못가게하고 이거 맞는거예요?ㅎㅎㅎ"
ISFP,"그래서 인간 고양이 라고 하는겁니다 ㅎㅎㅎㅎㅎㅎㅎㅎㅎ

왜 그래요? 헤어지지 마세요

잇프피를 좀더 염탐 해보아요 ㅎㅎㅎㅎ"
ESFP,"잇프피들 특징보면서 좀더 참고 알아보자 좀더 기다려보자.. 수십번 생각하다가 보살되기직전이예요ㅠㅠ
제 글 한번 보시구 잇프피입장에서 얘기한번만 해주세요🥹"
ISFP,"글...다 읽었습니다

제 입장에서 말씀 드립니다

초반글에 남친분이 표현 했는데 모르는거다 라는거는 반짝님 눈치가 없었던거 아닐지요......

아니면 마음을 몰라줫던 것인지요?

걱정해주고 신경써달라 애기는 했었네요......반짝님이 무신경 했던거 같습니다

스킨쉽 엄청 좋아한다, 등 긁어주고 쓰담쓰담, 이건 남친이 사랑받고 있어서 기분좋다 뜻 같네요

스킨쉽 좋아해서 변태다 싶을정도, 좋아하니까 하는거다 안좋아하면 누가 하느냐,

스킨쉽 수위를 어디까지 남친분이 하셧길레 이럴려고 만나까지 가셨는지?(근데 이건 밀당 아닙니까?)

잇프피는 밀당 안좋아하는지라........... 좋으면 좋고 싫으면 싫고 여서요.......

연락텀 긴거는 잇프피 대부분이 귀찮니즘 때문에 그런건데 이 특성이 싫으면 절을 떠나시는게 나을지도 모르겠군요

니가 날 좋아하지도 않는거 같다, 솔직히 혼자만 사랑 느낌이 강할수도 있는데요.....

이건 반짝님이 너무 강요하는거 같다는 기분이 듭니다 스며들어야 되는데 그게 아니고 불도저로 밀고 나가시려고만 해서....

표현을 하는데 저만 못 알아 듣는걸까요? 솔직하게 네 그런거 같습니다

글에 뜻을 나름대로 해석해서 썻는데 반짝님 입장에서 잘 받아드리셨나 모르겠네요

저의 입장에서 작성 해봤습니다"
ISFP,"그래서 잇프피 하고 연애 시작하시는분들 글 보면
다른 성향 분들과는 다르게
난이도가 부쩍 높다 라고 야기하시는거 같습니다
허허허.."
ISFP,"네...
그런말을 절이 싫으면 중이 떠나라 라는 말이 있죠

연애는 MBTI 떠나서 서로 맞는 사람끼리 사귀는게

맞는 이치 같습니다"
ISFP,"잇프피라고 다 같진 않고 조금씩 다르니...

속을 알수있는 잇프피도 있을것이고 그렇지 않는 잇프피도 있을것이고

그런거니 잇프피 일반화는 좀 자중해주시는게 어떠신지요......"
ISFP,"같은 잇프피면 눈치만 계속 볼것 같은데

같은 잇프피면 둘중에 하나라도 고백해야합니다

눈치면 보고 끝나버리면 허무할거 같아요"
ISFP,한 번 말이라도 걸어보는게 어떠실가욥
ESFP,"제 전남친 isfp는 여자 하대하는 막말은 안했고
정말 티나는 거짓말 많이 했었네요...ㅋㅋㅋ 그걸로도 많이 싸웠었는데... 끝까지 사람 화나게 변명으로 화 돋구고...
ㅠㅠ 하지만 이별 후에 자기 나쁜사람 아니란 얘기하려 굳이 말걸어오진 않았습니다. 왜저럴까요? 저러진 않았습니다.ㅋㅋ
제가 여러번 헤어지자 했었고, 변명과 붙잡는 말만 했었지. 마지막도 제가 헤어지자 하고 전남친은 안잡고 서로 연락안합니다 ㅎㅎ"
INFP,"맞아요 너무 티나는 거짓말...
뭐 자기도 모르게 저를 많이 상처준거 같다며
상처 주는 자신이 겁나서
앞으로 연애 못할거 같대요 ㅋㅋ

아니 그럼 제 입장에서는
상처 주는 말을 하지를 말던가 싶네요^^;;;

후 변명 심하고, 너무 회피형 성향이 큰거 같습니다.."
ESFP,mbti를 떠나 앞으로 연애 못할거 같다는 새빨간 거짓말은 추후에 새 연인이 생기죠
INFP,맞아요... 연애 못할거 같다=본인 좋아하는 여자가 없을거 같다 그래서 그런듯해요
ESFP,"제가 봐도 그런거 같아요~ 저도 제가 들이대서 만난 사이였지, 자기가 연애를 하기엔 많이 불안정한(?) 상태라는걸 보여줬었거든요.
그래서 연애를 좀 오래 쉰것 같았구요. 저란 사람이 나타났으니 만난거고 아마 연애할 생각은 없었던듯.....
저도 헤어진지 얼마 안됐습니다. 사람이 굉장히 착하단 이유로 질질 끌었네요..."
INFP,"와 저랑 비슷해요..
제 전남친도 늦은 나이에 첫 연애하고 제가 두번째 연애예요.
자기는 살면서 결혼 못할거 같았다 이런 말 많이 했었고..
저도 사람이 말만 저렇게 하지 착하니까..
그렇게 남은 전남친에 대한 마지막 기대감?으로 계속 만남과 헤어짐을 반복했었어요.

그런데 도저히 '몰라서 그랬다'로는 이제 감싸줄 수 없는 막말 지경에 이르러서.. 후 헤어졌습니다."
ESFP,"남에게 관심이 별로 없는건지, 전 초반부터 마지막까지 저에 대한 관심이 별로 없었어요.
물론 자기 얘기도 거의 안하고... 그래서 저는 전남친이 몇 번 연애했는지 모릅니다 ㅋㅋ
아마 제 연애도 잘 모를거에요.
저도 잡을때마다 이 사람이 날 좋아하긴 하는구나 싶어서 계속 기대하고 기회를 주고 그런거 같아요.
자기 가족과 친구를 소개해주고, 먼 친척까지도 다 인사돌렸고 '결혼해야죠'라며 저에게 믿음을 주고...
하지만 가면 갈수록 저한테 무신경했고, 같이 있어도 아무 것도 공유하지 않고.. 그냥 밥만 먹는 사이?
ㅋㅋㅋㅋ 쌈마웨이인가 뭔가 드라마 안봣는데 릴스로 짤막하게 보다가 딱 제 내용 나오더라구여
데이트도 안하고 아무 것도 안한다고........... 같이 밥먹는데도 혼자 다른거 보면서 먹고.......
결혼하면 진짜 완전히 우울증에 빠져 외로워서 죽겠구나 싶어서 나왔네요 ㅋㅋㅋ ㅠㅠ
글쓴이분도 고생하셨습니다 ㅠ 엣프피 특성 뛰어놀기 나가놀기 참느라 진짜 힘들었어요 저는 ㅋㅋㅋㅋㅋ"
INFP,"저희 둘다 너무 고생많았네요 정말ㅠㅠㅠ
저도 이대로 만나다가는... 제 자존감이 넘 떨어지고
스트레스 엄청 받아서 헤어졌어요.
이번이 진짜 마지막이다 하고 재회한거였는데
이제 나이도 있고 사람 쉽게 안바뀌네요.ㅋㅋ
제 전남친도 초반에 약간 의도적으로 나한테 관심을 안두는건가? 싶을 정도로 심했었어요.ㅋㅋ
저에 대한걸 기억 1도 못하고..
마음이 너무 여리고 불안정+상처도 잘받아서
오히려 더 본인 기억을 지워버리는가 싶더라고요.
그러다가 이제 좀 가까워지나 싶었는데
가까워지니 막말에 후...
너무 심한 스트레스를 줘서 ㅋㅋ 헤어졌네요.
저희 얼른 나쁜 기억 잊어버리고
좋은 사람 만나요!!!"
ESFP,"그래요 화이팅입니다ㅠㅠ
다음엔 리드하는 남성분 만나려구요... 진짜 나 혼자 연애해요..."
ISFP,"불건강한 isfp인거같아요.
연락끊는게 서로에게 좋아보여요"
INFP,네 저도 그게 서로에게 맞는거 같아요.
ISTP,"나한테 피해 안가는 선에 거짓말이거나 내가 화나게 했는데 참으려고 화 안났다고 하는 그런 거짓말은 그러려니하는데 그런게 아닌거 같고..

그거뿐아니라 굉장히 모든면에서 수동적인 사람이였을거 같네요..!! 사람이야 단점은 다 있지만 그걸 극복할만한 장점이 없는 사람인거 같네요ㅜㄴ"
INFP,"네.. 여사친 거짓말 문제였고,
가까운 사람에게 막말, 가스라이팅..
오히려 밖에서는 더 잘하는 사람이었어요.
본인에 대한 낮은 자존감? 때문인거 같기도 하고
안좋은 기억 잊어버리려고요.ㅠㅠ"
ISFP,"잇프피들은 상대가 바라보는 ""나"" 를 좀 중요시 하는거 같아요 뭔가 이미지 관리하는..?
근데 양심도 없네요 지가 잘못해놓고 주저리 변명 늘어놓는 모습을 보니ㅋㅋㅋ"
ISFP,"네 그냥 옆에서 지켜주세여.
본인이 이해하고 받아들이고
잇프피는 혼자 다 처리해야되요"
ISFJ,"모진말들 해도, 제가 잘못 한거니까
모두 들어주고, 말없이 안아주는데,,
한번씩 훅 올라오나봐요,,
그냥 묵묵히 들어줘야겠네요ㅜㅜ"
ISFP,"아니요. 그렇다고 잇프제님
본인은 깎아내리거나 상처받진 마세요.
연인도 중요하지만 본인의 행복도 챙기셔야죠
서로 행복하자고 하는 연애자나요 ㅎㅎ
너무 오냐오냐 하다보면
자꾸 더 그러니까 ㅎㅎㅎ"
ISFJ,"힘들면서 놓지는 않으니,,
더 미안하고 고맙고 그래요
어찌하면 좀더 나아질까 생각도 하게되구
이렇게 누군가를 많이 좋아해 본적이
없어서 더 그런가봐요😧"
ISFP,"제가 전 연인과의 사이에서
가장 후회하는게 모진말하고 상처준거에요
얼마나 상처였을지, 힘들었을지
그 사람도 제생각만 하고 자기는 못챙기고
오히려 그 생각에 마지막엔 잡지도 못햇어요
얼마나 큰 상처였을지, 힘들엇을지 생각에
잇프피가 자기 시간이 필요하고 하지만
잇프제님도 한번씩 자기만 생각하고 돌아보세요"
ISFJ,"어떤 상처들이든,
기억속에 문득 문득 남아 있고,
완전하게 잊혀지는건 아니겠지요
노력은 많이 해주고 있는데
워낙 속마음을 이야기 하지 않는 사람이라,,
걱정이예요;.;"
ENTP,엇 예전에 잠수땜에 놓으셧엇는데 재회하신고예요? 그가용서를빌었어요?
ISFJ,"네 그가 용서를 빌었는데,
제가 남자친구에게 상처를 줘서..
남자친구가 다시 새롭게 시작 하자고
그래서 만나고 있습니당"
ENTP,전아직도 끌려다니는데 ㅜㅜ 그래도 용서를빌었으니.. 그분도 힘들게하고 상처췄던게있으니 ㅜㅜ 어려워요 잇프피
ISFJ,"힘들어 하는게 보이는데...
놓지는 않으려고 하고, 예전의 모습으로
많이 돌아와서 좋기는 하지만...
마음 한켠으로는, 놓아줘야 하나,
그런 생각도 들고,,,
제가 더 많이 좋아하니까
버틸 수 있을때까지 버텨볼까,,,
이런 저런 생각들로 머리속이
복잡해요@_@"
ENTP,그래도 많이개선되고 잠수안타고 미래까지약속했으니 기회줘보세용 원래는 그조차도안하고 회피햇던사람이라면 ㅜㅜ
ISFJ,"제가 잘못을 한게 있어서
남자친구가 힘들어 해요,,
술 먹으면 괴로워 해서 제가 생각이
많아지더라구요"
ISFP,닥 선톡이 최고의플러팅 아닌가요...?
ISFP,그죠 일단 잇프피가 먼저 무언갈 한다는거 자체가 ㅎㅎ
ISFP,맞아요...ㅋㅋ특히 선톡해서 머해? 일해? 시덥지않는 질문부터할때가...ㅋㅋㅋ
ISFP,ㅎㅎ 관심없는 사람에겐 절대 선톡 안하죠 ㅎㅎ 일단 말 걸엇다는거 자체가 플러팅 ㅋㅋㅋ
ISFJ,"제 잇프피는 연락을 좋아하지 않는데,,,
연락하면 잘 받아주고, 만날 때마다 40분 거리
데려다 주고 가고, 일할 때 틈틈히 톡해주는,,,
밥맛 없다하면 밥먹이러 갈까? 요러는거에
플러팅을 느껴야 겠네요😅"
ISFP,"ㅎㅎㅎㅎ 사바사니까요.
저는 전연인에게 연락안하면
분리불안왓었어요 ㅎㅎㅎㄹ"
ISFJ,"본인은 연락 잘 안하면서,,
신경 덜 써주면 싫어하더라구요🫠"
ISFP,"ㅎㅎㅎㅎ 좀 그래요.
관심못받으면 나 싫어하나 싶어요.

그래도 밥먹엇나 뭐하나 싶어서 물어보는거
그게 플러팅이에요 ㅎㅎㅎ"
ISFJ,"만나면서 일하는날엔 점심시간에 밥 챙겨먹고,
오후에도 힘내라고 그랬었는데,,
몇일 안하니 왜 안해주냐고 그러더라구요ㅎㅎ
어찌보면 아이같아요ㅋ.ㅋ"
ISFP,"ㅎㅎㅎ 그만큼 연인의 관심이
잇프피에겐 살아가는 힘이에요

쉽게 마음 주지 않는 만큼
마음 준 사람에게 많이 기대니까요"
ISFP,"사바사겟지만 저는 아니요.
거리는 문제되지 않아요."
ISFP,"ㅎㅎㅎㅎ 전 인프피 연인도 한시간 넘는 거리기도 햇고 자주 못보니 더 아련해져서 ㅎㅎ
제가 특이케이스 인건지...ㅍㅎㅎ"
ISFP,ㅎㅎㅎ 그래서 진짜 이사람은 꼭 잡는다 싶은 사람에게만 하쥬 ㅋㅋ
ENFP,"이게 정말 플러팅이 맞는건가요..;;
어장인가 싶다가도 이런 글 보면 아닌가 싶고..
어렵네요..;
잇프피 분이 선톡 오고 난 뒤로 연락 안끊기고 
계속 2주 째 하루 종일 톡 하고
회사에 있을 때도 전화 오고 자기 약속 나가서도 틈틈히
전화 해주고 밤에 늘 몇시간씩 통화하고 자는데

전 저를 심심할때만 찾는다 생각했는데..

이게 정말 호감 표시가 맞는건가요..;

막상 제가 호감 표시를 하면 말 돌리고.. 칭찬해도
말 돌리고..; 그래서 어장인가 싶어서 연락 하는 그날 부터 이게 무슨 사이인지 고민 중인데
이런 글 보면 정말 호감인가 싶구.. 잇프피 어려워요ㅠㅠ"
ISFP,"네? 저렇게하는데도 막상 피한다구요?
물론 mbti가 무조건 맞다는 아니지만...
전 심심해도 연락 안해요... 귀찮아요.
제가 선톡하고 하루종일 연락하고 전화하고...
전 무조건 플러팅이네요

카페나 이런건 감정소모나 맞춰줄 필요가 없지만
연락은 그런게 아니라 정말 안하거든요.

많이 어려우시겟어요 ㅠㅠ"
ENFP,"만난적 없고 같은 인턴 햇던 단톡에서
알게 되서 제가 몇번 고민 얘기한거 공감 해줬더니 먼저 sns도 알려 달라하고 그러면서 연락오더라구요..

그리고 거리가 나름 서로 끝과끝이라..
4-5시간 걸려요..
그래서 선뜻 못하나 싶구..
늘 말은 만나러 가야지 하는데
모르겟어요..
지금도 계속 톡오고 질문 오고 하는데
톡이 근데 제 기준 10-15분 답 오는게 너무 느려서 처음엔 정말 관심 없는데 왜 이렇게 질문을 해서 톡을 이어가지 했거든요..

어제도 서로 약속있어서 잘 놀라고
톡 안할거처럼 하더니 사진보내주고
틈틈히 전화 오더라고요..;


호감이 맞는지..; 헷갈려요
늘 회사나 퇴근하고도 틈틈히 전화 해주고 밤에는 늘 2시간정도는 통화하고 자요 삘 받을때는 4-5시간 하고요..

근데 썸으로 즐길래도 이게 사람으로서 원래
이렇게 대하는 스타일인지 모르겠어서ㅠ
썸이라 생각도 못하고있어요 ㅋㅋ"
ISFP,"아..거리도 있고 아직 만남이 없으셧군요.
그럼 확실히 못하니 그럴 수 있지않나 싶네요.
아마 엠헬에 많은 잇프피들도 공감하실걸요.
선톡하고 연락하는거 정말 힘들고 귀찮아요.
자기가 그 에너지를 쓸만한 사람이여야 써요.
공공이님 말씀처럼 아직 못봐서, 멀어서
자기도 확신 못하는 거 아닐까도 싶네요."
ENFP,"그렇군요.. ㅠ
제가 가끔 칭찬과 호감 표시를 하기도 하고
어제 술 먹고 나서 통화하면서
제가 너 좋아~
이러고 얘기했는데 말 돌리다가도
진짜로 보러가야겠네 이러기도 하고
어려워요..; 후..

저는 저랑 계속 톡 하고 전화도 수시로 오는걸 요즘은 심심해서 하는건가..
어장인가라고 생각했는데..

호감이 조금은 있다라고 봐도 되나요..?

심심할때만 하는건줄 알았는데

어제 약속나갔는데도 틈틈히 톡오고
사진 보내놓고
전화오는거 봐서 조금 놀라서..

하.. 어렵네용..;;"
ISFP,"호감이 없는건 아닌거라고 봐요.
지인들과 두루 잘 지내는 잇프피라고 하지만
자기 개인 시간을 누구한테 할애하지 않아요.
자기것을 내어줄때는 마음이 있다고봐요.
특히나 무언갈 하면서 계속 연락할정도면
전 무조건 호의라고 보네요.
힘내시고 직접 만나보시는게 제일 빠를 듯 해요"
ENFP,"백곰님 답변 너무 감사합니다ㅠ

저도 질문글도 쓰고 하다 어장인거 같다는 걸 보고.. 맞는거 같긴하다
생각 하다가..

어제 이분이 친구들 만나는데도
화장실 나왔다면서 전화 오고
제가 집갈때 전화하니까 나와서 받는거 보고
그냥 뭔가 처음으로 얘가 나랑 연락하는게 자기 심심 할때만 하는건
아니구나라고 생각이 들어서 더
헷갈리더라구요..;

호감이 있지만 만나지 않아서 조심스러운거겠죠..?

어제 좀 취해서 좋아라고 하고 넌 요새
왜 안해줘 했더니 자주 해주면 감흥 없어져서 안돼 이러면서 말 돌려서..
좀 치사해서 해달라고 졸랐더니
좋아좋아좋아 됬지 이러고 놀리기만
하더라고요.. 매번 말 돌리는거 보니

역시
백곰님 말씀대로 만나야 서로 더 이어갈지 끝일지 보일거 같긴 하네요 ㅠㅠ"
ISFP,"네 공공이님이 하신 말씀보면 절대 맘없이 잇프피는 못할거라고 봐요.

잇프피는 짧은 연애보다 길게 이어가는
그런 관계를 선호한다고 하자나요.
단순 호감으로 계속 하기엔 아직 서로를
너무도 모르고 한번도 본 적 없으니
지금 호감만으로 확신하기엔 불안해서
그런거 아닐까 싶어요.

그러니 공공이님도 혼자서 끙끙대는거 보다
직접 만나서 서로가 이야기해보고
풀어나가는게 맞지 않을까 싶네요."
