mbti,comments
ISFJ,"안녕하세요 ㅎㅎ
음 잇프제가 원래 기억력이 좋기도 하고 눈치도 빨라서 공감능력에 있어서는 뛰어나긴 하지만
일단 의사라는 직업 특성상 당연히 모든 환자들에게 친절한 것도 있을테니 너무 섣부르게 판단하시는 건 안좋을 거 같아요
정말 잘 해보고 싶은 마음이 있으시다면
눈 딱 한번 감고
“퇴근하고 시간 괜찮으시면 저랑 저녁 같이 드실래요 ?” 이런 식으로 용기 내보시는걸 추천드립니다
“인생은 모 아니면 도다” 이것 때문이 아니라 정말 이렇게 단도직입적으로 행동해야
생각이 많고 조심스러운 잇프제인 저 의사 분도 작성자님의 마음을 알지 이렇게 안하면 마음을 알아보기도 그리고 열기도 어려울거에요"
ISFJ,"플러팅이라... 진짜 사람 마다 다르고 누구한테 하느냐에 따라 다르긴 한데
제가 만약 의사고 마음에 드는 환자가 있다라고 생각해보면 다른 환자 보다 더 신경 쓰고 수시로 체크하고 더 걱정해주는 정도가 될 거 같네요
아무래도 병원이기도 하고 보는 눈도 많아서 엄청 적극적인 행동은 못할 거 같네요 !"
ISFJ,회복 중이신 거 같은데 얼른 나으시고 꼭 잘 되셨으면 좋겠네요 ㅎ 절대 섣부르지 말기 메모 하세요
ISFJ,"아 제가 저걸 놓쳤네요 죄송해요
음 1년이라... 그러면 더 얼른 해보셔야 될 거 같은데요
안그래도 의사이신데 다른 사람이 낚아채가기 전에 서두르세요 !"
ISFJ,어떻게 보면 무모하다고 생각이 들 수도 있겠지만 때로는 과감하게 용기 내보는게 더 좋을 때가 있다고 생각해요. 화이팅입니다 ㅎ
ISFJ,"거절할거라는 생각부터 하시면 안돼요...
거절의 방법이야 다양하겠지만 저였으면
“내 친절이 호감의 표시로 느껴졌으면 어쩔 수 없지만 우리가 의사-환자 관계이지 그 이상으로는 오해안해줬으면 좋겠다”, “시간이 없어서 밥은 좀 그렇고 뭐 필요한 거 있어 ?” 너무 직설적으로 보다는 이런 식으로 얘기할 거 같아요"
ISFJ,"별 뜻은 없는 거 같은데...
작성자님이 아직 다 안나았으니까 다 낫고 마음 편하게 먹겠다는 뜻으로 얘기한걸수도 있긴 하지만 너무 의미부여는 하지 않는게 좋을 거 같아요"
ESTJ,"만약에 모임에서 만난 이성분이 헤어지고 카톡으로 오빠랑 친해지고 싶어요 라고해서 본인이 나도 너랑 친해지고 싶어했을때 이성분이 ""따로 연락하고 싶은데 번호 좀 알려주세요""라고 하면 어떨거 같나요?"
ESTJ,잇프제는 친절이 베이스라고 들어서 친해지기 싫은데도 친해지고싶다고 했을까봐 걱정이고 괜히 모임이라서 번호 알려주는게 아닐까 걱정됩니다...
ESTJ,잇프제가 먼저 한건 아니고 제가 먼저 하고 거기서도 얘기해줬어요
ESTJ,일단 개인적으로 연락하고 싶은데 번호달라고 얘기했어요!별로면 친해지면 준다고 하겠죠~~혹시 어떻게 다가가는 호감으로 할 수있는 방법이 있을까요?
ESTJ,약속은 어떻게 잡는게 중요할까요?
ESTJ,카톡하자마자 읽씹당했네요ㅜㅜ 연락하지말라는 이유인가봐요
ESTJ,번호받아서 카톡했는데 다 읽씹하시길래 그냥 저도 마음 접고 카톡 지웠어요 ㅎㅎ
ESTJ,번호는 왜 줬을까 싶네요! 다음 모임때 만나는데 아무렇지않게 행동하러구요!!
ENTP,오오오 감사해요!!
ENTP,그리고 겉으로 보기엔 극히 대범하고 거칠 것 하나 없어보이는데 뭔가 좀 간 보는거 같아요..? 속으론 소심할수도 있나요?
ISFJ,22222 공감합니다
ESTJ,"다른건 달 버티겠는데 카톡할때마다 ...
이게 신경쓰여요 대부분 내용이 이친구 업무가 힘들다 관련된 내용이긴한데 ...이게 아 카톡하기싫어 눙치껏해줘 이건 아닐까 걱정도 되고"
ISFJ,"얘기만 들었을 때는 일과 자기 자신을 중요시하는 사람인 거 같은데
그래도 저 분이 저렇게 얘기했으니
님도 힘드시더라도 너무 조급해하지 마시고 하는 일 열심히 하시면서
천천히 편하게 다가가시는게 좋을 거 같아요 !"
ISFJ,"일이 바빠서 상황이 그렇게 된거라면 옆에서 기다려 주시는게 좋을 것 같아요~
여러가지의 선택권이 주워지면 멀티가 되던 사람도 모든걸 놓아버리고 싶어지거든요~
저 같은 경우엔 난 일도 이렇게 힘든데 내 연애도 힘들구나 하는 이중의 스트레스를 받더라고요
옆에서 계속 응원해 주시고 일이 좀 여유로워 졌을때 다시한번 기회를 보시는게 좋을 것 같아요~
지금 그녀에게는 님을 받아줄 여유가 없어 보이네요~"
ISFJ,"예전에 esfj 였던 입장으로써 말씀드리면
esfj는 마음에 들면 힐끔힐끔 쳐다보는 건 기본이고
이때다 확신이 드는 순간 바로 다가가요 근데 치밀하게 조심스러워서
저 분은 지금 각을 보고 계신 걸수도 있고 어쩌면 님이 조금씩 방어를 해서
먼저 연락 같은 것도 못하는 걸 수도 있을 거 같아요
님도 저 분이 그렇게 나쁘지 않다, 한번 알아보고싶다 하시면
자연스럽게 연락하게 되는 그런 상황 한번 만들어보세요 ㅎㅎ"
ESFJ,"쓰니님이 ESFJ분에 대한 호감 표시를 했나요? 상대가 나한테 호감이 있다! 근데 나도 호감이 있다 하면 직진인데, 아리까리하면 절대 먼저 다가가지는 않는 것 같아용"
ISFJ,ISFJ는 그런거 전문입니다
ISFJ,"아 절대 그냥 주는 건 아니구요
어느 정도 마음이 있으니까 저러실텐데 그래도 혹시 모르니까 마음을 완전히 다 보여줄 때 까지
님도 너무 마음 많이는 보여주지 마세요 !"
ISFJ,"나빠보이지 않아요! 호감없는데 절대 저렇게 안합니다.
모든 인프제로 일반화하면 안되지만 제가 겪어온 인프제들 생각하면 빈말이나 가벼운 맘으로 저렇게 안 해요."
ISFJ,글 내용과 관련없는 댓글이지만 혹시 두근두근 쪼매 설렜다잉이라는 이모티콘 이름 뭔지 알 수 있을까요? 🥹
INTJ,흠~ 이런 솔직한 답변들을 보니 MBTI 중에서 찐 해바라기 유형 타이틀은 잇프제 아니고 인티제인가 싶네요. ㅋㅋ 인티제는 평소에도 사람들한테 관심이 없고 별로 이성으로도 잘 안보니까요 ㅋ 물론 사바사는 인정~
ISFJ,그렇군요 그냥 오빠사이로 생각할수도 있긴하겠네요 현재로서는 . 얽힌관계가 좀 많아서
ISFJ,그렇군요…노력하는거 밖에ㅜ없긴없군요 ㅎㅎㅎ한번씩 꽃 사주고 하니 좋아하긴하던뎅 다음에도 갖고싶다하는거보니
ISFJ,감사합니다. 남은 오후 좋은시간 보내세요
ISFJ,"그전에는 안부인사정도? 말고 따로 둘이보고 한적이 없긴없었어요 저도 그때는 관심이 없기도해서 , 그러다 우연찮게 얘쉬는날 자주보고하다 그 마음이 생기긴했어요"
ISFP,"제 기준으론 설레는 사람이 좋은데 친구처럼 편안 사람은 아무리 혼자 생각해봐도 연ㅇ ㅐ감정이 안느껴지고
혹여나 느껴 진다고 하더라도 사겼다가 헤어지면 이 사람을 잃기 때문에 끝까지 친구로 두는것 같아요!"
ISFJ,아맞아요…그런게 좀 잇죠 잃을수도 있기때문에 좀 더 조심스러운게 있긴있네요 . 마음정리가 어느정도 되긴됐는데 어렵긴하네요 그 마음이 커지면 연락안하게 되는건 맞기때문에..
ISFJ,그렇군요…얘는 p에서 j가 된거 같긴하다만…ㅎㅎ때가 되면 알수잇을거 같긴한데…흠
ISFJ,네맞아요. 저도 뭔가 얘 만나서 놀다보니 뭔가 그 목표가 생겨서 그거 실천하면서 생활하고있습니다. 감사합니다
INFJ,"제가 군인인 적이 없어서 이해가 어려운건지.. 모르겠어요 결혼 생각하고 있고 부모님 인사도 서로 드릴 만큼 마음의 크기는 큰데, 저도 회사 생활에 부침이 있거나 할 때에 대화하거나 나눌 수 없는게 힘들어요"
ISTJ,"전 ISTJ 여친은 ESTJ
일주일에 3일 만남. 그외 아침 카톡 점심카톡 저녁 카톡 및 잠자기전 10-20분 통화해요.

근데, 해외 파병이면 이해 해주는게 나을듯 해요. 그리고 차라리 일주일에 무슨요일 무슨요일 고정적으로 통화하는시간을 만드는것도 좋다보구요. 계속 해외에 있을건 아닌데, 힘들겠지만 이해해주시는게 낫다고 생각해요."
ISFJ,"작성자님 남자친구랑 떨어져있고 만나지 못하는 상황에 연락도 잘 안되고 속상하지만 남자친구분도 같을거라고 생각해요ㅠㅠ
직업군인 이시고 거기서 생활해야하고 그 생활관이 직장이니까 남자친구분도 많이 힘드실거 같아요
이제 한달이면 많이 예민하지 않을까요? 적응 중이실거 같아요
서로 떨어져있어서 예민 하신거 아닐까요ㅠㅠ 서로 연락 많이 하고 싶고 보고 싶은 마음에요ㅠㅠ"
INFP,빨리 얘기하는게 답이겠네요 그쵸 맞아요 셋은 아무래도 제 욕심이고 친구도 불편해 할 거 같네요 감사합니다!! 생각 정리가 잘 되었어요
INFP,잇팁이랑도 서로 좋아하는 걸 몰랐어서 정말 셋이 친구처럼 잘 지냈어요 잇프제 친구도 전혀 모를 거 같구요! 이용당했다고 느끼지만 않는다면 솔직하게 잘 얘기해보아야겠네요! 감사합니다!!
INFP,"그쵸ㅜㅜ 아무래도 셋은 힘들겠네요! 단체로 만날 때만 봐야겠어요,, 감사합니다!!"
INFP,아무래도 그렇죠? 남자친구랑 둘이 얘기하도록 하는 편이 좋겠네요! 댓글 정말 감사합니다!!
INFP,뭔가 제 생각에도 친구가 그렇게 생각할 거 같아요! 모든 분들이 의견이 비슷하셔서 결정에 도움이 되네요..! 댓글 너무 감사합니다~
INTP,착한사람은 죄가 없어요.ㅜ 그냥 그 사람 자체가 재미 없는 사람인가봐요.ㅋ
INFP,젊을땐 나쁜남자를 좋아하기 마련이죠
ISFJ,"저도 착한 사람, 조용한 사람들과는 잘 안됐던 기억뿐...."
ISTJ,어떤착한사람을 말씀이신지? 예를들어 보고. 싶네요😁
ISFJ,"3명이 서로의 분위기를 아는 사람이라면 중재를 하겠지만, 각각 입장에서 남남이라면.. 어떻게 하기가 상당히 곤란하겠군요..."
ISFJ,"a,b가 고민상담을 하면 들어주긴 하겠지만
제가 관여해서 둘 관계를 풀어줄고 하진 않을거 같아요.
어쩔 줄 몰라하는건 지금 그 상황이 많이 불편하신거 아닐까요? 언젠간 지쳐서 한쪽으로만 붙거나
방관하거나 혼자 다니실지도.."
ISFP,바람끼 한번 정도는 의심할 순 있지만 두번 의심될땐 거리두고 세번 의심되면 헤어지는것
INTP,"건강한 엣프제가 맞다면, 신뢰가 쌓일만큼 연애했고 애인이 관심을 꾸준히 주고 있는 상황엔 바람 안피우는 것 같아요. 좀 흔들리는 느낌은 가끔 있지만 선 그을 땐 또 잘 긋더라구요. J/P의 정도도 좀 중요한 것 같네요. J가 낮을수록 신뢰도는 좀 떨어진다고 생각해요."
ISTJ,와 주당이시네요ㅎㅎ 부럽
ISFJ,"2,3번은 격공이네요 제가 길을 잘 찾는다고는 생각 못하고 있었는데 다들 그렇다니 신기하네요 N은 아닌데..."
ISFP,오 그런거 같아요. 근데 잇프피도 경험하지 못한것에 대해 공감이 안가요..ㅜㅜ
ISTJ,마자요
ISFJ,F이지만 어쩔 때는 T 같은 isfj....
ENFP,제 남친이....
ESFJ,???????? 당신 생각했다는거부터 이미 플러팅아니에요??? 저 좋아하는 사람한테 잘 쓰는말이에요 ㅋㅋㅋ... 너생각났다..이런거..
ESFJ,음..근데 뭔가 표현하기는 쑥쓰러워서 술기운에 그러는건있어요 저두.. 근데 쌍방확신되면 불도저에여... 쑥쓰러눠서 그러시는것같은데..ㅎㅎ
ESFJ,쑥쓰러우면 그렇게라도 플러팅갈깁니다 🫠 제가 짝사랑하면 술기운에 별말 다하거든요...ㅋㅋㅋㅋ 암튼 쌍방이면 직진이구요 보통..!
ESFJ,저는 의미부여하는거 있어요...! 그래서 별 생각없으면 프뮤 자체를 안해놔요 ㅋㅋㅋㅋㅋㅋㅋㅋㅋㅋㅋ...
INTJ,"에이 그런걸로 불합격시키는거였으면
애초에 글쓴이분이 오히려좋아 ㅋ 일지도 몰라요 인재를 못알아본거니까요
너무 걱정마요"
INFJ,혹시 썸타고계신건가요? 아님 호감단계인가 두분 나이차가어찌되세요 저도 연하남이 요새 신경쓰여서요
INFJ,"헉 저도 5살연하인데..ㅋㅋㅋ고민이 많이되네요..
연하자체가 처음이라 더...잘되시면 좋겠네용"
INFJ,잘 사귀고 계신가요...? 5살 연하남...어떻게 만나셨는지...저는 모임에서 알게되었는데.. 안지 3개월째....4개월전부터 남친이랑 헤어지는 거 고민도 얘기하고 했었는데 남친이랑 어제 헤어졌거든요... 어장만 아니면 되는데....그 엣프제가 절 좋아하는게 맞는지 어떻게 구분하면 좋을까요...?
ISFJ,공감해주는게 저랑 진짜 똑같아서 놀랍네요 mbti는 정말 과학인가... 분명히 아닌데...
ISTJ,사직공원 전망대용!! 안에 카페두 있어용!! 행복한 시간되셨으면 좋겠네용😁 응원해요!!
ISTJ,오오 축하드려용☺️☺️☺️
ISFJ,산책로...? 같은 곳도 나쁘지 않은 거 같아요!! 갠적으루
INTJ,"네... 뭔가 제 성격이 확신을 원하는 스타일이라 그런지.. 아직 만난 지 얼마 안됐지만 내가 올인해도 될까 말까에 대해 고민하고 있던 중이라서요.. 제가 생각하는 만큼 상대방도 똑같길 바란다기보다는 방향성이 같은지에 대해서 알고 싶었어요..
ISFJ 공부 더 해서 천천히 다가가도록 노력 해야겠네요.
감사합니다!"
INTJ,"저도 긍정적으로 생각하는데 뭔가 긍정적 평가는 ( 6 : 4 이상) 이런 느낌이라면 확신은 (10 : 0 )이니깐요... 뭔가 이런 확신을 원했던 것 같아요 ㅠㅠ
전통적이고 보수적인 유형이라니 다행입니다.
감사합니다"
ISFJ,"1. 대화가 참 좋네요^^ 사귀는것에 진지한 유형인데 좋아요.
2. 일단 업무상 만나는분들 정리안해요. 무엇보다 이분들이랑 어색해지면 마음이 몹시 불편하기때문에 전처럼 지낼거예요. 사귀려는 사람한테 집중하지만 주변 관계 어색해지는거 몹시 힘들기때문에 터치안하시는게 좋을것 같아요. 그리고 카톡 프사에 남친사진 올리는거 싫어합니다. 결혼한후에 남편은 괜찮은데 그전까진 매우 신중해서 카톡 프사에 연애하는 그런 사진 올리기 싫고요. 단 연애 몇일 표시하는 정도까진 괜찮습니다."
INTJ,그렇군요... INTJ 가 못참고 내지르면 그대로 멀어지기 좋은 타입 같아요.....ㅠㅠ
ISFJ,사귀지 않는데 스킨쉽 안해요@_@
ISFJ,저도 절대 안합니다.
ESFJ,계속 하지는 않구 짬날때 보고 보내여!
ESFJ,짬 날때 합니다. 몰래 해줄때가 더 많은 거 같아요. 휴대전화 보면 알림은 뜨고 빨리 답해줘야지 하고 상사 눈치 보고 답변해줍니다.
ESTJ,제가 끊는게 답이겤ㅅ죠?
ISFJ,"나같기는 싫고, 남주기는 아까운
그런거 아닐까요🫠"
ESTJ,제가 그만두는게 답이겠죠?
ISFJ,저라면 그런사람 안만날듯 합니다
ISFJ,즐기고싶은거네요 그냥. 어장이에요 끊어내요.
INTP,isfj는 연인한테 좀 잘삐지나요
ISFP,썸녀/남이랑 1박 여행에 대해 어떻게 생각하시는지 궁금합니다! 썸남이 가자가자 하는데 너무 쉽게 얘기 하니까 빈말 같이 느껴져서요 ㅋㅋ..
ISFP,네 맞아용 그러면 썸타는 사이에소는 1박 여행 갈 수 있다고 생각하시나용 ??
INFJ,"표현을 원래 잘 안 하는 편인가요..?
마음 열리는 정도가 존재하나요?

ESFJ와 최근에 연애하게 된 남성입니다만.. 뭔가 제가 표현을 남들보다 매우 잘하는 편입니다!
사랑한다든가, 일거수일투족 관련해서 모든 걸 챙겨 주고 아껴 주고 싶은 마음에.. 늘 예쁘다고 해 주고 언제나 귀엽다고.. 근데 진짜여서 멈추질 못하는 편이에요.

근데 문득 드는 생각인데 제가 이 표현을 멈추는 순간이 헤어지는 날이 될 것 같은 느낌이 들었습니다.
뭐..저는 표현을 계속하고 있습니다.. 헤어지고 싶진 않아서
근데 좀 내다보면 제가 지치거나 돌아오는 표현 피드백이 없어서 서운해해서 제가 헤어지자고 할 것 같은데..
사바사인지 특징인지 궁금해요.."
ENFJ,ESFJ 여성분과 썸중인데 약속 가는 걸 좋아하고 활동적인 친구라 제가 감당하면서 잘 만날 수 있을지 걱정이에요 그리고 금사식이라고 하던데 제가 우선순위가 되지 않을까 걱정입니다 ㅠ
INTJ,"직설적인 표현보다는 은은한 표현을 하라는 말씀이시군요. 알겠습니다.
내일도 데리러가겠다라는 말은 하지 말아야겠네요.

혹시 이런 식의 고민들을 터놓고 얘기하는 것 또한 isfj 입장에서는 많이 부담스러울 수 있겠죠??"
INTJ,"좋은 조언 감사합니다.
내일 데리러가겠다는 말을 두번했는데 괜찮다 진짜 괜찮다 라고 했는데...
괜히 이게 부담을 준 건 아닌가 걱정이 돼서 내일 부담됐다면 미안하다 얘기하고 싶은데 그냥 언급 안하는게 좋을까요?.. 아님 얘기하는게 나을까요..
얘기한다면 어떤식으로 하는게 좋을지ㅠㅠ"
INTJ,"답변 감사합니다.
isfj가 돼서 그들이 원하는 화법을 배워보고 싶네요...
좋은 밤 되세요"
INTJ,"감사합니다.. 제가 너무 마음에 든 사람이 먼저 표현해주니 저도 모르게 들떠서 엄청 들이미는 것 같아요..
자제하려고 노력하는데 보고 싶은 마음이 너무 커서 그런 것 같아요ㅠㅠ"
INTJ,제 현재 상태를 상대한테 어필하는 것도 많이 부담스러울 수 있겠죠? 이러쿵 저러쿵 네가 너무 좋다 속마음 털어놓는 그런 것들요..
INTJ,"감사합니다 머릿 속에 드는 하고 싶은 말이
'내가 너무 마음에 들어하는 사람을 보면 뚝딱거리고 뭐라도 해주고 싶어해 혹시 어제 내가 데리러가겠다고 한 게 부담이었다면 미안해' 라고 하고 싶은데 괜찮을까요"
INTJ,"트리님 추가적으로 궁금한게 있는데
isfj 음슴체 같은 거 잘 쓰나요?
처음과는 다르게 요즘엔 음슴체도 많이 쓰는데 이성으로써 매력을 못느껴서 친구처럼 대하는 건지 아님 편해진건지 고민스러워서요 ㅋㅋㅋ 쓸 데 없는 걱정인 것 같기도 한데.."
INTJ,감사합니다 생각정리가 어느정도 된 것 같아요 ㅋㅋㅋ 점심에도 연락했는데 긍정적 시그널 많이 받아서 저도 긍정적으로만 생각해보려고 합니다 ㅋㅋㅋ
INTJ,"막줄에서 진정성과 간절함이 느껴지네요 ㅋㅋㅋ 선생님들의 안녕을 빌며 살겠습니다 ㅋㅋㅋ 찐이시네요... 인티제의 연애는 귀한것임을 알기에...잘 되길 빌어요~
주변 잇프제들을 본 바로 인티제가 보기에 그들은 겉으로는 감정 표현에 소극적이지만 내면에 품고있는 감정의 파도가 상당하다는 것을 알려드립니다... 관심과 사랑과 배려와 예절을 몹시 중요하고 가치있게 여기며 호감표현 만큼이나 중요한게 그들의 자존심과 체면과 입장을 매우매우 고려해 주어야 한다는 것입니다. 내 감정 위주로 들이밀면 어떻게 받아주어야 하나 고민하면서 곤란해 하니 단계별로 수위를 조금씩 높여가시기를 추천드립니다. 공주님께 대쉬하는 마음으로! 적극적이지만 예의있게!"
ISFJ,"저는 isfj이고 남편은 intj인데요, 지금 10년 넘게 잘 살고 있는 입장에서 말씀드리자면~ 여자분이 먼저 밥 먹자 하는 시점에서 이미 호감이 있으신 것 같구요
저는 intj 남편이 똑똑해보이는 것, 당당하게 말하는 것, 불편한 상황에서 눈치껏 나를 보호하는 것, 책임감 강하고 성실한 것, 본인의 일에 진심인 것 등등이 좋아보였거든요
대신에 (남편 기준에서 멍청한)다른 사람을 깍아내리는 것, 약간의 인간혐오, 융통성 1도 없이 철두철미한 것 등등이 좀 힘드네요 ㅎㅎ
intj는 인간에 대한 예의만 잘 지켜준다면 충분히 매력적인 타입이라고 생각해요 ^^
파이팅입니다"
ENTP,"오히려 회사에 대해서 알아가는단계라고 생각하시고 많이 물어보기도하세요.
모범답안처럼 외운다면 예상외적인 질문 나오면 버벅거리고
안좋을 수있으니 편하게 서로 알아가는거다라고 맘먹고가셔야해요 ^^"
INTP,네 완전 모든 걸 함께하고 싶어했어요
INFJ,저희 엄마가 ESFJ이신데 좋아합니다...!
ISTJ,저 한명 봣네요ㅋㅋㅋ
ISFJ,저도 E로 오해받아요. 낯 가리지만 성격좋고 편하고 잘웃어서 살갑다고 좋아라해요ㅋㅋㅋㅋ잘 놀기도하지만 사람한정인데ㅋㅋㅋ내성적인 사람은 아니라고해요ㅠ그냥 오지랖넓은것뿐인데..
ISFJ,"저도 그래요
니가 낯가린다고???????? 혹은 니가 소심하다고???????? 이러는 사람이 있고
옆에서
얘 엄청 낯가리잖아,
야 얘 엄청 소심하잖아~

이러면 엥?????? 이런반응ㅎㅎ
그런 게 몇번 겪으면서 전 깨달았지 뭐예요.

아 내가 사람들한테 대하는 게 상대적으로 다 다르구나... 라고요..

그땐 mbti모를때인데 알고나서 보니 잇프제 설명 보니까 저답더라고요.

지금은
a: 니가 i라고??????
b: 야 얘 딱 보면 파워i잖아
이런 소리 종종 듣고 살아요"
ISFJ,"간편검사에서 I 100%, 정식검사에서도 만점으로 나와서 그런지 딱 봐도 E로 보이지 않는다는 말을 많이 들어요. 처음 보는 사람도 엄청 내향형이라고 생각을 하니까요. 모임에 나가서는 말을 별로 안하고 사람들의 말을 주로 듣는 편이고요. 다만, 가깝게 지내는 사람 중에 굉장히 가깝다거나 친근하다고 생각하는 사람에 한해서 그래도 말을 조금 하고 안정감을 느껴요"
ISTP,같은 학원 다니니까 1 이요
ESTJ,"1. 지금처럼 꾸준히 할까요?
2. 그래도 지난 약속은 이친구가 주저하면서 말하더라고요 아 잠깐 맥주라도 할까요?근데 바쁘면 담에 먹어요 이런식으로"
ESTJ,제가 먼저 보자고 할때 제가 괜히 눈치보는걸수도 있겠는데 어떨때는 단번에 오케이 하는데 또 어떨땐 다이어트땜에 안먹는다고 하는데 이게 만나기싫은데 핑계인건지 진짜 저 이유인건지 모르겠습니다
ENTP,"그냥 미루고 회피하는 걸로 보입니다만… 
저런 모습은 잘 안바뀔 듯 해요."
ENTP,"이런 행동 하나 보면, 
대충 평소에 어떻게 행동하는지 눈에 보이네요. 

아마 글쓴이님 모르게 다른 방면에서도 
힘든 일이 있거나 귀찮은 일이 있으면 
회피할 것 같아요."
INTP,로댕의 생각하는 사람도 그렇게 생각 안하게따... 장난일침 어때여... 후으 ..
INFP,대부분 e들이 그렇군여..!!! 내향인으로써 놀랍고 뷰럽네여..!!
ESFJ,저는 소심한 엣프제인데 살면서 두어번 첫눈에 반한 적 있습니다. 저는 반하면 더 못 들이대겠던데요🥺 그분은 자신감이 넘치시나봐요
INTP,와 저도 이랬는데 ㅋㅋㅋ 진짜 적극적이긴 했어요
ESFJ,저는 여자지만 외모도 성격도 제 이상형인 분께 소심하게 적극적으로 표현한적은 한 번 있어요! 맘에 드는 이상형이다 싶으면 직진입니다 다만 뭐든 빠르면 금방 식는 다는 걸 아시고 그분을 조금 지켜보면서 나랑 잘 맞는 사람인지 보고 다가가셔도 좋을 것 같아요!
INTP,그냥 오글거리는말 잘하는 성향인것 같은...?실제론 연락을 자주안해요!
INTP,다른 사람들과 함께 만나세요. 제 3자 앞에서는 근엄진 모드를 유지하더라구요.
ENTP,33 무서움..;;
ESTP,네 저도 그래서... 그거때문에 지금 미칠것 같습니다... 그래도 이사람 착해서 제가 카톡 보내면 답장은 바로바로 보내주네요ㅠ 일욜에 얼굴 보고 얘기할건데 마음 조금이라도 돌릴 방법 뭐 없을까요
ESTP,"싸울때 말 예쁘게 안히고, 기분 나쁘면 나쁜티 내고 이래서 남친도 욱해서 같이 말싸움을 좀 심하게 했습니다... 본인 입으로 본인도 잘한거 없는거 안다고 근데 저한테 너무 화가 난거 같아요... 제가 사과도 하고, 두번다시 이런 일 없게 하겟다고 반성의 말도 전했습니다... ㅠㅠ"
ESTP,해결책 제시 / 문제 재발하지 않겠단 확신 주도록 하겠습니다 잘 예기해볼게요ㅠ 마음이 며칠 사이 금방 정리되서 이미 정리된 것만 아니면 좋겠네요ㅠ 감사합니다
ISFJ,저한테 없는 걸 가지고 있는데 이게.. 참 제 기준 치명적이라ㅠ
ISFJ,그쵸.. 어색한 척 하면 다른 친구들 불편할까봐 당분간은 가면써야될 거 같은데 걱정이네요ㅠㅠ
ISFJ,"아직 사귈 정도는 아니거나, 소심하거나 신중하거나..
여러가지 이유 아닐까요ㅎ
전 애매한 거 싫어해서 끝을 보려구 먼저 얘기했어요"
