mbti,comments
ISFJ,"아 욕나오네욬ㅋㅋ...ㅋ...할많하않...
어떻게 저렇게 사람이 겉과 속이 다르고 음흉하고 유치하고 쫌스러울까 감탄했습니다!
안전이별하십시오
이별을 축하드립니다!!"
ENFP,좀비세상이 됐는데 엄마가 좀비에 물리셔가지고 좀비가 되셨어요(탈룰라 설정죄송합니다..) 그럼 어떻게 하실 거죠???
ESTP,이런질문은....젭알...제발 이러지마세요.......ㅋㅋㅋㅋㅋㅋㅋㅋㅋㅋㅋㅋㅋㅋㅋㅋㅋㅋㅋㅋㅋㅋㅋ
ESTP,진지하게 생각해볼게요 도망갈거같아용 ㅎㅎㅎ
ENFP,"ㅋㅋㅋ(괴로운estp에 흥분한1인)안히 그럼 보기드릴게요
1번 마음이 아프지만 보내드린다..
2번 피한다
3번 어디에 잘 묶어놓고 백신이 나올 때까지지킨다(약간눌물날것같음)"
ESTP,1번은 제가 죽이는거죠? 맘아프지만 제가 죽을수도있어서 눈딱감고 할수있을거같고 2번이.. 젤 현실성있어보여요 ㅋㅋㅋ아님 3번처럼 가둬놓을듯.. 그러고 그 장소를 떠날거같아여
ENFP,"오..1번이 가능하시군요....그럴 수 있죠 대단히..... 성심성의껏 답변해주셨네요....하나하나 설명을...ㅠㅠ
너무 고맙습니다.... (흐뭇한 엔프피..)"
ESTP,"하핫 아닙니다 ㅋㅋㅋㅋㅋㅋ심심해서 나올수있는 바이브,,,1번도 눈딱감고 가능할지도몰라요 ㅎㅎ"
ENFP,"허허 답변 너무 감사드립니다!
심심하신 타이밍에 엣티피 정보 입수(?)했네욬ㅋ
예쁜밤되세요! :D"
ESTP,녜엥...맞습니다ㅜㅜ 제가 좋아해야 연애하고나서도 잘 이어나가더라구요. 상대가 먼저 젛아해서 만날수도있어요!!!! 쟤가 나 좋아한다고?? 해서 관심갈수도 ㅎㅎ
ENFJ,학생이구 엣팁 이성이랑 초중고 같이 나왔구 같은 반 된 적도 여럿 있고 작년까지 같은 학원도 다녔었는데 어떻게 친해져야 할 지 모르겠어요 ㅠㅠ 저한테 관심없는 거 알아서 친구로라도 친해지고 싶은데 어떡하면 좋을까요?
ESTP,은근슬쩍 말 걸어보세용ㅎㅎ근데 엣팁이 전혀 관심이 없는 눈치인가요? 엣팁의 스타일이 본인이 아니시면 이성으로는 힘들수도있어요ㅠㅠ
ENFJ,넹 다른 제 친구하고는 진짜 잘 지내요 ㅋㅋ ㅠㅠ
ESTP,친구한테 살짝 언지하는건 어떤가용ㅎㅎㅎ쟤랑 친해지고 싶다구!! 근데 엣팁 시야에 들어오면 웬만하면 말걸고 그러니까 친구랑 은근슬쩍 끼워대화하기!!
ESFJ,책임감으로 만남을 이어가실 수 있나요?ㅎㅎ 뭔가 책임감을 느끼는 상황이고 그런 책임감으로요 ㅎㅎ
ESTP,책임감만 있는건가요?! 그러면 힘들거같아요.... 애인을 말씀하시는거죵?
ESFJ,네 맞아요ㅎㅎ 남친이 엣팁인데 저한테 책임감 같은걸 느끼는 것 같아서요 저를 만나는데 그것만 있나싶어가지구요 ㅎㅎ
ESTP,음 상대방을 정말 책임지고 싶다는 마음가짐까지 들었으면 엣팁분이 엄청 사랑하는 마음일거같아요 ㅎㅎ어중간한 사랑으로는 책임감까지 들기는 힘들다고 생각해요!! 하지만 이사람을 계속 내가 챙겨줘야하고 거둬줘야만 하는 사람이라면 점점 지칠수도있을거같아요!
ESFJ,"연애하고있던 상대방에게 마음이 식으면
상대방에게 헤어지자는말이 나오도록 유도하는편인가요?
그냥 직설적으로 말하시는편인가요??"
ESTP,줏같게 굴면 바로 이별통보해요!!!!!개빡친상태로...ㅎㅎ
ESFJ,시간을 갖자는 엣팁의 말은 어떻게받아들이면될까요..?
ESTP,질려서 시간갖자고하는경우도 있아욤....근데 거의 헤어질준비 다 하고있을거에요ㅠ 시간갖자하고 얼마안되서 다시 연락이 되는거면 재회할가능성이 있는데 연락한동안 안오면 그냥 이별이에여..
ESFJ,"일단질려서 그런건 확실히 아닌데,
저희가 거리도멀고 남자친구가 스케줄근무라 만나는게 조금 힘들어요ㅠㅠ
그래서 서운함을 말을하다가 나는 이제 못하겠다.. 라고했는데 남자친구가 본인상황을 얘기해주면서 알겠다고 했어요.
근데 밤에 친구들이랑 술마시고 집에들어가면서 전화를했더라구요?? 남자친구의 상황설명, 왜 그럴수밖에 없었는지에 대한 설명을 해줬어요. 요즘 일적으로 힘든시기라고 말하더라구요....그래서 저는 남자친구가 이해가갔고, 나 싫어진거 아니면 됐다. 난 오빠 여전히좋아한다 만나자 그랬어요.
그랬더니 아니야.. 우리 일단 시간을좀 갖자. 다음주화요일에 연락줄게 라고왔습니다ㅠㅠ"
ESTP,현실적으로 남자는 바쁘고 여자한텐 상처인것같고 하니까 떼어내려고 하는걸수도있어용 ㅠ 감정적으로만 만날수있는 상황이 아닌걸 아는거같아서 시간을 갖자하는거같아요.. 어쨌든 룰루랄라님이 서운하고 이제 못하겠다 라고 하셨으니ㅠㅜ그냥 헤어져야겠다 생각하고있을거ㅏ같아여..
ESTP,"으으음 지금 상대가 어떤 상황일지는 모르겠는데 정말 일때문에 바쁘거나, 그냥 슥 보고 답장안하거나인데 만나자 라는 연락에 답장이 없는건 그냥 미리보기로 보고 귀찮거나,,, 귀찮거나.. 귀찮거나..... 해서 미루고있을가능성이 높아보입니다ㅠ 일정이 있고 이유가 있어서 못만나는거면 그 이유를 설명할 확률이 높아요 이래이래해서 지금은 못만난다 라구... 친구사이신가요 아님 썸단계인가여??"
ESTP,상대가 나한테 관심이 그만큼 없다고 느끼면... 엣팁이 호감도가 떨어졌을수도있어요ㅠㅠ 얘는 갑자기 왜 만나재? 이렇게 생각할수도있구용... 엣팁이 님을 얼마나 마음에 들어하는진 모르겠지만 정말 찐으로 짝사랑하거나 하지않는이상 금사빠 금사식일 확률이 높기에 안될거같은 상대에게는 금방 마음정리를 할수도있어요ㅠㅜ 아니면 진쯔 바빠서 그런걸수도있긴한데...!!!!진짜 바빠서 5시간동안 폰도 못볼일이 뭐가있겠어요 ㅠㅠ
ISTP,좋은것같아요..!! 영화만잼잇다면!!
ESTP,"영화,,,그켬,,,,, 특히 딥한내용이면 더더욱... 영화관가서 앉혀놔야 좀 보는스타일"
INFP,"ㅋㅋㅋ진짜 신기해요….
어쨋든 프로젝터는 로켓배송 주문했다는 ㅠㅠ"
ISTP,영화 많이 좋아해여 그냥 사바사입니다..
ISTP,"저는 영화관에서 즐겨 보는 편이고 영화 보는거 좋아하는데
집에서 나.. 누워서 보는거나 편한 분위기는 잠와서 .. 집에서는 안봐요
영화는 딱 집중해서 영화만 보는편.."
ISTP,"영화 좋아해요
혼자서도 영화관 잘갑니다 ㅎㅎ"
ISTP,전 완전 좋아해요 ㅋㅋ 취미 취향은 사바사죠 ^^
ISTP,"별로 안보긴 해요,, 너무 호흡도 길고 2시간을 봤는데 별로였어 싶은것도 싫고,, 지루할 틈이 없는 액션 추리물 쪽을 그나마 좋아하긴 하지만 대체로 짧은 호흡의 에피소드 옴니버스 형식 영상물을 좋아합니다!"
ISTP,"나의 흥미를 두 시간 내내 유지시키는 영화는 살면서 몇 작품 없었어요,,, 좀 보다보면 딴 생각 들거나 폰 보게되고 졸리고 시간 아깝고 그렇더라구요. 그의 영화 취향을 공략해보세요~"
ISTP,전 영화 좋아하고 OTT랑 극장으로 많이봐요.
ENFJ,저도 E/I S/N은 늘 반반으로 나와요!
ESTP,조화로운게 더 좋을수도있어요 ㅎㅎ
ESTP,상황에 따라 처세할 수 있는 성격들이 많다는건데 물론 조은거죵!!!
INFP,"잇팁이랑 연애하는데
너무 힘들어요 매일매일 마른 눈물이에요.ㅠㅠ"
ISTP,왜울어요... 무슨이유인가요? 연인 잇팁하고 이야기 해보셧나요?
INFP,"썸탈 땐 안이랬는데
먼저 전화하자하구 톡 하다 좀만 비워두
어디갔냐하구 찾고 그랬는데
대화 주제도 다양했구요..

요즘 이렇게 단답만해요..
저랑 관련된 프사도 4시간 답안하다가 내렸구요..
뭔 말을 못하게써요..
요즘 나이트 근무라 피곤해서 그런가 싶어도
좋아한다면 안이럴거같아요..
불과 2주 전이랑 온도차 너무 심해서
너무 힘드로요..

글고 무엇보다 연애 초기에 이럴수있나 싶으면서
너무 처음 겪는 무심함이라 슬퍼요..
(사진펑)"
ISTP,"본인이 편해져서 그런걸수도 있어요 혹시 만났을때도 반응이 이러면 문제가 있는거에요
그리고 본인이 몸이 힘들거나 정신적으로 힘들면 톡도 단답으로 가게되더라구요 저도 피곤하면 단답이에요"
INFP,"저희집도 오가구 빠르게 발전한 사이이긴한데.. 만나서 할건 다하거든뇨..ㅠㅠ
만나면 그냥 물어볼까요?
부담스러울까봐 못물어보고있는데 참다 제가 병날거같아요"
INFP,"말하긴 해야겠죠..
전 연인관계에서도 이런 문제로 자주 트러블 있었대서 저는 최대한 공감해주고 이해해주려 하고있는데 역시 한계에요.."
ISTP,"그부분에서는 그냥 마음을 놓으셔야할거같아요.. 이건답이없습니다 연락이 오면 오는가보다 안오면 안오는가보다..
할말이 없어도 저렇게 되요 진짜 할말이없어요 표현이 안되요 만나면 청산유수죠.,., 잇팁과 연애는 저같이 카톡으로 대화 좋아하는 사람도 간혹 있는데 대부분이 좀그렇긴해요 ㅎㅎㅎ"
INFP,만나도 청산유수는 아니에요.. 원래 스스로 말이 없고 노잼이라고 하긴했어요. 제가 대화를 어떻게 끌어내야할까요? ㅠㅠ
INFP,하ㅠ 잇팁 저도 너무힘들어요.. 근데 왜 못놓는고지ㅠ..ㅠ
ESTP,편하고 안정감있는 연애가 최고라고 생각합니다!!
ISFP,네 저도 그렇게 생각해서요.. 저런 사고 방식을 가진 게 이해가 안되고 자기 욕구만 생각하는 것 같아 이별했어요..
ISFP,네ㅜㅜ 사람 거를 줄 아는 눈을 길렀다고 생각해야죠 뭐 ㅠㅠ
ISFP,"그냥 김샜다고 하면 저도 이해가 가요.. 모텔 가기 전에 산책하고 맛있는 것도 먹었는데, 막상 관계 안 하니까 “원래 오늘 너 만나자마자 모텔 가고 싶었는데, 너가 여자니까 먼저 산책도 가고 맛있는 것도 먹으러 간거다. 모텔 예약도 너 쉬게 하려고 배려한 행동이다.”라고 ㅋㅋㅋ 하더라고요.."
ISFP,그쵸 ㅋㅋㅋㅋㅋㅋ 그냥 정뚝떨입니다; 헤어지자니까 펑펑 울고 붙잡더라고요; ㅋㅋㅋㅋ 근데 헤어지고 서로 sns 다 차단했어요..
ISFP,ㅋㅋㅋ저도 돌이켜보니 더 극혐이라는 생각이 드네요. 진짜.. 만난 시간이 아까워요
INFP,..... 여자친구랑 보내는 시간 자체를 좋아해야 하는데 저 전남자친구라는 사람은 오로지 그 생각밖에 없었나보네요.. 아무리 관계를 좋아하고 욕구가 있었어도 여자친구가 피곤해하면 아쉬워도 여자친구 몸부터 생각하는게 정상입니다. 저게 무슨 미친 소리인가요
ENTJ,말하는 꼬락서니 진짜 정뚝떨ㅋㅋㅋㅋ
ISFP,저도 그렇습니다.. 제가 마인드 쓰레기인 사람을 만났네요ㅜㅜ 사람 보는 눈을 길러야겠어요
ISFP,정말 제 정신을 갉아먹어요ㅠㅠ 되려 제가 이상한 사람인가 제 스스로에게 반문하게 되고..😭
ISFP,후.ㅜㅜ 네 그쵸.. 감사합니다 ☺️
ENFP,암묵적동의라 생각하는것도 맘에 안드는데 한발짝 물러나서 그럴수도 있겠다 싶지만 님 의사가 싫다고 하면 존중해줘야 하는게 맞는데 그짓거리가 우위에 있는 사람이네요. 똑부러지시네 잘 헤어졌어요
ISFP,"그러니까요.. 저를 진짜 많이 좋아하는 건 알겠는데, 자기가 원하는대로 상황이 흘러가지 않았을 때 욱하고 짜증을 내요;; 후련합니다~~ㅎㅎ"
ENTP,"아마 계속 사귀었으면 더 심한꼴을 봤을 수도 있을거에요 ㅠ 제가 멋모르던 스무살때 저런 암묵적 동의 운운하는 전남친때문에 별 이상한 꼴 다 겪었거든요 ㅠㅠ
빠르게 헤어지신거 정말 다행이에요.
그래도 정말 ㅠㅠ 믿고 좋아했던 분의 저런 모습을 알게되어 충격이었겠어요 ㅠㅠ"
INTP,"성범죄자들 생각같아요 솔직히 제가 최근 유튜브 영상을 보는데 안사귀거나 이제 막 사겼는데 첫 모텔가거나 첫만남에 여자 꼬실때 잠깐 쉬러 텔가자 하지 이게 대놓고 하러가자는 경우는 없잖아요 근데 저는 코로나 시기에 술마시다가 술집 빨리닫으니 그냥 아무일 없이 텔가서 술만 마시자고 방잡자는 애도 봤는데 극 혐 ㅋㅋㅋㅋ
진짜 그 말이 진짠줄 알고 가면 당하는거잖아요
성폭행 사건도 보면 텔가서 거절해도 여자탓하는 애들 많던데 진짜 ㅋㅋ 어이없음; 부부사이에서도 원치않은데 하는건 강간이거든요 제발 우리나라 인식좀 바꼈으면 좋겠네요"
ISTP,"예전 여자친구가 만날때마다 관계 가질려해서
이럴려고 나 만나냐
생각은들었지만 말은 못했습니다"
ISTP,쓰레기네요 헤어지기 잘했어요
ENTJ,와.. 저도 지금 한살 어린 잇팁남이랑 서로 마음 확인했는데 애교 엄청 많아요 ㅋㅎㅋㅎㅋㅋㅎㅋㅋㅋ ‘누나’에서 동질감 느껴져요!!!
ESFJ,와 오래 사귀셨네요! 궁금한게 있는데 잇팁남자는 한결같은 편인가요?? 물론 개인 특성이 영향이 크겠지만요 ㅠ 저런 행동이 언제까지 유지될지 궁금하네요...
ESTP,서운함딱히없지만 뭔가하자고할때 계속 부정적이고 게으른 느낌일때요? 생일은 서로안챙기는거면오케이
ESTP,그걸로태클안걸면 상관없을거같아요ㅎㅎ
ESTP,"뭔가 해야할게있는데 말로만 해야한다고 징징거리면서 계속미루는게 1순위, 뭔가 성장하든 일을하든 하는거없이 월급루팡을 자랑스럽게하면서 퇴근후에는 집에서잠만자던지 술약속만나간다든지 하는 안주하는삶이요"
ESTP,서운함? 나에 대한 애정 전보다 떨어져보이는거 아니면 서운한건 잘 모르겠는데 짜증날때는 한심해보이거나 너무 부정적이거나 자존감낮아보일때요
INFP,"본인이 속으로 다 정해놓고
이제 상대방에게 형식적으로 의견 물어보고 상대방이 ok만 하면 되는데
상대방이 반대 의견을 보이면
그렇게 서운해하더라구요"
ESTP,나(내 주위사람)를 무시하는 느낌들때?
ISTP,원래 관심있었는데 그걸 숨겼다가 시간 지나고 조금씩 티내는거 아닐까 싶네요 저는 한번 관심없으면 쭉 관심없거든요! 평소 친한 사람들한테도 먼저 연락하거나 관심주지 않는 스타일이여서요~
ISFP,잇팁 분들은 그냥 친한사이에서 연인으로 되기 어려운 타입인거 같나요?? 최근 알게된 분이 있는데 친해지긴 빠르게 친해졌는데 딱 그정도로만 생각하는거 같아서 어떻게 더 다가가야 할지 고민이네요
ISTP,원래 알고 지냈을 사이면 연인관계 발전이 좀 어려울 수있다 생각하는데요! 근데 최근에 알게된 사이인데 친해졌다면 연인 가능성이 있어보여요~ 만남 약속에 긍정적인 반응이라면 그분도 관심있을 것같아요
ISTP,자연스러운 분위기가 제일 좋은거 같아요! 친해졌다면 질문이 가장 많아요~그 사람 자체가 궁금해서 대화하다가 왜? 라는 질문이 많아요
ISTP,"최근에 알게된 사이일까요?? 사실 잇팁이 연락을 좋아하는 스타일이 아닌데 연락이 이어진다면 긍정적인 반응이거든요!
혹시 그 분에 관심있는 분야에 대해 말해보세요 그러면 좀더 얘기가 나올거예요"
ISTP,그분께서 딱히 뭘 하는것도 아니구..스몰토크 이어나가는것도 힘드시겠네요 ㅠ 연락보다는 만남이 더 나으실것같아요! 만나자고 약속을 잡아보시는게 어떠세요??
ISTP,글만 읽어도 저도 같이 어색하네요..그리고 어색한 관계에 저는 전화를 아예 안하는데..신기하네요 말도 많지 않을것같은데 ㅠㅋㅋ 잇팁분이 남자분인건가요?
ISTP,"모르겠다님께서 솔직하게 얘기해보시는건 어떠신가요?!
2주나 되었는데 연락만 하니 슬슬 만나보고 싶다를 강력히 말해야만 만남성사가 될것같아요 자꾸 만남을 피하는 기분이 들어서 힘들다고 해보시는것도 ..! 관계라는게 한쪽이 한계가 오면 결국 끝이라 생각됩니다 그렇게 말했는데 또 피하면 그때는 짤하는게 맞다고 봐요"
ISTP,꼭 만남이 성사되시길!!👍🏻
INTJ,"헤어졌는데 친추에 계속 떠요
안좋게 헤어졌어요
조금의 관심조차 없어서 차단조차
친구목록에 삭제조차 안하는 걸까요?"
ISTP,안좋게 헤어졌다면 큰 의미가 없을 수 있어요..잇팁은 헤어지면 어느정도 슬퍼하다가 금방 일상으로 돌아옵니다
INTJ,"전여친은 첫연애 였거든요 짧게 사겼지만, 프로필 음악이나 사진이 저한테 미련이 있어보여서 저도모르게 의미부여 했나봐요"
ISTP,제가 정답은 아니니깐요! 어쩌다가 안 좋게 헤어지신걸가요?
INTJ,"언제는 이성으로 안보여서 헤어졌다 그러고 언제는 외로워서 자기랑 사귀는 거 같다고 그러더라구요
이상해요 관심을 안주면 다가오고 관심을 주면 다가오지 말라 그러고
그러다가 훅 갔더니 위처럼 말하고"
ESTP,"ISTP는 관심 없으면 약속도 아예 안 잡나요? 약속 잡았다가 일 때문에 파토 났는데 다음약속은 안 잡네요>
진짜 일이 바빠서 파토인거죠? 별로면 처음부터 아예 약속도 안 잡겠죠?"
ISFJ,음... 엠비티아이떠나서.. 솔직히 지인. 친구 정도 마음 같아요. 썸이아닌거 같아요. 상대방이 선톡도 없다하고.. 알고지낸 기간에 비해 만남횟수도 너무 떨어지네요. 상대방은 이미 글쓴이분이 본인을 좋아한다는 것도 알고 있는데 뜨뜻미지근 하군요. 연락이야 솔직히 싫지만 않으면 늦게라도 답할 수 있는 부분 이구요.. 약속잡고 만나서 대화를 확실하게 해보세여.
ISFJ,"저도 모임에서 만나서 지내고 있는데 상대방이 맨날 선톡하고 일상보고 하고 개인적으로도 만나자해서 만납니다. 전 이럼에도 불구하고 썸이라 생각하진 않아요. 왜냐하면 사람마다 기준이 다르기에 설레발일거 같아서요. 모든지 확실하지 않은상태에서 단정짓는건 내자신이 상처받을 수 있습니다.

그리고 누구든지 상대방이 보고싶다하는데 이걸 아무리 곰인다 한들 상대방이 좋아하는거 눈치채죠. 아무리 소극적이래도 상대방이 다가와주면 더 적극적으로 할 수 밖에없습니다.

말하고 싶은 요지는 이렇게 추측하는것보다는 본인의 마음이 확실하다면 개인적으로 만났을때 마음을 전해보는게 좋을듯 합니다. 썸 쌈 구분짓지말구요."
ISTP,시간이 좀 오래걸릴꺼같네요 상대방을좋아한다는 자각이 될때까지 시간이 걸리구 아마 님이 저분 좋아하는거 모를수도 있어요
ISTP,그건 님이 알아서 하세요 ㅋㅋ
ISTP,선빵안치시면 발전하기어려울것같아요
ISTP,참고드리자면 그정도의 의지로 잇팁을감당하시기 어러우실것같습니다 ㅗㅜㅏ 돌아버리겠다 싶을땐 이미 딴남자가 홀랑 데려가버린후일것같습니다. 잇팁은 잇팁이 간택하거나 상대가 간쓸개 다빼고 진심으로 공략하거나 둘중하나같아요 간보시면 가요ㅠ
ISTP,"그럼 더그렇겠네요 나 너를 좋아해서 많이 사랑해주고 싶은데 니가 날 싫어한다면 어쩔수없겠지. 그런데 내가 싫어서 아니라 전여자의 기억때문에 사랑 할수없다는건 분한것같아.
모임말고 다른데서 만나면 연애해도 되는거야? 그럼 모임말고 오늘처음만난걸로 해보자. 안녕하세요 엔프피입니다. 해보세요. 귀여워서 까부러칠지도.."
ISTP,귀여우신 엔프피님의 연애를 응원합니도!!
INTJ,말 그대로 진취적이고 적극적이고 사람이 투명하다??
INTJ,"저 estp아니에요ㅋㅋ
intj인데
건강한 estp의 모습은 이게 아닐까 생각하고 적은거에요

estp도 깊어지면 감정에 예민해지고 크게 반응하지 않을까요

다만 그 바운더리가 좁아서 그렇지"
ESTP,"전 주위사람들 평가를 들으면서 스스로 건강한 엣팁이라고 생각하는 편인데 솔직하고 주관 뚜렷해서 멋있다는 소리를 들으면서도 배려심 있고 주변 사람 잘챙기고 따듯하단 말도 같이 들어요
인간관계는 내가 앞으로도 보고싶은 사람들 위주로 잘 챙기면서 관계에 있어 필요한 말은 꼭 하고 그러는 거 같아요"
ESTP,"다른분들 잘 적어주셨는데, 주변 잘 챙겨주기가 추가됩니다. 전 특히 제 주변사람성향 파악되면 그사람 성향 고려해줍니다.(계획적인거좋아하면 계획 세워서 브리핑해주고 괜찮아이거? 하고 물어보기, 내향적인 친구랑 밥먹으려는데 다른사람이 나도 가도되냐고 물어볼때 친구의사 먼저 물어보고 마지못해 니맘대로해 느낌이면 눈치채고 적당히 컷해주기) + 강강약약이라 주변사람이 곤란해하는거보면 귀찮은거감수하고 들이박아주기 같은게추가됩니다."
ISTP,"호감특징이요
다 겉으로는 티가 잘안나는것들인데 우선 그사람이 게속 생각나고요. 어떻게 접근해볼까 고민많이하게 되고요 눈을 잘못마주치고 능글맞은성격인데 그사람한정 뚝닥대고 적기귀찮다"
ISTP,칼답+꾸준한 연락 (찐친들이랑도 연락 잘 안 함)
ISTP,케바케 사바사예요 제 잇팁은 질문 없어요 선톡은 하고 눈보면 티나요
ISTP,개인적인성향이강한편인데 귀차니즘을 포기하고 내시간을 쓰고 행동하면 호감
ISTP,질문 많고 얘기를 계속 이어나가려 하고 답장도 빠르고 선물도 주거나 선톡도 자주 해요
ENFP,남자친구 성향을 잘 알아서 말씀하신대로 큰 방법은 없을거라고 생각은 했지만 ㅠㅠ 더 답답하고 그러네요.. 자기 고집도 쎄서 누가 뭐라해도 듣지도 않을것 같아여..
ISTP,빚이 있는 것도 아니고 사고친 것도 아닌데 굳이 왜 도와주려고 하세요 ㅋㅋ 아직 남자 20대후반이면 그렇게 안타까워할 나이도 아닌것같은데 나이 좀 더 먹고 주변에 같이 놀사람도 슬슬 없어지고 친구들 다 안정된 직장 잡고 능력 생기는거 보이면 본인도 슬슬 조급해질거예요ㅋㅋ 남의 말 잘안들어요 잇팁은…
ENFP,"본인이 스트레스 받아해서 도와주고 싶은거예요 ㅠㅠ 이해가 안가는 부분은, 그렇게 스트레스 받으면서도 뭔가 할 생각을 안한다는 부분.. 누군가 부추기면 뭐라도 하지않으려나 싶었어요. 홀덤같은데에 빠지는걸로 봐서 왠지 지금 정신이 건강한 상태같지도 않고요.."
ENFP,제가 본문에 홀덤에 대해 자세히 쓰지 않았지만 이 글을 쓰게 된 계기가 홀덤이예요. 지금껏 홀덤에 100만원 가까이 쓰게 된 사실을 알았고 매일 드나든다는 걸 알게됐거든요. 그 돈을 단기알바로 메꾼다는 게 참 답답했어요. 댓글 읽다보니 조금은 억울한 부분이 있어요. ㅜㅜ 그동안 저는 단 한번도 남친을 쪼아댄적이 없어요. 하고싶은 일 찾을 수 있도록 오히려 이것저것 같이 경험해주는게 제 일이자 낙이였어요. 기념일마다 쓴 편지엔 남친이 스트레스받는 것에 대한 위로가 늘 한가득이었고요..... 무엇보다 본인이 지금 자기가 보내는 시간을 즐기고 있다면 저도 관여하지 않았을겁니다.... 스스로 자괴감에 빠져 괴로워하면서도 어찌할 바를 모르니 도와주고 싶었어요.
ISFJ,"사랑하는 사람이라 괴로워 하는게 안타깝고 잘 됐으면 하는 간절한 마음이 있는건 알지만 갓난 아기때부터 키운 부모도 못하는거 연인이 어떻게 하겠나요. 연인으로, 그 적정선을 지키며 줄 수 있는 애정만 주시는걸 추천드려요. 남자친구 입장에서도 남자친구가 정상적인 사람이라면 동등한 관계인 연인이 옆에서 도와준다고 이것 저것 해주려고 애쓰는거 보이면 미안함+자책감이 더 들어서 괴로울 수도 있을거 같아요."
INTJ,"퇴사하고 단기알바하면서 공부하고 있는데, 공부하게 된 이유가 있어서 그 동기부여가 필요하지 않을까 싶어요 주변 친구들이 슬슬 직장이랑 연봉 얘기하면 공부할거에요 사람들과 연을 끊은게 아니기 때문에 크게 걱정 안하셔도 될거 같아요"
INTP,침대연애 생각나네요
ISTP,넘 좋은데요 ㅋㅋ
ISTP,"종일 누워서 부비부비하다가 배달시켜먹고 밤에 집앞에서 술한잔하고 또 집와서 부비부비할듯요,,"
ISTP,저인가요?? ㅋㅋ
ISTP,저 잇팁 남친엣팁인데 이게 생활이네요 ㅋㅋㅋ
ISTP,저두엣팁이엣티제가 저랑잘맞는것같아요 잇팁노잼ㅠ
ISTP,오 저희랑 남녀만 바뀌고 똑같애요 ㅋㅋㅋㅋ
ENTP,침대연애..? 밖에 ..나가긴 하나요..?ㅋㅋㅋㅋㅋ
