mbti,comments
ENTP,"친구같은 연애를 추구하는 타입이딘한데
스스로 부적합하다거 생각하지는 않습니다!"
INFJ,"친구같은 연애라는건, 편안하게, 연락 주고받는 것도 부담없이 하는 그런걸 말씀하시는건가유?!"
ENTP,"넵, 그 흔히 떠올리는 커플들 모습도 좋지만, 서로 편하게 장난치고 연락하고 위하는 사이욥!!
그렇다고 리엉 친구사이와 같지는 않은??
한마디로 서로 만나면 가장 유쾌하고 즐거운 사이요!"
INFJ,오호 ㅎㅎㅎ 감사합니당!!!!
ENTP,저는 그런 생각 종종 해요
INFJ,오오 드디어 그런 생각 하신다는 엔팁분 등장!! ㅎㅎ 주로 연인과 다툼 있거나 하셨을 때 그러셨나여? ㅠ
ENTP,상대가 저를 바꾸려고 할 때 그러는 것 같아요 ㅎㅎ
INFJ,오오 이것도 참고참고! 감사합니당 ㅎㅎ
ENTP,진짜 연애랑 하나도 안 맞는 사람이구나 느껴요 솔로일 때도 커플일 때도 ㅋㅋㅋㅋ 그래도 누군가를 만나게 되면 늘 최선을 다해요
INFJ,ㅎㅎㅎ 유칼립님은 주로 어떤 부분에서 느끼세요?! 예를 들어 어떤 사건이 있을 때?!
ENTP,사건사고가 있을 때나 서로 가치관이 충돌한다고 느껴질 때 보통 그렇더라고요! 어렸을 땐 가차없이 그냥 헤어지거나 상대가 헤어지자 할 때까지 질질 끌었지만 이제는 사회화 좀 됐다고 그래도 맞춰 주는 법은 배웠습니다 ㅎ...
INFJ,으아아 이 와중에 상대가 헤어지자 할 때까지 질질 끌었다고 하는게 의외인데요?!?! 보통 칼 같이 끊어내지 않으시나요?!
ENTP,칼같이 끊었을 때 계속 붙잡을 게 눈에 훤한 상대한테는 오히려 질질 끌었던 것 같아요 ㅋㅋㅋㅋㅋ 권태기를 가장한 쓰레기짓이었네요 생각하니
INFJ,호어어얼.... 그럼 헤어지기 전까지 만나기 싫고 이런데도 참고 만나셨나유?! 아님 그냥 연락만 주고 받으면서 약속은 피하셨나요? ㅠㅠ 마음에 두고 있는 엔팁남이 혹시나 이런 생각으로 저하고 연락을 이어가는 건가 싶어서 갑자기 불안감이 엄습하는 잉뿌제... ㅠㅠㅋㅋ 제가 붙잡고 연락 이어갈게 뻔해서 계쏙 연락 받아주나 싶어지네여 ㅠㅠ
ENTP,어이쿠야 불안해 하지 마세요 ㅋㅋㅋㅋ 불안 마시라고 덧붙이자면 그땐 약속을 오히려 대놓고 피하고 다른 사람들이랑 다같이 모일 때만 나가서 아직은 사귀는 중이지~ 이런 식으로 애매한 멘트 던지고 그랬어요 주위에 연애한다고 표시해 둔 거 하나둘 없애고... KTX 타고 가면서 봐도 헤어질 각 재는구나 할 짓만 골라서 했으니 그거 아니면 불안해 할 필요가 없어요
INFJ,"ㅎㅎ 저는 사귀는 건 아니고, 썸붕이였는데, 썸붕 나고 나서 자꾸 다시 귀여운 행동도 하고, 연락도 계속 이어가기도 해서 썸 다시 시작인가 싶었는데, 대놓고 약속 거절하고 다시 약속 잡으려는 모션도 취하지 않는 걸로 보아서는... ㅎㅎㅎㅎㅎㅎ 슬프지만 인정.... 해야죠 뭐 ㅠㅠ
답변 감사합니다아아아"
ENTP,"반반 입니다
연애할때 나름 인내심 갑이였을만큼
선만 넘지 않으면 다 받아줬고
그러면서도 제 할일은 놓지않으면서 다해요 ㅎㅎ
(개인시간 가지기, 취미등)
그러다가도 헤어지면 세상 언제 그랫냐는듯 행복하게 솔로생활 만끽합니다 ㅎㅎ"
INFJ,"공통적인 의견은, 일단 좋아하면 맞춰준다 군요.. ㅠㅠ ㅎㅎ 부럽네여 엔팁의 사랑을 받는 연인분들!!!!"
ENTP,엔팁는 간택필수져.. 인프제랑 잘 맞다하니 화이팅 입니다
INFJ,감사합니다아 ㅎㅎㅎ
ENTP,잘 맞는 사람이랑 만나면 장기연애 충분히 가능해요 근데 잘맞고 안질리는 사람 찾기가 매우 힘들뿐..저도 10년째 연애중이랍니닷
ENTP,혼자서도 잘 지내고 그러다가 마음에 드는 사람 있으면 표현하고 ~ 연애를 하게되면 내 생활도 하면서 챙겨주기도 잘 하는듯 합니다 사실 연애가 1순위가 아니기도 해요 ㅎㅎ 집착 없고 연락에 예민하지않은 스타일이긴합니다 ㅎㅎ
ENTP,네 전 저 스스로 연애와 사랑에 별로 적합하지 않은 사람인거 같아요. 개인주의도 심하고 타인을 위해? 희생하고 이런게 너무 어렵고 힘들다고 생각해요 ㅋㅋ 방법도 모르겠고 ㅋㅋ 아직 찐으로 좋아하는 사람을 못만나서봐서 그런걸수도 있지만 ㅎ
ENTP,"저는 장기로 연애를 하는 편인데 한번도 그렇게 생각한 적 없어요!
근데 나랑 안맞는 사람이랑 굳이 계속 만나야하나 라는 생각은 종종 했던거같아요"
INTP,맞아요 진짜 사회에서 제가 인팁이라 하면 다들 안 믿더라고요ㅠㅋㅋㅋ 찐친들은 역시 인팁이었군 하는데...
INTP,ㅠㅠㅋㅋㅋ 저는 페르소나를 얼마나 썼는지 ESFJ같단 소리도 들어본 적 있어욬ㅋㅋㅋ 거의 E는 패시브에 TJ도 진짜 자주 듣네요. 사회화된 인팁은 짱입니다 세상을 지배할 수도 있어요(??)
INTP,그치만 모임 5번 열릴 때 1번 참석하는 찐인팁입니다ㅋㅋㅋㅋㅋ 살다보면 ESFJ로 사는 날도 오고 그렇더라구요ㅋㅋㅋㄱ Isomer님도 인팁으로 살아남기 화이팅입니닷
INTP,저도 사람들이 ENFP로 보더라구요.사회화가 잘된거죵
INTP,저도 사회화 된 인팁인데 주변분들 저 인팁인지 몰라요 ㅋㅋ 찐친들만 인팁 인정하구요ㅋㅋㅋ 현코잘하고 있죠
ENTP,맞아요 근데 엔팁은 유난히 불건강이 그냥 그 유형의 원래 성향인 것처럼 싸잡히는걸 많이 봐서 ㅋㅋㅋ 좀 킹받았어요
ENTP,그렇죠ㅠㅠㅠㅠ 엔팁이 불건강해지면 워낙 안좋은 면이 강하게 드러나서 더 그런식으로 강인이 되는 것 같기도 한데 그게 엔팁 전체를 대변하는 건 아닌데 엔팁은 저래! 이런식으로 싸잡히는거 굉장히 마음에 안들었어요 ㅡ..
ENTP,2222 내말이 맞다고 무논리로 우기는애들보면 한심해서 입 닫아요
ENTP,저도 어릴때는 반박충이었으나 이제는 나이 먹으면서 말 안 통할 것 같은 애들과의 대화는 귀찮아서 넘기고 있읍니다
INTP,ㄹㅇㄹㅇ
ENTP,공감하시나요 ㅋㅋㅋㅋㅋ
ENTP,"저는 일부 편견 강한 스타일들이
한두명 겪어봤다고 결이 안 맞는다
별로다 할 때마다 좀 어이없더라고요
ㅋㅋㅋ 얼마나 안다고ㅋㅋ"
ENTP,바로 어떤 사람이 생각나는데 ㅋㅋㅋㅋㅋㅋㅋㅋㅋ.. 저도 안 맞는 특정 유형들이 있지만 그렇다고 해서 그 유형들에 대한 편견은 안 가지려고 노력하고 있어요 ㅎㅎㅋㅋㅋㅋ
ENTP,"저도 SF가 대부분 안 맞지만
어제 여행같이 간 친구가 ISFP거든요
사바사인데

엔팁 별루예요 결이 안 맞아여
댓글 볼 때마다
아 무서울정도로 본인말이 맞다고 생각하는구나 싶더라고요ㅋㅋ
엔팁밈이나 14기 옥순의 영향으로
엔팁이 이상하게 보이지 않았으면 좋겠네여~극 소수의 엔팁이 저렇다는건데ㅋ"
ENTP,엔팁중에 박유천 정준영 이런 사람들이 너무 인식이 강하게 되서 그런가.. 근데 황대헌 육성재 이제훈도 엔팁인데... 너무 속상하다규요 ㅠㅠ 옥순같은 사람은 진짜 ㄹㅇ 극소수의 불건강 엔팁인데 말이예여 잇프피는..음ㅋ 저도 아이러니하게 제 친구들중 잇프피가 젤 많지만 솔직히 잘 맞는건 모르겠어요 그냥 맞춰가는 느낌입니다..ㅋㅋㅋㅋㅋㅋㅋㅋㅋㅋㅋㅋ 엌 그나저나 보라님이랑 저랑 같은 사람 생각하고 있으면 개소름이네요
ENTP,"같은 사람 맞을거예욬ㅋㅋㅋ
맞아여 맞춰가는느낌 저듀저듀
잇프피친구들이 예민하고 금방 체력이 방전되더라고욬ㅋㅋ 왜케 일찍자ㅋ

착한 제훈씨♡"
ENTP,잇프피 칭구들 예민한거 인정..그래서 말할때 눈치 겁나봐요ㅜㅜ 모택에서 이제훈이 맡은 캐릭터도 건강 엔팁에 가깝다고 생각했어용 엔팁의 자랑♡
ENTP,"잇프피가 아닌 척 잘하고 뭐 말하면 속으로 욕하다가 실수로 나올 때 빼고는ㅋㅋㅋ 착하고 괜찮아욬ㅋㅋㅋ
우리 또 할말은 하고 살아야져ㅋㅋㅋ
저런게 안 맞고 싫다고 나랑 안 맞아요
하는 사람이 너무 많아서 안타깝지만
좋은점도 봐야지 흥
엔팁의자랑 이제훈♡ 육성재♡ 김세정"
ENTP,마자여 좋은점을 보려고해야지 딱 선그어버리거나 쟤네는 다 저렇다 이런식으로 보는건 안좋은것같아용 🥹
ENTP,청소년들중에 엔팁 비중이 많나용? 그건 처음 알았네요 근데 원래 10대 시절에 하는 mbti는 확실하지 않다고 하더라구요ㅠㅠ
ENTP,"저는 제가 먼저 싸움건적도 시비건적도 피해준적도 없는데
적이 많아아요
시기 질투등
그런것들이 왜곡 되었을수도..
진짜 남한테 피해주지도 받지도 말자 마인드입니다"
ENTP,맞아요 저도 본의아니게 적이 많아요 ㅋㅋㅋㅋ 그냥 제가 뭔 얘기를 하면 그걸 고깝게 받아들이는 사람들이 꼭 있는..ㅎㅎ 걍 이젠 그러려니합니다
ENTP,"약간 찐따 특을 왜 여기다 붙이는지,, 정말 억울 ㅜ"
ENTP,상황과 분위기파악 못하고 아무때나 할말 다하는 쿨찐 뭐 이런게 엔팁 이미지인거같은데..ㅋ...진짜 어이가 없더염 그건 그냥 유형 관계없이 쿨찐 특이고 엔팁도 할말 해야할때 안해야할때는 가리는데..ㅎㅋㅎㅋ
ENTP,"마자영,, 증말 속상해유,, 그래서 엔팁이라고 하면 초면일때는 약간 웁스 하는 경향이 ,,ㅋ"
ENTP,하지만 그래도 전 제가 엔팁인거 당당하게 얘기하고다녀요 ㅋㅋㅋㅋㅋ
INTP,생각없는 말은 인삿말로라도 안해서 연락올거같애여
ENFP,"앗 정말요?!🥺
제 기준으론 둘러둘러 거절의 표현이라고 생각했는데 어쩌면 연락올수도 있겠군요…!
감사합니다🥲"
ENFP,"잡아둔 약속은 아니구 제가 만나자고 한건데, 일정이 있다고 담에 보자구 일정확인해보고 연락준다고 하더라구요..!
정말 만나고 싶었는데 바빠서 그런거면 좋겠네요🥲"
ENFP,빈말일수도 있겠군요…🥲
ENFP,앗ㅠ 이건 상대에 대한 호감도.. 정말 사바사 겠네요..🥲
INTP,아뇨.. 관심 많은 사람 아니면 연락 하기로 한 걸 까먹습니다….. 상대가 적극적으로 잡아줘야 잡힙니다….
ENFP,"앗.. 뭔가 제가 먼저 연락했다가 일정이 있다던가, 방해가 될까봐 걱정되는데..ㅠ 자기가 먼저 말한게 있으니 기분나빠하진않을까요?ㅠ"
INTP,"그럼요~ 그런걸로 기분 나빠하지 않아요~ 단, 만약 귀찮아하거나 약속을 애매하게 미루고 잡지않으면 선 긋는 겁니다"
ENFP,헉..만약 이대로 약속을 잡지않는다면 선긋는거라고 생각해야겠네요..🥲
INTP,아마 그분은 약속 잡는걸 까먹었을 거예요~ 그건 선 긋는게 아니라 진짜 까먹은 거구요~상대가 약속 잡자고 했을 때 안 잡고 바쁘다며 애매하게 굴면 선 긋는 겁니다
ENFP,아하!! 그렇군요!!! 일단 바쁘다고 했으니 타이밍을 보고 다시 말해보던가 좀더 기다려 봐야겠네요!!
INTP,"7번은.. 인팁이라고 남들이랑 단 둘이 안 마시지 않습니다
9번도 그렇고 너무 상대를 mbti에 가두지 않는게..!
몇갠 애매한데 전체적으론 호감으로 보여요"
ESTJ,"의견 감사합니다
원래 mbti는 대표적 특징들만
참고하는 성격인데

인팁 친구랑 알게된지
7주밖에 안됐다 보니 아는게 없어서
더욱 맹신하게 되려는 거 같아요..

남자 선배랑 단둘이 술먹은 그게
제일 마음에 걸려서 슬프기도 합니다만

남자 선배 말로는
인팁이가 취업 때문에 고민ㅇ이 많더라
하시더라구요 그래서 취업때문에
고민상담겸 술 마신건가 싶기도 하구요"
INTP,"특징들이 틀린 말은 아니지만
상황에 따라(마음에 따라x) 달라지니까요~!!
지인이랑도 단둘이 술 마실수도 있지요
남자라는 단어로 콕 집지 않으셔도 될 거 같아요"
INTP,"호감 없는거 같아요
인팁녀는 이미 글쓴이가 좋아한다는거 충분히 알고있네요 그런데도 반응이 시원찮은거보면 힘들것같아요
글쓴이 힘들게 할거같아요"
ESTJ,그렇군요 의견 감사합니다 :)
INTP,"4. 몰랐을것 같음 ㅋㅋ
호감있는거 같은데 서운함을 표현한 정도면 마음이 아예 없진 않을듯요"
ESTJ,헷갈리네요.. 불도저 직진은 해보겠습니다 ㅜ 의견 감사합니다
ESTJ,그렇군요 의견 감사합니다 :)
INTP,"아....애석하게도 딱히 호감이라고 볼만한 포인트가 없어요ㅠㅠ....그냥 인간관계를 잘 하고 있다. 친한 사람1이다.

궁예해보자면 글쓴분한테 서운하게한 거 있느냐 물은 건 인팁이 뭘 잘못해서 글쓴분 태도가 달라졌나 싶어서 대놓고 물어본거고, 친구분한테 글쓴분 기분 어땠는지 물어본 건 본인한테만 태도가 냉랭해진건지 아니면 다른 것 때문에 기분이 안좋은 거라면 지인으로서 해결해주고 싶어서 물어봤을 거라는 생각이 드네요."
ESTJ,그렇군요 의견 감사합니다 :)
ESTJ,조언 감사합니다 :)
ESTJ,그렇군요 의견 감사합니다 :)
INTP,호감보여여 선톡도없구 애매하면 마음을 전하세여 그래야 연결이되든 잠시 친구로 끝이든 되니까여
ESTJ,호감이 보이신다니.. 의견 감사합니다 :)
INTP,저도 호감이 없다라고 생각되네요
INTP,딱히 이성적 호감이라고 하기엔 애매하네요 인팁은 자기감정이 어떤지 잘 모르는 사람들이 많으니까(특히 어릴수록..) 그냥 속맘을 표현해 보심 어떨지..
INFP,그 글의 결론에 굳이 저를 언급하면서 얘가 한 소린 개소리라 난 이제 무시하기로 했어~ 라고 헤어진지 한 달도 넘은 시기에 굳이 쓴게 저 보란듯이 올린건가 해서요 ㅠㅠㅋㅋ.. 헤어진지가 언젠데 아직도..
INFP,그렇군요..어휴.. 제 입장에서 보기엔 그냥 한심하네요... 본인 앞가림이나 잘 하고살지..
INFP,아.. 진짜 친구분껜 죄송하지만 정말 아닌 것 같아요... 하.. 심지어 제가 말한 엔팁은 자기관리도 안하는데 저렇게 본인의 행동과 말에 근자감만 많은거라 더 싫은 것 같아요.. 🤯
INFP,넵 ㅋㅋㅋ 조언 감사해요. ☺️
INFP,아하.. 그렇군요 근데 저랑 맞팔도 안되어있는데 올린게.. 신기하네요 저는 심지어 차단을.. 해뒀는데 ㅎ.. 친구놈을 패야겠군요^^..
ENTP,"그냥 신박하게 시비거는거 같은데요. 무시하세요 ㅋㅋㅋ
말 전한 친구 통해서 엑스가 개무시하더라 소리 들어가면 삭제하겠죠 뭐 ㅋㅋㅋㅋ"
INFP,넵! 감사합니다 ㅋㅋㅋ
INFP,연애할 때도 그랬습니다^^ 헤어진 이유 중에 말을 항상 너무 구구절절 해서 그런 것도 있었어요 ㅋㅋ 감사합니다☺️
INTP,"혼자 생각정리하면서 글쓴 건 그러려니 하는데 토사구팽 뭐얔ㅋㅋㅋㅋㅋㅋㅋ앜ㅋㅋㅋ저 쪼끔 터졌어요 죄송 ㅠㅠ 보라고 올린것도 맞고, 억울했나보네욬ㅋㅋㅋㅋㅋㅋㅋ"
INFP,어우 괜찮아요^^ 저도 보면서 비웃었오요 ㅎㅎ 제가 정말 싫어하는 사람이라.. 본인이 한 잘못은 쏙 빼놓고 자기 말이 맞고 제 생각이 틀렸다고 써놓은 것만 봐도 뭐..^^
ENTP,찐따인듯
ENTP,22222
INFP,감사합니다. 속 시원하네여 ◠‿◠
ENTP,걍 웃기네요 ㅋㅋ
INFP,이게 뭔🐶소리지 싶어서 저도 보고 웃었네요 ㅋㅋㅋㅋㅋ
ENTP,"친구에서 썸으로 넘어가는 단계같기도해요 일단 엔팁이 물음표가 많아지는건 관심이 어느정도 있다라는?
선톡은 저도 연인 아닌이상 용건 없면 잘안하는편.."
ENTP,"여자이긴하지만.. 진짜 운명의, 평생같이가고 싶은 친구를 발견했다의 느낌도 있는데 대놓고 표현하는걸 보면 이성적인 호감이 제로는 아닌거 같아요. 가치관같다고 느꼈고 저 정도의 연락과 말이라면... 툭툭 건들면 조금씩 썸으로 넘어갈거같아요. 저도 연애상대에게 연애전에 연애생각없다고 말했던 기억이 있네요 왜그랬냐하면 괜히 친한친구잃을까봐 그랬던거같아요"
ESTP,"저 엔팁 남자친구가 사귀기 전 한 행동이 3,4,5,6,7번이랑 똑같아요 친구 - 썸 맞는 것 같기도 해요!"
ESTP,헉 그런가요? 전 제가 꼬셔서요..
ESTP,"친구일 때도 서로 장난식의 플러팅은 자주 했었어요 숨 쉬면서 나오는 게 플러팅이라 ㅋㅋ 
제가 일하는 곳 단골이라 친해진 거였는데 어느 순간부터 그 친구가 안 오면 왜 안오나 싶고 보고 싶은? 신경이 쓰였어요 원래 연락 안 하던 사이었다가 제가 먼저 연락하고 데이트는 엔팁이 먼저 제안했어요!
사귀고 나서 제거 어느 순간부터 신경이 쓰였다는 걸 말했는데 남자친구도 저 말고 다른 사람이 일하고 있으면 괜히 실망하고 그랬었다고 하긴 하더라구요"
ESTP,저희도 모르게 썸을 타고 있었던 걸지도 모르겠아요ㅠㅠㅋㅋㅋ
ESTP,티키타카가 잘 맞았던 게 한몫 한 것 같아요 또 엔팁이 내향형에 끌린다는 말이 있듯이 남자친구도 저 만나기 전까지는 내향적인 사람만 만나다가 절 만나서 좀 신기해 하는 면도 있었고 제가 하는 말마다 엄청 웃겨해요 꼭 성공하세용 상대도 마음에 있다면 가끔씩의 플러팅은 좋은 것 같아요
ESTP,헐 맞아요 저도 남자친구가 하는 말마다 잘 받아쳐줘서 되게 웃겨했어요
ENTP,"저도 6.7.8 에선 호감으로 느껴지는데 나머진 이성적 호감 판정내리기엔 애매한 감이 있네요
연애할 생각이 없다는거 저도 해 본 말이긴한데
사실 연애는 했습니다.. ㅋㅋㅋ
다만 저한테 연애 생각 있냐고 물어본 친구한테
없다고 했습니다.. tmi이긴한데 그 친구는 절 좋아했거든요
저는 이성적 호감이 그 상대한테는 안 느껴져서
근데 그 사람을 절 좋아하는게 보이니
그렇게 말했습니다.

근데 그 분이 관심가지고 있는 단계 같아요
막 엄청 좋아한다까진 아니고 관심이 생겨서 스며드는 느낌이랄까요?
질문도 많고 답도 빨리 보는거면 관심있는거라고 할수있어요.."
ENTP,넵 홧팅!!
INTP,진짜 너가 좋다 (명쾌)
INTP,정말 딥비디비딥 한 이야기임미당.
INTP,오.. 진짜 사랑받고 계시네요
INTP,오 대박...ㅋㅋㅋㅋㅋㅋㅋ
INTP,쓰신그대로여 깊은진심을 순간순간 표현하는거여
ISTJ,안친하던 그냥 인스타 맞팔정도만 하던 사람과 갑자기 관계가 진전될 수 있나요? 사람을 오래 보는 편이신가요?
ENTP,"뭔가 계기가 있으면 확 가까워져요. 가령 그전엔 안보였던 그 사람만의 매력이라던가 이런게 발견되면요.
가까운 사람은 오래봅니다.
근데 바운더리 밖의 사람은 관심도가 떨어져서 0.1의 관심도로 볼 수 있어요.
이름을 틀린다던지 얼굴을 기억 못한다던지 애매하게 기억한다던지 그런 특징을 보여요."
ISTJ,오 바운더리 관련해서는 저랑 비슷한거 같아요!! 자유자재로 친해질 수 있는 능력은 조금 부럽네요☺️
ENTP,잇티제 기억력 대박인데 관심사 밖의 사람에겐 가차없군요 ㅋㅋㅋㅋㅋㅋ
ISTJ,기억하려는 노력조차 안합니다ㅋㅋㅋ
ENTP,"ㅋㅋㅋㅋㅋㅋ현웃 터짐ㅋㅋㅋㅋㅋㅋㅋㅋ
저는 좀 기억하고 싶은데ㅋㅋㅋ안됨ㅋㅋㅋ뇌내 네크워크 검색 돌려도 관련자료 없음으로 뜨구요
ㅋㅋㅋㅋㅋ근데 쓸데없는 정보량은 넘쳐나요 ㅋㅋㅋ가령 택배박스 테이프 쉽게 벗기는 법 같은 아니면 제기랄의 어원이라던지ㅋㅋㅋ"
ISTJ,Entp친구들 보면 잡다한 지식이 많더군요ㅎㅎ기 관심분야가 넓게 퍼져있는 듯한 느낌? 박학다식해보였어요
ENTP,"궁금하면 입이 드릉드릉 하고 알고 싶어서 난리나는 습성 때문에 그런가봐여
정작 뚜껑 열어보면 챗gpt처럼 대략난감한 자료인 경우도 많아요 ㅋㅋㅋㅋ"
INTP,"질투유발할때도 있으신가요?
사귀는 사이가 아닌데 질투유발하고 제 사생활 터치하는건 그만큼 좋아서 그런건지 궁금합니다"
ENTP,"질투 유발 고의적으로요? 전 해본 적 없는 것 같아요. 있다면 고의는 아니었을 듯.
사생활 터치는 엔팁이 거리감 계산 잘못해서 그래요. 솔직하게 딱 주의 주면 ok하고 물러납니다.
치대고 자꾸 들러붙어서 관심보이는건 사람 자체를 좋아해서 그래요.
특히 인팁이면 동료의 냄새가 나는데 나와는 다른 유형이라 엄청 궁금할거예요."
INTP,술집에서 술먹고 있으니 오늘 허락할게 놀아~ 이런식의 말을 하는게 좀 의아해서요 ㅋㅋ 인팁인 저는 그런 쿨한척은 오히려 상대반응볼려고 할때 써서 .. 그럼 호감과 사람자체를 어떻게 구별하고 행동하시나요?
ENTP,"그런 류의 멘트는 그냥 숨쉬듯 자연스러운거라...제가 다 죄송하네요.
같은 멘트여도 좀 능글맞게 영화대사처럼 치면 농담인거고
진심이면 두 눈 응시하면서 부담스러울정도로 진지하게 말했을거예요.
연애하면 진지모드로 바뀌고 엄청 감정적으로 변하더라구요"
INTP,"ㅋㅋㅋ아하 글쿤요 이친구가 오래알고지낸 친구사인데 (중간에 애매하게 썸이 있다가 끊어졌네요) 저한텐 이친구가 워낙 장난기가 많고 의도 안한 플러팅을 많이해서 저도 오해안하랴고 하는데 ㅋㅋㅋ 오묘하게 분위기가 바뀌어서 궁금했네요
일단 김칫국 마시지 말고 있어야겠어욬ㅋㅋㅋ"
ENTP,분위기가 바뀌었다라~~오호라~~~풍악 울릴 준비 할까여?
INTP,"앜ㅋㅋㅋㅋ 김칫국 떠먹여주시는 ㅠㅠ 뭔가 급 진지모드+장난기가 사라져서 제가 확 긴장하게되네여
제가 좀 철벽이 심한데 좀 저도 마음을 흘려봐야 제대로 알수있으려나요 ? ㅎㅎ"
ESTP,혹시 쪽지로 질문 보내드려도 될까용
ENTP,넹
ESTP,보냈습니다!
ENTP,저두 보냈습니다
ESTP,확인하고 방금 하나 더 보냈습니다 감사합니다
ESTP,"엔팁은 엣팁과 어떤가여
이성 궁합ㅂ"
ENTP,전 좋았어요ㅋㅋㅋ이성적으로 매력있음.
INTP,Mbti 도 안맞는다는걸 알게 됐으니 ...
ESFP,"그니까여 그걸 알게된 이후로ㅋㅋㅋ더 괜히
생각이 많아졌어요"
INTP,"인팁 불도저 완전 가능이에요.
꽂히는 일이 별로 없어서 그렇지, 한번 꽂히는 이성 나타나면 그런 불도저가 없습니다...
저는 오죽하면 너무 적극적으로 돌진해서 문제라는 얘기를 엔프피 남자한테 들어봤다니까요...🥲

인팁분...응원합니다ㅋㅋㅋㅋㅋㅋㅋ
그정도 꽂혔으면 어지간히 다 맞춰드림 ㅠㅠㅎㅎㅎ"
INTJ,상대가 좋다고 말하면요?
INTJ,우선 저만 좋아하는 상황
INTP,맘에 여유가 있고 연애할 마음이 있는데 상대가 나도 모른새 맘에들어오면 불도저 되는거같아용
INTP,"편하게 내 생각 얘기해도 되어서 좋은 지인들...계속 연락하고 지내는 대학 동기들과 선후배들의 대다수
estj, istj

적당히 티격태격하면서도 오구오구 잘해주고 챙겨줘서 편한 지인들
enfj, isfj

전 주변에 nt가 너무 극소수라서 데이터가 별로 없어서 꼭 만나보고 싶어요.

지금까지 만난 사람들중에서는 사실 맘편한 거 enfj, isfj(☆☆☆)예요 ㅋㅋㅋㅋㅋstj 친구들은 저랑 계속 놀아주고 챙겨주지만 답답해하는 게 느껴지거든요🥲"
INTP,네! 엔프제분들 성격도 포용적인 느낌이 있는데 동시에 자기 할일도 계획성있게 잘 추진하셔서 멋있더라구요! 사교적이셔서 인팁의 노잼 농담이나 길잃은 대화주제에도 호응 잘해줌 ㅠㅠ 왜 인기 많은 엠비티아이인지 알겠어요 ㅋㅋㅋㅋㅋ
ISTJ,"안맞는 유형 : 엔프피 엣프피 엔프제 엣프제

잘맞는 유형 엔팁 엣팁

무던한 유형 인프피 인프제 엣티제 잇티제 잇프피"
INTP,"이거 공감이요.
본인 기준 있는 거 알겠고, 존중하고, 멋있다고 생각하는데 그걸 그대로 저에게 씌우려고 할 때 엄청 거부감 느껴져요...."
ENTP,"지나가는 엔팁. 인팁 좋아해요 같이 한 주제가지고 이야기하면 한두시간 훌쩍 가요 !!
퇴사하셨지만 가끔 연락해요"
INTP,estp 제일 안맞고 대체로 s유형 안 맞아요
INTP,"잘맞는 유형 intj infp istp
안맞는 유형 xsfx, estx
안 맞는 유형도 친한 사람들 있는데 그냥 맞춰주는 느낌으로 친한 것 같아요.
보수적이고 전통적인 유형이랑 안 맞는 듯요"
INTP,Sf유형이랑 정말 안맞아요
INTP,"네 내 모든 걸 오픈해도 아깝지 않은 사람이죠.
보통은 찐친이거나 이성적으로 끌리는 사람한테만 해용"
INTP,"일단 저랑 제 주변 인팁들은 잘 하긴 해요. 물론 믿는 사람에게만!
호감 표시일 가능성이 굉장히 높아요. 저도 약간 저런식으로 친해졌다가 연인 된 경우가 많았습니다..!"
