mbti,comments
ENTP,"와 ㅎㅎㅎ 상당히 과학적으로 드시는데요?!
폭풍 질문드리규싶네요 ;ㅁ; ㅋㅋㅋ
비타민 C는 아스코르빈산 가루형으로 드시나요? 전 산화마그네슘 싫어가지고 가루로 먹거든요
비타민 D는 몇 IU로 드셔요?
콜라겐 보통 효과 못보던데 피쉬콜라겐가루는 좋다고 하더라구요 :D 아마존에서 사볼까 고민중이여요.
그리고 제품 추천이랑 식후 섭취 꼭 기억할게요 !!ㅎㅎ"
ENTP,"제가 이석증이 또 도져서 글을 늦게봤네요 ㅠ.ㅠ.ㅠ D3가 5000은 과하다고 다들 그러셨는데, 그거 하루 안먹으니 바로 이석증 ㅠㅠㅠㅠㅠㅠㅠㅠ
앗 여기는 미국 캘리포니아라서 받고싶어도 ㅠ.ㅠ...못받는 게 넘 슬프네용 한국이시죠?
여러모로 답변 너무너무 도움 많이되서 감사드려요!!!!"
ENTP,오메가3 종합비타민이용!
ENTP,"오메가 종합비타민은 필수인가봐요 ㅋㅋㅋㅋㅋㅋ
종합비타민이랑 D 하루 못먹었는데(햇빛까지 못봤더니) 바로 이석증 도지는거보고 무섭네요 ㅋㅋㅋㅋㅋㅋ"
INTP,"웬만하면 '아니겠지 / 다른 사람들한테도 그러겠지' 라고 생각하려고 하기때문에, 저한테만 반복적으로 하거나 누가봐도 강한 플러팅일 때 눈치채요!"
INTP,그리고 뭐하자 하는 제안 저 같은 경우엔 안 싫어합니다! 너무 몸 쓰는 것만 아니면;
INTJ,1달 전까지 연락 잘 되었고 준 날 이후 뭔가 저한테 눈치보는 느낌이 들었어요
INTP,앗 그럼 그분이 묘한 뭔가를 느끼셨나본데요..?? 뭐하자고 제안 해보세요!
INTJ,"오늘 그분한테 오랜만에 연락드렸는데 그쪽 관심사가 아닌것 같네요
근데 마지막에 제가 방학 잘지내라고 하니깐 “ 넵 방학 잘 보내세요!”라고 보내주셨네요
그리고 제가 디엠으로 하트 표시 보내드림
긍정적인건가요?"
INTP,"진짜 모름
뭔가 있는것 같은데 아니겠지 생각함
맞는 것 같은데 .. 왜 나를??
내가 받아야하나??

이 정도 생각하는 편인거 같아요
근데.. 맞는데 난 모른척 할래.. 했던 경우도 있는거 같네요"
INTJ,그런가요?
INTP,"뭐 인팁이 플러팅을 잘 대처하지는 못하는 편인거 같긴 해요..
그래도 잘해주는 사람한테 관심이 안 갈 수는 없겠죠?ㅎㅎ"
INTP,모릅니다. 뭐에 따라 다릅니다.
INFJ,"다른것에 집중 중입니다..
아니면 답하기 애매하거나 귀찮을때 안읽씹하고 있다가 하고싶을때 하드라구요 저는 눈치가 빨라서 그런지 다 느껴지드라구요..ㅋㅋ"
ESTP,22 남자친구가 엔팁인데 진짜 공감이요..
INFJ,ㅋㅋㅋ 엔팁박사가 된듯..이놈의눈치...피곤합니다
INFJ,33 다른거 하느라 ㅋㅋㅋㅋ그 이상도 그 이하도 아님ㅋㅋㅋㅋ
ENTP,"안읽은 메세지 999+찍어본 적도 있어요
상당수는 게임 길톡방이긴 하지만ㅋㅋㅋ
항상 폰만 쥐고 사는 건 아니라서..."
ENTP,스몰토크 끝나서요
ENTP,"애인이나 중요한 사람아님 귀찮거나 다른거하느라 안읽다가
몇시간~며칠 후에 한번에 답합니다
귀찮아서 알림도 안오게 설정합니다
저도 왜 이러는지는 모르겠네요 ㅋㅋㅋ"
ENTP,좌우명이 스스로 되뇌는 말이라면 저는오늘은 뭔가 기분 좋은 일이 생길 것 같다
INTP,내 몫의 고난을 지고 들어가자.
INFJ,"그 누구보다 행복하게 살자

입니다"
INTJ,모든 문제를 해결할 수 있는 하나의 열쇠는 없다. 사로잡히지 말고 이해하라.
INTJ,여러 답이 만나 퍼즐조각이 맞추어지고 합일이 되는거죠.
INTJ,모든 답이 각자의 위치에 역할을 하고 유기적으로 연계되어 하나의 연주가 되는거죠. 문제는 보통 하나의 문제를 내포하거나 내포되고 있는 경우가 있고 그 문제는 다른 문제와 연결되어있으며 각자의 자리에 맞는 열쇠가 필요합니다.
INTJ,이해가 불가능하여 해결할 수 없는 문제를 접근할때 실체에 다가가기보다는 대상을 간략화해서 도식화하는 행동은 편리성을 제공하지만 답과는 멀어질 수 있습니다. 이런 행동은 시간과 밀접한 관련을 보일때 치명적일 수 있습니다.
INFJ,"Now or Never
지금아니면안돼"
INFJ,"저 완전 벼락치기에여ㅋㅋㅋㅋ미루다 한번에 몰아서 해치우는스타일..
그래서 미루지말자 나중은 없다 지금해야해!! 라는 뜻으로...ㅋ"
INFP,인생은 마이웨이~
ENTJ,시간을 낭비하기엔 인생이 너무 짧다
INFP,강강약약
ISFJ,후회없이 살자 !!
ENTP,"""하면 된다""

시간 없다-는 사람에게는> 시간은 만드는거다 말하고
자리가 없다-는 사람에게는> 자리는 만드는거다
남들한테 자주 하는 것 같구요 ㅎㅎㅋㅋㅋ

지극히 S같은 발언이지만 사실 반대라서 그래요ㅠ
너무 생각이 많고 생각이 사방팔방으로 뻗어가는 저로써는
저 좌우명이 그나마 좀 몸을 일으킬 동력이 되더라구요 ㅎㅎㅎ
일단 할까?말까?어떨까?이럴까저럴까? 아니야......일단 부딪히면 어떻게든 잘 될거야! 하는?
때론 생각을 덜하고 일단 행동하는게 에너지도 생기고 더 좋은 아이디어도 생기더라구요."
ESTP,"""하지만 인간은 패배하도록 창조된 게 아니야. 인간은 파멸당할 수 있을지 몰라도 패배할 수는 없어""

제 인생 소설인 노인과 바다의 명대사가 제 좌우명이에요"
ENTP,어제와 똑같이 살면서 다른 내일을 기대하는건 정신병 초기증상이다
ISTP,20년전부터 그럴수도있지 가 좌우명 ㅋㅋ mbti는 과학인정합니다
INTP,확신이 틀린 경우가 많나요?
INTP,"저는 대체로 틀릴 가능성을 남보다 크게 생각하기 때문에 저정도로 확신하는 것은 대체로 정답인 경우가 많아요

그러나 틀린 적이 아예 없냐고 한다면 그건 아닌 것 같네요 사람이 100센트일 수 없으니까..?"
INTP,주장은 확실한게 좋으니 제 생각은 이렇다 맺음형으로 말하되 질문이나 반박을 받는편입니나
INTP,타인에게 고집있다거나 하는 다소 부정적인 피드백을 받으신 적 있으신가요?
INTP,그건 맨날듣는 말이고 팩트기때문에 .. 할말이없는데 완고한 고집말고 수용하는 태도는 디폴트로 가지고있습니다만 부정적인 피드백을 받으셨나용?? 상대의견이 논리적이면 저도 한수접는데 비효율적인건 못참고 그래도 설득안되면 하자는대로 해서 망하는걸 보여주는편이죠 그러면 듣더라구요.. 저도 사회성이 무너 져 .. 버리는 사람같군요 ㅜㅜ 근데 맞는말 어케참죠..
INTP,귀찮아서 의견 이야기를 잘 안합니다. 그래서 할 때는 그냥 합니다. 오히려 그러면 의견에 힘이 생겨서요.
INTP,저도요. 그럼 반대하던 사람들도 '원래 말 안 하던 사람이 저러는데는 이유가 있다 다시 점검해보자~ '하는 식으로 흘러가더라고요
ENTJ,짝사랑 왜 정리하셨어요?ㅠ
ENTP,"1.이대로 가면 너무 좋아하게 되서 스스로 문제가 될 것 같기 때문에
2.상대방 쪽이 부담스러워하는게 느껴져서
3.트라우마를 자극하는 작지만 큰 상처를 받아서
4.연애를 한다 한들 현실적인 여건들이 만족스럽지 못해서 등의 이유로요ㅠ"
ENTJ,ㅜㅜ 공감가네요. 전 엔티제 심남 분이 있는데 저도 그냥 멀리서 바라보면서 응원할까 고민되네요🥲
ENTP,정리하면 마음의 상당부분이 비어버리는 것이라 상당히 공허합니다. 대신 비어버린 그 부분을 자신을 위해 채울 수도 있겠죠
ENTP,일단 사적인 연락부터가 끊길 것 같고요 말투가 평소의 모습으로 돌아옵니다. 그렇다고 그 사람을 싫어하는 건 아니기 때문에 술 한잔 하자하면 만약 내가 그 사람이 너무 좋아질까 감당할 자신이 없는게 아니라면 나갈 것 같긴하네요. 속 시원하게 털어놓고 좋은 동료로 지낼 수도 있는거니까요 만약 바운더리 밖으로 나가서 정이 이미 다 떨어진 상태라면 진짜 어떤 이유를 대서라도 피할 것 같습니다. 사실 직장동료가 아니면 그냥 싫은데?라고 말할 정도로 칼같이 끊어낼 것 같습니다
INFJ,엔팁이 먼저 밥먹자고하고 연락 계속 하고 장난친닥 요???돌직구 그린라이트 10000%입니다...
ISTJ,"제가 한달정도 전쯤 혼자 좋아한다 생각했고 제 마음과 감정의 결이 안맞는 상황이 있었어서
혼자 다 끊고 잠수 탔었어요ㅋㅋㅋ"
ISTJ,"그래서 그런지 제가 지금 점점 마음이 시든? 느낌은 들어요ㅋㅋㅋ 친구 같은 느낌요
제가 전에 좋아했던걸 던졌는데
약간 재밌게 반응한게 저는 조금 걸려서 답답하긴 하네요"
ISFP,"친구랑 약속있는 날=노는 날
평범한 하루=쉬는 날"
ENTP,"위에 댓글들 참 편안하네요.
매일 나가는 사람대단해보임."
INTP,끝내야 시작하는 관계도 있죠는 뭔..소리야 싶겠지만 그런 인연도 있을거같아여
INTP,"개인적인 사견인데 인팁은 썸 오래타면 안되는 스타일이에요.
여자든 남자든 초반에 흥미 max일때 지금 아니면 이사람을 더 알아볼 기회가 없겠다 싶은 위기감과 함께 직진 고백 박고 관계형성을 먼저 하면 성공률이 좀 높더라고요.
티피들은 시간을 끌수록 딴생각을 하는 거 같더라고요..
고생많으셨습니다. 혹시라도 상대분이 후회하면 좋겟네요 ㅎㅎ"
INTP,이상한 사람을 만났네요. 우리는 저걸 어장이라고 부릅니다. 고생하셨습니다.
ESFP,저랑 비슷한 상황이네용.. 똥인지 된장인지 찍어먹어봐야 아냐고 하는데 전 찍어먹어보고싶어해서 관계 유지 즁입니다 ㅠㅠ 후 뭔가 저의 미래 상황 같아요 관계가 끝날 것을 두려워서라는 말도 들어봤거든요 ㅠㅠ 진짜 열받네요 ㅠㅠㅜ
ESFP,네 ㅠ 저도 조금만 더 지켜볼게요!! 연락오셨다는데 후회 연락인가유?!!!!퓨ㅠ 제발 그랬으면
ESFP,ㅜㅠ 맞아요 흔들리는 마음 충분히 이해합니다 ㅠㅠㅠㅠㅜㅜ 이야기해보시고 그래도 굳게 마음먹으시고 아니다 싶으면 진짜 그만해요 ㅠㅠ 제친구들 마음이 이런가봅니당.. ㅠㅠ 친구들 노발대발할일ㅠㅠ
ESFP,근데 이렇게 있다가 정리해서 헤어지는거나 사귀고 나서 헤어지는거랑 무슨차이일까요? 더 지내기로 한다면 본인은 그 기간동안 상처안받도록 마음을 정리하겠다는건가요??마음정리할 시간을 달라는건지?! 그게 아닌거면 더 지낼수록 마음은 깊어질텐데 무슨.. ㅠㅠ 진짜 이해불가능한 존재입니다..
ESFP,"ㅋㅋㅋㅋㅋㅋㅋㅋ 제가 좋아하능 인팁남 이야기하면서 재가 제친구한테 맨날 하는 말입니당 정말 특이한놈, 도라이,, 등등 ㅠ 잘다녀오셨길!!!!💛💙💜"
ENFP,"무슨 느낌인지 충분히 공감됩니다ㅠㅠ

저는 인팁이랑 1달정도 썸탔는데
저는 점점 인팁에게 빠지고있는데 인팁이 점점친구같아지고 편해지고해서 좋은데 연인으로는 힘들거같다라구하더라구요ㅠㅠ"
ENFP,"오 엔프피가 쟁취를못한걸 받아들이기쉽지않을텐데요..
저는 할수있는데 까지 해볼려구요!"
ENTP,좋으면 사귀는거지 뭔 말이 길어? 라고? 정의하시면 됩니다
ENTJ,"인팁 엔팁 연락패턴은 비슷한가요? ㅋㅋㅋ
둘이 어떤 차이가 있는지 궁금해요"
ENTJ,그렇군요. 꼭 연애 뿐 아니라 인팁님이 보시기에 엔팁과 인팁은 뭐가 다르다고 생각이 드시는지 궁금해요!
ENTP,"일주일 내로 한 번씩 뭐하냐고 선톡이 오는데 이건 그냥 할일없고 심심해서 보내는건가요? 

딱히 용건없이 뭐하는지만 물어보고, 먼저 연락했으면서 단답만 하는것도 어쩌라는건가 싶습니다. 매번 저만 대화 이끌어가고 질문하기도 지칩니다. 

원래 대화 방식도 그랬기에, 지쳐서 선톡을 안 한지 한 달째인데 그 동안 저런 행동을 보입니다. 혹시 상대를 만만하게 보거나 그냥 재미로만 여길 때 이와 같은 행동을 하는건가요? 저를 친한 존재로 여기는 상황은 아닌 것 같아서요. 

intp와 앞글자만 달라서 사고방식이 어느정도 비슷할 줄 알았는데 전혀 짐작도 못하겠습니다. 궁금해서 여쭤봅니다."
ENTP,"우선은 이성이 아니고 동성입니다.
그래서 의아해서 여쭈어본 것이고요. 보통 친구 사이에 저런식으로 톡해본 적이 없어서요. 

다른 분들은 어떨지 모르겠지만 저는 지금까지 살아오면서, 친구들이 수다떨고 싶을 때 이것저것 말해오거나 야 너 시간되냐 하면서 통화를 몇시간이고 하거나 그러는데, 얘는 그렇게 수다스러운 애도 아니고 통화도 싫어하는데 계속 저런식으로 뭐하냐고 묻기만 하고 단답만 하니 무슨 생각으로 저러는가 싶습니다. 그렇게 할 말이 없으면 왜 연락을 하는지.

상황을 추가로 설명드려보자면 그 애는 친구가 딱 두 명 있다고 했고, 무소식이 희소식이라며 연락을 거의 안한다고 했습니다. 원래 집 밖으로 거의 안나간다는데 제가 쉬는 날 놀자고 부르면 또 바로 나오고요.

여기까지만 듣는다면 나랑 친해지고 싶어서 그러나 싶은데, 그건 또 아닌게 제가 뭐만하면 지적하고, 자기는 이러이러하니 자신한테 맞추라고 합니다. 처음에는 물론 사람마다 다르니까 당연히 그럴수도 있지, 하고 다 맞춰줬는데(제 삶의 기본 가치관이 좋은 게 좋은 거 / 그럴수도 있지 라서 초반에는 이상함을 못 느꼈습니다.) 점차 읭스러운 점이 한 두 가지가 아니더라고요. 보통 사람들이라면 그렇게 해석하지 않을 상황을 전혀 상상해보지도 못한 방식으로 받아들이며 굉장히 분노하거나, 누가봐도 객관적으로 봐도 자신의 행동에 따른 결과인데 그것을 생뚱맞게 상대방 탓으로 돌리고 비난하더라고요. 그 현장에서 느낀 당혹감이 아직도 생생합니다.

그리고 저한테는 [넌 내 친구지]라고 말하다가도 [난 친구라도 바로 끊어내]라고 말한다거나, [너가 좋으니까 만나는거지 아니었으면 진작 차단했어] 이러면서도 [솔직히 너 친하다고 생각 안 해] 이럽니다. [너랑 나는 진짜 안맞아. 아예 결이 달라.] 이렇게 말하면서 [너가 먼저 친해지자고 말 안했으면 친해질 일 없었지]. [내 친구들은 다 나같아. 너같은 타입은 처음 봐].

이러는데 도대체 뭐 어쩌라는건지 모르겠습니다. 처음엔 맹하게 아 그렇구나, 넌 그런 사람이구나 하고 넘겼는데 최근에 와서 생각해보니 가스라이팅하는 것 같기도 하고, 다 알아서 떨어지라고 하는 말들인데 내가 못알아먹었나 싶어서 근 한 달째 연락을 제 쪽에서 아예 안했거든요. 

솔직히 맨 처음에 한 달 정도 지켜보다가 모든 사람에게 다정하고 섬세하고 장난 잘 받아쳐주는 모습에 아 쟤 좋은사람이구나, 하고 친해지고 싶어서 다가간거였는데, 그 이후로는 아예 그런 모습을 본 적이 없습니다. 제가 좋아했던 그런 모습들은 전부 사라지고 부정적이며 무례한, 사고방식을 이해할 수 없는 사람만이 보입니다. 그래서 최근 한 달 동안 제가 연락을 먼저 한 적이 없기도 했고요.

솔직히 mbti 를 떠나서 이 아이 자체가 나르시시스트 같다는 느낌이 옵니다. 도저히 이해할 수 없어서 근 두 달 동안 열심히 심리관련 전문지식들을 뒤져보았는데 모든 것들이 해당되더라고요. 하지만 일단 혹시 모르니 mbti 적인 측면들도 있을까 싶어서, 같은 intp 입장에서는 어떻게 보이는지 궁금해서 자세히 적어보았습니다.

주관적인 판단을 담은 감정적인 문장을 제외한 모든 문장들은 객관적인 사실만을 담았습니다. 인팁님께서는 어떻게 해석되시나요?"
ENTP,"역시... 친구로 애초에 생각하고 있지도 않은 거였네요. 실은 날 사람으로 생각하기는 하냐, 이 생각이 두 달 내내 들었거든요. 

정은 진작에 다 떨어졌지만 그래도 혹시나 싶었었는데 부질없었네요. 머리로는 다 알고 있었는데 ..ㅋㅋ 하

긴 글 읽어주며 정성스레 답변해주셔서 감사합니다. 덕분에 손절할 생각이 굳혀졌습니다. 안전하게 서서히 멀어져볼게요. 감사합니다."
ENTP,아니.. 예상치도 못하게 위로까지 받으니 괜히 울컥하네요ㅜㅜ 정말 많은 도움주셔서 감사합니다... 서서히 얼른 벗어날게요!! 인팁님도 좋으신 분 같으셔서 친구분들도 행복하시겠어요ㅜㅜ 요즘 날씨 힘든데 더위랑 감기 조심하세요..!! 정말 감사했습니다!!
INTP,
ISFJ,???? ㅋㅋㅋㅋㅋ
INTP,예쁜 사랑 하시네요ㅎㅎ
ISFJ,그런거예요? 감사합니다^^ㅋㅋㅋ
ISFJ,"맞아요 맞아요~
""내가 질척이면 오빠가 왜이렇게 질척여? 할거잖아"" 했더니 그럴것 같긴한데 그래도 질척이는거 보여달래요^^;;;;;;;
모냐.... ㅋㅋㅋㅋㅋ
하지만 잇프제는 질척이지 않쥬 ㅋㅋㅋ
밀면 한없이 밀리는... 그런 존재..ㅋㅋ"
ISFJ,"오호~~ 그런거군요~~ㅋㅋㅋ
절대 질척이지 않는걸로~ㅋㅋ"
INTP,"질척여줄 때 사랑받고 있다고 느껴져서 그런 것 같아요 ㅋㅋㅋㅋ 아주 모순적인...무슨 마음인지는 알겠는데, 질척여주는 사람이 일방적으로 에너지를 쓰거나 상처받을거라서 별루...🥲"
ISFJ,"그런것 같아요~
그래서 싫다고 거절했어요 ㅋㅋ 밀면 한없이 밀릴거라고 ㅋㅋ"
ISFJ,그쵸 너무 황당한데 귀엽더라구요~ 그런 생각을 하고있는지 전혀 몰랐어요 ㅋㅋㅋ 너무 귀여워 죽겠어요~~
ISFJ,그럼 다행이네요 ㅋㅋㅋㅋ
INTP,헐 저거 완전 저에여!! ㅋㅋㅋㅋㅋ
ISFJ,왜그로는거예요 도대체 ㅋㅋㅋㅋ 꼭 좀 자세하게 말해주세요 ㅋㅋㅋㅋ 약간 인팁이가 서운하거나 삐질만한 타이밍에 그러는것 같기도 한데 정확하진 않아요 ㅋㅋ 그리고 인팁이가 저를 좋아하는건 맞는거겠쥬? 좋으니까 사귀는거겠지만.. ㅋㅋ
INTP,동굴로 들어갔을땐 같이 들어와서 꺼내줘야 해요
ENTP,알고봤더니 숨겨진 사촌이 더 있었다던가...
ISTP,집집마다 사연 없는 집이 있을까요
INTP,"내가 이해할 수 있어야, 이해가 돼야 정상이란 마인드는 인생 살기 좋은 마인드는 아니더라구요 ㅎㅎ
내 기준이 표준도 아니고 사람 인생사 다양하고 별일들도 많은데 저긴 그런가보다 하며 사는거죠"
ENTP,어쩌다 부모님의 원가족에 대한 궁금증이 생기셨을까요? 그게 부모님을 이해하기 위해서였다면 아주 좋은 시도였다고 생각합니다. 그분들도 어른이기 이전에 연약한 아이였을 때가 있었고 부모이기 이전에 사람인지라 불완전한 존재일 수밖에 없거든요. 그래서 결핍도 가질 수 있고 실수도 할 수 있죠. 어떤 사람과 갈등이 있을 때에 그 사람의 입장에 서 보고 히스토리를 살펴보다 보면 이해 못 할 일이 참 많이 줄어드는 경험을 할 수 있습니다. 이런 노력을 통해 포용을 배우게 되는데 결과적으로 내 마음의 자유와 평화를 얻는 데 도움이 될 수 있다고 생각해요.
ENTP,"알콜중독은 대물림 된다고 하더라구요..
저도 그래서 술은 삼갑니다.
회식 가도 한약 핑계 대거나 한잔 받아만 놔요. 취할 정도로 안마심.."
ENTP,여기저기 치이는 엔팁 욕도먹고 사랑도 받고 꼭 두개 다 먹더라 ㅋㅋㅋ
ISTP,ㅋㅋㅋ너무 귀엽네요
ENTP,애써 무시하는 것도 있는것 같아요. 어차피 해야하는 일이니 그냥 하고.. 하고나면 뿌듯한데 후에는 병원 입원하거나 그러더라고요..
ENTP,"저도 주변에서 일중독이라는 이야기 들었어요. 애 낳은뒤로 덜하긴하는데.. 그래도 뭔가 성과가 있거나 새로운 아이디어를 갖고 일하면 득달같이 달려들어요 ㅋㅋㅋ
40 넘으니 감기는 1년에 한번씩 걸리더라고요 ㅠㅠ"
ENTP,오! 역시 행복한잇팁님!! 징징대봤자 변하는거 없으니 그냥 닥치고 합니다 ㅋㅋㅋ
ENTJ,엔팁분들 그러시는 것 같아 옆에서 걱정 ㅠ_ㅠ...
ENTP,"제 주변 직원들도 ""팀장님 괜찮으세요?""가 안부인사에요. 나는 감정을 못느끼지만(혹은 외면?) 얼굴은 썩어가고 있는듯요 ㅋㅋ"
ENTP,"아 이거 맞는 것 같아요.
에너지 몰아서 쓰다가 병나서 하루 날리고 기절해버리는 패턴 ㅎㅎㅎ
그 당시엔 몸이 피곤한줄 모르고 열정적이게 타오르다가 정말 재가 되버려요.
옆에서 말려주지 않으면 지치는 줄 모르고 컨디션조절 안될때가 있어서 스스로 주의하거나
주변인들에게 부탁해 놓기도 해요 ㅎㅎ
몸도 그렇지만 감정에대한 부분도 어느정도 그런 듯 하구요."
ENTP,"그야말로 하얗게 불태웠다입죠 ㅠ
업무분장 하긴하는데 어쩔수 없이 해야할 프로젝트 있으니.. 총대매는거죠 ㅠㅠ
오늘 오전까지 데드라인 지키고 오늘 오후는 이렇게 엠헬을 들락날락합니다."
ENTP,오! 바로 쉬고싶은데 데드라인이 턱턱 걸리는 업무들이라 ㅠ ㅠ 하루 쉬면 체력은 좀 회복되긴하는데 몇일 골골대긴 하죵
ENTP,네네 은근 화장실 다녀오는척하고 밖에서 하늘보고 오기도 해요 ㅎㅎ 소소한 휴식
ENTP,"네 저도 있어요.
남들 배로 씩씩하고 열심히 잘 살다가도 갑자기 번아웃 와서 아무것도 못하게 되고 자주 반복하는 편이에요. Si 열등에 Fi 7차, 엔팁분들은 의식적으로라도 자기 기분을 잘 살피고 무리하지 않고 규칙적인 생활 루틴을 만들도록 노력을 하시는 게 좋아요."
ENTP,그래서 가끔 제 신랑이 F여서 제 겉모습 보고 확인해달라고 하긴해요. 가끔은 감정을 인지못해서 아쉬울때가 있죵. 데드라인 걸리는 업무만 아니면 좀 여유 부리고싶은데 그게 잘 안되네요 호호~
ENTP,"아 이댓글 왜 웃기죠 ㅋㅋㅋㅋㅋ겉모습 확인해달라고 ㅋㅋㅋㅋㅋㅋ저도 F인 남편한테 그러거든요
""나 지금 상태 안좋나?"" "".......어 다크써클있어. 무리하는 것 같아""
ㅋㅋㅋㅋㅋㅋㅋㅋㅋㅋㅋㅋㅋ"
ENTP,아악ㅋㅋ 질문과 답변이 비슷해요ㅋ 오늘 데드라인 끝난줄알고 신랑이 5시58분부터 퇴근하라고 카톡왔어요ㅋ
ENTP,"저도 빨리 자거나 고농축 비타민 쭉 들이키고 그래요.
쉬는것도 노는걸 좋아하는데 이렇게 무리하는 기간이면 누워있어요 ㅋㅋ"
ENTP,"저도 계속 물어보면 싫어요.
괜스레 자존심 상하기도 하고 힘든거 티 안내려고 피곤해도 무조건 풀메해요."
ENTP,"저도 징징 힘들다고 하는 사람들 이해못해요. 그냥 그렇구나 인정만 해요.
저도 평소에 예민한 스타일 아니고 무던해요. 병나면 아~ 내가 힘들었구나 인지합니당"
ENTP,"저도 마찬가지예요ㅋㅋ
힘든 건 아는데 퇴근하는 길에 풀린다고 해야하나?
집에서 야식먹으면서 유튜브 보고 자면 피로는 뭐 다 풀리는거죠"
ENTP,"ㅋㅋ이쯤되면 역시 프로열정러 엔팁인가요
전 오늘 야식 양꼬치로 풀 예정입니다ㅎ"
ENTP,"맞아요ㅋㅋㅋㅋㅋㅋ저도 무리해서라도 제가 맡은 일은 최대한 최선을 다해서 끝내야 만족하는 타입이라ㅋㅋㅋㅋㅋㅋ야근은 기본에 집에 가서도 만족할 때까지 하는 것 같아요. 주위에서는 그렇게 무리하면 안힘드냐고 하는데 솔직히 힘든 거 잘 모르겠고 근데 머리로는 무리하는 거 알고 있기는 해요ㅋㅋㅋㅋㅋㅋ

그냥 다 떠나서 내가 맡은 것들은 내가 만족할 때까지 최선을 다 하고 싶은 마음이에요ㅋㅋㅋㅋㅋㅋ"
ENTP,"공감이에요
피곤하긴해도 성과있거나 완료하면 그 뿌듯함 (역시 난 천재야 훗😉) 자신감 충전하고 또 일하는것 같아요"
ENTP,단지 짝녀분 좋아서 계속 곁에 있는 시간 늘려보려고 하는게 일 열심히 하는 걸로 비쳐서인지 짝녀분은 절 무슨 일중독으로 아시는 듯...뭐 직장엔 성실하다로 비치는데는 성공한 듯
ENTP,"와웅 완전 쏘스윗~ 하십니다~~!
짝녀분 쟁취하셔서 일석이조를 달성하시길 바랍니다~! 🙏🙏"
ENTP,"저는 끝나고 깨달아요.ㅋ 아 내가 죽을뻔했구나.정도 ㅋㅋ

프로젝트 끝나고 쌍화탕 한 병 마시고 앓아 누우면 기분좋습니다. ㅋㅋ"
ENTP,"저도 일끝나고 힘들었구나 알아요ㅋ
끝냈다는 뿌듯함😉 저는 맥주한캔 따고 푹잡니다ㅎ"
ENTP,"저도 성취하고난뒤 뿜뿜인데ㅎㅎ
힘든것도 인지가 잘 안되기도 하지만
설령 힘들다고 하더라도 특유의 가오가 안산다는 이유도 좀 있어서 안힘든척 더 하는것 같아요. ;;"
