mbti,comments
ENTJ,전 연애로써는 말고 친구나 지인으로썬 SF가 강할 수록 안맞더라고요
ESFJ,밝고 쾌활한 성향때문인거 같아요~
INTP,"아 진짜 달달하죠.... 이전 모든 인연 다 잊고도 남을 정도로...
엣프제남의 매력을 아는 분이 하나 또 늘었네요
아잇 안되는데 ㅋㅋㅋ 저만 알아야되는데!! ㅋㅋㅋ"
ESTP,헐...저는 제 짝남?썸남이 엣프제인데 완전 ㅠㅠㅠ츤데레에 무뚝뚝이거든요...일부러그러고있는걸까요 그럼 ㅠㅠㅠ부럽습니다 그저 ㅠㅠㅠ
ESFJ,정말 좋아하면 딱 이럴꺼에요 ㅎㅎ 엣프제가 성향으로 보이는 보편적인 친절과 다른 부분! 사람들은 다 친절하다고 하는데 정말 미친 친절을 받아보면 그 이전의 친절은 그냥 형식적 습관이라는 걸 알게되죠 ㅋㅋ 저도 이 사람이다 판단되면 정말 사랑뿜뿜 터지거든요😊 예쁜 사랑 응원해요🎉
INFP,"엣프제랑 연애중인데
제 글 읽어보시면 아시겠지만 생색 많이 내는거 빼고는 아주 최고에요! ㅎㅎ 내일은 엣프제랑 펜션 가요! 한식 만들어주고 싶다면서 불고기랑 된장찌개 해준대요🥰"
INFP,"그러니까요ㅋㅋㅋ
곧 씻겨준다고 할지도 몰라요
항상 씻겨줄까? 이래요 ㅋㅋㅋㅋㅋ🤣"
INFP,"와 어쩜 그렇게 똑같죠ㅋㅋㅋㅋㅋㅋ
저의 엣프제도 오일로 전신 마사지 종종 해주거든요ㅋㅋㅋㅋ 여자친구 생기면 발 씻겨주고 싶었다면서 대야랑 풋샴푸 가져와서 발도 씻겨줬어요ㅋㅋㅋㅋ
저희도 이번에 스파펜션 갑니당 프히힛"
ENTP,오... 호의였나요?? 저는 isfj가 마음이 있는 줄 알고 읽다가 당황스럽네용... 글쓰님께서 약간 어벙벙하시는 기분이 너무 공감됩니다...ㅠㅠ
ESTP,더 좋은분 만나실겁니다~! 저도 최근 소개팅했었는데 결과가 좋진않았어요ㅎㅎ 맞는분 나타나실겁니다~! 저 같은 경우에는 30대 초중반으로달려가니까 아무래도 안정적이어지고싶은 생각에 조급해지는게있는거같아요ㅎㅎ 글쓴님 기분도 공감가요...
ESTP,저랑 완전 비슷하신데요?ㅎㅎ 웃어주는 여자도 좋겠지만 진짜 감정의속도가 중요한거 같아요 이성과의 만남에대한 진지함도 그렇고요 전 세번정도봤으면 관계정립하고 서로에집중하는걸 선호하는데 길게보는걸선호하는분들과는 속도가 안맞을때가많더라고요ㅎㅎ 그럴땐 야경보면서 바람쐬고 오시던지 시원한 맥주한잔해보세요~! 진짜 기분전환되고 좋아요ㅎㅎ
ISFJ,"호감인 것 같은데..
잘 들어갔냐고 연락 안했을 때는 너무 피곤했던 거 아닐까요?
귀찮았던거라면 다음 날에 칼답 안하고 안읽씹 했을 것 같습니다"
INTP,"와.... 통찰력 무엇.....
개복치 찐따새낔ㅋㅋㅋㅋㅋㅋㅋ"
ISFJ,"제 남자친구도 회피형인데,,,
저는 우리는 친구가 아니라 연애를 하고
있는거니까 기분 나쁘면 나쁘다고 이야기를
해주고, (침묵이 제일 좋지 않다구요)
생각 정리할 시간이 필요하면
존중해 줄테니 미리 말해주면 좋겠다고
했어요..
글쓴님도 상대방이 기분 나빠 보이면
전화 하지 마세요
시간이 필요한 사람이 있으니까요
서로 대화를 많이 하셔야 되실것 같아요"
ISFJ,"상대방에게 안전기지가 되어 주세요
동굴에 들어가더라도 난 늘 이자리에 있어
이렇게 해주니 제 남자친구는 많이 변화 하고 있어요"
ISFJ,"저는 나중에 이야기해 이러면
그냥 냅두고, 아침, 점심, 퇴근 요렇게만
카톡 남겨둬요
그리고 3일이 지났는데도 나타나지 않으면
생각할 시간이 더 필요하구나요
생각 정리되면 연락해요 이러고 냅둬요
이야기 하러 나왔을 때 비난 보다는
우와! 일찍 연락주고 너무 예쁘다~
이러면서 치켜세워 준다음,
기분 좋을 때 이야기 해요:)
조금 일찍 연락주면 맛있는거 사주거나
더 잘해줘요
회피형은 보상연애가 잘 맞더라구요"
ISFJ,회피형이 진짜 쉽지 않은데.... 노력은 해 보일 수 있지만 쉽게 바뀌지 않을 것 같습니다
ESFP,지금은 어떠신가요?
ISFJ,저는 제가 좋아해야 만나는 편이라 그냥 관심이 가고 만나고 싶고 알아가고 싶고 그런 때요!
ISFJ,"관심 없으면 안읽씹 많이 하거나 늦게 보구요
가족한테는 바로 볼 정도로 빨라요
친구는 빠를 때도 느릴 때도 있네용"
ISFJ,22
ISFJ,33 + 호감이면 빨라요
ISFJ,44
ISFJ,"제 사람들은 답 빠르구,,,
아닌 사람들은 답 느려요@.@"
ENTJ,"연인기준 칼답 그 자체, 선톡 잘 함
친구인 경우 두세시간 텀, 선톡 안 함"
ESFJ,"이것두 약간 사바사가 아닐까 싶어요!
남친이 잇프제인거같은데 한창 썸탈대 자기가 연락같은 걸 잘 못한다구 말해주더라구요... 그래서 썸 ~ 연애 초반엔 답장은 느려두 선톡은 꾸준히 했구 요즘은 최대한 빨리 답하려구 노력하는듯한 느낌!!"
ENFJ,"일단 전 잇프피가 1위 못한거에 대해
이 결과가 잘못되엇다 생각합니다🤨
저처럼 연락 칼같이 하는 잇프피는
무조건 1위라 생각합니다😏"
ISFJ,"ㅋㅋㅋ 연락 칼같이 하는분들 보면
부럽습니다,,,
주말에 보낸 톡 월요일에 보는 잇프피
이기 때문에요🫠😧😂"
ENFJ,"와...잇프제님의 잇프피 그정도 이신가요..
전 연인 한정해서는 절대
한시간 이상 넘가지 않아서..
(잠든거 아니라면요)"
ISFJ,"ㅋㅋㅋ 핸드폰은 유튜브 보고,
시계, 전화용이예요
카톡, 문자 쓰는거 안좋아하고,
친구, 엄마에게도 먼저 연락 안해요🤣
성향이 그러니 강요 안해요
저도 이제 적응 된건지 주말에 연락 안와도
그려러니 하고, 제시간 보내요ㅋㅋ"
ISTP,표현부분의 차이 아닐까요 제가 만나본 잇프제는 헌신도는 높은데 감정표현 부분에 있어서 조금 부족했어서ㅎㅎ잇프제도 속으로는 애인 엄청 생각하겠지만요ㅎㅎ
ISFJ,"저는 감정표현 잘하는데,,,
사람마다 다르긴 하겠지만요~
잇프피가 행동파라서 더 그런가봐요😅"
ISTP,그렇겠죠 감정표현 잘하는 잇프제라면 사랑꾼 인정해드립니다!ㅎㅎ
ENFJ,"저희 어머님 잇프제 이신데 정말
감정표현 서투르신 느낌. ㅎㅎ
그래도 마음은 누구보다 사랑꾼

잇프피 표현은 세계 최악이라고 자부합니다. ㅋㅋㅋㅋㅋㅋ
행동이랑 말이 너무 극과극"
ISTP,잇프피 표현이 왜 세계최악이죠ㅠㅠ지금 만나고 있는 잇프피 보면 아직 썸이라 그런지 마음을 100% 보여주진 않는 느낌인데 사귀고 제대로 만나면 왠지 잇프피 표현 엄청 잘할거 같던데 상대 잇프피 말로는 본인 뽀뽀귀신이라고ㅋㅋㅋㅋㅋ
ENFJ,"행동에 의한 표현은 정말 잘해요. ㅎㅎㅎ
말이 안되요. 만나 본 모든분의 불만사항
제 딴에는 되게 사랑한단 말도 이런저런
표현도 많이 한 것 같은데 너무 안한다고 ㅎ
그런데 만나면 손잡고 안고 뽀뽀하고
거의 껌딱지 수준으로 바뀌고 ㅎㅎ"
ISFJ,"ㅋㅋㅋ 표현은 세계 최악,,, 왜 공감가는거죠🤭"
ISTP,아ㅋㅋㅋㅋㅋㅋ말로 표현하는게 부족하군요 뭐 행동만으로도 마음이 느껴지는거면 괜찮을거 같은데 다들 확실하게 말로도 애정 느끼고 싶어하는건 어쩔수 없나봐요 근데 껌딱지라니 너무 좋을거 같네요🥺
ENFJ,"매일 만날 수 없으니 연락할때 말로 표현해주면 좋을텐데 그게 너무 아쉽데요
가끔은 제가 정말 자기를 좋아하는지 헷갈릴 정도라고 하더라구요.
저랑 만나신분들 손에 땀띠 많이 났을거에요. 절대 놓지 않거든요 ㅎㅎㅎ"
ISFJ,ㅋㅋㅋ 모두들 사랑꾼 인걸로용😄
ISFJ,재미로 보는거니까요
ENTJ,엔티제도 진짜 사랑꾼인데 흔한 유형이 아니라서 그렇죠😎
ISFJ,ㅋㅋ 엔티제는 많이 못뵈었어요🙄
INTP,인팁 사랑꾼인데ㅜㅜ자기사람한정
ISFJ,내사람에게만 사랑꾼이면 되지요^^
ENTJ,T랑 F지수가 크게 차이 없으면 왔다갔다 나올 수도 있을듯해요
ESFJ,글만보면 너무 이상적인 사람이에요~하루빼고 매일본다는게 엄청난 호감아니고는 쉬운게 아니잖아요~ 그런데 대기업 엔지니어면 바쁘지는 않나요? 저 아는분은 엄청 바쁘시거든요~ 매일보는데 아직 사귀자는 얘기는 없으셔서 고민하시는거에요?
ESFJ,저희는 남 잇프제 여 엣프제 ㅋㅋ 그러고보니 글쓴님은 여 잇프제 남 엣프제 반대네요 ^^
ENTJ,"’사람만나는 거 좋아하고‘ 이 이유로 연애가 짧게 끝났을 것 같네요.
만나면서 우선 순위에서 밀리는 걸로 여자친구들의 서운함이 많았을 것 같아요.
보통 대부분의 여자들은 비슷한 성향 아니고서야 나보다 다른 사람 많이 만나는 걸 선호하진 않죠~ 그리고 저 정도의 남자는 아마 30초중반까지는 본인이 ‘결혼’생각 없었을 것 같네요. (본인 여가 시간 즐기느라)

연애와 그 외에 다른 사람 만나는 비중을 적절하게 잘 조절하는 능력을 갖춘 엣프제라면ㅋㅋ 최고인 듯 해요."
ENTJ,"저 지금 만나는 분도 엣프제인데 엄청 비슷한 면 많거든요. 저 분만큼 사람을 좋아하진 않지만…

감성적이고 표현잘하고 다 좋은데 저는 개인적으로 저랑은 잘 안맞더라고요 ㅋㅋㅋㅋㅋ엣프제가 ‘사람 좋아하는 것’ 때문에요 ㅋㅋ

뭐라고 해야하나, 일상공유같은 것도 나한테만 하는 게 아니라 주변 사람들한테도 하고… 친하게 지내는 사람도 많고? 엣프제가 잘하니까 그만큼 엣프제를 챙겨주는 사람도 많고요ㅋ(여자친구인 내가 잘챙기는데 굳이 당신은 왜 내 남자친구를 챙기나..이런 경우도 있고요ㅋㅋㅋ)

저는 좁고 깊은 인간관계를 좋아해서 좀 안맞더군요ㅎㅎ"
ISFJ,"마마보이 혹은 친구랑 술 좋아해서 ..?
둘중 하나라고 감히 예상해봅니다..."
ISFJ,"그렇다면 딱히 걱정하실 필요 없을 거 같은데요 ㅎㅎ!
사람마다 다르겠지만 esfj가 딱히 모난 성격은 아니니까요 🙂
저도 esfj 남편과 천생연분까진 아니지만 80%정도 만족하는 결혼생활하고 있어요 ㅋㅋㅋ
저는 isfj, istj 번갈아서 나옵니당"
ISFJ,"뭐 나이들어서 시집, 장가 못간데는 다 이유가 있다 이러시는데 저는 그렇게만은 생각 안 해요 ㅎ
잘 맞으시면 진지하게 만나보셔도 될 것 같아요~~
저도 장기출장은 뭐.. 크게 상관 없네여 오히려 더 애틋해질 거 같은데 남편이 어디 멀리 한달간 간다고 하면 아쉬우면서도 혼자 집에서 열심히 놀 것 같아요 ㅋㅋㅋ"
ISFJ,완전 나쁘게 끝난거 아니라면 2번에 가까울거예요. 딱히 이유가 있다기보다는 인스타 스토리보고 그러는거에 그냥 별 생각 자체가 없어요. 만약 회원님께서 팔로우 끊으시면 그냥 끊었나보다 하고 말 확률도 사실 꽤 크다고 봅니다.
ESFJ,"저라면 친구아니고, 호감일거 같아요 ^^ 엣프제가 플러팅을 옵션으로 탑재했다고들 하는데,그건 한두번 형식적으로 할 수 있는 부분에 대한 얘기이고, (그것도 한두번이 지나면 더 하지않아요) 저라면 진짜 호감은 그 플러팅의 지속성에 있거든요~ 여자분은 글쓴님이 좋지만, 전연애에 대한 불안감을 해소시켜줄 수 있을지 걱정이 있는거 같아요~ 그리고 연락이 줄어드는 건 좋아하지만 둘의 관계진전이 없으니, 여자분도 그만해야하나 살짝 고민될 수 있을거 같구요.. 어디까지나 제 의견이네요 ㅎㅎ 글쓴님 마음이 여자분께 호감이 있다면 잘 될 수 있을거 같은데요"
ESFJ,저도 호감 한표여!
ISFJ,"오잉... 저희 남편이 esfj인데 감정기복이 너무 없어서 신기하던데..
사바사인 것 같아요"
ISFJ,전 불가능할 것 같아요...
ENFP,"제가 아는 (남)동생이 잇프제인데, 여사친이 연인으로 발전한 경험이 몇번있었다고 들었네요오🤔"
ISFJ,"저 같은 경우는 몇 년 본 친구면 이미 그 친구가 어떤 사람인지 파악이 됐기 때문에 거의 여자 or 남자로 안 보일 것 같아요
그 외에 진짜 친해진지 얼마 안 됐을 때 발전이 있던 경우는 있었어요"
INTJ,잇프제 아니어도 애인 생각하면 피곤이 가시는건 알것 같은데요 ㅋ 애인 얼굴보면 힘이나니까요 보러 가는길도 즐겁고 설레고~ 저도 장거리 연애 했었거든요 파워 오브 러브~
ISFJ,피곤한 것보다 보고 싶은 게 더 커서요
ISFJ,333
ISFJ,"그만큼 보고 싶으니까요
그렇지만, 남자들은 200프로의 모습 보이다가
어느순간 본래의 모습으로 돌아가는게
남자라서요,, 나중에 변했다고 생각은
하지 마세요🙄"
ENTJ,함께 있는 시간 자체에 사랑을 느끼는 경우가 많더라고요 보고싶고 같이 있고 싶어하는게 엄청 큰 것 같아요 만나는게 안 되면 통화라도 하고 싶어하고요
ESFJ,"친절하지만, 친절함이 달라요~ 저는 일상적인 친절 한번 보일 수는 있어도 한번 후 선그으면 뒤에 그런 친절을 두번다시 베풀지는 않아요~"
ESFJ,"공적자리는 얼마나 공적이냐에다를것같구요.
신경안쓰이는 공적자리면 티나고 아닌자리면 막 티는 안날순있어요 다만 그럴때 오히려 계속 주변에잇고 아이컨택? 눈마주치거나 아니면 그냥 슬쩍승쩍보구용

모든 사람한테 친절한건아닌거같아요 전
그냥 최소한 예의는 처음에 지키자고 제 기준에서
아닌사암은 아예 관심도 안 갖던지, 니가 얼마나 잘 사나 보자라는 마인드로그냥 묵묵하게 지켜봅니다 ㅎㅎ..."
ISFJ,"저도 엄청 친절히 대해주고 진짜 이성으로서 호감이 있나? 싶을 정도로 칭찬해주고 질문을 던지길래 꼬셨으나..
모든 사람에게 친절한 거였어요 ^^..
지금은 부부지만 본인은 그때 저에게 관심이 없었다고 하네요 ㅋㅋㅋ"
ENTJ,지금 만나는 분 엣프제인데 재회한 적이 한 번도 없대요;
ESFJ,저도 해볼때까지 해보자 주의라 진짜 미련과 후회 안남을때까지 해보고 완전히 헤어지는거 같아요ㅠ
ESFJ,음.. 사바사겠지만 내가 상대방한테 할만큼 했다라는 생각이 들면 끝인거같아요. 저는 얼마전에 차였는데 제가 못해준게 많다는 생각이 들어서인지 계속 생각나고 만나고싶고 그래요ㅠㅠ
INFP,저는 엣프제랑 5개월만에 재회해서 잘만나고 있어요!
INFP,"상대방이 성격차이라고 말씀하셨고 단호하셨다면
가망 없을 것 같아요..ㅠ"
INFP,아.. 다투셨던가요?
INFP,"저희는 엣프제가 업무과부하로 힘든 와중에 다투게 되면서 본인이 이런 상황이라 미안하다고 이별을 말하더라구요..
잡고 싶었지만 지금은 서로 힘들 것 같아서 고마웠다고 미안해하지 말라고 하면서 덤덤히 받아들였고 응원하겠다고 보냈었어요. 그 뒤로 5개월동안 한달에 한두번 톡으로 안부문자 왔고(전화는 두번정도 왔는데 안받았어요) 5개월만에 얼굴 보자고 하더라구요~ 그때 엣프제가 손편지랑 선물 가지고 왔었어요 엣프제는 생각할 시간이 좀 필요한 것 같아요~
일단 기다려보시는거 추천드리구요
시간이 좀 지난 다음에 넌지시 안부 건네보세요~ 감정적으로 나가시면 안돼요.
엣프제 왈 싸움이 세상에서 제일 나쁜거래요..ㅎ"
INFP,"연락하고 싶으시면 2주뒤쯤 해보세요
엣프제는 생각 할 시간이 많이 필요한 유형 같아요.
깨닫는게 있고 님을 많이 좋아한다면 엣프제는 무조건 연락할거에요!"
INTP,진짜 잡기는 엄청 잡던..
ESFJ,연구원이여
ESFJ,교사요!
ISFJ,"일단 저 같은 경우는 너무 바쁘고 힘들면 연락하는 것도 잘 안 하는 편이라 그분께서 주 7일일하시면 더 그럴 수 있겠다 싶습니다.
정말 친한 베스트 프렌드 면 스몰토크도 나쁘지 않다고 생각하지만 7일 내내 일하시기도 하고... 그분이 작성자님에게 친구 조금 이상의 호감이 아닌 것 같다면 그냥 두시는 게 좋을 것 같아요...! 그냥 친구인데 일 때문에 너무 힘든데 계속 연락 오면 답장해야 되나 부담도 되고 저라도 안읽씹 할 수 있을 것 같다는 생각이 듭니다 조심스럽게 제 의견 남겨봐요...!"
INFJ,"자기 스스로 몸도 마음도 편해지면 연락오겠죠....
저라면~ 마음이 있으면 뭐 몸이 힘들어도 관심있는 사람이면 하루에 한통 정도는 연락할 거 같아요.
그냥 그 정도의 마음인거같아요. 저도 쓰니님과 비슷한 잇프제남과 그렇게 지내다 ㅋㅋ
결국 제가 지쳐서 똑같이 읽씹하고 무신경하게 대했더니 연락 자기가 먼저 하더라구요....ㅋㅋ그거보고 정이 더 떨어졌어요~~
필요할 때만 찾는 느낌"
INFJ,저도ㅜㅜ마찬가지 지금보면 그냥 저 혼자 썸탄거예요ㅋㅋㅋ혼자 착각하고 들뜨고 실망했다 전 상대측에서 오해하게 행동한게 제일 크다 생각해요. 아니면 확실히 선을 그었어야하는데 애매하게 걸쳐서 사람 간이나 보고 정말 나빠요
INFJ,마지막 말이 넘 공감되네요ㅜㅜ 저도ㅋㅋ결론은 상대방은 아무것도 안했는데 차인 느낌 상처받은 ㅜㅜㅋㅋㅋ아흑 잊어야죠 뭐
ISFJ,"배려를 해 줌에 기쁨을 느끼는 사람으로서,, 1번만 해도 충분히 좋을 것 같아요>.<
2번도 넘 귀여운 표현인 것 같고
3번은 가끔 이렇게 해주시면 표현은 못해도 감동 10000배 먹습니다,,,,"
ISTP,"1번 3번요... 저희 직장 잇프제들 많은데 앞에선 정말 친절하고 착한것 같은데
뒤에선 좀 달라요 징징이들에다가 암튼 이중성을 넘 마니 봐서 전 잇프제가 저리 친절하면 거부감 들어요"
ISFJ,저 잇프제인데 잔소리 안하는데요🫠
INTP,"보통 스스로 잔소리를 안한다고 생각하시는거 같아요....ㅎㅎ 잔소리를 하고 있는데, 본인은 그게 잔소리가 아니라고 생각하는 편이 많더라구요. 다 그렇다는건 아니지만요"
INTP,그쵸 공감합니다
ISTJ,"무슨 잔소리인지에 따라 다를 것 같습니다. 구시대적이며 꼰대스러운 건지, 상대의 발전을 위한 조언인 건지.

그리고 저희 아버지는 NF인데 본인 도덕관, 가치관 강요에 정작 인생의 실용적인 부분에서는 본인/자녀에게 무신경한 부분이 있어서 ㅠㅠ 답답합니다"
ISTJ,"음ㅋㅋㅋㅋ 상황 이해했어요 잘 안 맞으셔서 힘드시겠어요ㅜㅜ
사실 부모님을 바꾸는 건 거의 불가능하다고 생각해서요
심리학 책 독서나 공부를 하면서 관계를 맞춰나가는 방법도 있겠지만 쉽지 않을 것 같아요
저는 가족이더라도 안 맞는 사람은 맞춰가지 않는다라는 주의라 혼자 사니까 행복해용"
INFJ,엣프제 아내에게 맨날 잔소리 들어요. 최근엔 저보다 엔프피 첫째아들에게 쏟아냅니다. 엣티제 둘째아들은 눈치 빨라서 사랑받고 자라고 있어요. 엔프피 첫째아들과 저는 nf 동지애로 뭉쳐있습니다 ㅋㅋㅋ
ENTJ,"잇프제 통제성향이 좀 심해요 은근 ㅋㅋㅋㅋㅋㅋㅋ
같이 잔소리해보세요 좀 나아요"
ISFJ,"1. 상대방에 따라 좀 달라지는 것 같아요 (상대방이 적극적이면 좀 빠르고 연애에 소극적이면 2달 이상 까지도 걸렸었어요)
2. 저는 한 3~4번 정도..? 이것도 개인 편차가 있겠지만 저 같은 경우는 먼저 만나자고 자주 하는 편이에요!
3. 해본 적은 없지만 아무래도 멀면 시간적 여유가 많아야 해서 힘들지 않을까 싶기도 한데 장거리가 어느 정도 장거린지 잘 모르겠습니다
4. 터치보다는 일단 말로 하는 편이에요. 성격 칭찬→외적인 칭찬(호감 있고 직진할땐 약간 누가봐도 티 날 정도로)"
ENTJ,"1. 저는 알고 지낸지 5년차였고 본격적인 썸은 한달 반 ~ 두 달 걸렸어요
2. 5회 이상 둘이서만 만나고 점차 마음 확인하게 되면서 가까워지더라고요
3. 장거리는 자신 없고 오래 사귄 상태에서 장거리가 된게 아니면 힘들 것 같다고 합니다
4. 사귀기전 스킨쉽 일체 없었고요, 호감 확인 된 후 부터는 보고싶다 좋다 하는 가벼운 직진 애정표현은 있었어요 사귄 후에도 조심스러웠어요 서로"
ESFJ,"그춐ㅋㅋ진짜 딱 그거.....다들 소개팅하면 보통 날은 잡고 보고 결정하던 아니면 아예 애초에 정리하지않나욜!....?...번호를 받은 이유를 도통모르겠어영
처음엔 일상보고하긴햇는데 그냥 텀도 점점느려지고 후"
ESFJ,맞아용 받았음 뭔가 마음이 있엇을텐데 제생각엔 딱히 안 받아도 그만이였던게 아닐까란 기분........이랄까용 ㅠㅠㅠ 그래서 마음이 없어서 끊지는 못하고 꾸준히 답이 오는 기분인거같아용 ㅠㅠ...근데 주말만될고고 전 주말을잘못쉬어서..더그런거같기두..
ISFJ,"빨리 만나는 게 좋습니다. 뭘 알아야 질문도 하는데 모르기도 하고 모르니까 신중해지기도 하고... 할 말이 점점 사라지고 흥미가 떨어질 가능성이 있어요
그런데 시간을 맞춰보자 했는데 바로바로 잡지 않았다는게 조금 걸리네요...!ㅠㅠ"
ESFJ,"그춍 ㅠㅠ 분명 맞추면되지하고 다른얘기도햇는데
잇프제가 그치그치하겨 다른얘기+자기얘기를 하더라구용 거기서 제가 더 이끌어야했나하다가도
본인도 생각과 의지가 있으면 차라리 언제로 정할까 하지않았을까싶구...
그냥 큰 호감도아니고 굳이 안봐도 그만인거같아용 저도 이런 반응이다보니 제가 적극적으로 할 수 가 없겟더라구용 저만 막 설레발 치는기분이라... 이러다가 그냥 흐지부지 끝날것같습니당😂😂😂"
INTJ,"와 저도 궁금하네요... 여태까지 잇프제 공부한 결과 저런 행동은 드문 케이스라서..
매일 봐야하는 사이에, 사귀지않는데도 끝까지 갔다는것이 의외이고 그 뒤에 잇프제 연하남이 혼자 현타? 와서 멀어지고
그러고서 인스타 좋아요는 누른다?
흠 미안한 마음이 있는건지 아니면 자기는 일단 실수했으니 다시 거리를 두면서 상대에 대해 판단하겠다는건지...
매일 봐야하니 적당히 좋은관계로 남으려고 하는것 같기도 하네요

근데 힘드시겠어요 ㅠ 솔직히 잘 되려다가 안된거잖아요
잘되더라도 남자분이 리드할 스타일은 아니라서 애를 많이 먹으실것 같아요"
INTJ,"글로만 배워서 모르겠네요... 잇프제님들 답변기다립니다 ㅠ
근데 희망적인 말이 아니면 이분들 답글도 잘 안다시는것 같긴해요;; 실망주는게 미안해서리~
우린 괜찮아요! 확실히 알고 싶을뿐입니다 잇프제 여러분~~ ㅋㅋ"
ISFJ,음.. 추측이긴 한데 일단 카톡 씹는 이유를 알았고 사과도 했으니 약간 불편했던 상황이 사라졌다?는 느낌을 받았을 것 같아요. 이성간의 관계까진 아니지만 친구로서 잘 지내보고 싶다곤 했으니 불편했던게 사라져서 평소처럼 대하려고 하는게 아닐까 하는 생각입니다..!
ISFJ,"음.. 맨날 봐야하는 관계신거죠? 제 생각에는 말씀하시는 부분보다는 불편했던 상황이 해결된게 더 큰 부분이라서 별로 신경 안쓰는거 같습니다..! 매일 봐야하는 상황이라면 최대한 불편한거 없이 잘지내고 싶어하기 때문에,, 추측이니 참고만 하세요 ㅎㅎ"
ESFJ,"전 무슨얘기나오면 거기에 관해서 꼬치꼬치 말고 
꼬리물기식으로 자연스레 이어가려구했어용!"
INTJ,잇프제에게 질문 많이 해주다가 만약에 너는 나한테 궁금한거 없어?^^* 라고 지긋이 물어보면 어떨까요?
INTJ,경력자의 여유가 느껴집니다 ㅋㅋ 프로 잇프제 조련사
ISFJ,제 기준으로는 질문을 계속 하는 것도 나름 생각 많이하고 노력해서 하는 질문들 일 거에요! 본인 얘기를 본인이 시작하진 않는 편이라 질문을 많이 해주신다면 오히려 좋아 대답은 또 잘하는 편이라
ESFJ,"전 찼을땐 미련없었고
차이면 미련이 왕창 남아요"
ESFJ,사람마다 다르지만! 제가 싫어한다고표시한행동이 반복됬을때요!! 신뢰가떨어지니...하지만 그것도 안고갈정도의 깊은 감정이면 안고 만나는데 그만큼이 아니면 끝내용!..
ISTJ,근데 왜 먼저 만나자는 얘기를 안할까요
ISFJ,3번도 종종 있더라고요.
ISFJ,아! 그렇군요 ㅎㅎ 정정하겠습니다.
ISFJ,신기하네요!
